29679326,GIGABYTE B760M AORUS ELITE X AX 피씨디렉트,,231730,129몰,
29679584,Supermicro X12SPA-TF STCOM,,1347300,95몰,
29681957,MSI PRO Z790-A 맥스 WIFI,,329000,9몰,
29687339,MSI MPG Z790 엣지 TI 맥스 WIFI,,378920,164몰,
29759561,BIOSTAR B650MT-E PRO 제이씨현,,119990,114몰,
29852999,ASUS ROG STRIX Z790-E GAMING WIFI II 코잇,,728050,7몰,
29863043,GIGABYTE B760M AORUS ELITE X AX 제이씨현,,236730,171몰,
29863127,GIGABYTE B650M AORUS ELITE AX ICE 제이씨현,,246080,204몰,
29879357,ASRock B450M-HDV R4.0 대원씨티에스,,61320,141몰,
29879744,ASRock B650M-H/M.2+ 대원씨티에스,,140030,4몰,
29880134,ASRock H610M-HVS M.2 R2.0 D4 대원씨티에스,,81920,113몰,
29880191,ASRock H610M-HVS M.2 R2.0 D4 대원씨티에스 (벌크),,84640,96몰,
29908775,ASRock B650M PG Lightning 디앤디컴,,152180,162몰,
29916821,GIGABYTE B650M AORUS ELITE AX ICE 피씨디렉트,,234690,197몰,
29916875,GIGABYTE B650 AORUS ELITE AX ICE 피씨디렉트,,288940,137몰,
29942195,ASUS PRIME H610M-D 코잇,,118630,110몰,
29942531,ASUS PRIME H610M-CS 코잇,,100280,100몰,
29960138,Supermicro H13SAE-MF STCOM,,831980,95몰,
29960348,Supermicro X12SPL-F STCOM,,882310,97몰,
29981321,ASRock Z790 Nova WIFI 에즈윈,,546690,103몰,
29983628,ASUS PRIME Z790M-PLUS-CSM 인텍앤컴퍼니,,297060,36몰,
30003794,ASUS PRO WS WRX80E-SAGE SE WIFI II 대원씨티에스,,1547230,87몰,
30070400,GIGABYTE B650 AORUS ELITE AX ICE 제이씨현,,297780,149몰,
30101828,ASRock Z790 Taichi Carrara 에즈윈,,868990,15몰,
30127295,ASRock B760M-HDV/M.2 D5 에즈윈 (벌크),,135290,103몰,
30131069,ASRock Z790 Nova WIFI 디앤디컴,,546460,109몰,
30161945,ASRock B760M-HDVP D5 디앤디컴,,141970,93몰,
30162119,ASRock B760M-HDVP D5 디앤디컴 (벌크),,140970,49몰,
30167879,ASRock B650M PG Lightning + WiFi6E 모듈 패키지 디앤디컴,,182650,131몰,
30300260,ASRock B650M PG Lightning 대원씨티에스,,146090,160몰,
30311870,COLORFUL BATTLE-AX A520M-K M.2 V14 STCOM,,65690,102몰,
30621842,MSI MEG Z790 갓라이크 (해외구매),,1015790,59몰,
30622283,ASRock B650M PG Lightning + WiFi6E 모듈 패키지 에즈윈,,178980,120몰,
30638927,ASRock B760M Pro RS D5 + WiFi6E 모듈 패키지 에즈윈,,194620,125몰,
30641906,ASRock B760M PG Riptide D5 + WiFi6E 모듈 패키지 에즈윈,,198950,118몰,
31080857,ASUS ProArt B760-CREATOR D4 대원씨티에스,,296030,94몰,
31261997,GIGABYTE Z790 AORUS ELITE X THRONE AND LIBERTY EDITION 피씨디렉트,,366860,48몰,
31280975,GIGABYTE Z790 AORUS ELITE X THRONE AND LIBERTY EDITION 제이씨현,,387690,136몰,
31346891,GIGABYTE GA-SBCAP3450 피씨디렉트,,69500,1몰,
31383614,GIGABYTE TRX50 AERO D 제이씨현,,1089940,103몰,
31405904,ASUS 라이젠 스레드리퍼 PRO 5975WX (샤갈 프로) 멀티팩 + PRO WS WRX80E-SAGE SE WIFI II 대원씨티에스 패키지,,5209990,5몰,
31426703,ASRock Z790 Nova WIFI 대원씨티에스,,482860,102몰,
31429022,Supermicro X12DPi-NT6 STCOM,,1624980,96몰,
31429109,Supermicro X12DPi-N6 STCOM,,1422840,83몰,
31463747,ECS ADLN-I N100 코잇 (무지박스),기본,168990,30몰,
31464083,ECS ADLN-I3 N100 코잇 (무지박스),기본,209000,2몰,
31472456,GIGABYTE TRX50 AERO D 피씨디렉트,,1060780,92몰,
31489394,ECS ADLN-I N100 코잇 (무지박스),65W 어댑터 포함,181330,30몰,
31489457,ECS ADLN-I3 N100 코잇 (무지박스),60W 어댑터 포함,223000,1몰,
31959437,ASRock Z790 Pro RS D5 + WiFi7 모듈 패키지 디앤디컴,,381080,98몰,
31959581,ASRock Z790 PG Lightning D5 + WiFi7 모듈 패키지 디앤디컴,,329720,25몰,
31959602,ASRock B760 Pro RS D5 + WiFi7 모듈 패키지 디앤디컴,,284080,93몰,
31959920,ASRock B760M Pro RS D5 + WiFi7 모듈 패키지 디앤디컴,,220720,89몰,
31959938,ASRock B760M PG LIGHTNING D5 + WiFi7 모듈 패키지 디앤디컴,,254520,2몰,
31960202,GIGABYTE X670E AORUS PRO X 피씨디렉트,,414990,46몰,
31981667,GIGABYTE X670E AORUS PRO X 제이씨현,,414920,179몰,
31981778,GIGABYTE X670E AORUS PRO X (해외구매),,463800,78몰,
32002067,GIGABYTE H610M K D4 제이씨현 (벌크),,81710,90몰,
32036924,ASRock B760M PG LIGHTNING/D4 에즈윈,,137890,124몰,
32043872,ASUS PRO WS TRX50-SAGE WiFi (해외구매),,1322860,45몰,
32063276,ASRock TRX50 WS 대원씨티에스,,1126460,65몰,
32070719,GIGABYTE B650 AORUS ELITE AX V2 피씨디렉트,,297920,128몰,
32071016,ASUS Z13PE-D16 코잇,,1834830,1몰,
32071067,GIGABYTE B650 AORUS ELITE V2 피씨디렉트,,274490,128몰,
32078006,GIGABYTE B650 AORUS ELITE V2 제이씨현,,286860,159몰,
32104016,ASRock Z790 PG Lightning D5 + WiFi6E 모듈 패키지 에즈윈,,294390,115몰,
32110508,ASRock A520M-HDVP R2.0 에즈윈 (벌크),,82030,109몰,
32126690,ASUS PRO WS TRX50-SAGE WiFi STCOM,,1347970,102몰,
32487287,ASUS PRO WS TRX50-SAGE WiFi 대원씨티에스,,1301530,73몰,
32867579,ASUS P12R-M-10G-2T STCOM,,553000,14몰,
33363434,ASUS PRO WS W790E-SAGE SE 코잇,,1980000,1몰,
33410735,COLORFUL H310M-D M.2 V20 STCOM,,90910,83몰,
33992234,ECS DURATHON2 B660H7-M22 코잇,,82000,80몰,
34372580,ASUS PRIME B760M-PLUS-CSM STCOM,,211830,117몰,
34372781,ASUS TUF Gaming B760M-PLUS II STCOM,,222240,105몰,
34372901,ASUS TUF Gaming B760M-PLUS WIFI II STCOM,,244330,120몰,
34373075,ASUS TUF Gaming B650-E WIFI STCOM,,310980,129몰,
34739282,ASUS PRIME H610M-CS 2.5G 코잇,,112570,84몰,
34741238,ASUS TUF Gaming Z790-BTF WIFI 인텍앤컴퍼니,,523420,126몰,
34741700,GIGABYTE B650E AORUS ELITE X AX ICE 피씨디렉트,,358840,120몰,
34741730,GIGABYTE B650E AORUS ELITE X AX ICE 제이씨현,,348990,17몰,
34810886,ASRock B760M PG LIGHTNING D5 대원씨티에스,,178610,2몰,
34810925,ASUS PRIME B760M-PLUS-CSM 인텍앤컴퍼니,,179000,133몰,
34815323,ASUS PRIME B760M-PLUS-CSM 코잇,,190140,108몰,
34815659,ASUS TUF Gaming B760M-PLUS II 코잇,,182600,121몰,
35810231,ASRock A620M-HDV/M.2 에즈윈,,111990,129몰,
35810438,ASRock B760M Pro-A 대원씨티에스,,146400,130몰,
36157511,ASRock A620M-HDVP 에즈윈,,128240,124몰,
36157520,ASRock A620M-HDVP 에즈윈 (벌크),,126490,97몰,
36308306,ASUS TUF Gaming B650-E WIFI 대원씨티에스,,251910,126몰,
36709451,ASRock B760M-HDV/M.2 D5 디앤디컴 (벌크),,140980,33몰,
37226114,MSI MAG B760M 박격포 II,,192400,191몰,
37286501,GIGABYTE H610M K D4 피씨디렉트 (벌크),,86310,4몰,
37286591,GIGABYTE H610M H V2 D4 피씨디렉트 (벌크),,96000,11몰,
37927508,ASUS P12R-E STCOM,,553980,78몰,
38347157,ASUS PRO WS WRX90E-SAGE SE STCOM,,1990980,87몰,
39249221,MSI PRO A620M-C EX,,127800,153몰,
40580234,ASRock WRX80 Creator R2.0 대원씨티에스,,1086060,115몰,
40580651,ASRock TRX50 WS 에즈윈,,1206400,100몰,
40895255,ASRock B760M Pro-A 에즈윈,,148920,127몰,
42390188,MAXSUN 챌린저 H510M-H,,83590,68몰,
42860537,ASUS Z13PE-D16 STCOM,,1747570,59몰,
42862973,ASRock Z790 Pro RS D5 + WiFi6E 모듈 패키지 에즈윈,,351490,111몰,
42862976,ASRock B760M Pro-A + WiFi6E 모듈 패키지 에즈윈,,172730,103몰,
42862979,ASRock A620M-HDV/M.2+ + WiFi6E 모듈 패키지 에즈윈,,142420,116몰,
43546877,MAXSUN 터미네이터 B760M D5,,159000,50몰,
43557464,MAXSUN 챌린저 H610M,,90000,52몰,
45257993,ASUS PRO WS WRX90E-SAGE SE 대원씨티에스,,1896210,69몰,
46003319,ASUS ROG MAXIMUS Z790 HERO BTF 코잇,,1059000,4몰,
46309496,GIGABYTE B650M D3HP 제이씨현,,144940,148몰,
46742996,ASRock B650M PG Lightning WiFi 디앤디컴,,182820,140몰,
48476933,ASUS TUF Gaming B650M-E STCOM,,211550,125몰,
48476972,ASUS TUF Gaming B650M-E WiFi STCOM,,220490,104몰,
48477197,GIGABYTE B650M D3HP 피씨디렉트,,142120,125몰,
48647831,ASRock WRX90 WS EVO 대원씨티에스,,1728430,12몰,
48647936,ASRock X570 Phantom Gaming 4 대원씨티에스,,138470,135몰,
49162646,ASRock B550M Pro RS 디앤디컴,,116970,142몰,
49538822,ASRock B550M Pro RS + WiFi6E 랜카드 패키지 디앤디컴,,160740,76몰,
49539176,ASUS ROG MAXIMUS Z790 HERO BTF 인텍앤컴퍼니 + ROG STRIX 지포스 RTX 4090 BTF O24G GAMING OC D6X 24GB 패키지,,4451990,28몰,
49539212,ASUS TUF Gaming Z790-BTF WIFI 인텍앤컴퍼니 + TUF Gaming 지포스 RTX 4070 Ti SUPER BTF O16G OC D6X 16GB White 패키지,,2000000,2몰,
49740182,ASRock B550M Pro RS 에즈윈,,120330,139몰,
49742366,ASRock B760M Pro-A 디앤디컴,,139180,141몰,
49829285,ASRock Z790 LiveMixer D5 + WiFi6E 모듈 패키지 에즈윈,,360000,68몰,
49995851,ASRock B550M Pro RS 대원씨티에스,,117790,138몰,
50128154,BIOSTAR A620MS 제이씨현,,97110,98몰,
50128394,BIOSTAR H610MHP 2.0 제이씨현,,83620,77몰,
50129651,ASRock B760M Pro-A + WiFi6E 모듈 패키지 디앤디컴,,173970,123몰,
52259141,GIGABYTE H610M K 제이씨현 (벌크),,106690,5몰,
53418977,MSI B650M 프로젝트 제로,,277760,149몰,
53419463,MSI B760M 프로젝트 제로,,257780,139몰,
54218069,Supermicro H13SRA-TF STCOM,,1238900,72몰,
54326459,Raspberry Pi 라즈베리 파이 4 모델 B (해외구매),8GB,107900,169몰,
54326471,Raspberry Pi 라즈베리 파이 4 모델 B (해외구매),2GB,89690,241몰,
54326486,Raspberry Pi 라즈베리 파이 4 모델 B (해외구매),4GB,101400,393몰,
54326606,GIGABYTE Z790 AORUS XTREME X ICE + AORUS 지포스 RTX 4080 SUPER XTREME ICE 패키지 피씨디렉트,,5069000,1몰,
54481319,액슬 MBAIH310 에즈윈,,73590,76몰,
54816743,ASUS Tinker Edge R (병행수입),,188140,14몰,
55468811,ASRock H510M-HDV/M.2 SE 에즈윈,,93560,98몰,
56139419,Supermicro X12SPO-F STCOM,,943130,65몰,
56139584,Supermicro X12SPO-NTF STCOM,,1183960,64몰,
56144006,ASRock A620M-HDVP 디앤디컴,,133980,113몰,
56156189,ASRock A620M-HDVP 디앤디컴 (벌크),,129310,91몰,
57295043,MSI PRO B650M-B,,133920,130몰,
58097897,GIGABYTE B650E AORUS PRO X USB4 피씨디렉트,,397490,36몰,
58103081,KHADAS VIM3 Pro 4GB,,201300,1몰,
58103207,KHADAS VIM3 Pro 2GB (해외구매),,197900,3몰,
58115534,COLORFUL COLORFIRE B760M-MEOW WIFI D5 ORANGE STCOM,,232450,89몰,
58119920,GIGABYTE B650E AORUS PRO X USB4 제이씨현,,397710,101몰,
58623128,ASRock H610M-H2/M.2 D4 에즈윈 (벌크),,86750,38몰,
58837484,MAXSUN 챌린저 H610ITX 2LAN,,148730,3몰,
59826524,ASRock H610M-H2/M.2 D4 디앤디컴,,87050,104몰,
59827064,ASRock H610M-H2/M.2 D4 디앤디컴 (벌크),,86160,82몰,
60064028,마이크로틱 MikroTik L11UG-5HaxD,,120990,16몰,
60151763,COLORFUL BATTLE-AX B650M-PLUS V14 STCOM,,150610,68몰,
60247235,COLORFUL COLORFIRE B760M-MEOW WIFI D5 ORANGE 디앤디컴,,230730,65몰,
61423451,ASRock H610M-X D5 에즈윈,,118770,86몰,
61423463,ASRock H610M-X D5 에즈윈 (벌크),,115640,78몰,
62568890,MSI PRO B650M-A,,163760,110몰,
62636738,Supermicro H12SSL-i STCOM,,882980,52몰,
62791640,ASRock B650M PG Riptide WiFi White 에즈윈,,248680,108몰,
63035990,GIGABYTE B650E AORUS STEALTH ICE 제이씨현,,377780,74몰,
63087248,GIGABYTE B650E AORUS STEALTH ICE 피씨디렉트,,373790,50몰,
63087650,ASRock H610M-X D5 디앤디컴,,118190,71몰,
63140087,ASRock H610M-X D5 디앤디컴 (벌크),,114340,63몰,
63269363,ASRock B650M PG Riptide WiFi White 디앤디컴,,248730,88몰,
63478082,ASRock B650M PG Riptide WiFi White 대원씨티에스,,243760,94몰,
63478493,KHADAS VIM4 8GB,,273900,5몰,
63478505,KHADAS VIM4 8GB (해외구매),,278250,50몰,
63938699,GIGABYTE TRX50 AI TOP 제이씨현,,1398940,100몰,
64267934,GIGABYTE TRX50 AI TOP 피씨디렉트,,1380740,75몰,
64375265,GIGABYTE H610M H V2 피씨디렉트,,113380,35몰,
64394135,ASRock B650 스틸레전드 WiFi 디앤디컴,,314000,6몰,
65307479,GIGABYTE H610M S2H V2 피씨디렉트,,118120,73몰,
65367206,BIOSTAR B760M SILVER 제이씨현,,153180,63몰,
65368136,ASUS PRIME Z790-A WIFI-CSM 코잇,,412650,52몰,
66046067,GIGABYTE H610M S2H V2 제이씨현,,120940,76몰,
66046259,GIGABYTE H610M H V2 제이씨현,,114900,78몰,
66046349,GIGABYTE H610M K V2 제이씨현,,105930,80몰,
67371704,ASRock Rack SP2C621D16-2T 명인일렉트로닉스,,2570410,3몰,
67372934,ASRock H510M-HDV/M.2 SE 디앤디컴,,91870,75몰,
67373036,ASRock H510M-HDV/M.2 SE 디앤디컴 (벌크),,91340,56몰,
67622027,ASRock H610M-X D5 대원씨티에스,,113390,54몰,
67678283,GIGABYTE H610M K V2 피씨디렉트,,102870,29몰,
67693886,ASUS PRIME X870-P WIFI-CSM STCOM,,478980,76몰,
67693952,ASUS PRIME X870-P-CSM STCOM,,453960,76몰,
67694132,ASUS ProArt X870E-CREATOR WIFI STCOM,,845960,59몰,
67694456,ASUS ROG CROSSHAIR X870E HERO STCOM,,1098990,8몰,
67694840,ASUS ROG STRIX X870-A GAMING WIFI STCOM,,598980,42몰,
67694921,ASUS ROG STRIX X870E-E GAMING WIFI STCOM,,873420,76몰,
67695545,ASUS ROG STRIX X870-F GAMING WIFI STCOM,,698980,42몰,
67695563,ASUS TUF Gaming X870-PLUS WIFI STCOM,,558980,76몰,
67695641,ASRock X870 Pro RS 에즈윈,,338980,66몰,
67845767,GIGABYTE X870E AORUS MASTER 제이씨현,,691800,82몰,
67845785,GIGABYTE X870E AORUS PRO ICE 제이씨현,,454580,82몰,
67845815,GIGABYTE X870 AORUS ELITE WIFI7 제이씨현,,397780,81몰,
67845863,GIGABYTE X870 AORUS ELITE WIFI7 ICE 제이씨현,,407780,81몰,
67846052,GIGABYTE X870 EAGLE WIFI7 제이씨현,,327780,79몰,
67847060,ASRock X870 스틸레전드 WiFi 에즈윈,,441980,66몰,
67847474,GIGABYTE X870 AORUS ELITE WIFI7 피씨디렉트,,398970,71몰,
67847492,GIGABYTE X870 AORUS ELITE WIFI7 ICE 피씨디렉트,,408980,73몰,
67847543,GIGABYTE X870E AORUS MASTER 피씨디렉트,,691900,75몰,
67847609,GIGABYTE X870E AORUS PRO ICE 피씨디렉트,,454390,76몰,
67850639,ASRock X870E Taichi 에즈윈,,797660,70몰,
67851653,ASUS PRIME X870-P WIFI-CSM 대원씨티에스,,가격비교예정,0몰,
67851971,ASUS PRIME X870-P-CSM 대원씨티에스,,457860,75몰,
67852106,ASUS ProArt X870E-CREATOR WIFI 대원씨티에스,,858770,73몰,
67852211,ASUS ROG CROSSHAIR X870E HERO 대원씨티에스,,1065280,61몰,
67852265,ASUS ROG STRIX X870-A GAMING WIFI 대원씨티에스,,618860,73몰,
67852370,MSI MAG X870 토마호크 WIFI,,495880,102몰,
67852469,MSI PRO X870-P WIFI,,422140,101몰,
67852652,MSI MPG X870E 카본 WIFI,,721180,111몰,
67852706,GIGABYTE X870 EAGLE WIFI7 피씨디렉트,,328980,74몰,
67852766,ASUS ROG STRIX X870E-E GAMING WIFI 대원씨티에스,,998860,70몰,
67852793,ASUS ROG STRIX X870-F GAMING WIFI 대원씨티에스,,698860,72몰,
67852838,ASUS TUF Gaming X870-PLUS WIFI 대원씨티에스,,553960,76몰,
67852967,ASRock X870E Nova WiFi 에즈윈,,가격비교예정,0몰,
67976948,ASUS ROG STRIX X870-I GAMING WIFI STCOM,,가격비교예정,0몰,
68242061,ASRock X870 스틸레전드 WiFi 대원씨티에스,,438990,55몰,
68242124,ASRock X870 Pro RS WiFi 대원씨티에스,,339000,55몰,
68242145,ASRock X870 Pro RS 대원씨티에스,,334990,54몰,
68246816,ASRock X870E Taichi 대원씨티에스,,779090,55몰,
68440085,ASRock X870E Taichi 디앤디컴,,766400,32몰,
68440103,ASRock X870 스틸레전드 WiFi 디앤디컴,,429260,32몰,
