74250659,ASRock B850M-X 대원씨티에스,,174100,22몰,
74250827,GIGABYTE B860 AORUS ELITE WIFI7 ICE 제이씨현,,296380,184몰,
74250974,GIGABYTE B860M AORUS ELITE WIFI6E ICE 제이씨현,,268080,210몰,
74251187,GIGABYTE B860M AORUS ELITE WIFI6E 제이씨현,,265050,114몰,
74251253,GIGABYTE B860M AORUS ELITE 제이씨현,,228630,174몰,
74251349,GIGABYTE B860M DS3H 제이씨현,,170710,198몰,
74253203,ASUS ROG STRIX B860-I GAMING WIFI STCOM,,419730,128몰,
74253692,ASUS ROG STRIX B860-F GAMING WIFI STCOM,,444390,128몰,
74254586,ASUS ROG STRIX B860-A GAMING WIFI STCOM,,396930,134몰,
74254724,ASUS TUF Gaming B860-PLUS WIFI STCOM,,367990,125몰,
74254814,ASUS TUF Gaming B860M-PLUS WIFI STCOM,,277890,113몰,
74254832,ASUS TUF Gaming B860M-PLUS STCOM,,253300,141몰,
74255033,ASUS PRIME B860M-A WIFI-CSM STCOM,,266820,82몰,
74255060,ASUS PRIME B860M-A-CSM STCOM,,248970,110몰,
74255084,ASUS PRIME B860M-K-CSM STCOM,,174370,135몰,
74255114,ASUS PRIME B860-PLUS-CSM STCOM,,289990,123몰,
74255120,ASUS PRIME B860-PLUS WIFI-CSM STCOM,,309930,121몰,
74255204,ASUS PRIME B860M-A WIFI-CSM 인텍앤컴퍼니,,241590,101몰,
74255321,ASUS PRIME B860M-A-CSM 인텍앤컴퍼니,,201140,84몰,
74255327,ASUS PRIME B860-PLUS WIFI-CSM 인텍앤컴퍼니,,319000,14몰,
74255330,ASUS PRIME B860-PLUS-CSM 인텍앤컴퍼니,,299000,36몰,
74255333,ASUS ROG STRIX B860-A GAMING WIFI 인텍앤컴퍼니,,383390,132몰,
74255336,ASUS ROG STRIX B860-F GAMING WIFI 인텍앤컴퍼니,,434990,135몰,
74255369,ASUS ROG STRIX B860-I GAMING WIFI 인텍앤컴퍼니,,399000,116몰,
74255378,ASUS TUF Gaming B860-PLUS WIFI 인텍앤컴퍼니,,368990,24몰,
74255381,GIGABYTE B860 AORUS ELITE WIFI7 ICE 피씨디렉트,,289430,158몰,
74255384,GIGABYTE B860M AORUS ELITE 피씨디렉트,,235310,136몰,
74255387,GIGABYTE B860M AORUS ELITE WIFI6E ICE 피씨디렉트,,262790,181몰,
74255390,GIGABYTE B860M AORUS ELITE WIFI6E 피씨디렉트,,262870,178몰,
74255393,GIGABYTE B860M DS3H 피씨디렉트,,170420,171몰,
74336033,ASUS PRIME H810M-A STCOM,,125060,131몰,
74336102,ASUS PRIME H810M-A-CSM STCOM,,135740,121몰,
74336888,ASUS PRIME H810M-A WIFI STCOM,,145160,122몰,
74336894,ASUS PRIME H810M-A WIFI-CSM STCOM,,150460,120몰,
74337014,ASUS PRIME B860-PLUS-CSM 코잇,,273230,133몰,
74337680,ASUS PRIME B860M-A-CSM 코잇,,193060,104몰,
74337722,ASUS ROG STRIX B860-A GAMING WIFI 코잇,,357210,134몰,
74338013,ASUS ROG STRIX B860-F GAMING WIFI 코잇,,401200,135몰,
74338115,ASUS ROG STRIX B860-G GAMING WIFI 코잇,,284450,168몰,
74338499,ASUS ROG STRIX B860-I GAMING WIFI 코잇,,373940,135몰,
74338622,ASUS TUF Gaming B860-PLUS WIFI 코잇,,300650,132몰,
74339975,MSI PRO B860M-A WIFI,,213260,179몰,
74340266,MSI MAG B860M 박격포 WIFI,,272360,195몰,
74340455,MSI MAG B860 토마호크 WIFI,,285560,154몰,
74340596,ASRock B850 Pro RS WiFi 디앤디컴,,249570,132몰,
74340710,ASRock B850 스틸레전드 WiFi 디앤디컴,,297140,145몰,
74341163,ASRock B850M Pro-A 에즈윈,,184620,148몰,
74341325,ASRock B850M Pro-A WiFi 에즈윈,,194310,134몰,
74341418,ASRock B850M 스틸레전드 WiFi 에즈윈,,242400,137몰,
74341610,ASRock B850 Pro-A 디앤디컴,,223230,142몰,
74341787,ASRock B850M-X 디앤디컴,,157130,154몰,
74415038,ASRock B860M Pro RS WiFi 에즈윈,,212080,134몰,
74415482,ASRock B860 Pro RS 에즈윈,,254350,145몰,
74415509,ASRock B860 Pro RS WiFi 에즈윈,,267470,147몰,
74422025,ASRock B860M Pro RS 디앤디컴,,196570,143몰,
74491244,ASUS PRIME B840M-A-CSM 인텍앤컴퍼니,,173000,133몰,
74491247,ASUS TUF Gaming B850M-PLUS 인텍앤컴퍼니,,233000,136몰,
74491250,ASUS TUF Gaming B850M-PLUS WIFI 인텍앤컴퍼니,,249950,131몰,
74491253,ASRock B860M-X 에즈윈,,170950,134몰,
74491295,ASRock B860I WiFi 에즈윈,,287270,110몰,
74808266,ASUS ROG STRIX Z890-I GAMING WIFI 인텍앤컴퍼니,,735470,114몰,
74814188,ASUS TUF Gaming X870-PLUS WIFI 인텍앤컴퍼니,,388000,136몰,
74814341,MSI MAG B850 토마호크 맥스 WIFI,,327860,159몰,
74814380,MSI MPG B850 엣지 TI WIFI,,365560,155몰,
74885192,ASRock H810M-X 에즈윈,,148490,103몰,
74885201,ASRock H810M-X 에즈윈 (벌크),,148790,95몰,
74999933,ASRock B850 Pro-A 에즈윈,,220000,125몰,
75372923,ASUS Z13PE-D16 아이보라,,2054260,45몰,
75373061,ASUS PRO WS WRX90E-SAGE SE 아이보라,,2030000,73몰,
75373118,ASUS PRO WS W790E-SAGE SE 아이보라,,2054450,69몰,
75536555,ASUS B860M AYW GAMING WIFI 인텍앤컴퍼니,,169990,142몰,
75538394,ASRock B850M Pro RS 대원씨티에스,,202330,131몰,
75538472,MSI MPG X870E 엣지 TI WIFI,,495580,145몰,
75538754,ASRock B850M Pro-A 대원씨티에스,,179100,150몰,
75540665,ASRock B850M Pro-A WiFi 대원씨티에스,,191780,71몰,
75541040,ASRock X870 Riptide WiFi 대원씨티에스,,490090,3몰,
75600170,GIGABYTE X870E AORUS PRO 제이씨현,,428430,195몰,
75600842,ASRock B850M Pro RS 디앤디컴,,201230,141몰,
75600851,ASRock B850M Pro RS WiFi 디앤디컴,,209580,141몰,
75720068,ASUS PRIME H810M-A 인텍앤컴퍼니,,128440,22몰,
75724184,ASRock B850M Pro-A 디앤디컴,,182220,140몰,
75856148,GIGABYTE W790 AI TOP 피씨디렉트,,1481990,91몰,
75856643,ASRock B860M Pro-A 인텍앤컴퍼니,,181710,105몰,
75857021,MSI MAG X870E 토마호크 WIFI,,488870,27몰,
75935612,ASRock B860M Pro RS WiFi 디앤디컴,,212890,123몰,
75935651,ASRock B860 Pro RS WiFi 디앤디컴,,247340,125몰,
75935675,ASRock B860M 스틸레전드 WiFi 디앤디컴,,259100,110몰,
75935729,ASRock B860I WiFi 디앤디컴,,296730,86몰,
75939005,ASRock B850 Pro RS WiFi 대원씨티에스,,243730,102몰,
75988922,GIGABYTE W790 AI TOP 제이씨현,,1589370,5몰,
75989195,ASRock B760M-HDV/M.2 D5 대원씨티에스 (벌크),,133000,1몰,
76330571,Supermicro X14SBM-TP4F STCOM,,1700970,2몰,
76330748,Supermicro X14SBM-TF STCOM,,1459170,1몰,
76386635,ASUS TUF Gaming B650M-E 인텍앤컴퍼니,,178990,5몰,
76463696,ASUS H810M AYW GAMING WIFI STCOM,,158970,105몰,
76463777,ASUS H810M AYW GAMING WIFI-CSM STCOM,,157860,118몰,
76509641,ASRock B650M Pro X3D 에즈윈,,149900,162몰,
76554605,MAXSUN 터미네이터 B550M 디앤디컴,,88190,98몰,
76941716,GIGABYTE H810M S2H 제이씨현,,137800,82몰,
76941815,GIGABYTE H810M H 제이씨현,,114600,35몰,
76941983,GIGABYTE H810M K 제이씨현,,119000,5몰,
76942061,GIGABYTE H810M H 피씨디렉트,,117680,135몰,
76942073,GIGABYTE H810M K 피씨디렉트,,114970,66몰,
76942094,GIGABYTE H810M S2H 피씨디렉트,,118980,142몰,
76944080,ASUS ROG STRIX B850-F GAMING WIFI 인텍앤컴퍼니,,406850,114몰,
76946525,ASUS ROG STRIX B850-I GAMING WIFI 인텍앤컴퍼니,,428990,32몰,
76948274,MAXSUN 챌린저 A620A 2.5G 디앤디컴,,100180,99몰,
76948292,MAXSUN e스포츠 B650ITX WIFI ICE 디앤디컴,,180900,101몰,
77083181,ASUS PRIME H810M-A 코잇,,124510,113몰,
77083238,ASUS PRIME H810M-A WIFI 코잇,,143310,11몰,
77083265,ASUS H810M AYW GAMING WIFI 코잇,,144340,106몰,
77278676,ASRock B850I Lightning WiFi 대원씨티에스,,342870,98몰,
77278823,COLORFUL CH310M-F M.2 V20 STCOM,,90980,75몰,
77278937,ASRock B850 스틸레전드 WiFi 에즈윈,,333960,63몰,
77283125,MAXSUN 아이크레프트 Z890 아크틱 디앤디컴,,452440,87몰,
77313929,MAXSUN 챌린저 B760ITX D5 디앤디컴,,192420,94몰,
77319245,MAXSUN 터미네이터 Z890-A WIFI 디앤디컴,,254200,118몰,
77382695,ASUS PRO WS Z890-ACE SE STCOM,,864970,97몰,
77459585,NZXT N7 Z890 Black,,587360,2몰,
77459705,NZXT N7 Z890 White,,587360,2몰,
77460638,NZXT N9 Z890 Black,,765000,32몰,
77460707,NZXT N9 Z890 White,,765000,33몰,
77460818,GIGABYTE B850M DS3H ICE 제이씨현,,192530,199몰,
77460890,ASUS ROG STRIX B850-E GAMING WIFI 인텍앤컴퍼니,,518990,104몰,
77460911,ASUS TUF Gaming B850-PLUS WIFI 인텍앤컴퍼니,,339000,6몰,
77460956,ASUS ROG CROSSHAIR X870E HERO 인텍앤컴퍼니,,852800,111몰,
77460980,ASUS ROG STRIX X870-A GAMING WIFI 인텍앤컴퍼니,,490750,113몰,
77618858,ASUS ROG STRIX B850-E GAMING WIFI STCOM,,539520,138몰,
77620880,GIGABYTE B850M DS3H ICE 피씨디렉트,,187180,179몰,
77704688,ASRock B850M 스틸레전드 WiFi 대원씨티에스,,240910,109몰,
77705072,ASRock B850M Riptide WiFi 대원씨티에스,,250070,114몰,
77706647,ASRock B650M Pro X3D 대원씨티에스,,152050,126몰,
77706989,ASRock A520M-HVS 대원씨티에스,,63340,69몰,
77784170,ASRock W790 WS R2.0 에즈윈,,1176570,73몰,
77786621,ASRock B650M Pro X3D WiFi 디앤디컴,,171380,136몰,
77786816,ASRock B650M Pro X3D 디앤디컴,,148120,145몰,
77791190,GIGABYTE X870I AORUS PRO ICE 피씨디렉트,,502980,135몰,
77856971,GIGABYTE B850I AORUS PRO 피씨디렉트,,340350,136몰,
78099548,ASUS ROG STRIX B850-A GAMING WIFI 인텍앤컴퍼니,,408990,7몰,
78102320,BIOSTAR B850MT-E PRO 제이씨현,,148260,158몰,
78102458,ASRock Z890 Pro-A WiFi 디앤디컴,,319160,128몰,
78102476,ASRock B850M 스틸레전드 WiFi 디앤디컴,,237960,139몰,
78180194,GIGABYTE B760M D3HP D4 제이씨현,,124500,23몰,
78307601,ASRock B860M-X 디앤디컴,,162260,129몰,
78307670,ASRock H810M-X WIFI 디앤디컴,,148500,130몰,
78307739,ASRock H810M-X 디앤디컴,,137130,127몰,
78312209,ASRock H810M-X 디앤디컴 (벌크),,138890,103몰,
78534680,ASRock B850M Pro RS + WiFi6E 모듈 패키지 디앤디컴,,257580,78몰,
78843671,GIGABYTE B850M AORUS ELITE WIFI6E 제이씨현,,239800,191몰,
78977822,ASRock H810M-X 인텍앤컴퍼니,,156160,84몰,
78990293,ASRock B850 Pro-A WiFi 에즈윈,,236910,138몰,
79000790,GIGABYTE B850M AORUS ELITE WIFI6E 피씨디렉트,,243780,162몰,
79397648,MSI MAG B850M 박격포 WIFI,,262690,187몰,
79402439,GIGABYTE X870I AORUS PRO ICE 제이씨현,,494450,153몰,
79410686,ASRock X870 Pro RS WiFi 디앤디컴,,304500,134몰,
79410761,ASRock B850 Pro-A WiFi 디앤디컴,,228540,131몰,
79553249,ASRock B850M Pro-A WiFi 디앤디컴,,191850,128몰,
79553456,ASRock B850M-X R2.0 디앤디컴,,164030,114몰,
79556738,ASRock B850M-X R2.0 대원씨티에스,,167320,23몰,
79556987,NZXT N7 Z790 White,,399000,11몰,
79559189,ASRock H610M-H2/M.2 D4 인텍앤컴퍼니,,78030,94몰,
82093181,ASRock B850M-X R2.0 에즈윈,,167070,132몰,
82470941,ASRock B860 Pro-A WiFi 에즈윈,,257450,124몰,
89861528,COLORFUL CVN X870 ARK FROZEN V14 STCOM,,336130,89몰,
90271250,GIGABYTE B760M AORUS ELITE GEN5 제이씨현,,180970,147몰,
90502931,GIGABYTE B760M AORUS ELITE GEN5 피씨디렉트,,178660,121몰,
90506507,ASRock A620AM-X 디앤디컴,,133490,119몰,
90643316,ASRock H610M-HDVP/D5 R2.0 인텍앤컴퍼니 (벌크),,102730,76몰,
90643517,ASRock Z790 PG Lightning D5 인텍앤컴퍼니,,265670,70몰,
90957212,NZXT N9 X870E Black,,1005260,1몰,
90957218,NZXT N9 X870E White,,1005260,1몰,
91493696,MSI MAG B850M 박격포,,243660,168몰,
91870847,GIGABYTE MX34-BS0,,593000,3몰,
91871951,GIGABYTE B760M DS3H GEN5 제이씨현,,142260,165몰,
91872095,GIGABYTE B760M DS3H GEN5 피씨디렉트,,142060,158몰,
92043230,MAXSUN e스포츠 B850ITX WIFI ICE 디앤디컴,,191000,76몰,
92108180,ASRock A620AM-HVS 대원씨티에스,,98560,84몰,
92149667,ASRock A620AM-HVS 디앤디컴,,101620,109몰,
92357948,ASUS WS C422 PRO/SE,,1499000,3몰,
92360492,ASRock B860 Pro-A 에즈윈,,231890,92몰,
92360591,ASRock A620AM-HVS 에즈윈,,94950,105몰,
92678384,타무즈 H610M-ID4,,71280,59몰,
92678408,타무즈 H610M-ID5,,79220,61몰,
92678840,ASUS TUF Gaming B850-BTF WIFI W 인텍앤컴퍼니,,386430,21몰,
92687522,ASUS PRO WS W880-ACE SE STCOM,,743500,85몰,
92971409,ASRock H810M-H 인텍앤컴퍼니,,131600,88몰,
92971469,ASUS ROG CROSSHAIR X870E APEX STCOM,,998630,113몰,
93018986,ASUS ROG CROSSHAIR X870E EXTREME STCOM,,1437860,120몰,
93019088,ASUS ROG CROSSHAIR X870E APEX 대원씨티에스,,955930,103몰,
93022388,ASUS TUF Gaming B850-BTF WIFI W 대원씨티에스,,387740,71몰,
93022430,ASUS ROG CROSSHAIR X870E EXTREME 대원씨티에스,,1386700,103몰,
93022751,ASUS PRIME B850M-A-CSM 대원씨티에스,,209000,103몰,
93071258,ASUS B850M MAX GAMING WIFI 대원씨티에스,,192740,25몰,
93073223,GIGABYTE X870 AORUS STEALTH ICE 제이씨현,,439980,111몰,
93073367,GIGABYTE X870 AORUS STEALTH ICE 피씨디렉트,,435140,110몰,
93317309,ASRock B650M Pro X3D WiFi 에즈윈,,169430,120몰,
93382583,ASRock B550M Phantom Gaming 4 + WiFi6E 랜카드 패키지 디앤디컴,,152250,3몰,
93442604,GIGABYTE B850 AORUS STEALTH ICE 피씨디렉트,,359400,107몰,
93500939,GIGABYTE B850 AORUS STEALTH ICE 제이씨현,,366230,107몰,
93502442,MSI PRO B850M-A WIFI,,206100,158몰,
93702833,ASRock B650M Pro X3D WiFi 대원씨티에스,,174690,81몰,
93703418,ASUS TUF Gaming B650EM-E WIFI 대원씨티에스,,201370,82몰,
93803822,ASRock B850M Pro RS WiFi WHITE 디앤디컴,,216440,118몰,
93804581,ASRock B850M Pro Plus WiFi 디앤디컴,,233870,110몰,
93864854,MSI MAG Z890 토마호크 WIFI (중고),,392280,1몰,
94028396,ASRock B850M Pro RS WiFi WHITE 대원씨티에스,,218000,88몰,
94080773,GIGABYTE B650M K 제이씨현 (벌크),,120160,90몰,
94080806,GIGABYTE H610M K V2 제이씨현 (벌크),,93080,22몰,
94081583,ASRock A620AM-X + WiFi6E 랜카드 패키지 디앤디컴,,168290,16몰,
94081679,ASRock A620AM-HVS + WiFi6E 랜카드 패키지 디앤디컴,,138720,63몰,
94129904,COLORFUL BATTLE-AX B850M-PLUS PRO WIFI V14 STCOM,,188230,97몰,
94815752,ASUS ROG STRIX B850-G GAMING WIFI 대원씨티에스,,342050,88몰,
94888226,GIGABYTE B760M D2HX LITE SI GEN5 피씨디렉트 (벌크),,142330,57몰,
94998482,ASRock B650M PG Riptide WiFi White 디앤디컴 (중고),,189000,1몰,
95200499,GIGABYTE B850M FORCE 피씨디렉트,,168130,113몰,
95280263,GIGABYTE B850M FORCE 제이씨현,,168040,151몰,
95420366,ASUS B850M MAX GAMING WIFI STCOM,,193670,80몰,
95420465,ASUS ROG STRIX B850-G GAMING WIFI STCOM,,342050,54몰,
95420537,ASUS PRIME B850M-A-CSM STCOM,,204230,102몰,
95421218,ASUS TUF Gaming B650EM-E WIFI STCOM,,193640,99몰,
95930900,BIOSTAR B850MT2-E DJ 제이씨현,,130700,91몰,
95988443,ASUS TUF Gaming B850M-E WIFI STCOM,,233990,107몰,
95988578,ASUS TUF Gaming B850M-PLUS II STCOM,,255160,127몰,
95988710,ASUS TUF Gaming B850M-PLUS WIFI7 STCOM,,264040,147몰,
95988944,ASUS TUF Gaming B850M-PLUS WIFI7 W STCOM,,271320,148몰,
96059018,ASUS P13R-E,,799000,1몰,
96259139,ASUS PRO WS TRX50-SAGE WiFi A 아이보라,,1709000,1몰,
96314954,GIGABYTE H610M K 피씨디렉트 (중고),,94440,2몰,
96366245,ADVANTECH ASMB-925-00A1,,1054700,43몰,
96426692,ASUS Pro H610T-CSM D5 코잇 (벌크),120W 어댑터 포함,196820,4몰,
96426704,ASUS Pro H610T-CSM D5 코잇 (벌크),어댑터 미포함,172990,4몰,
96656717,ASUS TUF Gaming B850-BTF WIFI W STCOM,,390710,94몰,
96711170,ASUS PRIME Z890-P WIFI-CSM STCOM (중고),,333200,3몰,
96711470,ASUS PRIME Z890-P-CSM STCOM (중고),,310500,1몰,
96712895,ASUS PRIME B650EM-A STCOM,,155210,77몰,
96776582,ASRock H610M-H2/M.2 D5 에즈윈,,90950,107몰,
96980930,Supermicro X14SBI-F STCOM,,1110000,1몰,
96981164,NZXT N7 B850 Black,,477990,17몰,
96981215,NZXT N7 B850 White,,477990,17몰,
97118543,ASUS TUF Gaming B850M-PLUS WIFI7 대원씨티에스,,274630,36몰,
97119116,ASUS TUF Gaming B850M-PLUS II 대원씨티에스,,261920,102몰,
97119959,ASUS PRIME B650EM-A 대원씨티에스,,151900,71몰,
97120361,ASUS TUF Gaming B850M-PLUS WIFI7 W 대원씨티에스,,272920,107몰,
97121303,ASUS TUF Gaming B850M-E WIFI 대원씨티에스,,228920,91몰,
97121510,MSI MPG B850I 엣지 TI WIFI,,367960,118몰,
97121798,MSI PRO H810M-B,,136610,91몰,
97224935,ASRock X870 Pro-A WiFi 디앤디컴,,310280,41몰,
97475957,ASUS TUF Gaming X870E-PLUS WIFI7 STCOM,,399320,81몰,
97476215,ASUS ROG STRIX X870E-H GAMING WIFI7 STCOM,,473230,82몰,
97476398,ASUS ROG CROSSHAIR X870E HERO BTF STCOM,,1053180,95몰,
97565858,ASRock A620AI WiFi 대원씨티에스,,230900,70몰,
97702355,ASRock B850 Challenger WiFi 7 White 대원씨티에스,,259510,71몰,
97702418,ASRock B850 Challenger WiFi 7 대원씨티에스,,250670,69몰,
97705844,ASUS ROG CROSSHAIR X870E HERO BTF 대원씨티에스,,1006730,72몰,
97837412,MSI PRO H610M-E DDR5,,89020,99몰,
97842113,ASUS ROG MAXIMUS XIII EXTREME 코잇 (중고),,426210,1몰,
97848539,MSI MAG B850M 박격포 WIFI (중고),,244350,1몰,
97865969,MSI MAG B850 토마호크 맥스 WIFI (중고),,298350,1몰,
97903310,BIOSTAR A620MS-E 제이씨현,,96670,90몰,
97903817,MSI MPG B850I 엣지 TI WIFI (중고),,334350,1몰,
97903919,MSI MPG X670E 카본 WiFi (중고),,519200,3몰,
97904378,ASUS ROG STRIX B650E-I GAMING WIFI STCOM (중고),,382500,1몰,
97904441,GIGABYTE X870E AORUS MASTER 피씨디렉트 (중고),,559200,1몰,
97904522,MSI PRO B760M-A WIFI (중고),,150750,1몰,
98089466,MAXSUN Thin mini N150-AIO T3C (벌크),,167480,15몰,
98184140,ADVANTECH ASMB-807-00A1,,1088660,28몰,
98227940,GIGABYTE X870E AORUS MASTER X3D ICE 제이씨현,,772900,86몰,
98229074,GIGABYTE X870E AORUS PRO X3D ICE 제이씨현,,599970,85몰,
98415254,ASRock X870 Taichi Creator 에즈윈,,591490,39몰,
98415419,ASRock B860M Pro-A 에즈윈,,183200,50몰,
98543660,GIGABYTE X870E AORUS PRO X3D ICE 피씨디렉트,,608790,66몰,
98544125,ASUS ROG STRIX X870E-H GAMING WIFI7 대원씨티에스,,가격비교예정,0몰,
98544692,MSI PRO B850M-P,,186590,37몰,
98613731,GIGABYTE X870E AORUS MASTER X3D ICE 피씨디렉트,,790000,55몰,
98925365,ASRock X870 Pro-A WiFi 대원씨티에스,,294410,11몰,
99054896,ASRock B850 Challenger WiFi 7 White 디앤디컴,,262630,14몰,
99125546,ECS H610H7-TI5 D5 V2.2 코잇,어댑터 미포함,173000,2몰,
99125693,ECS H610H7-TI5 D5 V2.2 코잇,120W 어댑터 포함,196000,1몰,
99125729,ECS H610H7-TI5 D5 V2.2 코잇,150W 어댑터 포함,206000,1몰,
