18448628,MSI MPG B650I 엣지 WIFI,,345230,46몰,
18449468,MSI MPG B650I 엣지 WIFI (해외구매),,327860,31몰,
18460412,GIGABYTE Z790 AORUS XTREME 제이씨현,,1550000,1몰,
18485645,ASRock Z790 Pro RS WiFi D5 디앤디컴,,353900,6몰,
18523409,ASUS PRIME H610M-K D4 아이보라,,90190,109몰,
18557519,GIGABYTE A520M K 제이씨현,,72330,3몰,
18584546,GIGABYTE Z790 AORUS TACHYON 피씨디렉트,,888000,6몰,
18645974,ASRock B760 Pro RS D5 에즈윈,,239000,4몰,
18646154,ASRock B760M PG SONIC WiFi D5 에즈윈,,224990,5몰,
18646550,ASRock B760M 스틸레전드 WiFi D5 에즈윈,,229000,6몰,
18646934,ASRock B760M PG Riptide D5 에즈윈,,167000,80몰,
18649997,GIGABYTE B760M AORUS ELITE 제이씨현,,187870,208몰,
18650078,GIGABYTE B760M AORUS ELITE D4 제이씨현,,173470,137몰,
18650483,GIGABYTE B760M DS3H D4 제이씨현,,135740,193몰,
18651431,GIGABYTE B760M AORUS ELITE 피씨디렉트,,184890,177몰,
18651506,GIGABYTE B760M AORUS ELITE AX 피씨디렉트,,212980,148몰,
18651545,GIGABYTE B760M AORUS ELITE D4 피씨디렉트,,172000,5몰,
18651560,GIGABYTE B760M DS3H D4 피씨디렉트,,136990,163몰,
18651962,GIGABYTE B760 AORUS MASTER D4 피씨디렉트,,432720,1몰,
18652151,ASRock B760 Pro RS D5 디앤디컴,,236000,4몰,
18652196,ASRock B760M PG SONIC WiFi D5 디앤디컴,,223690,55몰,
18652442,ASUS PRIME B760M-K D4 코잇,,157990,78몰,
18652511,ASUS EX B760M-V5 D4 코잇,,156890,76몰,
18652586,ASRock B760M PG Riptide D5 디앤디컴,,196990,3몰,
18652601,ASRock B760M 스틸레전드 WiFi D5 디앤디컴,,216000,1몰,
18652865,MSI MAG B760 토마호크 WIFI,,235000,71몰,
18652871,MSI MAG B760M 박격포,,301000,1몰,
18652877,MSI MAG B760M 박격포 맥스 WIFI,,492590,2몰,
18652886,MSI PRO B760M-G DDR4,,134000,114몰,
18652889,MSI PRO B760M-P DDR4,,124000,133몰,
18652895,ASUS PRIME B760M-K D4 STCOM,,164000,84몰,
18652898,ASUS PRIME B760M-A D4 STCOM,,179010,117몰,
18652901,ASUS PRIME B760M-A WIFI D4 STCOM,,402220,1몰,
18652904,ASUS ProArt B760-CREATOR D4 STCOM,,410000,2몰,
18662405,ASUS ROG STRIX B760-A GAMING WIFI D4 STCOM,,399000,59몰,
18662558,ASUS ROG STRIX B760-F GAMING WIFI STCOM,,440990,103몰,
18662669,ASUS ROG STRIX B760-G GAMING WIFI D4 STCOM,,291500,104몰,
18662789,ASUS ROG STRIX B760-I GAMING WIFI STCOM,,398780,116몰,
18663323,COLORFUL BATTLE-AX B760M-PLUS V20 D5 STCOM,,158030,113몰,
18663455,GIGABYTE H610M K D4 피씨디렉트,,82674,165몰,
18670778,GIGABYTE H610M K D4 제이씨현,,88000,180몰,
18716924,ASUS ROG STRIX B760-I GAMING WIFI 코잇,,374520,125몰,
18718829,ASRock B650 Pro RS 대원씨티에스,,290910,88몰,
18718865,ASRock B650 LiveMixer 대원씨티에스,,490900,2몰,
18725312,ASUS PRIME B760M-K D4 인텍앤컴퍼니,,175290,7몰,
18725357,ASUS ROG STRIX B760-I GAMING WIFI 인텍앤컴퍼니,,376000,1몰,
18780872,GIGABYTE B760 AORUS ELITE 피씨디렉트,,365410,2몰,
18781991,GIGABYTE B760M DS3H 피씨디렉트,,151770,176몰,
18813608,GIGABYTE B760M DS3H 제이씨현,,157000,189몰,
18815033,GIGABYTE B760 AORUS ELITE 제이씨현,,292000,2몰,
18917408,X470 (중고),,136000,1몰,
18981086,GIGABYTE B760 GAMING X 피씨디렉트,,251500,1몰,
18993305,GIGABYTE B760M AORUS ELITE AX 제이씨현,,226860,13몰,
19163258,ASUS PRIME B650M-A II STCOM,,183000,117몰,
19170107,GIGABYTE H610M S2H V2 D4 듀러블에디션 피씨디렉트,,114880,112몰,
19177262,BIOSTAR B760MZ-E PRO D5 이엠텍,,142430,7몰,
19240112,ECS H610H7-TI5 코잇,기본,161010,32몰,
19240121,ECS H610H7-TI5 코잇,120W 어댑터 포함,188000,1몰,
19241759,MSI PRO B760M-A WIFI,,171480,168몰,
19242146,GIGABYTE H610M S2H V2 D4 듀러블에디션 제이씨현,,118000,152몰,
19306598,ASUS TUF Gaming B760-PLUS WIFI 인텍앤컴퍼니,,315000,1몰,
19356875,GIGABYTE B760M GAMING D4 피씨디렉트,,140000,5몰,
19427744,ASUS TUF Gaming B760-PLUS WIFI STCOM,,288000,4몰,
19429325,ASUS PRIME B760-PLUS STCOM,,264640,1몰,
19431530,GIGABYTE A520M K V2 피씨디렉트,,65970,152몰,
19498640,ASRock B760M Pro RS D5 디앤디컴,,177100,119몰,
19523846,COLORFUL H610M-E M.2 V20 D4 STCOM,,81990,109몰,
19536062,ASRock B760M Pro RS D5 에즈윈,,184000,140몰,
19536692,ASRock B650M-HDV/M.2 에즈윈,,164000,76몰,
19554155,ASUS WS C422 SAGE/10G STCOM,,1342280,2몰,
19556732,ASUS PRO WS W680-ACE IPMI STCOM,,663000,91몰,
19556996,ASUS PRO WS W680-ACE STCOM,,569000,3몰,
19605602,ASUS PRIME B760M-A STCOM,,169000,113몰,
19606709,ASUS ROG STRIX B760-A GAMING WIFI STCOM,,370610,93몰,
19607402,ASUS TUF Gaming B760M-E D4 STCOM,,226890,81몰,
19608158,ASUS TUF Gaming B760M-PLUS STCOM,,215000,6몰,
19608629,ASUS TUF Gaming B760M-PLUS WIFI STCOM,,257000,3몰,
19610558,GIGABYTE H610M S2H 듀러블에디션 제이씨현,,128000,4몰,
19619507,GIGABYTE H610M H 듀러블에디션 제이씨현,,115000,8몰,
19627259,ASRock B650M-HDV/M.2 대원씨티에스,,161670,107몰,
19627397,ASRock B550M Phantom Gaming 4 대원씨티에스,,117630,96몰,
19628207,ASUS TUF Gaming B760M-PLUS 코잇,,188750,85몰,
19648718,ASRock B650 Pro RS + WiFi6E 모듈 패키지 디앤디컴,,379320,1몰,
19649354,ASRock B650 PG Lightning + WiFi6E 모듈 패키지 디앤디컴,,349000,1몰,
19673210,ASUS PRIME B760M-A WIFI STCOM,,232990,98몰,
19673600,GIGABYTE A620M GAMING X 제이씨현,,159500,13몰,
19673975,ECS DURATHON2 B760H7-M8 코잇 (벌크),,143530,66몰,
19691519,ASUS PRIME B650M-A II 대원씨티에스,,151500,154몰,
19692893,GIGABYTE H610M H 듀러블에디션 피씨디렉트,,115000,3몰,
19704527,ASUS PRIME B760M-A 코잇,,155210,139몰,
19705316,MSI PRO A620M-E,,115000,130몰,
19719305,GIGABYTE H310M HD2 2.0 듀러블에디션 (중고),,156000,1몰,
19719872,MSI H110M PRO-VD PLUS (중고),,60000,1몰,
19725299,GIGABYTE A620M GAMING X 피씨디렉트,,167110,98몰,
19753526,ECS DURATHON2 B760H7-M8 코잇,,144990,68몰,
19755890,ASRock A620M-HDV/M.2+ 에즈윈,,126000,113몰,
19756130,ASUS PRIME B760-PLUS 코잇,,256510,77몰,
19756199,ASUS TUF Gaming B760-PLUS WIFI 코잇,,260810,112몰,
19772375,ASUS PRIME B760M-A 인텍앤컴퍼니,,162000,118몰,
19772732,ASUS TUF Gaming B760M-PLUS 인텍앤컴퍼니,,188990,35몰,
19827572,ASRock A620M-HDV/M.2+ 디앤디컴,,126000,10몰,
19827944,ASRock A620M-HDV/M.2 디앤디컴,,117690,126몰,
19834694,GIGABYTE H610M S2H 듀러블에디션 피씨디렉트,,119600,7몰,
19868960,GIGABYTE B760M H D4 제이씨현,,276640,1몰,
19903283,ASUS ROG STRIX B760-A GAMING WIFI 코잇,,378750,1몰,
19903481,ASUS ROG STRIX B760-G GAMING WIFI 코잇,,222770,166몰,
19919207,GIGABYTE Z790 AORUS ELITE AX-W 피씨디렉트,,399000,1몰,
19924310,ASUS PRIME A620M-A STCOM,,123500,119몰,
19925807,ASUS TUF Gaming A620M-PLUS STCOM,,183000,68몰,
19926059,ASUS TUF Gaming A620M-PLUS WIFI STCOM,,199000,78몰,
19926611,ASUS PRIME A620M-A 대원씨티에스,,121700,99몰,
19926731,ASUS TUF Gaming A620M-PLUS 대원씨티에스,,160000,13몰,
19927037,ASUS TUF Gaming A620M-PLUS WIFI 대원씨티에스,,181000,4몰,
19927871,ASUS P12R-I STCOM,,391640,90몰,
19936247,ASRock A620M-HDV/M.2 대원씨티에스,,117080,139몰,
19938515,GIGABYTE H610M K 제이씨현,,109000,5몰,
19996577,ASUS PRIME B650M-A WIFI II STCOM,,219000,23몰,
19999916,GIGABYTE H610M K 피씨디렉트,,108580,6몰,
20012147,ASRock Z790 Pro RS D5 + WiFi6E 모듈 패키지 디앤디컴,,422500,6몰,
20027564,ASUS PRIME H510M-K R2.0 인텍앤컴퍼니,,104500,82몰,
20079008,ASUS PRIME Z790M-PLUS-CSM 코잇,,355000,3몰,
20079428,ASUS ROG STRIX Z790-A GAMING WIFI 코잇,,632500,1몰,
20101856,ASRock B760M PG Riptide D5 + WiFi6E 모듈 패키지 디앤디컴,,416780,1몰,
20103287,ASRock B760M Pro RS D5 + WiFi6E 모듈 패키지 디앤디컴,,213000,104몰,
20108249,MSI PRO B650M-P,,159000,134몰,
20119583,GIGABYTE H610M H V2 D4 피씨디렉트,,87990,147몰,
20120033,GIGABYTE B760M D2H 제이씨현,,159000,8몰,
20126900,ASRock B760M-HDVP D5 에즈윈,,144000,3몰,
20140688,ASRock A620M-HDV/M.2+ + WiFi6E 모듈 패키지 디앤디컴,,156000,8몰,
20140877,ASRock A620M-HDV/M.2 + WiFi6E 모듈 패키지 디앤디컴,,145000,120몰,
20171636,MSI PRO B760M-P,,145000,134몰,
20178734,BIOSTAR H610MH D5 이엠텍,,155400,2몰,
20225543,Supermicro X13SAE-F STCOM,,783990,74몰,
20226533,Supermicro X13SAQ STCOM,,694000,88몰,
20226770,Supermicro X13SAZ-Q STCOM,,721000,89몰,
20231597,GIGABYTE A620M S2H 피씨디렉트,,114000,9몰,
20238110,GIGABYTE A620M S2H 제이씨현,,113990,157몰,
20287199,BIOSTAR B760MXC PRO 2.0 D4 이엠텍,,278460,1몰,
20317493,ASUS PRIME B760M-K STCOM,,144000,2몰,
20317796,ASUS ProArt B760-CREATOR STCOM,,458100,84몰,
20318291,ASUS TUF Gaming A620-PRO WIFI STCOM,,274110,120몰,
20324882,GIGABYTE B650M K 제이씨현,,156890,227몰,
20343650,ASUS PRIME B760M-K 코잇,,166490,97몰,
20344700,ASUS PRIME H610M-CS D4 코잇,,83090,166몰,
20391572,ASRock B650M Pro RS 디앤디컴,,196470,146몰,
20405063,ASRock B760M PG LIGHTNING/D4 디앤디컴,,144000,3몰,
20444672,ASRock B650M Pro RS WIFI 디앤디컴,,224000,5몰,
20459081,GIGABYTE A520M K V2 제이씨현,,65990,216몰,
20462924,GIGABYTE H610M H V2 D4 제이씨현,,92000,169몰,
20506130,ASRock A620M-HDV/M.2+ 대원씨티에스,,125890,104몰,
20508416,Supermicro H12DSi-NT6 STCOM,,1495000,2몰,
20509004,Supermicro H12SSL-C STCOM,,1153000,70몰,
20524469,ASRock B760M PG LIGHTNING D5 디앤디컴,,331240,1몰,
20524634,ASRock A520M-HVS 에즈윈 (벌크),,74910,66몰,
20530115,ASRock B760M PG LIGHTNING D5 에즈윈,,172000,1몰,
20536331,ASRock B760M-HDVP D5 에즈윈 (벌크),,139110,101몰,
20578094,GIGAIPC mITX-1900A 산업용,,330000,1몰,
20593100,BIOSTAR A520MT 이엠텍,,65480,138몰,
20600042,Supermicro X13SEI-TF STCOM,,1333000,82몰,
20600072,Supermicro X13SEM-F STCOM,,1250000,84몰,
20606708,Supermicro X13SRA-TF STCOM,,1293680,37몰,
20612690,ASUS PRIME B760M-KS 코잇 (벌크),,142100,50몰,
20615138,Supermicro X13DAI-T STCOM,,2040000,1몰,
20645075,Supermicro X13DEI-T STCOM,,1866000,2몰,
20645813,Supermicro X13SWA-TF STCOM,,1636670,2몰,
20710217,ASUS PRIME B760M-K 인텍앤컴퍼니,,145490,169몰,
20738630,COLORFUL BATTLE-AX B760M-K V20 D5 STCOM,,125980,89몰,
21400361,ASUS PRIME A620M-E 대원씨티에스,,119970,1몰,
21421541,ASUS TUF Gaming B650M-E 대원씨티에스,,177990,123몰,
21427535,ASUS TUF Gaming B650M-E WIFI 대원씨티에스,,205000,38몰,
21428693,ASUS PRIME A620M-K 대원씨티에스,,113930,133몰,
21497582,BIOSTAR B760MX2-E D5 이엠텍,,129000,7몰,
21574646,GIGABYTE B760M D2H D4 제이씨현,,282100,1몰,
21627827,ASRock B650M Pro RS 대원씨티에스,,189220,150몰,
21628184,ASRock B650M Pro RS WiFi 대원씨티에스,,223650,78몰,
21695969,ASRock A520M-HDV 대원씨티에스 (벌크),,69000,113몰,
21727307,GIGABYTE B650M K 피씨디렉트,,151320,225몰,
21731021,GIGABYTE B650M S2H 제이씨현,,171080,2몰,
21755828,ASRock B650M Pro RS + WiFi6E 모듈 패키지 디앤디컴,,226740,105몰,
24703229,ASRock Rack ROME2D16-2T,,1440300,43몰,
25129808,ASUS PRO WS W790E-SAGE SE STCOM,,2082000,91몰,
25208807,ASUS PRO WS W790-ACE STCOM,,1378650,86몰,
25866491,ASRock H610M-HDV/M.2+ D5 에즈윈,,114000,132몰,
25869083,ASRock H610M-HDV/M.2+ D5 에즈윈 (벌크),,111080,107몰,
27409910,ASRock H610M-HDV/M.2+ D5 디앤디컴,,108420,117몰,
27474755,MSI PRO B760M-A DDR4 II,,145000,161몰,
27475223,MSI MAG X670E 토마호크 WIFI,,369000,117몰,
27499739,ASRock B760M-HDV/M.2 D5 디앤디컴,,149000,6몰,
27508001,ASUS WS X299 PRO-SE 대원씨티에스,,601270,86몰,
27534158,GIGABYTE H610M H V2 D4 제이씨현 (벌크),,87990,114몰,
27546074,ASRock H610M-HDV/M.2+ D5 대원씨티에스,,112890,97몰,
27572138,ASUS PRIME H610M-E 인텍앤컴퍼니,,130000,5몰,
27576677,MSI MAG X670E 토마호크 WIFI (해외구매),,412860,64몰,
27629561,ASRock B760M-HDV/M.2 D5 에즈윈,,142000,114몰,
27633896,ASRock B760 Pro RS D5 대원씨티에스,,369000,2몰,
27634559,ASRock B760M-HDV/M.2 D5 대원씨티에스,,148990,94몰,
27634862,ASRock H610M-HDV/M.2 R2.0 D4 대원씨티에스,,110710,3몰,
27635057,ASRock Z790 PG Lightning D5 대원씨티에스,,302000,5몰,
27635753,ASRock Z790 스틸레전드 WiFi D5 대원씨티에스,,452640,2몰,
27675110,ASUS PRIME H610M-E 코잇,,128800,106몰,
27679898,COLORFUL CH510M-K M.2 V20 STCOM,,92130,102몰,
27691589,NVIDIA Jetson Orin Nano Developer Kit 용량확인필요 (해외구매),,789990,8몰,
27698261,GIGABYTE H510M H V2 제이씨현,,98990,113몰,
27779696,ASRock N100M 디앤디컴,,188990,99몰,
28010348,GIGABYTE B760M E 피씨디렉트,,296660,1몰,
28029617,ASRock H610M-H2/M.2 D5 에즈윈 (벌크),,102840,106몰,
28059134,ASRock H610M-HDV/M.2+ D5 디앤디컴 (벌크),,112310,90몰,
28183691,ASRock H610M-H2/M.2 D5 디앤디컴,,106030,118몰,
28183721,ASRock H610M-H2/M.2 D5 디앤디컴 (벌크),,103870,71몰,
28247648,BIOSTAR A520MS 제이씨현,,66000,168몰,
28248419,BIOSTAR B650MT 제이씨현,,108880,143몰,
28248743,BIOSTAR H610MHD D5 제이씨현,,92150,121몰,
28248950,BIOSTAR H610MS 제이씨현,,88000,122몰,
28486034,GIGABYTE Z790 AORUS ELITE X 제이씨현,,475000,1몰,
28511822,ASUS PRIME H510M-K R2.0 STCOM,,108000,26몰,
28577999,ASUS Tinker Edge R,어댑터 포함,277200,62몰,
28581716,ASUS Tinker Edge T,어댑터 포함,141750,69몰,
28582691,ASUS EX B650M-V7 대원씨티에스,,247800,2몰,
28603964,ASRock B650M PG Lightning 에즈윈,,159530,155몰,
28652501,H610 DDR5 (중고),,106000,1몰,
28779527,ASRock B760M PG LIGHTNING D5 + WiFi6E 모듈 패키지 디앤디컴,,391300,1몰,
28780247,ASUS PRO WS W790E-SAGE SE 대원씨티에스,,1980000,1몰,
28802609,COLORFUL CVN Z790M FROZEN D5 V20 STCOM,,302000,2몰,
28803482,ASUS ROG MAXIMUS Z790 APEX ENCORE STCOM,,889700,107몰,
28807472,BIOSTAR B650MP-E PRO 이엠텍,,141500,103몰,
28826600,GIGABYTE Z790 AORUS MASTER X 피씨디렉트,,839000,1몰,
28827020,GIGABYTE Z790 AORUS ELITE X WIFI7 피씨디렉트,,439000,4몰,
28827605,GIGABYTE Z790 AORUS PRO X 피씨디렉트,,459000,13몰,
28827962,GIGABYTE Z790 AORUS ELITE AX ICE 피씨디렉트,,371980,105몰,
28829297,GIGABYTE Z790 AORUS ELITE AX ICE 제이씨현,,374990,119몰,
28857518,ASUS PRIME H610M-K D5 인텍앤컴퍼니,,128320,4몰,
28857623,ASUS PRIME H610M-K ARGB 인텍앤컴퍼니,,123370,95몰,
28857914,ASUS TUF Gaming B760M-BTF WIFI 인텍앤컴퍼니,,252200,76몰,
28859531,ASUS ROG STRIX Z790-F GAMING WIFI II 인텍앤컴퍼니,,721280,1몰,
29309096,MSI MAG Z790 토마호크 맥스 WIFI,,369000,110몰,
29393921,ASUS PRIME H610I-PLUS 코잇,,189000,105몰,
29619623,AFOX IH110D4-MA5-V2 에즈윈,,85500,90몰,
29679326,GIGABYTE B760M AORUS ELITE X AX 피씨디렉트,,430000,3몰,
29679584,Supermicro X12SPA-TF STCOM,,1371000,76몰,
29681957,MSI PRO Z790-A 맥스 WIFI,,329000,81몰,
29687339,MSI MPG Z790 엣지 TI 맥스 WIFI,,800000,2몰,
29759561,BIOSTAR B650MT-E PRO 제이씨현,,137900,126몰,
29863127,GIGABYTE B650M AORUS ELITE AX ICE 제이씨현,,240670,207몰,
29879357,ASRock B450M-HDV R4.0 대원씨티에스,,67800,163몰,
29879744,ASRock B650M-H/M.2+ 대원씨티에스,,129000,1몰,
29880134,ASRock H610M-HVS M.2 R2.0 D4 대원씨티에스,,93940,106몰,
29880191,ASRock H610M-HVS M.2 R2.0 D4 대원씨티에스 (벌크),,87000,96몰,
29908775,ASRock B650M PG Lightning 디앤디컴,,154820,151몰,
29916821,GIGABYTE B650M AORUS ELITE AX ICE 피씨디렉트,,241140,174몰,
29916875,GIGABYTE B650 AORUS ELITE AX ICE 피씨디렉트,,280210,124몰,
29942195,ASUS PRIME H610M-D 코잇,,119000,9몰,
29942531,ASUS PRIME H610M-CS 코잇,,112000,7몰,
29960138,Supermicro H13SAE-MF STCOM,,866000,84몰,
29960348,Supermicro X12SPL-F STCOM,,961000,83몰,
29981321,ASRock Z790 Nova WIFI 에즈윈,,549000,3몰,
30070400,GIGABYTE B650 AORUS ELITE AX ICE 제이씨현,,273610,149몰,
30101828,ASRock Z790 Taichi Carrara 에즈윈,,869000,1몰,
30127295,ASRock B760M-HDV/M.2 D5 에즈윈 (벌크),,144060,106몰,
30131069,ASRock Z790 Nova WIFI 디앤디컴,,549000,1몰,
30161945,ASRock B760M-HDVP D5 디앤디컴,,144000,85몰,
30162119,ASRock B760M-HDVP D5 디앤디컴 (벌크),,147310,66몰,
30167879,ASRock B650M PG Lightning + WiFi6E 모듈 패키지 디앤디컴,,190900,107몰,
30300260,ASRock B650M PG Lightning 대원씨티에스,,157850,159몰,
30311870,COLORFUL BATTLE-AX A520M-K M.2 V14 STCOM,,61500,93몰,
30621842,MSI MEG Z790 갓라이크 (해외구매),,1104390,16몰,
30622283,ASRock B650M PG Lightning + WiFi6E 모듈 패키지 에즈윈,,188010,112몰,
30638927,ASRock B760M Pro RS D5 + WiFi6E 모듈 패키지 에즈윈,,199000,124몰,
30641906,ASRock B760M PG Riptide D5 + WiFi6E 모듈 패키지 에즈윈,,196930,46몰,
31261997,GIGABYTE Z790 AORUS ELITE X THRONE AND LIBERTY EDITION 피씨디렉트,,532230,1몰,
31280975,GIGABYTE Z790 AORUS ELITE X THRONE AND LIBERTY EDITION 제이씨현,,730000,3몰,
31383614,GIGABYTE TRX50 AERO D 제이씨현,,1080000,104몰,
31426703,ASRock Z790 Nova WIFI 대원씨티에스,,513000,3몰,
31429022,Supermicro X12DPi-NT6 STCOM,,1708000,79몰,
31429109,Supermicro X12DPi-N6 STCOM,,1490000,69몰,
31463747,ECS ADLN-I N100 코잇 (무지박스),기본,168990,31몰,
31464083,ECS ADLN-I3 N100 코잇 (무지박스),기본,196310,40몰,
31472456,GIGABYTE TRX50 AERO D 피씨디렉트,,1054090,99몰,
31489394,ECS ADLN-I N100 코잇 (무지박스),65W 어댑터 포함,179720,30몰,
31489457,ECS ADLN-I3 N100 코잇 (무지박스),60W 어댑터 포함,213000,1몰,
31959437,ASRock Z790 Pro RS D5 + WiFi7 모듈 패키지 디앤디컴,,423410,8몰,
31959920,ASRock B760M Pro RS D5 + WiFi7 모듈 패키지 디앤디컴,,229000,92몰,
31960202,GIGABYTE X670E AORUS PRO X 피씨디렉트,,일시품절,0몰,
31981667,GIGABYTE X670E AORUS PRO X 제이씨현,,770000,3몰,
31981778,GIGABYTE X670E AORUS PRO X (해외구매),,464300,26몰,
32002067,GIGABYTE H610M K D4 제이씨현 (벌크),,86990,94몰,
32036924,ASRock B760M PG LIGHTNING/D4 에즈윈,,135690,128몰,
32043872,ASUS PRO WS TRX50-SAGE WiFi (해외구매),,1349390,13몰,
32070719,GIGABYTE B650 AORUS ELITE AX V2 피씨디렉트,,280470,126몰,
32070935,ASUS PRO WS WRX90E-SAGE SE 코잇,,2003800,1몰,
32071067,GIGABYTE B650 AORUS ELITE V2 피씨디렉트,,272290,120몰,
32078006,GIGABYTE B650 AORUS ELITE V2 제이씨현,,275000,152몰,
32110508,ASRock A520M-HDVP R2.0 에즈윈 (벌크),,81910,112몰,
32126690,ASUS PRO WS TRX50-SAGE WiFi STCOM,,1425810,98몰,
32487287,ASUS PRO WS TRX50-SAGE WiFi 대원씨티에스,,1420940,89몰,
33363434,ASUS PRO WS W790E-SAGE SE 코잇,,2094000,2몰,
33410735,COLORFUL H310M-D M.2 V20 STCOM,,92000,4몰,
33992234,ECS DURATHON2 B660H7-M22 코잇,,98980,78몰,
34372580,ASUS PRIME B760M-PLUS-CSM STCOM,,226970,107몰,
34372781,ASUS TUF Gaming B760M-PLUS II STCOM,,243990,101몰,
34372901,ASUS TUF Gaming B760M-PLUS WIFI II STCOM,,272750,98몰,
34373075,ASUS TUF Gaming B650-E WIFI STCOM,,304990,120몰,
34739282,ASUS PRIME H610M-CS 2.5G 코잇,,112860,84몰,
34741700,GIGABYTE B650E AORUS ELITE X AX ICE 피씨디렉트,,332450,133몰,
34741730,GIGABYTE B650E AORUS ELITE X AX ICE 제이씨현,,339000,141몰,
34810886,ASRock B760M PG LIGHTNING D5 대원씨티에스,,178180,1몰,
34810925,ASUS PRIME B760M-PLUS-CSM 인텍앤컴퍼니,,226700,103몰,
34815323,ASUS PRIME B760M-PLUS-CSM 코잇,,193210,93몰,
34815659,ASUS TUF Gaming B760M-PLUS II 코잇,,186200,165몰,
35810231,ASRock A620M-HDV/M.2 에즈윈,,128250,6몰,
35810438,ASRock B760M Pro-A 대원씨티에스,,157000,17몰,
36157511,ASRock A620M-HDVP 에즈윈,,129000,133몰,
36157520,ASRock A620M-HDVP 에즈윈 (벌크),,123890,107몰,
36709451,ASRock B760M-HDV/M.2 D5 디앤디컴 (벌크),,142310,84몰,
37226114,MSI MAG B760M 박격포 II,,192730,122몰,
37286501,GIGABYTE H610M K D4 피씨디렉트 (벌크),,128100,4몰,
37286591,GIGABYTE H610M H V2 D4 피씨디렉트 (벌크),,92000,5몰,
37927508,ASUS P12R-E STCOM,,553990,23몰,
38347157,ASUS PRO WS WRX90E-SAGE SE STCOM,,2019660,91몰,
39249221,MSI PRO A620M-C EX,,116950,145몰,
40580651,ASRock TRX50 WS 에즈윈,,1236980,11몰,
40895255,ASRock B760M Pro-A 에즈윈,,152000,12몰,
42390188,MAXSUN 챌린저 H510M-H,,84270,73몰,
42860537,ASUS Z13PE-D16 STCOM,,1875880,2몰,
42862973,ASRock Z790 Pro RS D5 + WiFi6E 모듈 패키지 에즈윈,,359000,1몰,
42862976,ASRock B760M Pro-A + WiFi6E 모듈 패키지 에즈윈,,174000,5몰,
42862979,ASRock A620M-HDV/M.2+ + WiFi6E 모듈 패키지 에즈윈,,153250,76몰,
43546877,MAXSUN 터미네이터 B760M D5,,159000,58몰,
43557464,MAXSUN 챌린저 H610M,,87900,12몰,
45257993,ASUS PRO WS WRX90E-SAGE SE 대원씨티에스,,2040740,94몰,
46309496,GIGABYTE B650M D3HP 제이씨현,,145000,6몰,
46742996,ASRock B650M PG Lightning WiFi 디앤디컴,,189000,5몰,
48476933,ASUS TUF Gaming B650M-E STCOM,,212990,114몰,
48476972,ASUS TUF Gaming B650M-E WiFi STCOM,,232800,2몰,
48477197,GIGABYTE B650M D3HP 피씨디렉트,,141320,115몰,
49162646,ASRock B550M Pro RS 디앤디컴,,124100,121몰,
49538822,ASRock B550M Pro RS + WiFi6E 랜카드 패키지 디앤디컴,,168530,4몰,
49740182,ASRock B550M Pro RS 에즈윈,,128240,137몰,
49742366,ASRock B760M Pro-A 디앤디컴,,157000,14몰,
49995851,ASRock B550M Pro RS 대원씨티에스,,126950,137몰,
50128154,BIOSTAR A620MS 제이씨현,,160700,2몰,
50128394,BIOSTAR H610MHP 2.0 제이씨현,,88000,5몰,
50129651,ASRock B760M Pro-A + WiFi6E 모듈 패키지 디앤디컴,,175740,6몰,
53418977,MSI B650M 프로젝트 제로,,311120,5몰,
53419463,MSI B760M 프로젝트 제로,,249000,104몰,
54218069,Supermicro H13SRA-TF STCOM,,1256990,82몰,
54326459,Raspberry Pi 라즈베리 파이 4 모델 B (해외구매),8GB,120990,46몰,
54326471,Raspberry Pi 라즈베리 파이 4 모델 B (해외구매),2GB,87710,65몰,
54326486,Raspberry Pi 라즈베리 파이 4 모델 B (해외구매),4GB,101400,101몰,
54326606,GIGABYTE Z790 AORUS XTREME X ICE + AORUS 지포스 RTX 4080 SUPER XTREME ICE 패키지 피씨디렉트,,5569000,1몰,
54481319,액슬 MBAIH310 에즈윈,,80710,90몰,
54816743,ASUS Tinker Edge R (병행수입),,185790,9몰,
55468811,ASRock H510M-HDV/M.2 SE 에즈윈,,96000,133몰,
56139419,Supermicro X12SPO-F STCOM,,957000,67몰,
56139584,Supermicro X12SPO-NTF STCOM,,1193000,67몰,
56144006,ASRock A620M-HDVP 디앤디컴,,121000,115몰,
56156189,ASRock A620M-HDVP 디앤디컴 (벌크),,121500,85몰,
57295043,MSI PRO B650M-B,,139000,134몰,
58103081,KHADAS VIM3 Pro 4GB,,201300,1몰,
58103207,KHADAS VIM3 Pro 2GB (해외구매),,198000,2몰,
58115534,COLORFUL COLORFIRE B760M-MEOW WIFI D5 ORANGE STCOM,,230910,57몰,
58119920,GIGABYTE B650E AORUS PRO X USB4 제이씨현,,483550,1몰,
58623128,ASRock H610M-H2/M.2 D4 에즈윈 (벌크),,87900,52몰,
58837484,MAXSUN 챌린저 H610ITX 2LAN,,146300,69몰,
59826524,ASRock H610M-H2/M.2 D4 디앤디컴,,88600,130몰,
59827064,ASRock H610M-H2/M.2 D4 디앤디컴 (벌크),,87990,99몰,
60064028,마이크로틱 MikroTik L11UG-5HaxD,,121000,20몰,
60151763,COLORFUL BATTLE-AX B650M-PLUS V14 STCOM,,159000,23몰,
60247235,COLORFUL COLORFIRE B760M-MEOW WIFI D5 ORANGE 디앤디컴,,231630,72몰,
61423451,ASRock H610M-X D5 에즈윈,,123000,52몰,
61423463,ASRock H610M-X D5 에즈윈 (벌크),,118360,86몰,
62568890,MSI PRO B650M-A,,169000,41몰,
62636738,Supermicro H12SSL-i STCOM,,993380,55몰,
62791640,ASRock B650M PG Riptide WiFi White 에즈윈,,259000,111몰,
63035990,GIGABYTE B650E AORUS STEALTH ICE 제이씨현,,388990,124몰,
63087248,GIGABYTE B650E AORUS STEALTH ICE 피씨디렉트,,378480,89몰,
63087650,ASRock H610M-X D5 디앤디컴,,120190,108몰,
63140087,ASRock H610M-X D5 디앤디컴 (벌크),,121000,80몰,
63269363,ASRock B650M PG Riptide WiFi White 디앤디컴,,256490,92몰,
63478082,ASRock B650M PG Riptide WiFi White 대원씨티에스,,254310,87몰,
63478493,KHADAS VIM4 8GB,,273900,5몰,
63478505,KHADAS VIM4 8GB (해외구매),,270640,17몰,
63938699,GIGABYTE TRX50 AI TOP 제이씨현,,1399000,110몰,
64267934,GIGABYTE TRX50 AI TOP 피씨디렉트,,1397570,38몰,
64375265,GIGABYTE H610M H V2 피씨디렉트,,116260,87몰,
64394135,ASRock B650 스틸레전드 WiFi 디앤디컴,,305000,1몰,
65307479,GIGABYTE H610M S2H V2 피씨디렉트,,124630,84몰,
65367206,BIOSTAR B760M SILVER 제이씨현,,155580,2몰,
65368136,ASUS PRIME Z790-A WIFI-CSM 코잇,,379640,95몰,
66046067,GIGABYTE H610M S2H V2 제이씨현,,127990,118몰,
66046259,GIGABYTE H610M H V2 제이씨현,,119000,123몰,
66046349,GIGABYTE H610M K V2 제이씨현,,108960,126몰,
67371704,ASRock Rack SP2C621D16-2T 명인일렉트로닉스,,2570410,2몰,
67372934,ASRock H510M-HDV/M.2 SE 디앤디컴,,96000,117몰,
67373036,ASRock H510M-HDV/M.2 SE 디앤디컴 (벌크),,95000,79몰,
67622027,ASRock H610M-X D5 대원씨티에스,,123000,5몰,
67678283,GIGABYTE H610M K V2 피씨디렉트,,105690,83몰,
67693886,ASUS PRIME X870-P WIFI-CSM STCOM,,389000,95몰,
67693952,ASUS PRIME X870-P-CSM STCOM,,360000,92몰,
67694132,ASUS ProArt X870E-CREATOR WIFI STCOM,,771850,97몰,
67694456,ASUS ROG CROSSHAIR X870E HERO STCOM,,965790,117몰,
67694840,ASUS ROG STRIX X870-A GAMING WIFI STCOM,,547430,110몰,
67694921,ASUS ROG STRIX X870E-E GAMING WIFI STCOM,,783990,109몰,
67695545,ASUS ROG STRIX X870-F GAMING WIFI STCOM,,711990,105몰,
67695563,ASUS TUF Gaming X870-PLUS WIFI STCOM,,513010,106몰,
67695641,ASRock X870 Pro RS 에즈윈,,368990,98몰,
67845767,GIGABYTE X870E AORUS MASTER 제이씨현,,699000,118몰,
67845785,GIGABYTE X870E AORUS PRO ICE 제이씨현,,466660,173몰,
67845815,GIGABYTE X870 AORUS ELITE WIFI7 제이씨현,,398990,83몰,
67845863,GIGABYTE X870 AORUS ELITE WIFI7 ICE 제이씨현,,406530,162몰,
67846052,GIGABYTE X870 EAGLE WIFI7 제이씨현,,334990,144몰,
67847060,ASRock X870 스틸레전드 WiFi 에즈윈,,475000,1몰,
67847474,GIGABYTE X870 AORUS ELITE WIFI7 피씨디렉트,,396390,51몰,
67847492,GIGABYTE X870 AORUS ELITE WIFI7 ICE 피씨디렉트,,397930,121몰,
67847543,GIGABYTE X870E AORUS MASTER 피씨디렉트,,698670,113몰,
67847609,GIGABYTE X870E AORUS PRO ICE 피씨디렉트,,453760,146몰,
67850639,ASRock X870E Taichi 에즈윈,,819280,71몰,
