69471116,ASRock Z890I Nova WiFi 에즈윈,,504330,147몰,
69471320,ASRock Z890 Nova WiFi 에즈윈,,529000,5몰,
69566399,ASUS ROG MAXIMUS Z890 APEX 인텍앤컴퍼니,,825000,16몰,
69566516,ASUS ROG MAXIMUS Z890 EXTREME 인텍앤컴퍼니,,1890500,1몰,
69566996,ASUS ROG MAXIMUS Z890 HERO 인텍앤컴퍼니,,904930,143몰,
69656168,ASUS ROG STRIX Z890-A GAMING WIFI 인텍앤컴퍼니,,524090,104몰,
69656276,ASUS ROG STRIX Z890-E GAMING WIFI 인텍앤컴퍼니,,804230,4몰,
69656426,ASUS ROG STRIX Z890-F GAMING WIFI 인텍앤컴퍼니,,715015,7몰,
69656816,ASUS PRIME Z890-P WIFI-CSM 인텍앤컴퍼니,,398880,80몰,
69656858,ASUS PRIME Z890-P-CSM 인텍앤컴퍼니,,347210,14몰,
69661004,ASUS Z890 AYW GAMING WIFI W 인텍앤컴퍼니,,369000,111몰,
69661214,ASUS ProArt Z890-CREATOR WIFI 인텍앤컴퍼니,,798990,7몰,
69661250,ASUS PRIME Z890-P WIFI-CSM STCOM,,410800,150몰,
69661526,ASUS PRIME Z890-P-CSM STCOM,,361800,153몰,
69661643,ASUS ROG MAXIMUS Z890 APEX STCOM,,751050,126몰,
69661799,ASUS ROG MAXIMUS Z890 HERO STCOM,,997690,158몰,
69662105,ASUS ROG STRIX Z890-E GAMING WIFI STCOM,,749990,19몰,
69662114,ASUS ROG STRIX Z890-F GAMING WIFI STCOM,,689000,41몰,
69662153,ASUS ROG STRIX Z890-I GAMING WIFI STCOM,,796810,7몰,
69662171,ASUS TUF Gaming Z890-PRO WIFI STCOM,,444090,123몰,
69662327,ASUS Z890 AYW GAMING WIFI W STCOM,,369000,153몰,
69696089,ASUS PRIME Z890-P WIFI-CSM 코잇,,399000,19몰,
69696269,ASUS PRIME Z890-P-CSM 코잇,,355420,133몰,
69696464,ASUS PRIME Z890M-PLUS WIFI-CSM 코잇,,367000,122몰,
69696563,ASUS ProArt Z890-CREATOR WIFI 코잇,,818910,110몰,
69696602,ASUS ROG MAXIMUS Z890 APEX 코잇,,708990,132몰,
69696641,ASUS ROG MAXIMUS Z890 EXTREME 코잇,,1754000,3몰,
69696719,ASUS ROG MAXIMUS Z890 HERO 코잇,,1046490,118몰,
69696863,ASUS ROG STRIX Z890-E GAMING WIFI 코잇,,814970,99몰,
69696959,ASUS ROG STRIX Z890-F GAMING WIFI 코잇,,753770,134몰,
69697016,ASUS ROG STRIX Z890-I GAMING WIFI 코잇,,731990,86몰,
69697058,ASUS TUF Gaming Z890-PLUS WIFI 코잇,,398990,137몰,
69697280,ASUS Z890 AYW GAMING WIFI W 코잇,,389000,132몰,
69697592,MSI MEG Z890 에이스,,948990,24몰,
69697766,MSI MAG Z890 토마호크 WIFI,,454000,160몰,
69697916,MSI PRO Z890-A WIFI,,384900,170몰,
69698066,MSI MPG Z890 카본 WIFI,,590000,159몰,
69698492,MSI MPG Z890 엣지 TI WIFI,,539000,138몰,
69698594,MSI MEG Z890 유니파이-X,,696000,143몰,
69698870,GIGABYTE Z890 AORUS PRO ICE 제이씨현,,432800,188몰,
69699071,GIGABYTE Z890 AORUS ELITE WIFI7 ICE 제이씨현,,360330,210몰,
69699182,GIGABYTE Z890 AORUS ELITE WIFI7 제이씨현,,348490,207몰,
69699317,GIGABYTE Z890 UD 제이씨현,,312890,203몰,
69699389,GIGABYTE Z890I AORUS ULTRA 제이씨현,,496490,115몰,
69699425,GIGABYTE Z890 UD 피씨디렉트,,324990,152몰,
69699467,GIGABYTE Z890 AORUS MASTER 피씨디렉트,,668990,10몰,
69699584,GIGABYTE Z890 AORUS PRO ICE 피씨디렉트,,441950,153몰,
69699599,GIGABYTE Z890 AORUS ELITE WIFI7 ICE 피씨디렉트,,373600,150몰,
69699671,GIGABYTE Z890 AORUS ELITE WIFI7 피씨디렉트,,356910,166몰,
69699695,GIGABYTE Z890I AORUS ULTRA 피씨디렉트,,493990,131몰,
69867761,ASRock Z890 스틸레전드 WIFI 인텍앤컴퍼니,,369000,7몰,
69867902,ASRock Z890 Taichi 인텍앤컴퍼니,,676400,132몰,
69868004,ASRock Z890 Taichi AQUA 인텍앤컴퍼니,,1514290,3몰,
69868175,ASRock Z890 Taichi OCF 인텍앤컴퍼니,,900830,12몰,
69868301,ASRock Z890 Nova WiFi 인텍앤컴퍼니,,638000,3몰,
69868430,ASRock Z890 LiveMixer WiFi 인텍앤컴퍼니,,316500,145몰,
69868478,ASRock Z890 Pro RS WiFi 인텍앤컴퍼니,,347490,136몰,
69868499,ASRock Z890 Pro-A WiFi 인텍앤컴퍼니,,300000,115몰,
70000382,ASRock Z890 Taichi 디앤디컴,,682000,149몰,
70001147,ASUS ProArt Z890-CREATOR WIFI STCOM,,814990,5몰,
70002455,ASUS PRIME Z890M-PLUS WIFI-CSM STCOM,,378990,119몰,
70006577,ASRock Z890 스틸레전드 WIFI 디앤디컴,,363930,115몰,
70006589,ASRock Z890 Pro RS 디앤디컴,,336480,113몰,
70006610,ASRock Z890 Pro-A 디앤디컴,,304860,145몰,
70101260,ASRock X870 Pro RS WiFi 에즈윈,,322850,152몰,
70769987,ASRock X870E Nova WiFi 대원씨티에스,,424440,121몰,
70875566,ASRock X870 Pro RS 디앤디컴,,295800,91몰,
71007920,ASRock Z890 Lightning WiFi 에즈윈,,419840,149몰,
71010251,ASRock Z890 Pro RS WiFi White 디앤디컴,,334400,157몰,
71216543,MSI PRO Z890-P WIFI,,345000,153몰,
71426399,ASRock Rack EC262D4U 명인일렉트로닉스,,654210,3몰,
71502050,Supermicro H13SSL-NT R2.0 STCOM,,1404990,65몰,
72227675,GIGABYTE Z890 AORUS XTREME AI TOP 피씨디렉트,,1492490,140몰,
72304610,ASRock B650 스틸레전드 WiFi 대원씨티에스,,228960,119몰,
72757274,ASRock X870E Nova WiFi 디앤디컴,,455400,156몰,
73071959,ASRock Rack SP2C741D16X-2T 명인일렉트로닉스,,2090000,3몰,
73072130,ASRock Rack SPC741D8-2L2T/BCM 명인일렉트로닉스,,1980990,4몰,
73560548,GIGABYTE X870E AORUS PRO 피씨디렉트,,412990,190몰,
73763492,ASUS TUF Gaming B850-PLUS WIFI 대원씨티에스,,318280,174몰,
73763909,ASUS TUF Gaming B850M-PLUS WIFI 대원씨티에스,,278990,6몰,
73764137,ASUS ROG STRIX B850-A GAMING WIFI 대원씨티에스,,418770,6몰,
73767836,ASUS ROG STRIX B850-E GAMING WIFI 대원씨티에스,,544980,136몰,
73767989,ASUS ROG STRIX B850-F GAMING WIFI 대원씨티에스,,422550,13몰,
73768364,ASUS ROG STRIX B850-I GAMING WIFI 대원씨티에스,,401000,1몰,
73769318,ASUS PRIME B840M-A WIFI-CSM 대원씨티에스,,234990,94몰,
73769342,ASUS PRIME B840M-A-CSM 대원씨티에스,,162000,98몰,
73769357,ASUS PRIME B840-PLUS WIFI-CSM 대원씨티에스,,279780,4몰,
73770854,GIGABYTE X870E AORUS XTREME AI TOP 피씨디렉트,,939000,3몰,
73883426,ASUS TUF Gaming B850M-PLUS 대원씨티에스,,328890,1몰,
73883867,ASUS ROG STRIX B850-A GAMING WIFI STCOM,,406430,156몰,
73883918,ASUS ROG STRIX B850-F GAMING WIFI STCOM,,425590,157몰,
73883963,ASUS ROG STRIX B850-I GAMING WIFI STCOM,,415000,156몰,
73884029,ASUS TUF Gaming B850M-PLUS STCOM,,254000,19몰,
73884041,ASUS TUF Gaming B850M-PLUS WIFI STCOM,,261230,54몰,
73884083,ASUS TUF Gaming B850-PLUS WIFI STCOM,,318480,214몰,
73884143,ASUS PRIME B840M-A WIFI-CSM STCOM,,250600,136몰,
73884173,ASUS PRIME B840M-A-CSM STCOM,,236170,136몰,
73891739,GIGABYTE B850 AORUS ELITE WIFI7 피씨디렉트,,290770,179몰,
73891778,GIGABYTE B850 AORUS ELITE WIFI7 ICE 피씨디렉트,,308970,168몰,
73892000,GIGABYTE B850M AORUS ELITE WIFI6E ICE 피씨디렉트,,222300,215몰,
73892084,GIGABYTE B850M DS3H 피씨디렉트,,170080,193몰,
73892279,GIGABYTE B850 AORUS ELITE WIFI7 ICE 제이씨현,,264000,201몰,
73892309,GIGABYTE B850 AORUS ELITE WIFI7 제이씨현,,290700,166몰,
73892354,GIGABYTE B850M DS3H 제이씨현,,163920,233몰,
73892423,GIGABYTE B850M AORUS ELITE WIFI6E ICE 제이씨현,,227600,255몰,
73948922,MSI PRO B840-P WIFI,,198980,156몰,
73949189,ASRock X870E Taichi Lite (해외구매),,702500,1몰,
73949327,GIGABYTE X870E AORUS ELITE WIFI7 (해외구매),,418200,9몰,
73952525,ASRock B850 Pro RS 에즈윈,,241430,164몰,
73952591,ASRock B850I Lightning WiFi 에즈윈,,338510,135몰,
73952600,ASRock B850 Pro RS WiFi 에즈윈,,240400,162몰,
73952729,ASRock B850M Pro RS 에즈윈,,202910,146몰,
73952732,ASRock B850M Pro RS WiFi 에즈윈,,202940,147몰,
74013710,ASRock B860M Pro RS 에즈윈,,194400,159몰,
74116181,ASRock B860 LiveMixer WiFi 인텍앤컴퍼니,,272000,117몰,
74116334,ASRock B860M LiveMixer WiFi 인텍앤컴퍼니,,210210,146몰,
74116589,ASRock B860 스틸레전드 WiFi 인텍앤컴퍼니,,335040,7몰,
74116682,ASRock B860M 스틸레전드 WiFi 인텍앤컴퍼니,,263520,10몰,
74121977,ASRock B860M Pro RS WiFi 인텍앤컴퍼니,,218500,22몰,
74122352,ASRock B860M-X 인텍앤컴퍼니,,166100,127몰,
74250353,ASRock B850 LiveMixer WiFi 대원씨티에스,,282970,4몰,
74250455,ASRock B850 Pro-A 대원씨티에스,,199900,129몰,
74250557,ASRock B850 Riptide WiFi 대원씨티에스,,294280,96몰,
74250659,ASRock B850M-X 대원씨티에스,,166750,2몰,
74250827,GIGABYTE B860 AORUS ELITE WIFI7 ICE 제이씨현,,284500,190몰,
74250974,GIGABYTE B860M AORUS ELITE WIFI6E ICE 제이씨현,,258500,216몰,
74251187,GIGABYTE B860M AORUS ELITE WIFI6E 제이씨현,,258560,209몰,
74251253,GIGABYTE B860M AORUS ELITE 제이씨현,,224480,194몰,
74251349,GIGABYTE B860M DS3H 제이씨현,,167830,229몰,
74253203,ASUS ROG STRIX B860-I GAMING WIFI STCOM,,428980,147몰,
74253692,ASUS ROG STRIX B860-F GAMING WIFI STCOM,,443920,147몰,
74254586,ASUS ROG STRIX B860-A GAMING WIFI STCOM,,394440,155몰,
74254724,ASUS TUF Gaming B860-PLUS WIFI STCOM,,319000,142몰,
74254814,ASUS TUF Gaming B860M-PLUS WIFI STCOM,,278750,156몰,
74254832,ASUS TUF Gaming B860M-PLUS STCOM,,249980,158몰,
74255033,ASUS PRIME B860M-A WIFI-CSM STCOM,,222320,126몰,
74255060,ASUS PRIME B860M-A-CSM STCOM,,189000,119몰,
74255084,ASUS PRIME B860M-K-CSM STCOM,,198980,159몰,
74255114,ASUS PRIME B860-PLUS-CSM STCOM,,299000,66몰,
74255120,ASUS PRIME B860-PLUS WIFI-CSM STCOM,,318990,85몰,
74255204,ASUS PRIME B860M-A WIFI-CSM 인텍앤컴퍼니,,214000,3몰,
74255321,ASUS PRIME B860M-A-CSM 인텍앤컴퍼니,,177020,134몰,
74255333,ASUS ROG STRIX B860-A GAMING WIFI 인텍앤컴퍼니,,398990,13몰,
74255336,ASUS ROG STRIX B860-F GAMING WIFI 인텍앤컴퍼니,,445000,10몰,
74255369,ASUS ROG STRIX B860-I GAMING WIFI 인텍앤컴퍼니,,429000,3몰,
74255378,ASUS TUF Gaming B860-PLUS WIFI 인텍앤컴퍼니,,368890,60몰,
74255381,GIGABYTE B860 AORUS ELITE WIFI7 ICE 피씨디렉트,,291980,167몰,
74255384,GIGABYTE B860M AORUS ELITE 피씨디렉트,,233980,153몰,
74255387,GIGABYTE B860M AORUS ELITE WIFI6E ICE 피씨디렉트,,257940,206몰,
74255390,GIGABYTE B860M AORUS ELITE WIFI6E 피씨디렉트,,260970,193몰,
74255393,GIGABYTE B860M DS3H 피씨디렉트,,178900,178몰,
74336033,ASUS PRIME H810M-A STCOM,,131870,138몰,
74336102,ASUS PRIME H810M-A-CSM STCOM,,140180,135몰,
74336888,ASUS PRIME H810M-A WIFI STCOM,,148830,137몰,
74336894,ASUS PRIME H810M-A WIFI-CSM STCOM,,158990,135몰,
74337014,ASUS PRIME B860-PLUS-CSM 코잇,,279000,148몰,
74337680,ASUS PRIME B860M-A-CSM 코잇,,180580,171몰,
74337722,ASUS ROG STRIX B860-A GAMING WIFI 코잇,,369000,132몰,
74338013,ASUS ROG STRIX B860-F GAMING WIFI 코잇,,456480,143몰,
74338115,ASUS ROG STRIX B860-G GAMING WIFI 코잇,,279280,183몰,
74338499,ASUS ROG STRIX B860-I GAMING WIFI 코잇,,416150,137몰,
74338622,ASUS TUF Gaming B860-PLUS WIFI 코잇,,318980,144몰,
74339975,MSI PRO B860M-A WIFI,,208980,161몰,
74340266,MSI MAG B860M 박격포 WIFI,,261700,201몰,
74340455,MSI MAG B860 토마호크 WIFI,,288980,187몰,
74340596,ASRock B850 Pro RS WiFi 디앤디컴,,248120,146몰,
74340710,ASRock B850 스틸레전드 WiFi 디앤디컴,,283320,158몰,
74341163,ASRock B850M Pro-A 에즈윈,,164050,185몰,
74341325,ASRock B850M Pro-A WiFi 에즈윈,,189000,168몰,
74341418,ASRock B850M 스틸레전드 WiFi 에즈윈,,241400,148몰,
74341610,ASRock B850 Pro-A 디앤디컴,,222110,159몰,
74341787,ASRock B850M-X 디앤디컴,,146850,122몰,
74415038,ASRock B860M Pro RS WiFi 에즈윈,,211660,152몰,
74415482,ASRock B860 Pro RS 에즈윈,,250420,159몰,
74415509,ASRock B860 Pro RS WiFi 에즈윈,,260630,160몰,
74422025,ASRock B860M Pro RS 디앤디컴,,201950,144몰,
74491244,ASUS PRIME B840M-A-CSM 인텍앤컴퍼니,,144440,148몰,
74491247,ASUS TUF Gaming B850M-PLUS 인텍앤컴퍼니,,259000,2몰,
74491250,ASUS TUF Gaming B850M-PLUS WIFI 인텍앤컴퍼니,,264000,74몰,
74491253,ASRock B860M-X 에즈윈,,173000,4몰,
74491295,ASRock B860I WiFi 에즈윈,,275440,142몰,
74808266,ASUS ROG STRIX Z890-I GAMING WIFI 인텍앤컴퍼니,,776790,11몰,
74814188,ASUS TUF Gaming X870-PLUS WIFI 인텍앤컴퍼니,,362860,117몰,
74814341,MSI MAG B850 토마호크 맥스 WIFI,,326000,142몰,
74814380,MSI MPG B850 엣지 TI WIFI,,365000,186몰,
74885192,ASRock H810M-X 에즈윈,,118790,146몰,
74885201,ASRock H810M-X 에즈윈 (벌크),,131740,92몰,
74999933,ASRock B850 Pro-A 에즈윈,,220010,138몰,
75372923,ASUS Z13PE-D16 아이보라,,1992630,86몰,
75373061,ASUS PRO WS WRX90E-SAGE SE 아이보라,,2042950,88몰,
75373118,ASUS PRO WS W790E-SAGE SE 아이보라,,2127210,87몰,
75465857,ASUS PRO WS TRX50-SAGE WiFi 아이보라,,1467000,3몰,
75536555,ASUS B860M AYW GAMING WIFI 인텍앤컴퍼니,,171380,158몰,
75538394,ASRock B850M Pro RS 대원씨티에스,,196990,138몰,
75538472,MSI MPG X870E 엣지 TI WIFI,,498980,169몰,
75538754,ASRock B850M Pro-A 대원씨티에스,,195000,8몰,
75540665,ASRock B850M Pro-A WiFi 대원씨티에스,,179000,127몰,
75541040,ASRock X870 Riptide WiFi 대원씨티에스,,366240,60몰,
75600170,GIGABYTE X870E AORUS PRO 제이씨현,,410860,158몰,
75600842,ASRock B850M Pro RS 디앤디컴,,201760,170몰,
75600851,ASRock B850M Pro RS WiFi 디앤디컴,,202020,125몰,
75720068,ASUS PRIME H810M-A 인텍앤컴퍼니,,123000,136몰,
75724184,ASRock B850M Pro-A 디앤디컴,,163450,192몰,
75856148,GIGABYTE W790 AI TOP 피씨디렉트,,1495890,61몰,
75856643,ASRock B860M Pro-A 인텍앤컴퍼니,,154200,110몰,
75857021,MSI MAG X870E 토마호크 WIFI,,454000,207몰,
75935612,ASRock B860M Pro RS WiFi 디앤디컴,,217950,149몰,
75935651,ASRock B860 Pro RS WiFi 디앤디컴,,249850,156몰,
75935675,ASRock B860M 스틸레전드 WiFi 디앤디컴,,271700,124몰,
75935729,ASRock B860I WiFi 디앤디컴,,277000,131몰,
75939005,ASRock B850 Pro RS WiFi 대원씨티에스,,251300,102몰,
75988922,GIGABYTE W790 AI TOP 제이씨현,,1410000,2몰,
76463696,ASUS H810M AYW GAMING WIFI STCOM,,158990,87몰,
76463777,ASUS H810M AYW GAMING WIFI-CSM STCOM,,161000,132몰,
76509641,ASRock B650M Pro X3D 에즈윈,,142800,187몰,
76875365,ASUS ProArt Z890-CREATOR WIFI 대원씨티에스,,819000,4몰,
76941716,GIGABYTE H810M S2H 제이씨현,,131490,146몰,
76941815,GIGABYTE H810M H 제이씨현,,107380,186몰,
76941983,GIGABYTE H810M K 제이씨현,,106800,149몰,
76942061,GIGABYTE H810M H 피씨디렉트,,111890,156몰,
76942073,GIGABYTE H810M K 피씨디렉트,,112970,176몰,
76942094,GIGABYTE H810M S2H 피씨디렉트,,129990,156몰,
76944080,ASUS ROG STRIX B850-F GAMING WIFI 인텍앤컴퍼니,,421120,5몰,
76946525,ASUS ROG STRIX B850-I GAMING WIFI 인텍앤컴퍼니,,358970,80몰,
76948274,MAXSUN 챌린저 A620A 2.5G 디앤디컴,,99990,88몰,
76948292,MAXSUN e스포츠 B650ITX WIFI ICE 디앤디컴,,186990,90몰,
77083181,ASUS PRIME H810M-A 코잇,,122980,148몰,
77083238,ASUS PRIME H810M-A WIFI 코잇,,140550,129몰,
77083265,ASUS H810M AYW GAMING WIFI 코잇,,153880,116몰,
77278676,ASRock B850I Lightning WiFi 대원씨티에스,,335640,117몰,
77278937,ASRock B850 스틸레전드 WiFi 에즈윈,,287530,67몰,
77283125,MAXSUN 아이크레프트 Z890 아크틱 디앤디컴,,455580,99몰,
77313929,MAXSUN 챌린저 B760ITX D5 디앤디컴,,187520,84몰,
77319245,MAXSUN 터미네이터 Z890-A WIFI 디앤디컴,,251990,96몰,
77382695,ASUS PRO WS Z890-ACE SE STCOM,,797000,2몰,
77460638,NZXT N9 Z890 Black,,639900,25몰,
77460707,NZXT N9 Z890 White,,673200,31몰,
77460818,GIGABYTE B850M DS3H ICE 제이씨현,,173000,211몰,
77460890,ASUS ROG STRIX B850-E GAMING WIFI 인텍앤컴퍼니,,367700,102몰,
77460911,ASUS TUF Gaming B850-PLUS WIFI 인텍앤컴퍼니,,304640,134몰,
77460956,ASUS ROG CROSSHAIR X870E HERO 인텍앤컴퍼니,,972000,11몰,
77460980,ASUS ROG STRIX X870-A GAMING WIFI 인텍앤컴퍼니,,538990,12몰,
77618858,ASUS ROG STRIX B850-E GAMING WIFI STCOM,,556980,154몰,
77620880,GIGABYTE B850M DS3H ICE 피씨디렉트,,177900,209몰,
77704688,ASRock B850M 스틸레전드 WiFi 대원씨티에스,,234990,132몰,
77705072,ASRock B850M Riptide WiFi 대원씨티에스,,241230,137몰,
77706647,ASRock B650M Pro X3D 대원씨티에스,,134320,174몰,
77706989,ASRock A520M-HVS 대원씨티에스,,57420,160몰,
77784170,ASRock W790 WS R2.0 에즈윈,,1276500,1몰,
77786621,ASRock B650M Pro X3D WiFi 디앤디컴,,178980,167몰,
77786816,ASRock B650M Pro X3D 디앤디컴,,137210,175몰,
77791190,GIGABYTE X870I AORUS PRO ICE 피씨디렉트,,501960,145몰,
77856971,GIGABYTE B850I AORUS PRO 피씨디렉트,,348990,8몰,
78099548,ASUS ROG STRIX B850-A GAMING WIFI 인텍앤컴퍼니,,408990,10몰,
78102320,BIOSTAR B850MT-E PRO 제이씨현,,149000,130몰,
78102458,ASRock Z890 Pro-A WiFi 디앤디컴,,315170,135몰,
78102476,ASRock B850M 스틸레전드 WiFi 디앤디컴,,225700,171몰,
78307601,ASRock B860M-X 디앤디컴,,179000,4몰,
78307670,ASRock H810M-X WIFI 디앤디컴,,149870,118몰,
78307739,ASRock H810M-X 디앤디컴,,135420,142몰,
78312209,ASRock H810M-X 디앤디컴 (벌크),,134920,95몰,
78534680,ASRock B850M Pro RS + WiFi6E 모듈 패키지 디앤디컴,,237900,85몰,
78843671,GIGABYTE B850M AORUS ELITE WIFI6E 제이씨현,,224300,229몰,
78977822,ASRock H810M-X 인텍앤컴퍼니,,129410,7몰,
78990293,ASRock B850 Pro-A WiFi 에즈윈,,226570,150몰,
79000790,GIGABYTE B850M AORUS ELITE WIFI6E 피씨디렉트,,231960,185몰,
79397648,MSI MAG B850M 박격포 WIFI,,260630,234몰,
79402439,GIGABYTE X870I AORUS PRO ICE 제이씨현,,501410,21몰,
79410686,ASRock X870 Pro RS WiFi 디앤디컴,,321950,116몰,
79410761,ASRock B850 Pro-A WiFi 디앤디컴,,225960,158몰,
79553249,ASRock B850M Pro-A WiFi 디앤디컴,,180870,194몰,
79553456,ASRock B850M-X R2.0 디앤디컴,,151350,164몰,
79556738,ASRock B850M-X R2.0 대원씨티에스,,158540,124몰,
79559189,ASRock H610M-H2/M.2 D4 인텍앤컴퍼니,,89000,8몰,
82093181,ASRock B850M-X R2.0 에즈윈,,154190,156몰,
82470941,ASRock B860 Pro-A WiFi 에즈윈,,240630,148몰,
89861528,COLORFUL CVN X870 ARK FROZEN V14 STCOM,,338510,98몰,
90271250,GIGABYTE B760M AORUS ELITE GEN5 제이씨현,,170000,174몰,
90502931,GIGABYTE B760M AORUS ELITE GEN5 피씨디렉트,,165000,152몰,
90506507,ASRock A620AM-X 디앤디컴,,102800,168몰,
90643316,ASRock H610M-HDVP/D5 R2.0 인텍앤컴퍼니 (벌크),,102600,98몰,
90643517,ASRock Z790 PG Lightning D5 인텍앤컴퍼니,,333000,1몰,
90643637,ASRock B760M-HDVP D5 인텍앤컴퍼니 (벌크),,135000,4몰,
90702200,ASUS PRO WS W790-ACE 아이보라,,1449410,74몰,
90957212,NZXT N9 X870E Black,,649000,16몰,
90957218,NZXT N9 X870E White,,649000,27몰,
91493696,MSI MAG B850M 박격포,,241820,197몰,
91870847,GIGABYTE MX34-BS0,,593000,2몰,
91871951,GIGABYTE B760M DS3H GEN5 제이씨현,,123500,203몰,
91872095,GIGABYTE B760M DS3H GEN5 피씨디렉트,,127900,180몰,
92043230,MAXSUN e스포츠 B850ITX WIFI ICE 디앤디컴,,201500,80몰,
92108180,ASRock A620AM-HVS 대원씨티에스,,94690,120몰,
92149667,ASRock A620AM-HVS 디앤디컴,,93910,159몰,
92357948,ASUS WS C422 PRO/SE,,1499000,3몰,
92360492,ASRock B860 Pro-A 에즈윈,,227480,114몰,
92360591,ASRock A620AM-HVS 에즈윈,,90740,142몰,
92678384,타무즈 H610M-ID4,,75800,81몰,
92678408,타무즈 H610M-ID5,,77850,88몰,
92678840,ASUS TUF Gaming B850-BTF WIFI W 인텍앤컴퍼니,,390740,95몰,
92687522,ASUS PRO WS W880-ACE SE STCOM,,786980,106몰,
92971409,ASRock H810M-H 인텍앤컴퍼니,,114170,92몰,
92971469,ASUS ROG CROSSHAIR X870E APEX STCOM,,1038990,124몰,
93018986,ASUS ROG CROSSHAIR X870E EXTREME STCOM,,1440000,72몰,
93019088,ASUS ROG CROSSHAIR X870E APEX 대원씨티에스,,799000,136몰,
93022430,ASUS ROG CROSSHAIR X870E EXTREME 대원씨티에스,,1393060,112몰,
93022751,ASUS PRIME B850M-A-CSM 대원씨티에스,,209000,101몰,
93071258,ASUS B850M MAX GAMING WIFI 대원씨티에스,,188420,131몰,
93073223,GIGABYTE X870 AORUS STEALTH ICE 제이씨현,,448340,85몰,
93073367,GIGABYTE X870 AORUS STEALTH ICE 피씨디렉트,,453980,130몰,
93317309,ASRock B650M Pro X3D WiFi 에즈윈,,171990,146몰,
93382583,ASRock B550M Phantom Gaming 4 + WiFi6E 랜카드 패키지 디앤디컴,,142460,87몰,
93442604,GIGABYTE B850 AORUS STEALTH ICE 피씨디렉트,,378960,124몰,
93500939,GIGABYTE B850 AORUS STEALTH ICE 제이씨현,,376400,140몰,
93502442,MSI PRO B850M-A WIFI,,183260,206몰,
93702833,ASRock B650M Pro X3D WiFi 대원씨티에스,,172620,30몰,
93703418,ASUS TUF Gaming B650EM-E WIFI 대원씨티에스,,174800,172몰,
93803822,ASRock B850M Pro RS WiFi WHITE 디앤디컴,,217070,152몰,
93804581,ASRock B850M Pro Plus WiFi 디앤디컴,,226380,154몰,
94028396,ASRock B850M Pro RS WiFi WHITE 대원씨티에스,,196340,122몰,
94080773,GIGABYTE B650M K 제이씨현 (벌크),,112490,93몰,
94080806,GIGABYTE H610M K V2 제이씨현 (벌크),,75800,36몰,
94081583,ASRock A620AM-X + WiFi6E 랜카드 패키지 디앤디컴,,164480,28몰,
94081679,ASRock A620AM-HVS + WiFi6E 랜카드 패키지 디앤디컴,,130000,96몰,
94129904,COLORFUL BATTLE-AX B850M-PLUS PRO WIFI V14 STCOM,,180960,109몰,
94815752,ASUS ROG STRIX B850-G GAMING WIFI 대원씨티에스,,338530,4몰,
94888226,GIGABYTE B760M D2HX LITE SI GEN5 피씨디렉트 (벌크),,103940,92몰,
94998482,ASRock B650M PG Riptide WiFi White 디앤디컴 (중고),,211680,1몰,
95200499,GIGABYTE B850M FORCE 피씨디렉트,,157700,167몰,
95280263,GIGABYTE B850M FORCE 제이씨현,,152310,218몰,
95420366,ASUS B850M MAX GAMING WIFI STCOM,,192920,146몰,
95420465,ASUS ROG STRIX B850-G GAMING WIFI STCOM,,352000,132몰,
95420537,ASUS PRIME B850M-A-CSM STCOM,,209000,15몰,
95421218,ASUS TUF Gaming B650EM-E WIFI STCOM,,174800,120몰,
95930900,BIOSTAR B850MT2-E DJ 제이씨현,,129800,137몰,
95988443,ASUS TUF Gaming B850M-E WIFI STCOM,,253000,124몰,
95988578,ASUS TUF Gaming B850M-PLUS II STCOM,,236170,172몰,
95988710,ASUS TUF Gaming B850M-PLUS WIFI7 STCOM,,271830,182몰,
95988944,ASUS TUF Gaming B850M-PLUS WIFI7 W STCOM,,263970,188몰,
96059018,ASUS P13R-E,,798900,1몰,
96259139,ASUS PRO WS TRX50-SAGE WiFi A 아이보라,,1479440,58몰,
96314954,GIGABYTE H610M K 피씨디렉트 (중고),,81000,1몰,
96314975,BIOSTAR H610MHD D5 제이씨현 (중고),,82800,2몰,
96366245,ADVANTECH ASMB-925-00A1,,1500000,2몰,
96426692,ASUS Pro H610T-CSM D5 코잇 (벌크),120W 어댑터 포함,208380,4몰,
96426704,ASUS Pro H610T-CSM D5 코잇 (벌크),어댑터 미포함,177380,4몰,
96656717,ASUS TUF Gaming B850-BTF WIFI W STCOM,,401420,126몰,
96711170,ASUS PRIME Z890-P WIFI-CSM STCOM (중고),,335200,3몰,
96712895,ASUS PRIME B650EM-A STCOM,,146990,123몰,
96776582,ASRock H610M-H2/M.2 D5 에즈윈,,82570,136몰,
96981164,NZXT N7 B850 Black,,478000,21몰,
96981215,NZXT N7 B850 White,,243570,38몰,
97118543,ASUS TUF Gaming B850M-PLUS WIFI7 대원씨티에스,,267980,163몰,
97119116,ASUS TUF Gaming B850M-PLUS II 대원씨티에스,,232210,161몰,
97119959,ASUS PRIME B650EM-A 대원씨티에스,,137580,132몰,
97120361,ASUS TUF Gaming B850M-PLUS WIFI7 W 대원씨티에스,,277470,164몰,
97121303,ASUS TUF Gaming B850M-E WIFI 대원씨티에스,,226510,145몰,
97121510,MSI MPG B850I 엣지 TI WIFI,,367620,152몰,
97121798,MSI PRO H810M-B,,126270,189몰,
97224935,ASRock X870 Pro-A WiFi 디앤디컴,,290870,130몰,
97475957,ASUS TUF Gaming X870E-PLUS WIFI7 STCOM,,400150,139몰,
97476215,ASUS ROG STRIX X870E-H GAMING WIFI7 STCOM,,545300,120몰,
97476398,ASUS ROG CROSSHAIR X870E HERO BTF STCOM,,1104000,18몰,
97565858,ASRock A620AI WiFi 대원씨티에스,,227380,116몰,
97702355,ASRock B850 Challenger WiFi 7 White 대원씨티에스,,249490,97몰,
97702418,ASRock B850 Challenger WiFi 7 대원씨티에스,,239000,80몰,
97837412,MSI PRO H610M-E DDR5,,89990,157몰,
97855343,MSI MPG X870E 엣지 TI WIFI (중고),,451350,2몰,
97865969,MSI MAG B850 토마호크 맥스 WIFI (중고),,298350,1몰,
97903310,BIOSTAR A620MS-E 제이씨현,,95990,130몰,
97903688,MSI PRO H610M-C EX (중고),,94000,4몰,
97903817,MSI MPG B850I 엣지 TI WIFI (중고),,334350,2몰,
97903919,MSI MPG X670E 카본 WiFi (중고),,519200,2몰,
97904327,GIGABYTE B850M AORUS ELITE WIFI6E ICE 제이씨현 (중고),,232040,2몰,
97904522,MSI PRO B760M-A WIFI (중고),,109000,4몰,
98184140,ADVANTECH ASMB-807-00A1,,1080160,69몰,
98229074,GIGABYTE X870E AORUS PRO X3D ICE 제이씨현,,615850,87몰,
98415254,ASRock X870 Taichi Creator 에즈윈,,619510,99몰,
98415419,ASRock B860M Pro-A 에즈윈,,169440,108몰,
98543660,GIGABYTE X870E AORUS PRO X3D ICE 피씨디렉트,,604130,153몰,
98544125,ASUS ROG STRIX X870E-H GAMING WIFI7 대원씨티에스,,626000,1몰,
98544692,MSI PRO B850M-P,,170040,159몰,
98613731,GIGABYTE X870E AORUS MASTER X3D ICE 피씨디렉트,,799000,1몰,
98925365,ASRock X870 Pro-A WiFi 대원씨티에스,,292510,103몰,
99054896,ASRock B850 Challenger WiFi 7 White 디앤디컴,,249480,125몰,
99125546,ECS H610H7-TI5 D5 V2.2 코잇,어댑터 미포함,170650,84몰,
99125693,ECS H610H7-TI5 D5 V2.2 코잇,120W 어댑터 포함,195800,83몰,
99125729,ECS H610H7-TI5 D5 V2.2 코잇,150W 어댑터 포함,205360,84몰,
99288923,ASUS TUF Gaming X870E-PLUS WIFI7 대원씨티에스,,413990,64몰,
99640991,타무즈 B760M-ID5 (벌크),,103840,82몰,
99714806,ASRock B760M-X Gen5 에즈윈 (벌크),,123910,97몰,
99714830,ASRock H610M-X D5 Gen5 에즈윈 (벌크),,108660,85몰,
99714851,ASRock H610M-HDV/M.2 D5 Gen5 에즈윈,,98110,123몰,
99733238,ASUS PRIME B760M-A II 코잇,,153950,96몰,
99746582,GIGABYTE B850 EAGLE ICE 제이씨현,,228890,157몰,
99746822,GIGABYTE B850M AORUS ELITE WIFI7 ICE-P 제이씨현,,250790,127몰,
99893756,ASUS TUF Gaming B650EM-E WIFI 인텍앤컴퍼니,,174630,95몰,
99894263,ASUS TUF Gaming B850M-PLUS WIFI7 인텍앤컴퍼니,,258570,113몰,
99913676,ASUS PRO WS B850M-ACE SE STCOM,,604280,98몰,
99945386,GIGABYTE B850M AORUS ELITE WIFI7 ICE-P 피씨디렉트,,262990,125몰,
99948020,ADVANTECH ASMB-927T2-00A1 아이보라,,2077590,60몰,
100192175,MSI PRO A620AM-B EVO,,94390,161몰,
100192475,GIGABYTE B850 EAGLE ICE 피씨디렉트,,233490,121몰,
100383200,ASRock B850 Challenger WiFi 7 White 에즈윈,,259910,122몰,
100691990,ASUS PRIME H810M-E 코잇,,113990,104몰,
100698416,ASUS PRIME B860M-A WIFI-CSM 코잇,,209810,101몰,
101069660,ASRock H610M-X D5 Gen5 디앤디컴,,114000,132몰,
101069831,ASRock H610M-HDV/M.2 D5 Gen5 디앤디컴,,98550,131몰,
