72227675,GIGABYTE Z890 AORUS XTREME AI TOP 피씨디렉트,,1437160,98몰,
72304610,ASRock B650 스틸레전드 WiFi 대원씨티에스,,274160,99몰,
72757274,ASRock X870E Nova WiFi 디앤디컴,,519000,137몰,
72911912,GIGABYTE Z890 AORUS XTREME AI TOP 제이씨현,,1409000,23몰,
72974786,COLORFUL iGame Z890 ULTRA V20 STCOM,,334800,9몰,
73071959,ASRock Rack SP2C741D16X-2T 명인일렉트로닉스,,2220990,3몰,
73072019,ASRock Rack SP2C741D16-2T 명인일렉트로닉스,,2656100,3몰,
73072130,ASRock Rack SPC741D8-2L2T/BCM 명인일렉트로닉스,,1335000,1몰,
73560548,GIGABYTE X870E AORUS PRO 피씨디렉트,,432010,166몰,
73763492,ASUS TUF Gaming B850-PLUS WIFI 대원씨티에스,,315410,114몰,
73763909,ASUS TUF Gaming B850M-PLUS WIFI 대원씨티에스,,250130,46몰,
73764137,ASUS ROG STRIX B850-A GAMING WIFI 대원씨티에스,,393730,105몰,
73767836,ASUS ROG STRIX B850-E GAMING WIFI 대원씨티에스,,546990,104몰,
73767989,ASUS ROG STRIX B850-F GAMING WIFI 대원씨티에스,,415120,72몰,
73768364,ASUS ROG STRIX B850-I GAMING WIFI 대원씨티에스,,416140,100몰,
73769318,ASUS PRIME B840M-A WIFI-CSM 대원씨티에스,,244000,46몰,
73769342,ASUS PRIME B840M-A-CSM 대원씨티에스,,209000,100몰,
73769357,ASUS PRIME B840-PLUS WIFI-CSM 대원씨티에스,,278020,6몰,
73770173,GIGABYTE X870E AORUS XTREME AI TOP 제이씨현,,902930,121몰,
73770854,GIGABYTE X870E AORUS XTREME AI TOP 피씨디렉트,,913410,102몰,
73883426,ASUS TUF Gaming B850M-PLUS 대원씨티에스,,226880,149몰,
73883867,ASUS ROG STRIX B850-A GAMING WIFI STCOM,,399000,128몰,
73883918,ASUS ROG STRIX B850-F GAMING WIFI STCOM,,420100,127몰,
73883963,ASUS ROG STRIX B850-I GAMING WIFI STCOM,,418970,134몰,
73884029,ASUS TUF Gaming B850M-PLUS STCOM,,229550,159몰,
73884041,ASUS TUF Gaming B850M-PLUS WIFI STCOM,,251360,195몰,
73884083,ASUS TUF Gaming B850-PLUS WIFI STCOM,,324800,165몰,
73884143,ASUS PRIME B840M-A WIFI-CSM STCOM,,239400,117몰,
73884173,ASUS PRIME B840M-A-CSM STCOM,,221350,124몰,
73891739,GIGABYTE B850 AORUS ELITE WIFI7 피씨디렉트,,314440,144몰,
73891778,GIGABYTE B850 AORUS ELITE WIFI7 ICE 피씨디렉트,,331390,149몰,
73892000,GIGABYTE B850M AORUS ELITE WIFI6E ICE 피씨디렉트,,244500,176몰,
73892084,GIGABYTE B850M DS3H 피씨디렉트,,218210,171몰,
73892279,GIGABYTE B850 AORUS ELITE WIFI7 ICE 제이씨현,,330990,187몰,
73892309,GIGABYTE B850 AORUS ELITE WIFI7 제이씨현,,320990,182몰,
73892354,GIGABYTE B850M DS3H 제이씨현,,204900,207몰,
73892423,GIGABYTE B850M AORUS ELITE WIFI6E ICE 제이씨현,,246010,223몰,
73948922,MSI PRO B840-P WIFI,,189050,123몰,
73949189,ASRock X870E Taichi Lite (해외구매),,508600,19몰,
73949327,GIGABYTE X870E AORUS ELITE WIFI7 (해외구매),,465380,28몰,
73952525,ASRock B850 Pro RS 에즈윈,,273110,152몰,
73952591,ASRock B850I Lightning WiFi 에즈윈,,366820,109몰,
73952600,ASRock B850 Pro RS WiFi 에즈윈,,288580,141몰,
73952729,ASRock B850M Pro RS 에즈윈,,218260,139몰,
73952732,ASRock B850M Pro RS WiFi 에즈윈,,232490,139몰,
74013710,ASRock B860M Pro RS 에즈윈,,201960,150몰,
74116181,ASRock B860 LiveMixer WiFi 인텍앤컴퍼니,,279000,118몰,
74116334,ASRock B860M LiveMixer WiFi 인텍앤컴퍼니,,249000,132몰,
74116589,ASRock B860 스틸레전드 WiFi 인텍앤컴퍼니,,278990,125몰,
74116682,ASRock B860M 스틸레전드 WiFi 인텍앤컴퍼니,,261730,116몰,
74121977,ASRock B860M Pro RS WiFi 인텍앤컴퍼니,,210660,103몰,
74122352,ASRock B860M-X 인텍앤컴퍼니,,170440,83몰,
74250353,ASRock B850 LiveMixer WiFi 대원씨티에스,,320750,121몰,
74250455,ASRock B850 Pro-A 대원씨티에스,,254780,109몰,
74250557,ASRock B850 Riptide WiFi 대원씨티에스,,345200,74몰,
74250659,ASRock B850M-X 대원씨티에스,,190390,21몰,
74250827,GIGABYTE B860 AORUS ELITE WIFI7 ICE 제이씨현,,297350,175몰,
74250974,GIGABYTE B860M AORUS ELITE WIFI6E ICE 제이씨현,,268990,199몰,
74251187,GIGABYTE B860M AORUS ELITE WIFI6E 제이씨현,,269000,162몰,
74251253,GIGABYTE B860M AORUS ELITE 제이씨현,,234360,142몰,
74251349,GIGABYTE B860M DS3H 제이씨현,,173274,171몰,
74253203,ASUS ROG STRIX B860-I GAMING WIFI STCOM,,419000,111몰,
74253692,ASUS ROG STRIX B860-F GAMING WIFI STCOM,,435000,119몰,
74254586,ASUS ROG STRIX B860-A GAMING WIFI STCOM,,389000,119몰,
74254724,ASUS TUF Gaming B860-PLUS WIFI STCOM,,359000,110몰,
74254814,ASUS TUF Gaming B860M-PLUS WIFI STCOM,,314000,4몰,
74254832,ASUS TUF Gaming B860M-PLUS STCOM,,249000,125몰,
74255033,ASUS PRIME B860M-A WIFI-CSM STCOM,,259000,103몰,
74255060,ASUS PRIME B860M-A-CSM STCOM,,248990,8몰,
74255084,ASUS PRIME B860M-K-CSM STCOM,,169000,126몰,
74255114,ASUS PRIME B860-PLUS-CSM STCOM,,289840,111몰,
74255120,ASUS PRIME B860-PLUS WIFI-CSM STCOM,,309000,104몰,
74255204,ASUS PRIME B860M-A WIFI-CSM 인텍앤컴퍼니,,261240,111몰,
74255321,ASUS PRIME B860M-A-CSM 인텍앤컴퍼니,,201170,16몰,
74255327,ASUS PRIME B860-PLUS WIFI-CSM 인텍앤컴퍼니,,314000,44몰,
74255330,ASUS PRIME B860-PLUS-CSM 인텍앤컴퍼니,,290000,88몰,
74255333,ASUS ROG STRIX B860-A GAMING WIFI 인텍앤컴퍼니,,393250,116몰,
74255336,ASUS ROG STRIX B860-F GAMING WIFI 인텍앤컴퍼니,,440660,124몰,
74255369,ASUS ROG STRIX B860-I GAMING WIFI 인텍앤컴퍼니,,399000,125몰,
74255378,ASUS TUF Gaming B860-PLUS WIFI 인텍앤컴퍼니,,360450,33몰,
74255381,GIGABYTE B860 AORUS ELITE WIFI7 ICE 피씨디렉트,,294260,155몰,
74255384,GIGABYTE B860M AORUS ELITE 피씨디렉트,,239000,14몰,
74255387,GIGABYTE B860M AORUS ELITE WIFI6E ICE 피씨디렉트,,265030,183몰,
74255390,GIGABYTE B860M AORUS ELITE WIFI6E 피씨디렉트,,266640,175몰,
74255393,GIGABYTE B860M DS3H 피씨디렉트,,173700,170몰,
74336033,ASUS PRIME H810M-A STCOM,,129921,114몰,
74336102,ASUS PRIME H810M-A-CSM STCOM,,139000,100몰,
74336888,ASUS PRIME H810M-A WIFI STCOM,,151000,110몰,
74336894,ASUS PRIME H810M-A WIFI-CSM STCOM,,155390,106몰,
74337014,ASUS PRIME B860-PLUS-CSM 코잇,,275210,93몰,
74337680,ASUS PRIME B860M-A-CSM 코잇,,195340,135몰,
74337722,ASUS ROG STRIX B860-A GAMING WIFI 코잇,,354000,121몰,
74338013,ASUS ROG STRIX B860-F GAMING WIFI 코잇,,404770,120몰,
74338115,ASUS ROG STRIX B860-G GAMING WIFI 코잇,,289670,151몰,
74338499,ASUS ROG STRIX B860-I GAMING WIFI 코잇,,376020,111몰,
74338622,ASUS TUF Gaming B860-PLUS WIFI 코잇,,314000,111몰,
74339975,MSI PRO B860M-A WIFI,,209274,168몰,
74340266,MSI MAG B860M 박격포 WIFI,,273640,184몰,
74340455,MSI MAG B860 토마호크 WIFI,,279000,144몰,
74340596,ASRock B850 Pro RS WiFi 디앤디컴,,289000,117몰,
74340710,ASRock B850 스틸레전드 WiFi 디앤디컴,,321530,129몰,
74341163,ASRock B850M Pro-A 에즈윈,,208470,143몰,
74341325,ASRock B850M Pro-A WiFi 에즈윈,,218260,122몰,
74341418,ASRock B850M 스틸레전드 WiFi 에즈윈,,249950,136몰,
74341610,ASRock B850 Pro-A 디앤디컴,,260660,126몰,
74341787,ASRock B850M-X 디앤디컴,,166090,143몰,
74415038,ASRock B860M Pro RS WiFi 에즈윈,,212290,146몰,
74415482,ASRock B860 Pro RS 에즈윈,,253040,143몰,
74415509,ASRock B860 Pro RS WiFi 에즈윈,,262820,145몰,
74422025,ASRock B860M Pro RS 디앤디컴,,200870,133몰,
74491244,ASUS PRIME B840M-A-CSM 인텍앤컴퍼니,,188000,108몰,
74491247,ASUS TUF Gaming B850M-PLUS 인텍앤컴퍼니,,242890,146몰,
74491250,ASUS TUF Gaming B850M-PLUS WIFI 인텍앤컴퍼니,,257500,147몰,
74491253,ASRock B860M-X 에즈윈,,168810,132몰,
74491295,ASRock B860I WiFi 에즈윈,,292000,11몰,
74808266,ASUS ROG STRIX Z890-I GAMING WIFI 인텍앤컴퍼니,,743010,96몰,
74814188,ASUS TUF Gaming X870-PLUS WIFI 인텍앤컴퍼니,,395000,124몰,
74814341,MSI MAG B850 토마호크 맥스 WIFI,,326826,150몰,
74814380,MSI MPG B850 엣지 TI WIFI,,397430,135몰,
74885192,ASRock H810M-X 에즈윈,,145440,131몰,
74885201,ASRock H810M-X 에즈윈 (벌크),,144350,113몰,
74999933,ASRock B850 Pro-A 에즈윈,,258410,125몰,
75372923,ASUS Z13PE-D16 아이보라,,1900900,41몰,
75373061,ASUS PRO WS WRX90E-SAGE SE 아이보라,,2337580,58몰,
75373118,ASUS PRO WS W790E-SAGE SE 아이보라,,2001500,48몰,
75465857,ASUS PRO WS TRX50-SAGE WiFi 아이보라,,1362730,50몰,
75536555,ASUS B860M AYW GAMING WIFI 인텍앤컴퍼니,,187970,135몰,
75538394,ASRock B850M Pro RS 대원씨티에스,,218000,145몰,
75538472,MSI MPG X870E 엣지 TI WIFI,,497870,128몰,
75538754,ASRock B850M Pro-A 대원씨티에스,,205480,141몰,
75540665,ASRock B850M Pro-A WiFi 대원씨티에스,,220820,89몰,
75600170,GIGABYTE X870E AORUS PRO 제이씨현,,432000,188몰,
75600842,ASRock B850M Pro RS 디앤디컴,,214000,130몰,
75600851,ASRock B850M Pro RS WiFi 디앤디컴,,223870,130몰,
75720068,ASUS PRIME H810M-A 인텍앤컴퍼니,,123154,113몰,
75724184,ASRock B850M Pro-A 디앤디컴,,204000,119몰,
75856148,GIGABYTE W790 AI TOP 피씨디렉트,,1480240,85몰,
75856643,ASRock B860M Pro-A 인텍앤컴퍼니,,176960,105몰,
75857021,MSI MAG X870E 토마호크 WIFI,,488150,136몰,
75935612,ASRock B860M Pro RS WiFi 디앤디컴,,210660,110몰,
75935651,ASRock B860 Pro RS WiFi 디앤디컴,,260650,114몰,
75935675,ASRock B860M 스틸레전드 WiFi 디앤디컴,,260660,111몰,
75935729,ASRock B860I WiFi 디앤디컴,,291090,107몰,
75939005,ASRock B850 Pro RS WiFi 대원씨티에스,,284650,105몰,
75988922,GIGABYTE W790 AI TOP 제이씨현,,1449000,28몰,
75989195,ASRock B760M-HDV/M.2 D5 대원씨티에스 (벌크),,136580,1몰,
76330571,Supermicro X14SBM-TP4F STCOM,,1532000,66몰,
76330748,Supermicro X14SBM-TF STCOM,,1292000,77몰,
76386635,ASUS TUF Gaming B650M-E 인텍앤컴퍼니,,178990,7몰,
76463696,ASUS H810M AYW GAMING WIFI STCOM,,168470,102몰,
76463777,ASUS H810M AYW GAMING WIFI-CSM STCOM,,154000,113몰,
76509641,ASRock B650M Pro X3D 에즈윈,,169600,154몰,
76554605,MAXSUN 터미네이터 B550M,,83674,90몰,
76875365,ASUS ProArt Z890-CREATOR WIFI 대원씨티에스,,730680,91몰,
76941716,GIGABYTE H810M S2H 제이씨현,,129270,150몰,
76941815,GIGABYTE H810M H 제이씨현,,110670,178몰,
76941983,GIGABYTE H810M K 제이씨현,,97111,160몰,
76942061,GIGABYTE H810M H 피씨디렉트,,106123,153몰,
76942073,GIGABYTE H810M K 피씨디렉트,,101510,152몰,
76942094,GIGABYTE H810M S2H 피씨디렉트,,124583,127몰,
76944080,ASUS ROG STRIX B850-F GAMING WIFI 인텍앤컴퍼니,,415620,105몰,
76946525,ASUS ROG STRIX B850-I GAMING WIFI 인텍앤컴퍼니,,415640,94몰,
76948274,MAXSUN 챌린저 A620A 2.5G,,98977,93몰,
76948292,MAXSUN e스포츠 B650ITX WIFI ICE,,182000,97몰,
77083181,ASUS PRIME H810M-A 코잇,,122500,116몰,
77083238,ASUS PRIME H810M-A WIFI 코잇,,153700,109몰,
77083265,ASUS H810M AYW GAMING WIFI 코잇,,146260,107몰,
77278676,ASRock B850I Lightning WiFi 대원씨티에스,,358480,90몰,
77278823,COLORFUL CH310M-F M.2 V20 STCOM,,87840,61몰,
77278937,ASRock B850 스틸레전드 WiFi 에즈윈,,361560,60몰,
77283125,MAXSUN 아이크레프트 Z890 아크틱,,452450,90몰,
77313929,MAXSUN 챌린저 B760ITX D5,,193040,88몰,
77314058,ASUS PRO WS WRX80E-SAGE SE WIFI II 아이보라,,1638000,49몰,
77318666,ASUS PRO WS Z890-ACE SE 아이보라,,834510,50몰,
77319245,MAXSUN 터미네이터 Z890-A WIFI,,254820,111몰,
77382695,ASUS PRO WS Z890-ACE SE STCOM,,841000,97몰,
77459585,NZXT N7 Z890 Black,,558000,1몰,
77459705,NZXT N7 Z890 White,,558000,1몰,
77460638,NZXT N9 Z890 Black,,734400,34몰,
77460707,NZXT N9 Z890 White,,734400,33몰,
77460818,GIGABYTE B850M DS3H ICE 제이씨현,,220000,184몰,
77460890,ASUS ROG STRIX B850-E GAMING WIFI 인텍앤컴퍼니,,550040,104몰,
77460911,ASUS TUF Gaming B850-PLUS WIFI 인텍앤컴퍼니,,341500,5몰,
77460956,ASUS ROG CROSSHAIR X870E HERO 인텍앤컴퍼니,,904980,105몰,
77460980,ASUS ROG STRIX X870-A GAMING WIFI 인텍앤컴퍼니,,525120,103몰,
77618858,ASUS ROG STRIX B850-E GAMING WIFI STCOM,,539600,127몰,
77620880,GIGABYTE B850M DS3H ICE 피씨디렉트,,213260,171몰,
77704688,ASRock B850M 스틸레전드 WiFi 대원씨티에스,,246840,109몰,
77705072,ASRock B850M Riptide WiFi 대원씨티에스,,258840,114몰,
77706647,ASRock B650M Pro X3D 대원씨티에스,,167720,118몰,
77706989,ASRock A520M-HVS 대원씨티에스,,65990,9몰,
77784170,ASRock W790 WS R2.0 에즈윈,,1189720,24몰,
77786621,ASRock B650M Pro X3D WiFi 디앤디컴,,191700,114몰,
77786816,ASRock B650M Pro X3D 디앤디컴,,169000,120몰,
77791190,GIGABYTE X870I AORUS PRO ICE 피씨디렉트,,484500,125몰,
77856971,GIGABYTE B850I AORUS PRO 피씨디렉트,,337440,125몰,
78099548,ASUS ROG STRIX B850-A GAMING WIFI 인텍앤컴퍼니,,383740,81몰,
78102320,BIOSTAR B850MT-E PRO 제이씨현,,155677,138몰,
78102458,ASRock Z890 Pro-A WiFi 디앤디컴,,321530,115몰,
78102476,ASRock B850M 스틸레전드 WiFi 디앤디컴,,250870,118몰,
78180194,GIGABYTE B760M D3HP D4 제이씨현,,119040,102몰,
78307601,ASRock B860M-X 디앤디컴,,169160,114몰,
78307670,ASRock H810M-X WIFI 디앤디컴,,151500,120몰,
78307739,ASRock H810M-X 디앤디컴,,140000,117몰,
78312209,ASRock H810M-X 디앤디컴 (벌크),,138920,94몰,
78534680,ASRock B850M Pro RS + WiFi6E 모듈 패키지 디앤디컴,,250870,79몰,
78843671,GIGABYTE B850M AORUS ELITE WIFI6E 제이씨현,,244670,173몰,
78977822,ASRock H810M-X 인텍앤컴퍼니,,151960,84몰,
78990293,ASRock B850 Pro-A WiFi 에즈윈,,270880,134몰,
79000790,GIGABYTE B850M AORUS ELITE WIFI6E 피씨디렉트,,242670,148몰,
79397648,MSI MAG B850M 박격포 WIFI,,260320,162몰,
79402439,GIGABYTE X870I AORUS PRO ICE 제이씨현,,459000,144몰,
79410686,ASRock X870 Pro RS WiFi 디앤디컴,,314000,120몰,
79410761,ASRock B850 Pro-A WiFi 디앤디컴,,271530,114몰,
79553249,ASRock B850M Pro-A WiFi 디앤디컴,,219000,107몰,
79553456,ASRock B850M-X R2.0 디앤디컴,,169000,99몰,
79556738,ASRock B850M-X R2.0 대원씨티에스,,167180,105몰,
79559189,ASRock H610M-H2/M.2 D4 인텍앤컴퍼니,,73796,91몰,
82093181,ASRock B850M-X R2.0 에즈윈,,172070,122몰,
82470941,ASRock B860 Pro-A WiFi 에즈윈,,220000,113몰,
89861528,COLORFUL CVN X870 ARK FROZEN V14 STCOM,,344420,81몰,
89862107,COLORFUL CVN B850I GAMING FROZEN V14 STCOM,,209060,88몰,
90271250,GIGABYTE B760M AORUS ELITE GEN5 제이씨현,,180000,131몰,
90502931,GIGABYTE B760M AORUS ELITE GEN5 피씨디렉트,,183770,93몰,
90506507,ASRock A620AM-X 디앤디컴,,131837,100몰,
90643316,ASRock H610M-HDVP/D5 R2.0 인텍앤컴퍼니 (벌크),,102105,50몰,
90643517,ASRock Z790 PG Lightning D5 인텍앤컴퍼니,,270040,55몰,
90702200,ASUS PRO WS W790-ACE 아이보라,,1355510,15몰,
90957212,NZXT N9 X870E Black,,765000,1몰,
90957218,NZXT N9 X870E White,,765000,1몰,
91493696,MSI MAG B850M 박격포,,244544,130몰,
91870847,GIGABYTE MX34-BS0,,590000,3몰,
91871951,GIGABYTE B760M DS3H GEN5 제이씨현,,141990,132몰,
91872095,GIGABYTE B760M DS3H GEN5 피씨디렉트,,145360,105몰,
92043230,MAXSUN e스포츠 B850ITX WIFI ICE,,191879,63몰,
92108180,ASRock A620AM-HVS 대원씨티에스,,99073,55몰,
92149667,ASRock A620AM-HVS 디앤디컴,,101184,82몰,
92357948,ASUS WS C422 PRO/SE,,1496000,3몰,
92360492,ASRock B860 Pro-A 에즈윈,,203000,69몰,
92360591,ASRock A620AM-HVS 에즈윈,,103110,86몰,
92678384,타무즈 H610M-ID4,,68880,58몰,
92678408,타무즈 H610M-ID5,,76532,57몰,
92678840,ASUS TUF Gaming B850-BTF WIFI W 인텍앤컴퍼니,,389000,14몰,
92687522,ASUS PRO WS W880-ACE SE STCOM,,739990,65몰,
92971409,ASRock H810M-H 인텍앤컴퍼니,,128387,56몰,
92971469,ASUS ROG CROSSHAIR X870E APEX STCOM,,1008980,83몰,
93018986,ASUS ROG CROSSHAIR X870E EXTREME STCOM,,1468840,87몰,
93019088,ASUS ROG CROSSHAIR X870E APEX 대원씨티에스,,1028110,78몰,
93022388,ASUS TUF Gaming B850-BTF WIFI W 대원씨티에스,,389680,71몰,
93022430,ASUS ROG CROSSHAIR X870E EXTREME 대원씨티에스,,1470220,80몰,
93022751,ASUS PRIME B850M-A-CSM 대원씨티에스,,209000,77몰,
93071258,ASUS B850M MAX GAMING WIFI 대원씨티에스,,189000,78몰,
93073223,GIGABYTE X870 AORUS STEALTH ICE 제이씨현,,449000,93몰,
93073367,GIGABYTE X870 AORUS STEALTH ICE 피씨디렉트,,444150,89몰,
93317309,ASRock B650M Pro X3D WiFi 에즈윈,,206140,100몰,
93382583,ASRock B550M Phantom Gaming 4 + WiFi6E 랜카드 패키지 디앤디컴,,144350,51몰,
93442604,GIGABYTE B850 AORUS STEALTH ICE 피씨디렉트,,366190,90몰,
93500939,GIGABYTE B850 AORUS STEALTH ICE 제이씨현,,376180,110몰,
93502442,MSI PRO B850M-A WIFI,,203946,125몰,
93702833,ASRock B650M Pro X3D WiFi 대원씨티에스,,204130,62몰,
93703418,ASUS TUF Gaming B650EM-E WIFI 대원씨티에스,,189000,55몰,
93803822,ASRock B850M Pro RS WiFi WHITE 디앤디컴,,229000,81몰,
93804581,ASRock B850M Pro Plus WiFi 디앤디컴,,239000,79몰,
93864854,MSI MAG Z890 토마호크 WIFI (중고),,392280,1몰,
94028396,ASRock B850M Pro RS WiFi WHITE 대원씨티에스,,234810,64몰,
94080773,GIGABYTE B650M K 제이씨현 (벌크),,127841,79몰,
94080806,GIGABYTE H610M K V2 제이씨현 (벌크),,96930,25몰,
94081583,ASRock A620AM-X + WiFi6E 랜카드 패키지 디앤디컴,,168390,16몰,
94081679,ASRock A620AM-HVS + WiFi6E 랜카드 패키지 디앤디컴,,132432,51몰,
94129904,COLORFUL BATTLE-AX B850M-PLUS PRO WIFI V14 STCOM,,187150,75몰,
94815752,ASUS ROG STRIX B850-G GAMING WIFI 대원씨티에스,,가격비교예정,0몰,
94888226,GIGABYTE B760M D2HX LITE SI GEN5 피씨디렉트,,149280,31몰,
94998482,ASRock B650M PG Riptide WiFi White 디앤디컴 (중고),,224910,1몰,
94998641,ASUS PRO WS W480-ACE STCOM (중고),,161470,1몰,
95200499,GIGABYTE B850M FORCE 피씨디렉트,,176780,62몰,
95280263,GIGABYTE B850M FORCE 제이씨현,,179000,77몰,
95420366,ASUS B850M MAX GAMING WIFI STCOM,,189050,56몰,
95420465,ASUS ROG STRIX B850-G GAMING WIFI STCOM,,331550,57몰,
95420537,ASUS PRIME B850M-A-CSM STCOM,,198550,53몰,
95421218,ASUS TUF Gaming B650EM-E WIFI STCOM,,189050,49몰,
95930900,BIOSTAR B850MT2-E DJ 제이씨현,,136700,37몰,
95988443,ASUS TUF Gaming B850M-E WIFI STCOM,,234040,24몰,
95988578,ASUS TUF Gaming B850M-PLUS II STCOM,,263700,25몰,
95988710,ASUS TUF Gaming B850M-PLUS WIFI7 STCOM,,273230,25몰,
95988944,ASUS TUF Gaming B850M-PLUS WIFI7 W STCOM,,282760,25몰,
