78307601,ASRock B860M-X 디앤디컴,,179000,4몰,
78307670,ASRock H810M-X WIFI 디앤디컴,,149880,118몰,
78307739,ASRock H810M-X 디앤디컴,,135450,143몰,
78312209,ASRock H810M-X 디앤디컴 (벌크),,137370,95몰,
78534680,ASRock B850M Pro RS + WiFi6E 모듈 패키지 디앤디컴,,237900,85몰,
78843671,GIGABYTE B850M AORUS ELITE WIFI6E 제이씨현,,224300,230몰,
78977822,ASRock H810M-X 인텍앤컴퍼니,,129410,7몰,
78990293,ASRock B850 Pro-A WiFi 에즈윈,,229570,151몰,
79000790,GIGABYTE B850M AORUS ELITE WIFI6E 피씨디렉트,,231980,188몰,
79397648,MSI MAG B850M 박격포 WIFI,,268980,234몰,
79402439,GIGABYTE X870I AORUS PRO ICE 제이씨현,,501410,20몰,
79410686,ASRock X870 Pro RS WiFi 디앤디컴,,321640,118몰,
79410761,ASRock B850 Pro-A WiFi 디앤디컴,,225950,156몰,
79553249,ASRock B850M Pro-A WiFi 디앤디컴,,180870,194몰,
79553456,ASRock B850M-X R2.0 디앤디컴,,151390,169몰,
79556738,ASRock B850M-X R2.0 대원씨티에스,,158540,124몰,
79559189,ASRock H610M-H2/M.2 D4 인텍앤컴퍼니,,89000,8몰,
82093181,ASRock B850M-X R2.0 에즈윈,,154190,157몰,
82470941,ASRock B860 Pro-A WiFi 에즈윈,,240630,150몰,
89861528,COLORFUL CVN X870 ARK FROZEN V14 STCOM,,338510,98몰,
90271250,GIGABYTE B760M AORUS ELITE GEN5 제이씨현,,170000,174몰,
90502931,GIGABYTE B760M AORUS ELITE GEN5 피씨디렉트,,165000,152몰,
90506507,ASRock A620AM-X 디앤디컴,,102970,170몰,
90643316,ASRock H610M-HDVP/D5 R2.0 인텍앤컴퍼니 (벌크),,102570,97몰,
90643517,ASRock Z790 PG Lightning D5 인텍앤컴퍼니,,333000,1몰,
90643637,ASRock B760M-HDVP D5 인텍앤컴퍼니 (벌크),,135000,4몰,
90702200,ASUS PRO WS W790-ACE 아이보라,,1449410,72몰,
90957212,NZXT N9 X870E Black,,649000,16몰,
90957218,NZXT N9 X870E White,,649000,27몰,
91493696,MSI MAG B850M 박격포,,248980,197몰,
91870847,GIGABYTE MX34-BS0,,593000,2몰,
91871951,GIGABYTE B760M DS3H GEN5 제이씨현,,120050,204몰,
91872095,GIGABYTE B760M DS3H GEN5 피씨디렉트,,135470,181몰,
92043230,MAXSUN e스포츠 B850ITX WIFI ICE 디앤디컴,,201500,80몰,
92108180,ASRock A620AM-HVS 대원씨티에스,,94690,120몰,
92149667,ASRock A620AM-HVS 디앤디컴,,92700,160몰,
92357948,ASUS WS C422 PRO/SE,,1499000,3몰,
92360492,ASRock B860 Pro-A 에즈윈,,227480,117몰,
92360591,ASRock A620AM-HVS 에즈윈,,90740,142몰,
92678384,타무즈 H610M-ID4,,75800,82몰,
92678408,타무즈 H610M-ID5,,77850,88몰,
92678840,ASUS TUF Gaming B850-BTF WIFI W 인텍앤컴퍼니,,390740,95몰,
92687522,ASUS PRO WS W880-ACE SE STCOM,,786980,106몰,
92971409,ASRock H810M-H 인텍앤컴퍼니,,114170,93몰,
92971469,ASUS ROG CROSSHAIR X870E APEX STCOM,,1038980,126몰,
93018986,ASUS ROG CROSSHAIR X870E EXTREME STCOM,,1443990,70몰,
93019088,ASUS ROG CROSSHAIR X870E APEX 대원씨티에스,,799000,137몰,
93022430,ASUS ROG CROSSHAIR X870E EXTREME 대원씨티에스,,1393060,89몰,
93022751,ASUS PRIME B850M-A-CSM 대원씨티에스,,209000,101몰,
93071258,ASUS B850M MAX GAMING WIFI 대원씨티에스,,194620,129몰,
93073223,GIGABYTE X870 AORUS STEALTH ICE 제이씨현,,448340,84몰,
93073367,GIGABYTE X870 AORUS STEALTH ICE 피씨디렉트,,453990,132몰,
93317309,ASRock B650M Pro X3D WiFi 에즈윈,,171940,129몰,
93382583,ASRock B550M Phantom Gaming 4 + WiFi6E 랜카드 패키지 디앤디컴,,142470,87몰,
93442604,GIGABYTE B850 AORUS STEALTH ICE 피씨디렉트,,378960,125몰,
93500939,GIGABYTE B850 AORUS STEALTH ICE 제이씨현,,376400,141몰,
93502442,MSI PRO B850M-A WIFI,,183260,205몰,
93702833,ASRock B650M Pro X3D WiFi 대원씨티에스,,172620,30몰,
93703418,ASUS TUF Gaming B650EM-E WIFI 대원씨티에스,,176240,172몰,
93803822,ASRock B850M Pro RS WiFi WHITE 디앤디컴,,203820,155몰,
93804581,ASRock B850M Pro Plus WiFi 디앤디컴,,213770,160몰,
94028396,ASRock B850M Pro RS WiFi WHITE 대원씨티에스,,196340,124몰,
94080806,GIGABYTE H610M K V2 제이씨현 (벌크),,75800,37몰,
94081583,ASRock A620AM-X + WiFi6E 랜카드 패키지 디앤디컴,,164480,28몰,
94081679,ASRock A620AM-HVS + WiFi6E 랜카드 패키지 디앤디컴,,130000,96몰,
94129904,COLORFUL BATTLE-AX B850M-PLUS PRO WIFI V14 STCOM,,180860,109몰,
94815752,ASUS ROG STRIX B850-G GAMING WIFI 대원씨티에스,,338530,4몰,
94888226,GIGABYTE B760M D2HX LITE SI GEN5 피씨디렉트 (벌크),,103930,92몰,
94998482,ASRock B650M PG Riptide WiFi White 디앤디컴 (중고),,211680,1몰,
95200499,GIGABYTE B850M FORCE 피씨디렉트,,158940,167몰,
95280263,GIGABYTE B850M FORCE 제이씨현,,152310,219몰,
95420366,ASUS B850M MAX GAMING WIFI STCOM,,192920,146몰,
95420465,ASUS ROG STRIX B850-G GAMING WIFI STCOM,,352000,134몰,
95420537,ASUS PRIME B850M-A-CSM STCOM,,209000,16몰,
95421218,ASUS TUF Gaming B650EM-E WIFI STCOM,,181500,119몰,
95930900,BIOSTAR B850MT2-E DJ 제이씨현,,134821,137몰,
95988443,ASUS TUF Gaming B850M-E WIFI STCOM,,253000,126몰,
95988578,ASUS TUF Gaming B850M-PLUS II STCOM,,259000,174몰,
95988710,ASUS TUF Gaming B850M-PLUS WIFI7 STCOM,,274610,186몰,
95988944,ASUS TUF Gaming B850M-PLUS WIFI7 W STCOM,,272160,192몰,
96059018,ASUS P13R-E,,798900,1몰,
96259139,ASUS PRO WS TRX50-SAGE WiFi A 아이보라,,1479440,58몰,
96314975,BIOSTAR H610MHD D5 제이씨현 (중고),,82800,2몰,
96366245,ADVANTECH ASMB-925-00A1,,1500000,2몰,
96426692,ASUS Pro H610T-CSM D5 코잇 (벌크),120W 어댑터 포함,208260,4몰,
96426704,ASUS Pro H610T-CSM D5 코잇 (벌크),어댑터 미포함,177260,4몰,
96656717,ASUS TUF Gaming B850-BTF WIFI W STCOM,,401420,127몰,
96711170,ASUS PRIME Z890-P WIFI-CSM STCOM (중고),,335200,3몰,
96712895,ASUS PRIME B650EM-A STCOM,,146990,123몰,
96776582,ASRock H610M-H2/M.2 D5 에즈윈,,82570,137몰,
96981164,NZXT N7 B850 Black,,458000,21몰,
96981215,NZXT N7 B850 White,,243570,38몰,
97118543,ASUS TUF Gaming B850M-PLUS WIFI7 대원씨티에스,,267990,162몰,
97119116,ASUS TUF Gaming B850M-PLUS II 대원씨티에스,,232210,160몰,
97119959,ASUS PRIME B650EM-A 대원씨티에스,,137560,130몰,
97120361,ASUS TUF Gaming B850M-PLUS WIFI7 W 대원씨티에스,,277490,165몰,
97121303,ASUS TUF Gaming B850M-E WIFI 대원씨티에스,,226510,146몰,
97121510,MSI MPG B850I 엣지 TI WIFI,,367610,151몰,
97121798,MSI PRO H810M-B,,126280,188몰,
97224935,ASRock X870 Pro-A WiFi 디앤디컴,,290880,132몰,
97475957,ASUS TUF Gaming X870E-PLUS WIFI7 STCOM,,440770,138몰,
97476215,ASUS ROG STRIX X870E-H GAMING WIFI7 STCOM,,545990,121몰,
97476398,ASUS ROG CROSSHAIR X870E HERO BTF STCOM,,1104000,20몰,
97565858,ASRock A620AI WiFi 대원씨티에스,,227380,114몰,
97702355,ASRock B850 Challenger WiFi 7 White 대원씨티에스,,249490,97몰,
97702418,ASRock B850 Challenger WiFi 7 대원씨티에스,,239000,80몰,
97837412,MSI PRO H610M-E DDR5,,89990,156몰,
97855343,MSI MPG X870E 엣지 TI WIFI (중고),,451350,2몰,
97865969,MSI MAG B850 토마호크 맥스 WIFI (중고),,298350,1몰,
97903310,BIOSTAR A620MS-E 제이씨현,,95270,128몰,
97903817,MSI MPG B850I 엣지 TI WIFI (중고),,334350,2몰,
97904327,GIGABYTE B850M AORUS ELITE WIFI6E ICE 제이씨현 (중고),,232040,2몰,
98184140,ADVANTECH ASMB-807-00A1,,1080160,69몰,
98227940,GIGABYTE X870E AORUS MASTER X3D ICE 제이씨현,,839000,7몰,
98229074,GIGABYTE X870E AORUS PRO X3D ICE 제이씨현,,615850,88몰,
98415254,ASRock X870 Taichi Creator 에즈윈,,619490,99몰,
98415419,ASRock B860M Pro-A 에즈윈,,169440,109몰,
98543660,GIGABYTE X870E AORUS PRO X3D ICE 피씨디렉트,,604140,155몰,
98544125,ASUS ROG STRIX X870E-H GAMING WIFI7 대원씨티에스,,626000,1몰,
98544692,MSI PRO B850M-P,,170050,159몰,
98613731,GIGABYTE X870E AORUS MASTER X3D ICE 피씨디렉트,,799000,1몰,
98925365,ASRock X870 Pro-A WiFi 대원씨티에스,,292510,106몰,
99054896,ASRock B850 Challenger WiFi 7 White 디앤디컴,,248980,127몰,
99125546,ECS H610H7-TI5 D5 V2.2 코잇,어댑터 미포함,170650,85몰,
99125693,ECS H610H7-TI5 D5 V2.2 코잇,120W 어댑터 포함,195800,84몰,
99125729,ECS H610H7-TI5 D5 V2.2 코잇,150W 어댑터 포함,205360,85몰,
99288923,ASUS TUF Gaming X870E-PLUS WIFI7 대원씨티에스,,413900,63몰,
99640991,타무즈 B760M-ID5 (벌크),,103840,82몰,
99714806,ASRock B760M-X Gen5 에즈윈 (벌크),,123910,98몰,
99714830,ASRock H610M-X D5 Gen5 에즈윈 (벌크),,108660,85몰,
99714851,ASRock H610M-HDV/M.2 D5 Gen5 에즈윈,,98110,124몰,
99733238,ASUS PRIME B760M-A II 코잇,,153950,100몰,
99746582,GIGABYTE B850 EAGLE ICE 제이씨현,,228890,158몰,
99746822,GIGABYTE B850M AORUS ELITE WIFI7 ICE-P 제이씨현,,261380,78몰,
99893756,ASUS TUF Gaming B650EM-E WIFI 인텍앤컴퍼니,,182430,95몰,
99894263,ASUS TUF Gaming B850M-PLUS WIFI7 인텍앤컴퍼니,,259550,110몰,
99913676,ASUS PRO WS B850M-ACE SE STCOM,,604280,98몰,
99945386,GIGABYTE B850M AORUS ELITE WIFI7 ICE-P 피씨디렉트,,262990,126몰,
99948020,ADVANTECH ASMB-927T2-00A1 아이보라,,2077590,59몰,
100192175,MSI PRO A620AM-B EVO,,94400,158몰,
100192475,GIGABYTE B850 EAGLE ICE 피씨디렉트,,233890,122몰,
100383200,ASRock B850 Challenger WiFi 7 White 에즈윈,,259910,125몰,
100691990,ASUS PRIME H810M-E 코잇,,112000,106몰,
100698416,ASUS PRIME B860M-A WIFI-CSM 코잇,,209810,105몰,
101069660,ASRock H610M-X D5 Gen5 디앤디컴,,115500,133몰,
101069831,ASRock H610M-HDV/M.2 D5 Gen5 디앤디컴,,98560,133몰,
101073890,ADVANTECH ASMB-816-00A1,,1061000,53몰,
101074490,ASRock H610M-X D5 Gen5 디앤디컴 (벌크),,114290,80몰,
101074493,ASRock H610M-HDV/M.2 D5 Gen5 디앤디컴 (벌크),,98190,87몰,
101184890,ASUS PRIME B850M-A-CSM 인텍앤컴퍼니,,194060,84몰,
101184935,ASUS TUF Gaming B850M-PLUS WIFI7 W 인텍앤컴퍼니,,271000,104몰,
101956625,액슬 MBAIH310 R2 에즈윈,,88610,83몰,
102004853,ASUS PRIME B650EM-A 인텍앤컴퍼니,,135900,26몰,
102004859,MAXSUN 챌린저 H810M 2.5G 디앤디컴,,123440,105몰,
102004862,MAXSUN 챌린저 H810ITX WIFI 디앤디컴,,204000,91몰,
102412694,ASRock B860M-X Gen5 디앤디컴,,162490,128몰,
102412697,ASRock B860M Pro-A 디앤디컴,,176840,124몰,
102621374,ASUS TUF Gaming B860M-PLUS 코잇,,245690,67몰,
103130498,MAXSUN 챌린저 H810M-F 디앤디컴,,95070,79몰,
103182476,ASUS ROG STRIX B850-G GAMING WIFI 인텍앤컴퍼니,,393860,6몰,
103183034,ASUS TUF Gaming X870E-PLUS WIFI7 인텍앤컴퍼니,,408770,69몰,
103187819,ASRock H610TM-ITX 에즈윈 (벌크),,167350,85몰,
103187837,ASRock H610TM-ITX 에즈윈,120W 어댑터 포함,208990,3몰,
103187846,ASRock H610TM-ITX 에즈윈,180W 어댑터 포함,213010,4몰,
103188215,ASUS TUF Gaming B850M-PLUS II 인텍앤컴퍼니,,236300,99몰,
103188218,ASUS B850M MAX GAMING WIFI 인텍앤컴퍼니,,193020,95몰,
103414754,ASUS Pro H810T-CSM,어댑터 미포함,176530,4몰,
103414778,ASUS Pro H810T-CSM,120W 어댑터 포함,213010,4몰,
103414784,ASUS Pro H810T-CSM,180W 어댑터 포함,222530,4몰,
103415738,ASRock H610M-X D5 Gen5 에즈윈,,112200,82몰,
103415765,ASRock B860M-X Gen5 에즈윈 (벌크),,144780,96몰,
103415894,ADVANTECH ASMB-818I-00A1,,1224880,60몰,
103452395,MAXSUN e스포츠 B850M WIFI ICE 디앤디컴,,161580,102몰,
103694657,BIOSTAR H610MT-E D5 제이씨현,,83900,109몰,
103750595,ASRock X870 Taichi Creator 대원씨티에스,,579810,42몰,
103877579,ASRock H810TM-ITX 에즈윈 (벌크),어댑터 미포함,173840,89몰,
104325440,MSI MAG X870E 토마호크 맥스 WIFI PZ,,529000,113몰,
104554913,ASUS ROG CROSSHAIR X870E DARK HERO STCOM,,1110100,3몰,
104595728,ASRock H610M-X D5 Gen5 대원씨티에스,,98580,94몰,
104616128,ASUS PRIME H810M-K 인텍앤컴퍼니,,112980,100몰,
104628878,ASRock B860M-X Gen5 인텍앤컴퍼니,,166110,93몰,
104966219,ASRock H810M-X Gen5 에즈윈,,129310,109몰,
104966246,ASRock B860M-X Gen5 에즈윈,,163990,105몰,
104966306,GIGABYTE X870 AORUS STEALTH 피씨디렉트,,454990,103몰,
104966336,GIGABYTE B850 AORUS STEALTH 피씨디렉트,,382190,99몰,
104989463,ASUS ROG CROSSHAIR X870E DARK HERO 대원씨티에스,,1058350,92몰,
104989499,ASUS PRIME H810M-K STCOM,,124000,104몰,
104989559,ASUS PRIME A620AM-A STCOM,,121000,90몰,
105184787,ASRock H810M-X Gen5 인텍앤컴퍼니,,133480,91몰,
105813494,GIGABYTE B760M AORUS ELITE D4 GEN5 피씨디렉트,,183530,96몰,
105817802,GIGABYTE B760M AORUS ELITE D4 GEN5 제이씨현,,181480,120몰,
105968849,ASUS PRIME B550M-K ARGB 대원씨티에스,,109800,92몰,
105968858,ASUS PRIME B550M-K ARGB STCOM,,119000,95몰,
105968915,GIGABYTE B760M DS3H WIFI6E D4 GEN5 피씨디렉트,,161990,122몰,
105969083,ASRock H810M-HDVP 디앤디컴,,135000,116몰,
105969161,MSI PRO H810M-C EX,,135000,130몰,
105969170,ASRock Rack SPC741D8UD-2T/X550 명인일렉트로닉스,,1319890,40몰,
106044725,GIGABYTE B760M DS3H D4 GEN5 제이씨현,,136560,142몰,
106045001,GIGABYTE H810M H GEN5 피씨디렉트,,119390,113몰,
106045718,GIGABYTE H810M K GEN5 피씨디렉트,,110950,113몰,
106047329,GIGABYTE B760M DS3H WIFI6E D4 GEN5 제이씨현,,161940,113몰,
106220351,ASRock H810M-P Gen5 에즈윈,,105900,91몰,
106454201,GIGABYTE H810M D2HX SI GEN5 제이씨현,,125600,116몰,
106465508,GIGABYTE A620M H 피씨디렉트,,101060,89몰,
106688174,GIGABYTE H810M S2H GEN5 피씨디렉트,,130990,108몰,
106689341,ASRock H810M-P Gen5 디앤디컴,,111280,106몰,
106689347,ASRock H810M-P Gen5 디앤디컴 (벌크),,108340,89몰,
106689353,ASRock H810M-X Gen5 디앤디컴,,134000,109몰,
106689356,ASRock H810M-X Gen5 디앤디컴 (벌크),,128500,82몰,
106695713,GIGABYTE B850M AORUS PRO WIFI7 피씨디렉트,,267990,112몰,
106703318,ASUS PRIME A620AM-K 대원씨티에스,,106280,106몰,
106703432,ASUS PRIME A620AM-A 대원씨티에스,,103410,85몰,
106704263,GIGABYTE B850M FORCE V2 피씨디렉트,,164970,63몰,
106708949,ASUS PRIME B760M-A D4 코잇,,146820,85몰,
106709246,ASRock H810M-P Gen5 + WiFi6E 랜카드 패키지 디앤디컴,,136950,95몰,
106710032,ASRock H810M-X Gen5 + WiFi6E 랜카드 패키지 디앤디컴,,157500,95몰,
106717493,ASRock B850 Rock WiFi 7 에즈윈,,227050,105몰,
106717577,ASRock B850M Rock WiFi 에즈윈,,189050,102몰,
106717613,ASRock B760M Pro-A 에즈윈 (벌크),,134460,82몰,
106717637,ASRock H810M-HDVP 에즈윈 (벌크),,132050,88몰,
106727312,GIGABYTE B850M AORUS PRO WIFI7 제이씨현,,259380,129몰,
106728086,ASRock B860 Rock WiFi 7 에즈윈,,222090,105몰,
106728191,ASRock B860M Rock WiFi 에즈윈,,190620,103몰,
106728485,ASRock B850M Challenger WiFi 7 White 에즈윈,,242250,100몰,
106729391,ASRock H810M-X Gen5 + WiFi7 랜카드 패키지 디앤디컴,,178000,92몰,
106729403,ASRock H810M-P Gen5 + WiFi7 랜카드 패키지 디앤디컴,,158500,90몰,
106735550,GIGABYTE H810M D2HX SI GEN5 피씨디렉트,,126890,109몰,
106746197,ASRock H810M-P Gen5 인텍앤컴퍼니,,100000,75몰,
106746452,ASUS TUF Gaming X870-PRO WIFI7 W NEO 대원씨티에스,,407840,4몰,
106748744,ASRock B860 Rock WiFi 7 디앤디컴,,219890,109몰,
106749107,ASRock B760M Pro-A/D4 디앤디컴,,133990,106몰,
106764977,GIGABYTE X870E AORUS ELITE X3D 피씨디렉트,,436960,109몰,
106765016,GIGABYTE X870E AORUS ELITE X3D ICE 피씨디렉트,,445490,105몰,
106767464,GIGABYTE X870E AORUS ELITE X3D ICE 제이씨현,,431990,130몰,
106784549,COLORFUL BATTLE-AX B850M-T WIFI V14 도우정보,,165000,101몰,
106784699,COLORFUL BATTLE-AX B650M-E PRO V14 도우정보,,116000,117몰,
106785044,COLORFUL BATTLE-AX A520M-K M.2 V14 도우정보,,68000,115몰,
106785122,COLORFUL BATTLE-AX B760M-D PRO D4 V20 도우정보,,125000,105몰,
106785227,COLORFUL H610M-D V20A 도우정보,,75000,114몰,
107768525,ASRock B850M Challenger WiFi 7 White 디앤디컴,,228980,111몰,
107956478,ASRock B850M Challenger WiFi 7 White 대원씨티에스,,238340,103몰,
107958404,ASRock B850 Rock WiFi 7 대원씨티에스,,232210,100몰,
107960645,ASRock B850M Rock WiFi 대원씨티에스,,178230,110몰,
107989658,GIGABYTE X870E AORUS ELITE X3D 제이씨현,,432940,122몰,
108167225,ASUS PRIME H810M-X 2.5G Gen5 코잇,,120720,45몰,
108227489,GIGABYTE B850 AORUS STEALTH 제이씨현,,379000,4몰,
108227564,GIGABYTE X870 AORUS STEALTH 제이씨현,,457900,92몰,
108352127,ASRock H810TM-ITX 에즈윈 (벌크),120W 어댑터 포함,218990,3몰,
108352133,ASRock H810TM-ITX 에즈윈 (벌크),180W 어댑터 포함,228990,3몰,
108401501,ADVANTECH ASMB-817I-00A1 아이보라,,1540000,3몰,
108401528,GIGABYTE H810M K GEN5 제이씨현,,106010,128몰,
108411866,BIOSTAR A520MSP 제이씨현,,58050,78몰,
108456887,ASRock B860M Rock WiFi 인텍앤컴퍼니,,191950,71몰,
109483313,ASRock B760M Pro-A/D4 에즈윈,,130220,102몰,
109597367,GIGABYTE B760M DS3H D4 GEN5 피씨디렉트,,141990,98몰,
109680482,GIGABYTE Z890 AORUS ELITE DUO X 피씨디렉트,,453000,99몰,
122616566,MAXSUN 아이크레프트 Z890 퍼시픽 디앤디컴,,444660,80몰,
122617802,GIGABYTE Z890 AORUS ELITE WIFI7 PLUS 피씨디렉트,,396490,107몰,
122617854,GIGABYTE Z890M AORUS ELITE WIFI7 ICE 피씨디렉트,,346610,92몰,
122617914,GIGABYTE Z890M AORUS ELITE WIFI7 피씨디렉트,,328990,73몰,
122618006,GIGABYTE Z890 AORUS ELITE DUO X 제이씨현,,452880,117몰,
122618520,ASRock B550M Phantom Gaming 4 + WiFi7 랜카드 패키지 디앤디컴,,161990,78몰,
122618538,ASRock B550M Pro RS + WiFi7 랜카드 패키지 디앤디컴,,174800,73몰,
122618900,GIGABYTE Z890 AORUS ELITE WIFI7 PLUS 제이씨현,,383880,100몰,
122620820,ASRock B860M-HDVP 에즈윈 (벌크),,146670,79몰,
122621357,ASUS TUF Gaming X870-PRO WIFI7 W NEO STCOM,,409830,101몰,
122621970,ASUS PRO WS W890E-SAGE SE STCOM,,2687550,4몰,
122636609,MSI MAG B860M 박격포,,245580,35몰,
122637313,MSI PRO B760M-E DDR4,,117490,116몰,
122637941,ASUS ROG STRIX B850-F GAMING WIFI7 NEO STCOM,,434960,93몰,
122639563,MSI B850M 게이밍 플러스 WIFI6E,,206480,144몰,
122641599,ASUS ProArt B850-CREATOR WIFI NEO 대원씨티에스,,374880,26몰,
122642210,ASUS ROG STRIX X870E-E GAMING WIFI7 NEO 대원씨티에스,,910730,24몰,
122642236,ASUS ROG STRIX B850-F GAMING WIFI7 NEO 대원씨티에스,,429930,78몰,
122642245,ASUS ROG STRIX B850-A GAMING WIFI7 NEO 대원씨티에스,,381230,28몰,
122642328,ASUS TUF Gaming B850-PRO WIFI7 W NEO 대원씨티에스,,330190,46몰,
122642347,ASRock B860 Rock WiFi7 인텍앤컴퍼니,,193000,76몰,
122643555,ASUS PRIME A520M-K 인텍앤컴퍼니,,61990,77몰,
122645205,ASUS ROG STRIX X870E-A GAMING WIFI7 NEO 대원씨티에스,,683050,23몰,
122645671,BIOSTAR H810MT-E 2.0 제이씨현,,104940,85몰,
122662050,GIGABYTE X870E AERO X3D DARK WOOD 제이씨현,,562000,93몰,
122663533,ASUS ProArt B850-CREATOR WIFI NEO 인텍앤컴퍼니,,363840,7몰,
122663559,ASUS ROG STRIX B850-F GAMING WIFI7 NEO 인텍앤컴퍼니,,437360,54몰,
122663567,ASUS ROG STRIX B850-A GAMING WIFI7 NEO 인텍앤컴퍼니,,392630,51몰,
122663659,ASUS ROG STRIX X870E-A GAMING WIFI7 NEO 인텍앤컴퍼니,,671040,53몰,
122663671,ASUS TUF Gaming B850-PRO WIFI7 W NEO 인텍앤컴퍼니,,338980,51몰,
122663744,ASRock H810M-X Gen5 에즈윈 (벌크),,128140,51몰,
122669173,GIGABYTE B860M GAMING X 피씨디렉트,,188930,93몰,
122670765,ASUS ROG STRIX B850-A GAMING WIFI7 NEO STCOM,,379000,75몰,
122670803,ASUS ProArt B850-CREATOR WIFI NEO STCOM,,370650,4몰,
122670820,ASUS TUF Gaming B850-PRO WIFI7 W NEO STCOM,,330130,85몰,
122675438,MSI PRO H810M-E,,117490,100몰,
122676874,GIGABYTE B860M GAMING X 제이씨현,,183400,90몰,
122676913,ASUS ROG STRIX X870E-A GAMING WIFI7 NEO STCOM,,670310,74몰,
122678230,ECS H810H8-TI 코잇,,178860,54몰,
122678247,ECS H810H8-TI 코잇,125W 어댑터 포함,205990,46몰,
122678251,ECS H810H8-TI 코잇,152W 어댑터 포함,217990,46몰,
122678326,ASRock B650M Pro X3D + WiFi6E 모듈 패키지 디앤디컴,,160970,14몰,
122678434,ASRock B760M Pro-A/D4 + WiFi7 모듈 패키지 디앤디컴,,188510,52몰,
122678463,ASRock B760M Pro-A/D4 + WiFi6E 모듈 패키지 디앤디컴,,166270,53몰,
122681102,GIGABYTE X870E AERO X3D DARK WOOD 피씨디렉트,,578980,91몰,
122684807,ASUS ROG STRIX X870E-E GAMING WIFI7 NEO STCOM,,910730,88몰,
122687782,GIGABYTE H810M S2H GEN5 제이씨현,,129140,89몰,
122690875,ASUS ROG CROSSHAIR 2006 STCOM,,1244960,78몰,
122694411,MSI B550M-A PRO,,97400,72몰,
122694479,MSI PRO B550M-P,,113290,82몰,
122694530,GIGABYTE B850M GAMING X WIFI6E 피씨디렉트,,195820,55몰,
122694851,ASRock Z890 Pro RS WiFi 디앤디컴,,331130,62몰,
122694855,ASRock B860M Rock WiFi 디앤디컴,,190850,66몰,
122694865,ASRock B850M Rock WiFi 디앤디컴,,192690,72몰,
122694871,ASRock B850 Rock WiFi 7 디앤디컴,,232540,72몰,
122697197,GIGABYTE B850M GAMING X WIFI6E 제이씨현,,193980,100몰,
122697250,ASRock B650M PRO-A Gen5 디앤디컴,,139000,64몰,
122699502,ASRock B650M PRO-A Gen5 대원씨티에스,,136680,50몰,
122699665,GIGABYTE B850M FORCE V2 제이씨현,,165990,97몰,
122701088,ASUS PRO WS W880-ACE SE 아이보라,,799990,27몰,
122705643,ASUS ROG CROSSHAIR 2006 인텍앤컴퍼니,,1205990,36몰,
122710775,GIGABYTE B850M AORUS STEALTH ICE 피씨디렉트,,305990,21몰,
122710792,GIGABYTE B850M AORUS STEALTH 피씨디렉트,,305990,21몰,
122711070,GIGABYTE B850M AORUS STEALTH ICE 제이씨현,,307390,23몰,
122711072,GIGABYTE B850M AORUS STEALTH 제이씨현,,307390,29몰,
122712415,ASUS P13R-M STCOM,,754990,22몰,
122718466,GIGABYTE B850 AORUS ELITE X3D 피씨디렉트,,가격비교예정,0몰,
122718531,ASUS PRO WS W890-SAGE STCOM,,1588490,21몰,
