106785122,COLORFUL BATTLE-AX B760M-D PRO D4 V20 도우정보,,125000,103몰,
106785227,COLORFUL H610M-D V20A 도우정보,,75000,113몰,
107768525,ASRock B850M Challenger WiFi 7 White 디앤디컴,,232300,113몰,
107956478,ASRock B850M Challenger WiFi 7 White 대원씨티에스,,238340,104몰,
107958404,ASRock B850 Rock WiFi 7 대원씨티에스,,227240,101몰,
107960645,ASRock B850M Rock WiFi 대원씨티에스,,178240,110몰,
107989658,GIGABYTE X870E AORUS ELITE X3D 제이씨현,,445530,124몰,
108167225,ASUS PRIME H810M-X 2.5G Gen5 코잇,,120720,46몰,
108227489,GIGABYTE B850 AORUS STEALTH 제이씨현,,379000,4몰,
108227564,GIGABYTE X870 AORUS STEALTH 제이씨현,,459000,90몰,
108352127,ASRock H810TM-ITX 에즈윈 (벌크),120W 어댑터 포함,218990,3몰,
108352133,ASRock H810TM-ITX 에즈윈 (벌크),180W 어댑터 포함,228990,3몰,
108401501,ADVANTECH ASMB-817I-00A1 아이보라,,1138990,35몰,
108401528,GIGABYTE H810M K GEN5 제이씨현,,110980,129몰,
108411866,BIOSTAR A520MSP 제이씨현,,62000,80몰,
108456887,ASRock B860M Rock WiFi 인텍앤컴퍼니,,191730,71몰,
109483313,ASRock B760M Pro-A/D4 에즈윈,,130220,102몰,
109597367,GIGABYTE B760M DS3H D4 GEN5 피씨디렉트,,144990,98몰,
109680482,GIGABYTE Z890 AORUS ELITE DUO X 피씨디렉트,,452990,103몰,
122616566,MAXSUN 아이크레프트 Z890 퍼시픽 디앤디컴,,444520,82몰,
122617802,GIGABYTE Z890 AORUS ELITE WIFI7 PLUS 피씨디렉트,,396490,108몰,
122617854,GIGABYTE Z890M AORUS ELITE WIFI7 ICE 피씨디렉트,,346610,92몰,
122617914,GIGABYTE Z890M AORUS ELITE WIFI7 피씨디렉트,,329000,73몰,
122618006,GIGABYTE Z890 AORUS ELITE DUO X 제이씨현,,466430,119몰,
122618520,ASRock B550M Phantom Gaming 4 + WiFi7 랜카드 패키지 디앤디컴,,161990,79몰,
122618538,ASRock B550M Pro RS + WiFi7 랜카드 패키지 디앤디컴,,174900,74몰,
122618900,GIGABYTE Z890 AORUS ELITE WIFI7 PLUS 제이씨현,,394980,102몰,
122620820,ASRock B860M-HDVP 에즈윈 (벌크),,146670,79몰,
122621357,ASUS TUF Gaming X870-PRO WIFI7 W NEO STCOM,,409830,101몰,
122621970,ASUS PRO WS W890E-SAGE SE STCOM,,2687550,4몰,
122636609,MSI MAG B860M 박격포,,241530,43몰,
122637313,MSI PRO B760M-E DDR4,,115430,123몰,
122637941,ASUS ROG STRIX B850-F GAMING WIFI7 NEO STCOM,,425170,78몰,
122639563,MSI B850M 게이밍 플러스 WIFI6E,,202730,148몰,
122641599,ASUS ProArt B850-CREATOR WIFI NEO 대원씨티에스,,374880,27몰,
122642210,ASUS ROG STRIX X870E-E GAMING WIFI7 NEO 대원씨티에스,,910730,29몰,
122642236,ASUS ROG STRIX B850-F GAMING WIFI7 NEO 대원씨티에스,,429900,76몰,
122642245,ASUS ROG STRIX B850-A GAMING WIFI7 NEO 대원씨티에스,,381230,29몰,
122642328,ASUS TUF Gaming B850-PRO WIFI7 W NEO 대원씨티에스,,330690,51몰,
122642347,ASRock B860 Rock WiFi7 인텍앤컴퍼니,,193000,76몰,
122643555,ASUS PRIME A520M-K 인텍앤컴퍼니,,62100,77몰,
122645205,ASUS ROG STRIX X870E-A GAMING WIFI7 NEO 대원씨티에스,,683050,29몰,
122645671,BIOSTAR H810MT-E 2.0 제이씨현,,104940,85몰,
122662050,GIGABYTE X870E AERO X3D DARK WOOD 제이씨현,,561990,92몰,
122663533,ASUS ProArt B850-CREATOR WIFI NEO 인텍앤컴퍼니,,352990,15몰,
122663559,ASUS ROG STRIX B850-F GAMING WIFI7 NEO 인텍앤컴퍼니,,418190,59몰,
122663567,ASUS ROG STRIX B850-A GAMING WIFI7 NEO 인텍앤컴퍼니,,380930,54몰,
122663659,ASUS ROG STRIX X870E-A GAMING WIFI7 NEO 인텍앤컴퍼니,,655300,57몰,
122663671,ASUS TUF Gaming B850-PRO WIFI7 W NEO 인텍앤컴퍼니,,338980,52몰,
122663744,ASRock H810M-X Gen5 에즈윈 (벌크),,128130,51몰,
122669173,GIGABYTE B860M GAMING X 피씨디렉트,,188940,93몰,
122670765,ASUS ROG STRIX B850-A GAMING WIFI7 NEO STCOM,,379000,74몰,
122670803,ASUS ProArt B850-CREATOR WIFI NEO STCOM,,361500,4몰,
122670820,ASUS TUF Gaming B850-PRO WIFI7 W NEO STCOM,,329790,86몰,
122675438,MSI PRO H810M-E,,115420,112몰,
122676874,GIGABYTE B860M GAMING X 제이씨현,,186670,86몰,
122676913,ASUS ROG STRIX X870E-A GAMING WIFI7 NEO STCOM,,670310,74몰,
122678230,ECS H810H8-TI 코잇,,176500,56몰,
122678247,ECS H810H8-TI 코잇,125W 어댑터 포함,205990,49몰,
122678251,ECS H810H8-TI 코잇,152W 어댑터 포함,217990,48몰,
122678326,ASRock B650M Pro X3D + WiFi6E 모듈 패키지 디앤디컴,,160970,15몰,
122678434,ASRock B760M Pro-A/D4 + WiFi7 모듈 패키지 디앤디컴,,188510,54몰,
122678463,ASRock B760M Pro-A/D4 + WiFi6E 모듈 패키지 디앤디컴,,166270,55몰,
122681102,GIGABYTE X870E AERO X3D DARK WOOD 피씨디렉트,,578930,91몰,
122684807,ASUS ROG STRIX X870E-E GAMING WIFI7 NEO STCOM,,910710,75몰,
122687782,GIGABYTE H810M S2H GEN5 제이씨현,,129150,88몰,
122690875,ASUS ROG CROSSHAIR 2006 STCOM,,1206210,76몰,
122694411,MSI B550M-A PRO,,96020,104몰,
122694479,MSI PRO B550M-P,,111550,92몰,
122694530,GIGABYTE B850M GAMING X WIFI6E 피씨디렉트,,195820,58몰,
122694851,ASRock Z890 Pro RS WiFi 디앤디컴,,331130,64몰,
122694855,ASRock B860M Rock WiFi 디앤디컴,,190850,69몰,
122694865,ASRock B850M Rock WiFi 디앤디컴,,192730,73몰,
122694871,ASRock B850 Rock WiFi 7 디앤디컴,,232270,73몰,
122697197,GIGABYTE B850M GAMING X WIFI6E 제이씨현,,195750,99몰,
122697250,ASRock B650M PRO-A Gen5 디앤디컴,,138990,66몰,
122699502,ASRock B650M PRO-A Gen5 대원씨티에스,,136680,52몰,
122699665,GIGABYTE B850M FORCE V2 제이씨현,,165000,104몰,
122701088,ASUS PRO WS W880-ACE SE 아이보라,,799990,28몰,
122705643,ASUS ROG CROSSHAIR 2006 인텍앤컴퍼니,,1180430,40몰,
122710775,GIGABYTE B850M AORUS STEALTH ICE 피씨디렉트,,305990,45몰,
122710792,GIGABYTE B850M AORUS STEALTH 피씨디렉트,,305990,47몰,
122711070,GIGABYTE B850M AORUS STEALTH ICE 제이씨현,,305990,57몰,
122711072,GIGABYTE B850M AORUS STEALTH 제이씨현,,305990,48몰,
122712415,ASUS P13R-M STCOM,,754990,34몰,
122718466,GIGABYTE B850 AORUS ELITE X3D 피씨디렉트,,가격비교예정,0몰,
122718531,ASUS PRO WS W890-SAGE STCOM,,1588490,35몰,
122721897,ASUS PRIME A520M-K ARGB 대원씨티에스,,가격비교예정,0몰,
122723330,ASUS PRIME B650EM-A WIFI-CSM 대원씨티에스,,가격비교예정,0몰,
122726156,GIGABYTE B850 AORUS ELITE X3D 제이씨현,,327230,34몰,
122726205,ASRock B860M Challenger WiFi 7 White 디앤디컴,,254160,22몰,
122726258,ASRock B550M Pro-A 디앤디컴,,117550,23몰,
122726583,GIGABYTE X870 AORUS INFINITY 피씨디렉트,,1091820,13몰,
