122678463,ASRock B760M Pro-A/D4 + WiFi6E 모듈 패키지 디앤디컴,,174740,12몰,
122681102,GIGABYTE X870E AERO X3D DARK WOOD 피씨디렉트,,578990,26몰,
122684807,ASUS ROG STRIX X870E-E GAMING WIFI7 NEO STCOM,,919090,21몰,
122687782,GIGABYTE H810M S2H GEN5 제이씨현,,129160,32몰,
122690875,ASUS ROG CROSSHAIR 2006 STCOM,,1245380,20몰,
122694411,MSI B550M-A PRO,,97390,17몰,
122694479,MSI PRO B550M-P,,113290,22몰,
122694530,GIGABYTE B850M GAMING X WIFI6E 피씨디렉트,,가격비교예정,0몰,
122694851,ASRock Z890 Pro RS WiFi 디앤디컴,,334650,15몰,
122694855,ASRock B860M Rock WiFi 디앤디컴,,192740,13몰,
122694865,ASRock B850M Rock WiFi 디앤디컴,,194860,15몰,
122694871,ASRock B850 Rock WiFi 7 디앤디컴,,235100,15몰,
122697197,GIGABYTE B850M GAMING X WIFI6E 제이씨현,,가격비교예정,0몰,
122697250,ASRock B650M PRO-A Gen5 디앤디컴,,139790,7몰,
