Id,Name,Type,Price,Mall,2026-06-12 01:11:22
18781991,GIGABYTE B760M DS3H 피씨디렉트,,151720,24몰,
18813608,GIGABYTE B760M DS3H 제이씨현,,159770,8몰,
18917408,X470 (중고),,93000,11몰,
19163258,ASUS PRIME B650M-A II STCOM,,226980,54몰,
19170107,GIGABYTE H610M S2H V2 D4 듀러블에디션 피씨디렉트,,113990,118몰,
19240112,ECS H610H7-TI5 코잇,기본,165000,1몰,
19241759,MSI PRO B760M-A WIFI,,158700,200몰,
19242146,GIGABYTE H610M S2H V2 D4 듀러블에디션 제이씨현,,112500,191몰,
19306598,ASUS TUF Gaming B760-PLUS WIFI 인텍앤컴퍼니,,442140,1몰,
19429325,ASUS PRIME B760-PLUS STCOM,,288000,1몰,
19431530,GIGABYTE A520M K V2 피씨디렉트,,57490,206몰,
19498640,ASRock B760M Pro RS D5 디앤디컴,,152060,169몰,
19523846,COLORFUL H610M-E M.2 V20 D4 STCOM,,77750,90몰,
19536062,ASRock B760M Pro RS D5 에즈윈,,146000,186몰,
19536692,ASRock B650M-HDV/M.2 에즈윈,,186680,1몰,
19556732,ASUS PRO WS W680-ACE IPMI STCOM,,730990,117몰,
19556996,ASUS PRO WS W680-ACE STCOM,,598980,96몰,
19605602,ASUS PRIME B760M-A STCOM,,152790,111몰,
19610558,GIGABYTE H610M S2H 듀러블에디션 제이씨현,,135000,1몰,
19619507,GIGABYTE H610M H 듀러블에디션 제이씨현,,118000,2몰,
19627397,ASRock B550M Phantom Gaming 4 대원씨티에스,,108200,145몰,
19628207,ASUS TUF Gaming B760M-PLUS 코잇,,190890,95몰,
19648718,ASRock B650 Pro RS + WiFi6E 모듈 패키지 디앤디컴,,379320,1몰,
19649354,ASRock B650 PG Lightning + WiFi6E 모듈 패키지 디앤디컴,,354790,1몰,
19673600,GIGABYTE A620M GAMING X 제이씨현,,159430,10몰,
19673975,ECS DURATHON2 B760H7-M8 코잇 (벌크),,142150,81몰,
19691519,ASUS PRIME B650M-A II 대원씨티에스,,129000,16몰,
19704527,ASUS PRIME B760M-A 코잇,,148990,134몰,
19705316,MSI PRO A620M-E,,154500,2몰,
19725299,GIGABYTE A620M GAMING X 피씨디렉트,,160230,84몰,
19753526,ECS DURATHON2 B760H7-M8 코잇,,142470,20몰,
19754957,ASRock B560M-HDV/M.2 디앤디컴,,136000,1몰,
19756130,ASUS PRIME B760-PLUS 코잇,,249890,121몰,
19756199,ASUS TUF Gaming B760-PLUS WIFI 코잇,,284010,125몰,
19772375,ASUS PRIME B760M-A 인텍앤컴퍼니,,146690,141몰,
19772519,ASUS PRIME B760-PLUS 인텍앤컴퍼니,,279000,1몰,
19772675,ASUS ROG STRIX B760-G GAMING WIFI 인텍앤컴퍼니,,236500,1몰,
19827944,ASRock A620M-HDV/M.2 디앤디컴,,109240,2몰,
19834694,GIGABYTE H610M S2H 듀러블에디션 피씨디렉트,,121000,1몰,
19903481,ASUS ROG STRIX B760-G GAMING WIFI 코잇,,226210,141몰,
19924310,ASUS PRIME A620M-A STCOM,,128000,3몰,
19925807,ASUS TUF Gaming A620M-PLUS STCOM,,186000,5몰,
19926059,ASUS TUF Gaming A620M-PLUS WIFI STCOM,,199920,60몰,
19926611,ASUS PRIME A620M-A 대원씨티에스,,125000,7몰,
19926731,ASUS TUF Gaming A620M-PLUS 대원씨티에스,,115900,15몰,
19927037,ASUS TUF Gaming A620M-PLUS WIFI 대원씨티에스,,181000,1몰,
19927871,ASUS P12R-I STCOM,,358490,124몰,
19938515,GIGABYTE H610M K 제이씨현,,85030,5몰,
19999916,GIGABYTE H610M K 피씨디렉트,,89000,1몰,
20012147,ASRock Z790 Pro RS D5 + WiFi6E 모듈 패키지 디앤디컴,,386000,3몰,
20027564,ASUS PRIME H510M-K R2.0 인텍앤컴퍼니,,300000,1몰,
20079008,ASUS PRIME Z790M-PLUS-CSM 코잇,,354980,72몰,
20103287,ASRock B760M Pro RS D5 + WiFi6E 모듈 패키지 디앤디컴,,181100,140몰,
20108249,MSI PRO B650M-P,,119100,182몰,
20119583,GIGABYTE H610M H V2 D4 피씨디렉트,,88340,167몰,
20140877,ASRock A620M-HDV/M.2 + WiFi6E 모듈 패키지 디앤디컴,,150500,1몰,
20171636,MSI PRO B760M-P,,134980,164몰,
20178734,BIOSTAR H610MH D5 이엠텍,,98050,1몰,
20226533,Supermicro X13SAQ STCOM,,680000,6몰,
20226770,Supermicro X13SAZ-Q STCOM,,684100,95몰,
20238110,GIGABYTE A620M S2H 제이씨현,,111000,1몰,
20318291,ASUS TUF Gaming A620-PRO WIFI STCOM,,275030,139몰,
20324882,GIGABYTE B650M K 제이씨현,,110317,275몰,
20343650,ASUS PRIME B760M-K 코잇,,159630,90몰,
20344700,ASUS PRIME H610M-CS D4 코잇,,80990,138몰,
20459081,GIGABYTE A520M K V2 제이씨현,,56560,270몰,
20462924,GIGABYTE H610M H V2 D4 제이씨현,,97890,5몰,
20536331,ASRock B760M-HDVP D5 에즈윈 (벌크),,121880,135몰,
20606708,Supermicro X13SRA-TF STCOM,,1338000,12몰,
20612690,ASUS PRIME B760M-KS 코잇 (벌크),,144990,7몰,
20645075,Supermicro X13DEI-T STCOM,,1980000,1몰,
20710217,ASUS PRIME B760M-K 인텍앤컴퍼니,,130000,161몰,
20738630,COLORFUL BATTLE-AX B760M-K V20 D5 STCOM,,122880,105몰,
21427535,ASUS TUF Gaming B650M-E WIFI 대원씨티에스,,224290,3몰,
21428693,ASUS PRIME A620M-K 대원씨티에스,,111620,9몰,
21627827,ASRock B650M Pro RS 대원씨티에스,,165000,1몰,
21727307,GIGABYTE B650M K 피씨디렉트,,112790,249몰,
21731021,GIGABYTE B650M S2H 제이씨현,,172900,2몰,
24703229,ASRock Rack ROME2D16-2T,,1336000,1몰,
25129808,ASUS PRO WS W790E-SAGE SE STCOM,,2227990,122몰,
25208807,ASUS PRO WS W790-ACE STCOM,,1542990,127몰,
25213067,ASRock A520M-HDV 에즈윈 (벌크),,65120,21몰,
25866491,ASRock H610M-HDV/M.2+ D5 에즈윈,,92400,151몰,
25869083,ASRock H610M-HDV/M.2+ D5 에즈윈 (벌크),,92576,114몰,
27409910,ASRock H610M-HDV/M.2+ D5 디앤디컴,,93930,117몰,
27474755,MSI PRO B760M-A DDR4 II,,143440,166몰,
27475223,MSI MAG X670E 토마호크 WIFI,,468950,2몰,
27534158,GIGABYTE H610M H V2 D4 제이씨현 (벌크),,102360,3몰,
27546074,ASRock H610M-HDV/M.2+ D5 대원씨티에스,,90090,132몰,
27572138,ASUS PRIME H610M-E 인텍앤컴퍼니,,171900,2몰,
27576677,MSI MAG X670E 토마호크 WIFI (해외구매),,447680,2몰,
27675110,ASUS PRIME H610M-E 코잇,,111930,123몰,
27691589,NVIDIA Jetson Orin Nano Developer Kit 용량확인필요 (해외구매),,1195000,2몰,
28010348,GIGABYTE B760M E 피씨디렉트,,101112,30몰,
28029617,ASRock H610M-H2/M.2 D5 에즈윈 (벌크),,79376,140몰,
28059134,ASRock H610M-HDV/M.2+ D5 디앤디컴 (벌크),,93932,37몰,
28183691,ASRock H610M-H2/M.2 D5 디앤디컴,,80510,167몰,
28183721,ASRock H610M-H2/M.2 D5 디앤디컴 (벌크),,79482,127몰,
28248743,BIOSTAR H610MHD D5 제이씨현,,85000,152몰,
28248950,BIOSTAR H610MS 제이씨현,,75000,151몰,
28511822,ASUS PRIME H510M-K R2.0 STCOM,,116990,74몰,
28581716,ASUS Tinker Edge T,어댑터 포함,135000,1몰,
28603964,ASRock B650M PG Lightning 에즈윈,,111190,192몰,
28780247,ASUS PRO WS W790E-SAGE SE 대원씨티에스,,1980000,1몰,
28803482,ASUS ROG MAXIMUS Z790 APEX ENCORE STCOM,,898000,123몰,
28857518,ASUS PRIME H610M-K D5 인텍앤컴퍼니,,69900,3몰,
28857623,ASUS PRIME H610M-K ARGB 인텍앤컴퍼니,,167940,2몰,
29393921,ASUS PRIME H610I-PLUS 코잇,,202350,102몰,
29759561,BIOSTAR B650MT-E PRO 제이씨현,,124000,150몰,
29863127,GIGABYTE B650M AORUS ELITE AX ICE 제이씨현,,238990,10몰,
29880134,ASRock H610M-HVS M.2 R2.0 D4 대원씨티에스,,95000,1몰,
29908775,ASRock B650M PG Lightning 디앤디컴,,114570,179몰,
29942195,ASUS PRIME H610M-D 코잇,,110500,103몰,
30070400,GIGABYTE B650 AORUS ELITE AX ICE 제이씨현,,406250,2몰,
30161945,ASRock B760M-HDVP D5 디앤디컴,,176000,1몰,
30167879,ASRock B650M PG Lightning + WiFi6E 모듈 패키지 디앤디컴,,145990,148몰,
30300260,ASRock B650M PG Lightning 대원씨티에스,,111180,202몰,
30311870,COLORFUL BATTLE-AX A520M-K M.2 V14 STCOM,,161730,3몰,
30622283,ASRock B650M PG Lightning + WiFi6E 모듈 패키지 에즈윈,,146390,8몰,
30638927,ASRock B760M Pro RS D5 + WiFi6E 모듈 패키지 에즈윈,,188360,12몰,
31472456,GIGABYTE TRX50 AERO D 피씨디렉트,,1069000,1몰,
31959437,ASRock Z790 Pro RS D5 + WiFi7 모듈 패키지 디앤디컴,,405000,5몰,
31959920,ASRock B760M Pro RS D5 + WiFi7 모듈 패키지 디앤디컴,,200730,134몰,
32002067,GIGABYTE H610M K D4 제이씨현 (벌크),,71680,111몰,
32043872,ASUS PRO WS TRX50-SAGE WiFi (해외구매),,1597560,9몰,
32070719,GIGABYTE B650 AORUS ELITE AX V2 피씨디렉트,,217990,152몰,
32071067,GIGABYTE B650 AORUS ELITE V2 피씨디렉트,,203990,147몰,
32078006,GIGABYTE B650 AORUS ELITE V2 제이씨현,,209000,5몰,
32104016,ASRock Z790 PG Lightning D5 + WiFi6E 모듈 패키지 에즈윈,,299000,1몰,
32110508,ASRock A520M-HDVP R2.0 에즈윈 (벌크),,84000,1몰,
32126690,ASUS PRO WS TRX50-SAGE WiFi STCOM,,1443990,121몰,
32487287,ASUS PRO WS TRX50-SAGE WiFi 대원씨티에스,,1396990,126몰,
33363434,ASUS PRO WS W790E-SAGE SE 코잇,,1929000,1몰,
34372580,ASUS PRIME B760M-PLUS-CSM STCOM,,227890,6몰,
34373075,ASUS TUF Gaming B650-E WIFI STCOM,,326000,5몰,
34739282,ASUS PRIME H610M-CS 2.5G 코잇,,105840,122몰,
34741700,GIGABYTE B650E AORUS ELITE X AX ICE 피씨디렉트,,263990,133몰,
34741730,GIGABYTE B650E AORUS ELITE X AX ICE 제이씨현,,251690,4몰,
34810925,ASUS PRIME B760M-PLUS-CSM 인텍앤컴퍼니,,164420,45몰,
34815323,ASUS PRIME B760M-PLUS-CSM 코잇,,200990,1몰,
34815659,ASUS TUF Gaming B760M-PLUS II 코잇,,163960,156몰,
35810231,ASRock A620M-HDV/M.2 에즈윈,,131990,1몰,
36157520,ASRock A620M-HDVP 에즈윈 (벌크),,101990,4몰,
37226114,MSI MAG B760M 박격포 II,,171100,216몰,
37286501,GIGABYTE H610M K D4 피씨디렉트 (벌크),,74200,23몰,
37286591,GIGABYTE H610M H V2 D4 피씨디렉트 (벌크),,83150,20몰,
37286687,GIGABYTE H610M K 피씨디렉트 (벌크),,92000,66몰,
38347157,ASUS PRO WS WRX90E-SAGE SE STCOM,,2181960,35몰,
39249221,MSI PRO A620M-C EX,,118980,118몰,
40895255,ASRock B760M Pro-A 에즈윈,,171500,2몰,
42860537,ASUS Z13PE-D16 STCOM,,2071990,94몰,
43546877,MAXSUN 터미네이터 B760M D5,,108750,9몰,
43557464,MAXSUN 챌린저 H610M,,128750,4몰,
45257993,ASUS PRO WS WRX90E-SAGE SE 대원씨티에스,,2047880,125몰,
46742996,ASRock B650M PG Lightning WiFi 디앤디컴,,170000,28몰,
48476933,ASUS TUF Gaming B650M-E STCOM,,219310,7몰,
48647831,ASRock WRX90 WS EVO 대원씨티에스,,1823990,79몰,
49162646,ASRock B550M Pro RS 디앤디컴,,129020,165몰,
49538822,ASRock B550M Pro RS + WiFi6E 랜카드 패키지 디앤디컴,,168510,91몰,
49740182,ASRock B550M Pro RS 에즈윈,,126984,155몰,
49995851,ASRock B550M Pro RS 대원씨티에스,,119680,156몰,
50129651,ASRock B760M Pro-A + WiFi6E 모듈 패키지 디앤디컴,,183000,12몰,
53418977,MSI B650M 프로젝트 제로,,208350,179몰,
53419463,MSI B760M 프로젝트 제로,,238990,92몰,
54326606,GIGABYTE Z790 AORUS XTREME X ICE + AORUS 지포스 RTX 4080 SUPER XTREME ICE 패키지 피씨디렉트,,3111260,54몰,
54481319,액슬 MBAIH310 에즈윈,,88640,10몰,
54816743,ASUS Tinker Edge R (병행수입),,183290,8몰,
55468811,ASRock H510M-HDV/M.2 SE 에즈윈,,93544,138몰,
57295043,MSI PRO B650M-B,,111130,168몰,
58103081,KHADAS VIM3 Pro 4GB,,363000,1몰,
58115534,COLORFUL COLORFIRE B760M-MEOW WIFI D5 ORANGE STCOM,,232040,103몰,
58432343,ASRock H610M-H2/M.2 D4 에즈윈,,78936,85몰,
58623128,ASRock H610M-H2/M.2 D4 에즈윈 (벌크),,80730,30몰,
58837484,MAXSUN 챌린저 H610ITX 2LAN 디앤디컴,,142410,100몰,
59826524,ASRock H610M-H2/M.2 D4 디앤디컴,,76380,154몰,
59827064,ASRock H610M-H2/M.2 D4 디앤디컴 (벌크),,75970,109몰,
60064028,마이크로틱 MikroTik L11UG-5HaxD,,117990,25몰,
60151763,COLORFUL BATTLE-AX B650M-PLUS V14 STCOM,,106390,4몰,
61423463,ASRock H610M-X D5 에즈윈 (벌크),,101112,116몰,
62568890,MSI PRO B650M-A,,145600,196몰,
62791640,ASRock B650M PG Riptide WiFi White 에즈윈,,221990,164몰,
63087650,ASRock H610M-X D5 디앤디컴,,94961,113몰,
63140087,ASRock H610M-X D5 디앤디컴 (벌크),,93932,125몰,
63269363,ASRock B650M PG Riptide WiFi White 디앤디컴,,248500,120몰,
63478082,ASRock B650M PG Riptide WiFi White 대원씨티에스,,252630,5몰,
63478493,KHADAS VIM4 8GB,,495000,1몰,
63478505,KHADAS VIM4 8GB (해외구매),,470360,2몰,
63938699,GIGABYTE TRX50 AI TOP 제이씨현,,1407900,153몰,
64267934,GIGABYTE TRX50 AI TOP 피씨디렉트,,1396590,114몰,
64375265,GIGABYTE H610M H V2 피씨디렉트,,102990,144몰,
64394135,ASRock B650 스틸레전드 WiFi 디앤디컴,,242580,120몰,
65307479,GIGABYTE H610M S2H V2 피씨디렉트,,113000,139몰,
66046067,GIGABYTE H610M S2H V2 제이씨현,,111960,169몰,
66046259,GIGABYTE H610M H V2 제이씨현,,102800,165몰,
66046349,GIGABYTE H610M K V2 제이씨현,,79480,185몰,
67371704,ASRock Rack SP2C621D16-2T 명인일렉트로닉스,,2107410,8몰,
67372934,ASRock H510M-HDV/M.2 SE 디앤디컴,,98050,143몰,
67373036,ASRock H510M-HDV/M.2 SE 디앤디컴 (벌크),,96000,107몰,
67678283,GIGABYTE H610M K V2 피씨디렉트,,86590,149몰,
67693886,ASUS PRIME X870-P WIFI-CSM STCOM,,355000,151몰,
67693952,ASUS PRIME X870-P-CSM STCOM,,346000,51몰,
67694132,ASUS ProArt X870E-CREATOR WIFI STCOM,,814980,26몰,
67694456,ASUS ROG CROSSHAIR X870E HERO STCOM,,953990,5몰,
67694840,ASUS ROG STRIX X870-A GAMING WIFI STCOM,,541490,39몰,
67694921,ASUS ROG STRIX X870E-E GAMING WIFI STCOM,,771000,14몰,
67695545,ASUS ROG STRIX X870-F GAMING WIFI STCOM,,675000,15몰,
67695563,ASUS TUF Gaming X870-PLUS WIFI STCOM,,411500,10몰,
67695641,ASRock X870 Pro RS 에즈윈,,289650,154몰,
67845785,GIGABYTE X870E AORUS PRO ICE 제이씨현,,452960,16몰,
67845815,GIGABYTE X870 AORUS ELITE WIFI7 제이씨현,,352190,215몰,
67845863,GIGABYTE X870 AORUS ELITE WIFI7 ICE 제이씨현,,359090,215몰,
67846052,GIGABYTE X870 EAGLE WIFI7 제이씨현,,301000,186몰,
67847474,GIGABYTE X870 AORUS ELITE WIFI7 피씨디렉트,,353990,177몰,
67847492,GIGABYTE X870 AORUS ELITE WIFI7 ICE 피씨디렉트,,362990,178몰,
67847543,GIGABYTE X870E AORUS MASTER 피씨디렉트,,699000,1몰,
67847609,GIGABYTE X870E AORUS PRO ICE 피씨디렉트,,442000,4몰,
67850639,ASRock X870E Taichi 에즈윈,,753000,1몰,
67851653,ASUS PRIME X870-P WIFI-CSM 대원씨티에스,,331880,108몰,
67851971,ASUS PRIME X870-P-CSM 대원씨티에스,,306950,106몰,
67852211,ASUS ROG CROSSHAIR X870E HERO 대원씨티에스,,925800,100몰,
67852265,ASUS ROG STRIX X870-A GAMING WIFI 대원씨티에스,,524880,89몰,
67852370,MSI MAG X870 토마호크 WIFI,,418980,150몰,
67852469,MSI PRO X870-P WIFI,,394380,2몰,
67852652,MSI MPG X870E 카본 WIFI,,649980,104몰,
67852706,GIGABYTE X870 EAGLE WIFI7 피씨디렉트,,312990,146몰,
67852766,ASUS ROG STRIX X870E-E GAMING WIFI 대원씨티에스,,789530,3몰,
67852793,ASUS ROG STRIX X870-F GAMING WIFI 대원씨티에스,,646900,109몰,
67852838,ASUS TUF Gaming X870-PLUS WIFI 대원씨티에스,,381960,21몰,
67852946,ASUS ROG STRIX X870-I GAMING WIFI 대원씨티에스,,758490,93몰,
67852967,ASRock X870E Nova WiFi 에즈윈,,474900,160몰,
67976948,ASUS ROG STRIX X870-I GAMING WIFI STCOM,,758930,24몰,
68242061,ASRock X870 스틸레전드 WiFi 대원씨티에스,,320590,128몰,
68242124,ASRock X870 Pro RS WiFi 대원씨티에스,,314790,21몰,
68242145,ASRock X870 Pro RS 대원씨티에스,,278000,3몰,
68246816,ASRock X870E Taichi 대원씨티에스,,768000,1몰,
68440085,ASRock X870E Taichi 디앤디컴,,794540,22몰,
68440103,ASRock X870 스틸레전드 WiFi 디앤디컴,,358800,157몰,
68687615,ASRock Z890 Pro RS 에즈윈,,324550,129몰,
68687816,ASRock Z890 Pro RS WiFi White 에즈윈,,335190,150몰,
68776211,ASRock Z890 Taichi 에즈윈,,671560,155몰,
68919209,ASRock Z890 Pro-A 에즈윈,,309440,157몰,
69053765,ASRock Z890 Pro-A WiFi 에즈윈,,318550,147몰,
69468680,ASRock H610M-X D5 인텍앤컴퍼니 (벌크),,102168,100몰,
69468782,ASRock H610M-HVS M.2 R2.0 D4 인텍앤컴퍼니,,97200,6몰,
69468977,ASRock B760M Pro-A 인텍앤컴퍼니,,133900,154몰,
69469049,ASRock B760M Pro RS D5 인텍앤컴퍼니,,169000,109몰,
69471116,ASRock Z890I Nova WiFi 에즈윈,,504330,151몰,
69471320,ASRock Z890 Nova WiFi 에즈윈,,529000,6몰,
69566399,ASUS ROG MAXIMUS Z890 APEX 인텍앤컴퍼니,,825000,12몰,
69566516,ASUS ROG MAXIMUS Z890 EXTREME 인텍앤컴퍼니,,1890500,1몰,
69566996,ASUS ROG MAXIMUS Z890 HERO 인텍앤컴퍼니,,904930,140몰,
69656168,ASUS ROG STRIX Z890-A GAMING WIFI 인텍앤컴퍼니,,524100,96몰,
69656276,ASUS ROG STRIX Z890-E GAMING WIFI 인텍앤컴퍼니,,750000,8몰,
69656426,ASUS ROG STRIX Z890-F GAMING WIFI 인텍앤컴퍼니,,715015,7몰,
69656816,ASUS PRIME Z890-P WIFI-CSM 인텍앤컴퍼니,,399000,24몰,
69656858,ASUS PRIME Z890-P-CSM 인텍앤컴퍼니,,328970,78몰,
69661004,ASUS Z890 AYW GAMING WIFI W 인텍앤컴퍼니,,362500,102몰,
69661214,ASUS ProArt Z890-CREATOR WIFI 인텍앤컴퍼니,,798990,7몰,
69661250,ASUS PRIME Z890-P WIFI-CSM STCOM,,414000,6몰,
69661526,ASUS PRIME Z890-P-CSM STCOM,,357950,150몰,
69661643,ASUS ROG MAXIMUS Z890 APEX STCOM,,799000,109몰,
69661799,ASUS ROG MAXIMUS Z890 HERO STCOM,,997980,154몰,
69662105,ASUS ROG STRIX Z890-E GAMING WIFI STCOM,,750000,149몰,
69662114,ASUS ROG STRIX Z890-F GAMING WIFI STCOM,,689000,45몰,
69662153,ASUS ROG STRIX Z890-I GAMING WIFI STCOM,,738000,46몰,
69662171,ASUS TUF Gaming Z890-PRO WIFI STCOM,,457980,123몰,
69662327,ASUS Z890 AYW GAMING WIFI W STCOM,,372700,152몰,
69696089,ASUS PRIME Z890-P WIFI-CSM 코잇,,389000,8몰,
69696269,ASUS PRIME Z890-P-CSM 코잇,,355420,145몰,
69696464,ASUS PRIME Z890M-PLUS WIFI-CSM 코잇,,364390,125몰,
69696563,ASUS ProArt Z890-CREATOR WIFI 코잇,,818920,113몰,
69696602,ASUS ROG MAXIMUS Z890 APEX 코잇,,683060,139몰,
69696641,ASUS ROG MAXIMUS Z890 EXTREME 코잇,,1539000,8몰,
69696719,ASUS ROG MAXIMUS Z890 HERO 코잇,,954000,10몰,
69696863,ASUS ROG STRIX Z890-E GAMING WIFI 코잇,,751000,127몰,
69696959,ASUS ROG STRIX Z890-F GAMING WIFI 코잇,,716510,133몰,
69697016,ASUS ROG STRIX Z890-I GAMING WIFI 코잇,,731990,98몰,
69697058,ASUS TUF Gaming Z890-PLUS WIFI 코잇,,386290,147몰,
69697280,ASUS Z890 AYW GAMING WIFI W 코잇,,375900,139몰,
69697592,MSI MEG Z890 에이스,,1278400,2몰,
69697766,MSI MAG Z890 토마호크 WIFI,,455000,167몰,
69697916,MSI PRO Z890-A WIFI,,388990,42몰,
69698066,MSI MPG Z890 카본 WIFI,,580750,164몰,
69698492,MSI MPG Z890 엣지 TI WIFI,,543990,126몰,
69698594,MSI MEG Z890 유니파이-X,,698980,152몰,
69698870,GIGABYTE Z890 AORUS PRO ICE 제이씨현,,432880,184몰,
69699071,GIGABYTE Z890 AORUS ELITE WIFI7 ICE 제이씨현,,353850,204몰,
69699182,GIGABYTE Z890 AORUS ELITE WIFI7 제이씨현,,348490,198몰,
69699317,GIGABYTE Z890 UD 제이씨현,,313000,176몰,
69699389,GIGABYTE Z890I AORUS ULTRA 제이씨현,,498990,113몰,
69699425,GIGABYTE Z890 UD 피씨디렉트,,324990,152몰,
69699467,GIGABYTE Z890 AORUS MASTER 피씨디렉트,,668990,43몰,
69699584,GIGABYTE Z890 AORUS PRO ICE 피씨디렉트,,428400,151몰,
69699599,GIGABYTE Z890 AORUS ELITE WIFI7 ICE 피씨디렉트,,374990,153몰,
69699671,GIGABYTE Z890 AORUS ELITE WIFI7 피씨디렉트,,358490,157몰,
69699695,GIGABYTE Z890I AORUS ULTRA 피씨디렉트,,493990,132몰,
69867761,ASRock Z890 스틸레전드 WIFI 인텍앤컴퍼니,,369000,8몰,
69867902,ASRock Z890 Taichi 인텍앤컴퍼니,,676400,137몰,
69868004,ASRock Z890 Taichi AQUA 인텍앤컴퍼니,,1419060,60몰,
69868175,ASRock Z890 Taichi OCF 인텍앤컴퍼니,,878970,23몰,
69868301,ASRock Z890 Nova WiFi 인텍앤컴퍼니,,529000,6몰,
69868430,ASRock Z890 LiveMixer WiFi 인텍앤컴퍼니,,354960,145몰,
69868478,ASRock Z890 Pro RS WiFi 인텍앤컴퍼니,,347480,135몰,
69868499,ASRock Z890 Pro-A WiFi 인텍앤컴퍼니,,300000,119몰,
70000382,ASRock Z890 Taichi 디앤디컴,,682000,135몰,
70001147,ASUS ProArt Z890-CREATOR WIFI STCOM,,815000,101몰,
70002455,ASUS PRIME Z890M-PLUS WIFI-CSM STCOM,,378980,109몰,
70006577,ASRock Z890 스틸레전드 WIFI 디앤디컴,,376530,2몰,
70006589,ASRock Z890 Pro RS 디앤디컴,,335280,115몰,
70006610,ASRock Z890 Pro-A 디앤디컴,,306780,174몰,
70101260,ASRock X870 Pro RS WiFi 에즈윈,,323890,157몰,
70769987,ASRock X870E Nova WiFi 대원씨티에스,,426530,126몰,
70875566,ASRock X870 Pro RS 디앤디컴,,295800,94몰,
71007920,ASRock Z890 Lightning WiFi 에즈윈,,419840,153몰,
71010251,ASRock Z890 Pro RS WiFi White 디앤디컴,,334410,156몰,
71216543,MSI PRO Z890-P WIFI,,348980,156몰,
71426399,ASRock Rack EC262D4U 명인일렉트로닉스,,654210,3몰,
71502050,Supermicro H13SSL-NT R2.0 STCOM,,1405000,65몰,
72227675,GIGABYTE Z890 AORUS XTREME AI TOP 피씨디렉트,,1493940,140몰,
72304610,ASRock B650 스틸레전드 WiFi 대원씨티에스,,239400,124몰,
72757274,ASRock X870E Nova WiFi 디앤디컴,,476570,175몰,
73071959,ASRock Rack SP2C741D16X-2T 명인일렉트로닉스,,2090000,3몰,
73072130,ASRock Rack SPC741D8-2L2T/BCM 명인일렉트로닉스,,1980990,4몰,
73560548,GIGABYTE X870E AORUS PRO 피씨디렉트,,411890,182몰,
73763492,ASUS TUF Gaming B850-PLUS WIFI 대원씨티에스,,317980,172몰,
73763909,ASUS TUF Gaming B850M-PLUS WIFI 대원씨티에스,,278990,6몰,
73764137,ASUS ROG STRIX B850-A GAMING WIFI 대원씨티에스,,408990,7몰,
73767836,ASUS ROG STRIX B850-E GAMING WIFI 대원씨티에스,,546990,136몰,
73767989,ASUS ROG STRIX B850-F GAMING WIFI 대원씨티에스,,422550,14몰,
73768364,ASUS ROG STRIX B850-I GAMING WIFI 대원씨티에스,,401000,1몰,
73769318,ASUS PRIME B840M-A WIFI-CSM 대원씨티에스,,247990,92몰,
73769342,ASUS PRIME B840M-A-CSM 대원씨티에스,,162000,98몰,
73769357,ASUS PRIME B840-PLUS WIFI-CSM 대원씨티에스,,273890,4몰,
73770854,GIGABYTE X870E AORUS XTREME AI TOP 피씨디렉트,,939000,4몰,
73883426,ASUS TUF Gaming B850M-PLUS 대원씨티에스,,328890,1몰,
73883867,ASUS ROG STRIX B850-A GAMING WIFI STCOM,,405940,151몰,
73883918,ASUS ROG STRIX B850-F GAMING WIFI STCOM,,425290,156몰,
73883963,ASUS ROG STRIX B850-I GAMING WIFI STCOM,,411030,112몰,
73884029,ASUS TUF Gaming B850M-PLUS STCOM,,254000,19몰,
73884041,ASUS TUF Gaming B850M-PLUS WIFI STCOM,,261230,4몰,
73884083,ASUS TUF Gaming B850-PLUS WIFI STCOM,,323530,204몰,
73884143,ASUS PRIME B840M-A WIFI-CSM STCOM,,239400,133몰,
73884173,ASUS PRIME B840M-A-CSM STCOM,,221350,137몰,
73891739,GIGABYTE B850 AORUS ELITE WIFI7 피씨디렉트,,295590,154몰,
73891778,GIGABYTE B850 AORUS ELITE WIFI7 ICE 피씨디렉트,,308990,141몰,
73892000,GIGABYTE B850M AORUS ELITE WIFI6E ICE 피씨디렉트,,233000,198몰,
73892084,GIGABYTE B850M DS3H 피씨디렉트,,168570,186몰,
73892279,GIGABYTE B850 AORUS ELITE WIFI7 ICE 제이씨현,,307000,163몰,
73892309,GIGABYTE B850 AORUS ELITE WIFI7 제이씨현,,290700,171몰,
73892354,GIGABYTE B850M DS3H 제이씨현,,163920,218몰,
73892423,GIGABYTE B850M AORUS ELITE WIFI6E ICE 제이씨현,,227900,240몰,
73948922,MSI PRO B840-P WIFI,,191490,144몰,
73949189,ASRock X870E Taichi Lite (해외구매),,388000,2몰,
73949327,GIGABYTE X870E AORUS ELITE WIFI7 (해외구매),,418200,9몰,
73952525,ASRock B850 Pro RS 에즈윈,,240860,167몰,
73952591,ASRock B850I Lightning WiFi 에즈윈,,326100,136몰,
73952600,ASRock B850 Pro RS WiFi 에즈윈,,240400,160몰,
73952729,ASRock B850M Pro RS 에즈윈,,200690,155몰,
73952732,ASRock B850M Pro RS WiFi 에즈윈,,202940,148몰,
74013710,ASRock B860M Pro RS 에즈윈,,194400,163몰,
74116181,ASRock B860 LiveMixer WiFi 인텍앤컴퍼니,,272000,115몰,
74116334,ASRock B860M LiveMixer WiFi 인텍앤컴퍼니,,238840,140몰,
74116589,ASRock B860 스틸레전드 WiFi 인텍앤컴퍼니,,329306,7몰,
74116682,ASRock B860M 스틸레전드 WiFi 인텍앤컴퍼니,,263520,10몰,
74121977,ASRock B860M Pro RS WiFi 인텍앤컴퍼니,,219000,23몰,
74122352,ASRock B860M-X 인텍앤컴퍼니,,163900,121몰,
74250353,ASRock B850 LiveMixer WiFi 대원씨티에스,,282970,28몰,
74250455,ASRock B850 Pro-A 대원씨티에스,,214740,128몰,
74250557,ASRock B850 Riptide WiFi 대원씨티에스,,298360,96몰,
74250659,ASRock B850M-X 대원씨티에스,,166750,2몰,
74250827,GIGABYTE B860 AORUS ELITE WIFI7 ICE 제이씨현,,284600,187몰,
74250974,GIGABYTE B860M AORUS ELITE WIFI6E ICE 제이씨현,,259500,215몰,
74251187,GIGABYTE B860M AORUS ELITE WIFI6E 제이씨현,,260000,205몰,
74251253,GIGABYTE B860M AORUS ELITE 제이씨현,,226300,195몰,
74251349,GIGABYTE B860M DS3H 제이씨현,,167830,214몰,
74253203,ASUS ROG STRIX B860-I GAMING WIFI STCOM,,428980,141몰,
74253692,ASUS ROG STRIX B860-F GAMING WIFI STCOM,,444980,140몰,
74254586,ASUS ROG STRIX B860-A GAMING WIFI STCOM,,398990,148몰,
74254724,ASUS TUF Gaming B860-PLUS WIFI STCOM,,365600,141몰,
74254814,ASUS TUF Gaming B860M-PLUS WIFI STCOM,,288980,151몰,
74254832,ASUS TUF Gaming B860M-PLUS STCOM,,247490,159몰,
74255033,ASUS PRIME B860M-A WIFI-CSM STCOM,,268990,125몰,
74255060,ASUS PRIME B860M-A-CSM STCOM,,188000,114몰,
74255084,ASUS PRIME B860M-K-CSM STCOM,,185790,95몰,
74255114,ASUS PRIME B860-PLUS-CSM STCOM,,286990,66몰,
74255120,ASUS PRIME B860-PLUS WIFI-CSM STCOM,,318990,81몰,
74255204,ASUS PRIME B860M-A WIFI-CSM 인텍앤컴퍼니,,214000,3몰,
74255321,ASUS PRIME B860M-A-CSM 인텍앤컴퍼니,,177020,135몰,
74255333,ASUS ROG STRIX B860-A GAMING WIFI 인텍앤컴퍼니,,398990,15몰,
74255336,ASUS ROG STRIX B860-F GAMING WIFI 인텍앤컴퍼니,,445000,10몰,
74255369,ASUS ROG STRIX B860-I GAMING WIFI 인텍앤컴퍼니,,429000,3몰,
74255378,ASUS TUF Gaming B860-PLUS WIFI 인텍앤컴퍼니,,368900,18몰,
74255381,GIGABYTE B860 AORUS ELITE WIFI7 ICE 피씨디렉트,,291990,164몰,
74255384,GIGABYTE B860M AORUS ELITE 피씨디렉트,,232990,156몰,
74255387,GIGABYTE B860M AORUS ELITE WIFI6E ICE 피씨디렉트,,257940,199몰,
74255390,GIGABYTE B860M AORUS ELITE WIFI6E 피씨디렉트,,260470,188몰,
74255393,GIGABYTE B860M DS3H 피씨디렉트,,177990,175몰,
74336033,ASUS PRIME H810M-A STCOM,,132920,133몰,
74336102,ASUS PRIME H810M-A-CSM STCOM,,141740,133몰,
74336888,ASUS PRIME H810M-A WIFI STCOM,,148840,135몰,
74336894,ASUS PRIME H810M-A WIFI-CSM STCOM,,158990,129몰,
74337014,ASUS PRIME B860-PLUS-CSM 코잇,,278980,134몰,
74337680,ASUS PRIME B860M-A-CSM 코잇,,180580,177몰,
74337722,ASUS ROG STRIX B860-A GAMING WIFI 코잇,,369000,142몰,
74338013,ASUS ROG STRIX B860-F GAMING WIFI 코잇,,443990,142몰,
74338115,ASUS ROG STRIX B860-G GAMING WIFI 코잇,,280220,189몰,
74338499,ASUS ROG STRIX B860-I GAMING WIFI 코잇,,404820,137몰,
74338622,ASUS TUF Gaming B860-PLUS WIFI 코잇,,298980,142몰,
74339975,MSI PRO B860M-A WIFI,,208620,205몰,
