73883963,ASUS ROG STRIX B850-I GAMING WIFI STCOM,,427000,160몰,
73884029,ASUS TUF Gaming B850M-PLUS STCOM,,254000,19몰,
73884041,ASUS TUF Gaming B850M-PLUS WIFI STCOM,,261230,12몰,
73884083,ASUS TUF Gaming B850-PLUS WIFI STCOM,,318500,225몰,
73884143,ASUS PRIME B840M-A WIFI-CSM STCOM,,239400,142몰,
73884173,ASUS PRIME B840M-A-CSM STCOM,,221350,140몰,
73891739,GIGABYTE B850 AORUS ELITE WIFI7 피씨디렉트,,290780,178몰,
73891778,GIGABYTE B850 AORUS ELITE WIFI7 ICE 피씨디렉트,,308980,167몰,
73892000,GIGABYTE B850M AORUS ELITE WIFI6E ICE 피씨디렉트,,232790,215몰,
73892084,GIGABYTE B850M DS3H 피씨디렉트,,170070,192몰,
73892279,GIGABYTE B850 AORUS ELITE WIFI7 ICE 제이씨현,,303790,193몰,
73892309,GIGABYTE B850 AORUS ELITE WIFI7 제이씨현,,295050,177몰,
73892354,GIGABYTE B850M DS3H 제이씨현,,164070,232몰,
73892423,GIGABYTE B850M AORUS ELITE WIFI6E ICE 제이씨현,,227640,231몰,
73948922,MSI PRO B840-P WIFI,,198990,154몰,
73949189,ASRock X870E Taichi Lite (해외구매),,702500,1몰,
73949327,GIGABYTE X870E AORUS ELITE WIFI7 (해외구매),,418200,7몰,
73952525,ASRock B850 Pro RS 에즈윈,,241410,165몰,
73952591,ASRock B850I Lightning WiFi 에즈윈,,326100,135몰,
73952600,ASRock B850 Pro RS WiFi 에즈윈,,240400,163몰,
73952729,ASRock B850M Pro RS 에즈윈,,202890,150몰,
73952732,ASRock B850M Pro RS WiFi 에즈윈,,202940,149몰,
74013710,ASRock B860M Pro RS 에즈윈,,194400,161몰,
74116181,ASRock B860 LiveMixer WiFi 인텍앤컴퍼니,,272000,119몰,
74116334,ASRock B860M LiveMixer WiFi 인텍앤컴퍼니,,198100,145몰,
74116589,ASRock B860 스틸레전드 WiFi 인텍앤컴퍼니,,330860,7몰,
74116682,ASRock B860M 스틸레전드 WiFi 인텍앤컴퍼니,,263520,9몰,
74121977,ASRock B860M Pro RS WiFi 인텍앤컴퍼니,,217500,22몰,
74122352,ASRock B860M-X 인텍앤컴퍼니,,166100,127몰,
74250353,ASRock B850 LiveMixer WiFi 대원씨티에스,,282970,4몰,
74250455,ASRock B850 Pro-A 대원씨티에스,,214750,128몰,
74250557,ASRock B850 Riptide WiFi 대원씨티에스,,297820,97몰,
74250659,ASRock B850M-X 대원씨티에스,,166750,2몰,
74250827,GIGABYTE B860 AORUS ELITE WIFI7 ICE 제이씨현,,291330,193몰,
74250974,GIGABYTE B860M AORUS ELITE WIFI6E ICE 제이씨현,,258490,221몰,
74251187,GIGABYTE B860M AORUS ELITE WIFI6E 제이씨현,,267750,210몰,
74251253,GIGABYTE B860M AORUS ELITE 제이씨현,,233180,204몰,
74251349,GIGABYTE B860M DS3H 제이씨현,,179940,232몰,
74253203,ASUS ROG STRIX B860-I GAMING WIFI STCOM,,428940,148몰,
74253692,ASUS ROG STRIX B860-F GAMING WIFI STCOM,,443870,148몰,
74254586,ASUS ROG STRIX B860-A GAMING WIFI STCOM,,394430,157몰,
74254724,ASUS TUF Gaming B860-PLUS WIFI STCOM,,319000,144몰,
74254814,ASUS TUF Gaming B860M-PLUS WIFI STCOM,,278750,153몰,
74254832,ASUS TUF Gaming B860M-PLUS STCOM,,242100,160몰,
74255033,ASUS PRIME B860M-A WIFI-CSM STCOM,,222320,128몰,
74255060,ASUS PRIME B860M-A-CSM STCOM,,191500,121몰,
74255084,ASUS PRIME B860M-K-CSM STCOM,,198940,158몰,
74255114,ASUS PRIME B860-PLUS-CSM STCOM,,298990,66몰,
74255120,ASUS PRIME B860-PLUS WIFI-CSM STCOM,,318990,86몰,
74255204,ASUS PRIME B860M-A WIFI-CSM 인텍앤컴퍼니,,214000,3몰,
74255321,ASUS PRIME B860M-A-CSM 인텍앤컴퍼니,,177020,135몰,
74255333,ASUS ROG STRIX B860-A GAMING WIFI 인텍앤컴퍼니,,398990,12몰,
74255336,ASUS ROG STRIX B860-F GAMING WIFI 인텍앤컴퍼니,,445000,9몰,
74255369,ASUS ROG STRIX B860-I GAMING WIFI 인텍앤컴퍼니,,429000,3몰,
74255378,ASUS TUF Gaming B860-PLUS WIFI 인텍앤컴퍼니,,368890,57몰,
74255381,GIGABYTE B860 AORUS ELITE WIFI7 ICE 피씨디렉트,,291990,169몰,
74255384,GIGABYTE B860M AORUS ELITE 피씨디렉트,,233990,163몰,
74255387,GIGABYTE B860M AORUS ELITE WIFI6E ICE 피씨디렉트,,265990,205몰,
74255390,GIGABYTE B860M AORUS ELITE WIFI6E 피씨디렉트,,260990,200몰,
74255393,GIGABYTE B860M DS3H 피씨디렉트,,176870,177몰,
74336033,ASUS PRIME H810M-A STCOM,,131870,135몰,
74336102,ASUS PRIME H810M-A-CSM STCOM,,143990,134몰,
74336888,ASUS PRIME H810M-A WIFI STCOM,,143980,134몰,
74336894,ASUS PRIME H810M-A WIFI-CSM STCOM,,158990,136몰,
74337014,ASUS PRIME B860-PLUS-CSM 코잇,,279000,149몰,
74337680,ASUS PRIME B860M-A-CSM 코잇,,180580,177몰,
74337722,ASUS ROG STRIX B860-A GAMING WIFI 코잇,,369000,140몰,
74338013,ASUS ROG STRIX B860-F GAMING WIFI 코잇,,456490,146몰,
74338115,ASUS ROG STRIX B860-G GAMING WIFI 코잇,,284520,192몰,
74338499,ASUS ROG STRIX B860-I GAMING WIFI 코잇,,418990,111몰,
74338622,ASUS TUF Gaming B860-PLUS WIFI 코잇,,303000,145몰,
74339975,MSI PRO B860M-A WIFI,,208980,46몰,
74340266,MSI MAG B860M 박격포 WIFI,,263980,191몰,
74340455,MSI MAG B860 토마호크 WIFI,,288860,188몰,
74340596,ASRock B850 Pro RS WiFi 디앤디컴,,248120,143몰,
74340710,ASRock B850 스틸레전드 WiFi 디앤디컴,,283210,158몰,
74341163,ASRock B850M Pro-A 에즈윈,,164050,166몰,
74341325,ASRock B850M Pro-A WiFi 에즈윈,,193120,146몰,
74341418,ASRock B850M 스틸레전드 WiFi 에즈윈,,241400,150몰,
74341610,ASRock B850 Pro-A 디앤디컴,,220150,161몰,
74341787,ASRock B850M-X 디앤디컴,,147440,122몰,
74415038,ASRock B860M Pro RS WiFi 에즈윈,,204440,155몰,
74415482,ASRock B860 Pro RS 에즈윈,,250420,164몰,
74415509,ASRock B860 Pro RS WiFi 에즈윈,,260630,164몰,
74422025,ASRock B860M Pro RS 디앤디컴,,202000,150몰,
74491244,ASUS PRIME B840M-A-CSM 인텍앤컴퍼니,,144950,152몰,
74491247,ASUS TUF Gaming B850M-PLUS 인텍앤컴퍼니,,259000,2몰,
74491250,ASUS TUF Gaming B850M-PLUS WIFI 인텍앤컴퍼니,,292970,9몰,
74491253,ASRock B860M-X 에즈윈,,173000,4몰,
74491295,ASRock B860I WiFi 에즈윈,,275440,145몰,
74808266,ASUS ROG STRIX Z890-I GAMING WIFI 인텍앤컴퍼니,,776800,8몰,
74814188,ASUS TUF Gaming X870-PLUS WIFI 인텍앤컴퍼니,,362190,118몰,
74814341,MSI MAG B850 토마호크 맥스 WIFI,,328870,145몰,
74814380,MSI MPG B850 엣지 TI WIFI,,365680,186몰,
74885192,ASRock H810M-X 에즈윈,,126490,148몰,
74885201,ASRock H810M-X 에즈윈 (벌크),,131740,94몰,
74999933,ASRock B850 Pro-A 에즈윈,,220000,140몰,
75372923,ASUS Z13PE-D16 아이보라,,1992630,84몰,
75373061,ASUS PRO WS WRX90E-SAGE SE 아이보라,,2089310,87몰,
75373118,ASUS PRO WS W790E-SAGE SE 아이보라,,2127210,87몰,
75465857,ASUS PRO WS TRX50-SAGE WiFi 아이보라,,1467000,3몰,
75536555,ASUS B860M AYW GAMING WIFI 인텍앤컴퍼니,,171380,160몰,
75538394,ASRock B850M Pro RS 대원씨티에스,,196990,139몰,
75538472,MSI MPG X870E 엣지 TI WIFI,,498870,167몰,
75538754,ASRock B850M Pro-A 대원씨티에스,,194110,10몰,
75540665,ASRock B850M Pro-A WiFi 대원씨티에스,,187000,108몰,
75541040,ASRock X870 Riptide WiFi 대원씨티에스,,366240,62몰,
75600170,GIGABYTE X870E AORUS PRO 제이씨현,,412700,155몰,
75600842,ASRock B850M Pro RS 디앤디컴,,201710,172몰,
75600851,ASRock B850M Pro RS WiFi 디앤디컴,,202650,148몰,
75720068,ASUS PRIME H810M-A 인텍앤컴퍼니,,123000,134몰,
75724184,ASRock B850M Pro-A 디앤디컴,,162740,184몰,
75856148,GIGABYTE W790 AI TOP 피씨디렉트,,1498840,62몰,
75856643,ASRock B860M Pro-A 인텍앤컴퍼니,,154190,111몰,
75857021,MSI MAG X870E 토마호크 WIFI,,456560,193몰,
75935612,ASRock B860M Pro RS WiFi 디앤디컴,,218940,150몰,
75935651,ASRock B860 Pro RS WiFi 디앤디컴,,249900,159몰,
75935675,ASRock B860M 스틸레전드 WiFi 디앤디컴,,273970,124몰,
75935729,ASRock B860I WiFi 디앤디컴,,277020,136몰,
75939005,ASRock B850 Pro RS WiFi 대원씨티에스,,251300,101몰,
75988922,GIGABYTE W790 AI TOP 제이씨현,,1410000,1몰,
76463696,ASUS H810M AYW GAMING WIFI STCOM,,157460,88몰,
76463777,ASUS H810M AYW GAMING WIFI-CSM STCOM,,160990,131몰,
76509641,ASRock B650M Pro X3D 에즈윈,,142730,187몰,
76941716,GIGABYTE H810M S2H 제이씨현,,132180,143몰,
76941815,GIGABYTE H810M H 제이씨현,,110560,188몰,
76941983,GIGABYTE H810M K 제이씨현,,110070,149몰,
76942061,GIGABYTE H810M H 피씨디렉트,,107990,155몰,
76942073,GIGABYTE H810M K 피씨디렉트,,107990,174몰,
76942094,GIGABYTE H810M S2H 피씨디렉트,,129990,155몰,
76944080,ASUS ROG STRIX B850-F GAMING WIFI 인텍앤컴퍼니,,421120,7몰,
76946525,ASUS ROG STRIX B850-I GAMING WIFI 인텍앤컴퍼니,,405720,74몰,
76948274,MAXSUN 챌린저 A620A 2.5G 디앤디컴,,99990,88몰,
76948292,MAXSUN e스포츠 B650ITX WIFI ICE 디앤디컴,,186000,92몰,
77083181,ASUS PRIME H810M-A 코잇,,122980,153몰,
77083238,ASUS PRIME H810M-A WIFI 코잇,,140560,133몰,
77083265,ASUS H810M AYW GAMING WIFI 코잇,,153880,113몰,
77278676,ASRock B850I Lightning WiFi 대원씨티에스,,331560,117몰,
77278937,ASRock B850 스틸레전드 WiFi 에즈윈,,287530,67몰,
77283125,MAXSUN 아이크레프트 Z890 아크틱 디앤디컴,,455430,100몰,
77313929,MAXSUN 챌린저 B760ITX D5 디앤디컴,,187520,84몰,
77319245,MAXSUN 터미네이터 Z890-A WIFI 디앤디컴,,251840,96몰,
77382695,ASUS PRO WS Z890-ACE SE STCOM,,797000,2몰,
77460638,NZXT N9 Z890 Black,,765000,23몰,
77460707,NZXT N9 Z890 White,,669900,29몰,
77460818,GIGABYTE B850M DS3H ICE 제이씨현,,171330,207몰,
77460890,ASUS ROG STRIX B850-E GAMING WIFI 인텍앤컴퍼니,,367700,104몰,
77460911,ASUS TUF Gaming B850-PLUS WIFI 인텍앤컴퍼니,,312560,134몰,
77460956,ASUS ROG CROSSHAIR X870E HERO 인텍앤컴퍼니,,972000,9몰,
77460980,ASUS ROG STRIX X870-A GAMING WIFI 인텍앤컴퍼니,,538990,12몰,
77618858,ASUS ROG STRIX B850-E GAMING WIFI STCOM,,556850,157몰,
77620880,GIGABYTE B850M DS3H ICE 피씨디렉트,,171990,209몰,
77704688,ASRock B850M 스틸레전드 WiFi 대원씨티에스,,234990,134몰,
77705072,ASRock B850M Riptide WiFi 대원씨티에스,,241690,139몰,
77706647,ASRock B650M Pro X3D 대원씨티에스,,128520,174몰,
77706989,ASRock A520M-HVS 대원씨티에스,,58530,158몰,
77784170,ASRock W790 WS R2.0 에즈윈,,1276500,1몰,
77786621,ASRock B650M Pro X3D WiFi 디앤디컴,,178890,152몰,
77786816,ASRock B650M Pro X3D 디앤디컴,,137230,176몰,
77791190,GIGABYTE X870I AORUS PRO ICE 피씨디렉트,,502890,117몰,
77856971,GIGABYTE B850I AORUS PRO 피씨디렉트,,337770,97몰,
78099548,ASUS ROG STRIX B850-A GAMING WIFI 인텍앤컴퍼니,,408990,9몰,
78102320,BIOSTAR B850MT-E PRO 제이씨현,,149000,129몰,
78102458,ASRock Z890 Pro-A WiFi 디앤디컴,,328970,131몰,
78102476,ASRock B850M 스틸레전드 WiFi 디앤디컴,,227110,174몰,
78307601,ASRock B860M-X 디앤디컴,,179000,4몰,
78307670,ASRock H810M-X WIFI 디앤디컴,,149880,117몰,
78307739,ASRock H810M-X 디앤디컴,,135500,143몰,
78312209,ASRock H810M-X 디앤디컴 (벌크),,140910,95몰,
78534680,ASRock B850M Pro RS + WiFi6E 모듈 패키지 디앤디컴,,237900,84몰,
78843671,GIGABYTE B850M AORUS ELITE WIFI6E 제이씨현,,224370,232몰,
78977822,ASRock H810M-X 인텍앤컴퍼니,,129410,7몰,
78990293,ASRock B850 Pro-A WiFi 에즈윈,,232070,144몰,
79000790,GIGABYTE B850M AORUS ELITE WIFI6E 피씨디렉트,,229490,188몰,
79397648,MSI MAG B850M 박격포 WIFI,,268990,233몰,
79402439,GIGABYTE X870I AORUS PRO ICE 제이씨현,,501410,21몰,
79410686,ASRock X870 Pro RS WiFi 디앤디컴,,320030,136몰,
79410761,ASRock B850 Pro-A WiFi 디앤디컴,,225940,156몰,
79553249,ASRock B850M Pro-A WiFi 디앤디컴,,180850,175몰,
79553456,ASRock B850M-X R2.0 디앤디컴,,151920,166몰,
79556738,ASRock B850M-X R2.0 대원씨티에스,,158540,124몰,
79559189,ASRock H610M-H2/M.2 D4 인텍앤컴퍼니,,89000,8몰,
82093181,ASRock B850M-X R2.0 에즈윈,,154190,159몰,
82470941,ASRock B860 Pro-A WiFi 에즈윈,,240630,152몰,
89861528,COLORFUL CVN X870 ARK FROZEN V14 STCOM,,338510,97몰,
90271250,GIGABYTE B760M AORUS ELITE GEN5 제이씨현,,170000,176몰,
90502931,GIGABYTE B760M AORUS ELITE GEN5 피씨디렉트,,165000,150몰,
90506507,ASRock A620AM-X 디앤디컴,,102950,170몰,
90643316,ASRock H610M-HDVP/D5 R2.0 인텍앤컴퍼니 (벌크),,102620,98몰,
90643517,ASRock Z790 PG Lightning D5 인텍앤컴퍼니,,333000,1몰,
90643637,ASRock B760M-HDVP D5 인텍앤컴퍼니 (벌크),,135000,4몰,
90702200,ASUS PRO WS W790-ACE 아이보라,,1449410,73몰,
90957212,NZXT N9 X870E Black,,649000,14몰,
90957218,NZXT N9 X870E White,,649000,22몰,
91493696,MSI MAG B850M 박격포,,243700,194몰,
91871951,GIGABYTE B760M DS3H GEN5 제이씨현,,123570,201몰,
91872095,GIGABYTE B760M DS3H GEN5 피씨디렉트,,141090,177몰,
92043230,MAXSUN e스포츠 B850ITX WIFI ICE 디앤디컴,,201500,80몰,
92108180,ASRock A620AM-HVS 대원씨티에스,,94690,119몰,
92149667,ASRock A620AM-HVS 디앤디컴,,93950,161몰,
92357948,ASUS WS C422 PRO/SE,,1499000,3몰,
92360492,ASRock B860 Pro-A 에즈윈,,227480,115몰,
92360591,ASRock A620AM-HVS 에즈윈,,90740,141몰,
92678384,타무즈 H610M-ID4,,75800,81몰,
92678408,타무즈 H610M-ID5,,77850,87몰,
92678840,ASUS TUF Gaming B850-BTF WIFI W 인텍앤컴퍼니,,390740,95몰,
92687522,ASUS PRO WS W880-ACE SE STCOM,,786980,102몰,
92971409,ASRock H810M-H 인텍앤컴퍼니,,114170,93몰,
92971469,ASUS ROG CROSSHAIR X870E APEX STCOM,,1038820,127몰,
93018986,ASUS ROG CROSSHAIR X870E EXTREME STCOM,,1436620,71몰,
93019088,ASUS ROG CROSSHAIR X870E APEX 대원씨티에스,,799000,138몰,
93022430,ASUS ROG CROSSHAIR X870E EXTREME 대원씨티에스,,1393060,89몰,
93022751,ASUS PRIME B850M-A-CSM 대원씨티에스,,209000,102몰,
93071258,ASUS B850M MAX GAMING WIFI 대원씨티에스,,194450,128몰,
93073223,GIGABYTE X870 AORUS STEALTH ICE 제이씨현,,448340,85몰,
93073367,GIGABYTE X870 AORUS STEALTH ICE 피씨디렉트,,453990,135몰,
93317309,ASRock B650M Pro X3D WiFi 에즈윈,,171540,107몰,
93382583,ASRock B550M Phantom Gaming 4 + WiFi6E 랜카드 패키지 디앤디컴,,142470,87몰,
93442604,GIGABYTE B850 AORUS STEALTH ICE 피씨디렉트,,378960,124몰,
93500939,GIGABYTE B850 AORUS STEALTH ICE 제이씨현,,374630,138몰,
93502442,MSI PRO B850M-A WIFI,,183270,202몰,
93702833,ASRock B650M Pro X3D WiFi 대원씨티에스,,172620,29몰,
93703418,ASUS TUF Gaming B650EM-E WIFI 대원씨티에스,,178990,168몰,
93803822,ASRock B850M Pro RS WiFi WHITE 디앤디컴,,206510,157몰,
93804581,ASRock B850M Pro Plus WiFi 디앤디컴,,218360,161몰,
94028396,ASRock B850M Pro RS WiFi WHITE 대원씨티에스,,193720,125몰,
94080773,GIGABYTE B650M K 제이씨현 (벌크),,113180,92몰,
94080806,GIGABYTE H610M K V2 제이씨현 (벌크),,77480,35몰,
94081583,ASRock A620AM-X + WiFi6E 랜카드 패키지 디앤디컴,,164490,28몰,
94081679,ASRock A620AM-HVS + WiFi6E 랜카드 패키지 디앤디컴,,130000,96몰,
94129904,COLORFUL BATTLE-AX B850M-PLUS PRO WIFI V14 STCOM,,180700,108몰,
94815752,ASUS ROG STRIX B850-G GAMING WIFI 대원씨티에스,,338530,4몰,
94888226,GIGABYTE B760M D2HX LITE SI GEN5 피씨디렉트 (벌크),,108970,94몰,
94998482,ASRock B650M PG Riptide WiFi White 디앤디컴 (중고),,211680,1몰,
95200499,GIGABYTE B850M FORCE 피씨디렉트,,158190,164몰,
95280263,GIGABYTE B850M FORCE 제이씨현,,154790,216몰,
95420366,ASUS B850M MAX GAMING WIFI STCOM,,192920,147몰,
95420465,ASUS ROG STRIX B850-G GAMING WIFI STCOM,,352000,133몰,
95420537,ASUS PRIME B850M-A-CSM STCOM,,209000,16몰,
95421218,ASUS TUF Gaming B650EM-E WIFI STCOM,,181490,119몰,
95930900,BIOSTAR B850MT2-E DJ 제이씨현,,138980,135몰,
95988443,ASUS TUF Gaming B850M-E WIFI STCOM,,243000,130몰,
95988578,ASUS TUF Gaming B850M-PLUS II STCOM,,236170,173몰,
95988710,ASUS TUF Gaming B850M-PLUS WIFI7 STCOM,,268970,190몰,
95988944,ASUS TUF Gaming B850M-PLUS WIFI7 W STCOM,,269290,191몰,
96259139,ASUS PRO WS TRX50-SAGE WiFi A 아이보라,,1479440,60몰,
96314954,GIGABYTE H610M K 피씨디렉트 (중고),,81000,1몰,
96314975,BIOSTAR H610MHD D5 제이씨현 (중고),,82800,2몰,
96366245,ADVANTECH ASMB-925-00A1,,1500000,2몰,
96426692,ASUS Pro H610T-CSM D5 코잇 (벌크),120W 어댑터 포함,207620,4몰,
96426704,ASUS Pro H610T-CSM D5 코잇 (벌크),어댑터 미포함,176620,4몰,
96656717,ASUS TUF Gaming B850-BTF WIFI W STCOM,,401420,127몰,
96711170,ASUS PRIME Z890-P WIFI-CSM STCOM (중고),,335200,3몰,
96712895,ASUS PRIME B650EM-A STCOM,,146990,123몰,
96776582,ASRock H610M-H2/M.2 D5 에즈윈,,82570,137몰,
96981164,NZXT N7 B850 Black,,478000,19몰,
96981215,NZXT N7 B850 White,,243570,36몰,
97118543,ASUS TUF Gaming B850M-PLUS WIFI7 대원씨티에스,,267570,164몰,
97119116,ASUS TUF Gaming B850M-PLUS II 대원씨티에스,,232210,160몰,
97119959,ASUS PRIME B650EM-A 대원씨티에스,,134980,130몰,
97120361,ASUS TUF Gaming B850M-PLUS WIFI7 W 대원씨티에스,,271510,166몰,
97121303,ASUS TUF Gaming B850M-E WIFI 대원씨티에스,,226510,146몰,
97121510,MSI MPG B850I 엣지 TI WIFI,,367620,149몰,
97121798,MSI PRO H810M-B,,126250,185몰,
97224935,ASRock X870 Pro-A WiFi 디앤디컴,,295530,131몰,
97475957,ASUS TUF Gaming X870E-PLUS WIFI7 STCOM,,428000,139몰,
97476215,ASUS ROG STRIX X870E-H GAMING WIFI7 STCOM,,546000,118몰,
97476398,ASUS ROG CROSSHAIR X870E HERO BTF STCOM,,1281550,4몰,
97565858,ASRock A620AI WiFi 대원씨티에스,,227380,118몰,
97702355,ASRock B850 Challenger WiFi 7 White 대원씨티에스,,249490,97몰,
97702418,ASRock B850 Challenger WiFi 7 대원씨티에스,,239000,82몰,
97837412,MSI PRO H610M-E DDR5,,90000,157몰,
97855343,MSI MPG X870E 엣지 TI WIFI (중고),,451350,2몰,
97903310,BIOSTAR A620MS-E 제이씨현,,93470,127몰,
97903817,MSI MPG B850I 엣지 TI WIFI (중고),,334350,2몰,
97903919,MSI MPG X670E 카본 WiFi (중고),,519200,2몰,
97904327,GIGABYTE B850M AORUS ELITE WIFI6E ICE 제이씨현 (중고),,232040,2몰,
97904522,MSI PRO B760M-A WIFI (중고),,109000,3몰,
98184140,ADVANTECH ASMB-807-00A1,,1080160,70몰,
98227940,GIGABYTE X870E AORUS MASTER X3D ICE 제이씨현,,839000,6몰,
98229074,GIGABYTE X870E AORUS PRO X3D ICE 제이씨현,,641930,89몰,
98415254,ASRock X870 Taichi Creator 에즈윈,,619490,100몰,
98415419,ASRock B860M Pro-A 에즈윈,,169440,110몰,
98543660,GIGABYTE X870E AORUS PRO X3D ICE 피씨디렉트,,604050,154몰,
98544125,ASUS ROG STRIX X870E-H GAMING WIFI7 대원씨티에스,,626000,1몰,
98544692,MSI PRO B850M-P,,170050,159몰,
98613731,GIGABYTE X870E AORUS MASTER X3D ICE 피씨디렉트,,771400,29몰,
98925365,ASRock X870 Pro-A WiFi 대원씨티에스,,292420,107몰,
99054896,ASRock B850 Challenger WiFi 7 White 디앤디컴,,248970,128몰,
99125546,ECS H610H7-TI5 D5 V2.2 코잇,어댑터 미포함,170650,85몰,
99125693,ECS H610H7-TI5 D5 V2.2 코잇,120W 어댑터 포함,195800,84몰,
99125729,ECS H610H7-TI5 D5 V2.2 코잇,150W 어댑터 포함,205360,86몰,
99288923,ASUS TUF Gaming X870E-PLUS WIFI7 대원씨티에스,,413000,65몰,
99640991,타무즈 B760M-ID5 (벌크),,103840,82몰,
99714806,ASRock B760M-X Gen5 에즈윈 (벌크),,123900,98몰,
99714830,ASRock H610M-X D5 Gen5 에즈윈 (벌크),,108660,85몰,
99714851,ASRock H610M-HDV/M.2 D5 Gen5 에즈윈,,98110,131몰,
99733238,ASUS PRIME B760M-A II 코잇,,153950,101몰,
99746582,GIGABYTE B850 EAGLE ICE 제이씨현,,235490,156몰,
99746822,GIGABYTE B850M AORUS ELITE WIFI7 ICE-P 제이씨현,,263990,30몰,
99893756,ASUS TUF Gaming B650EM-E WIFI 인텍앤컴퍼니,,182430,96몰,
99894263,ASUS TUF Gaming B850M-PLUS WIFI7 인텍앤컴퍼니,,261760,109몰,
99913676,ASUS PRO WS B850M-ACE SE STCOM,,604290,6몰,
99945386,GIGABYTE B850M AORUS ELITE WIFI7 ICE-P 피씨디렉트,,262540,123몰,
99948020,ADVANTECH ASMB-927T2-00A1 아이보라,,2077590,60몰,
100192175,MSI PRO A620AM-B EVO,,94400,159몰,
100192475,GIGABYTE B850 EAGLE ICE 피씨디렉트,,233870,120몰,
100383200,ASRock B850 Challenger WiFi 7 White 에즈윈,,268660,123몰,
100691990,ASUS PRIME H810M-E 코잇,,112000,106몰,
100698416,ASUS PRIME B860M-A WIFI-CSM 코잇,,209810,105몰,
101069660,ASRock H610M-X D5 Gen5 디앤디컴,,115460,135몰,
101069831,ASRock H610M-HDV/M.2 D5 Gen5 디앤디컴,,98590,133몰,
101073890,ADVANTECH ASMB-816-00A1,,1061000,53몰,
101074490,ASRock H610M-X D5 Gen5 디앤디컴 (벌크),,114200,80몰,
101074493,ASRock H610M-HDV/M.2 D5 Gen5 디앤디컴 (벌크),,98160,87몰,
101184890,ASUS PRIME B850M-A-CSM 인텍앤컴퍼니,,194060,85몰,
101184935,ASUS TUF Gaming B850M-PLUS WIFI7 W 인텍앤컴퍼니,,271000,104몰,
101956625,액슬 MBAIH310 R2 에즈윈,,88610,83몰,
102004853,ASUS PRIME B650EM-A 인텍앤컴퍼니,,134980,24몰,
102004859,MAXSUN 챌린저 H810M 2.5G 디앤디컴,,123990,105몰,
102004862,MAXSUN 챌린저 H810ITX WIFI 디앤디컴,,211500,91몰,
102412694,ASRock B860M-X Gen5 디앤디컴,,162490,119몰,
102412697,ASRock B860M Pro-A 디앤디컴,,177880,116몰,
102621374,ASUS TUF Gaming B860M-PLUS 코잇,,245690,67몰,
103130498,MAXSUN 챌린저 H810M-F 디앤디컴,,95050,79몰,
103182476,ASUS ROG STRIX B850-G GAMING WIFI 인텍앤컴퍼니,,397220,6몰,
103183034,ASUS TUF Gaming X870E-PLUS WIFI7 인텍앤컴퍼니,,408770,69몰,
103187819,ASRock H610TM-ITX 에즈윈 (벌크),,167350,86몰,
103187837,ASRock H610TM-ITX 에즈윈,120W 어댑터 포함,208990,3몰,
103187846,ASRock H610TM-ITX 에즈윈,180W 어댑터 포함,212370,4몰,
103188215,ASUS TUF Gaming B850M-PLUS II 인텍앤컴퍼니,,236730,100몰,
103188218,ASUS B850M MAX GAMING WIFI 인텍앤컴퍼니,,191990,96몰,
103414754,ASUS Pro H810T-CSM,어댑터 미포함,176530,4몰,
103414778,ASUS Pro H810T-CSM,120W 어댑터 포함,212370,4몰,
103414784,ASUS Pro H810T-CSM,180W 어댑터 포함,221890,4몰,
103415738,ASRock H610M-X D5 Gen5 에즈윈,,112200,82몰,
103415765,ASRock B860M-X Gen5 에즈윈 (벌크),,144780,96몰,
103415894,ADVANTECH ASMB-818I-00A1,,1224880,60몰,
103452395,MAXSUN e스포츠 B850M WIFI ICE 디앤디컴,,159000,101몰,
103694657,BIOSTAR H610MT-E D5 제이씨현,,83900,109몰,
103750595,ASRock X870 Taichi Creator 대원씨티에스,,584560,43몰,
103877579,ASRock H810TM-ITX 에즈윈 (벌크),어댑터 미포함,173840,89몰,
104325440,MSI MAG X870E 토마호크 맥스 WIFI PZ,,524630,116몰,
104554913,ASUS ROG CROSSHAIR X870E DARK HERO STCOM,,1099000,27몰,
104595728,ASRock H610M-X D5 Gen5 대원씨티에스,,98580,95몰,
104616128,ASUS PRIME H810M-K 인텍앤컴퍼니,,112980,100몰,
104628878,ASRock B860M-X Gen5 인텍앤컴퍼니,,166110,94몰,
104966219,ASRock H810M-X Gen5 에즈윈,,128980,109몰,
104966246,ASRock B860M-X Gen5 에즈윈,,163430,105몰,
104966306,GIGABYTE X870 AORUS STEALTH 피씨디렉트,,454970,103몰,
104966336,GIGABYTE B850 AORUS STEALTH 피씨디렉트,,382190,98몰,
104989463,ASUS ROG CROSSHAIR X870E DARK HERO 대원씨티에스,,1033960,92몰,
104989499,ASUS PRIME H810M-K STCOM,,124000,102몰,
104989559,ASUS PRIME A620AM-A STCOM,,121000,90몰,
105184787,ASRock H810M-X Gen5 인텍앤컴퍼니,,134000,91몰,
105813494,GIGABYTE B760M AORUS ELITE D4 GEN5 피씨디렉트,,183100,94몰,
105817802,GIGABYTE B760M AORUS ELITE D4 GEN5 제이씨현,,184960,127몰,
105968849,ASUS PRIME B550M-K ARGB 대원씨티에스,,108890,92몰,
105968858,ASUS PRIME B550M-K ARGB STCOM,,119000,95몰,
105968915,GIGABYTE B760M DS3H WIFI6E D4 GEN5 피씨디렉트,,165800,120몰,
105969083,ASRock H810M-HDVP 디앤디컴,,133100,118몰,
105969161,MSI PRO H810M-C EX,,134990,132몰,
105969170,ASRock Rack SPC741D8UD-2T/X550 명인일렉트로닉스,,1319890,36몰,
106044725,GIGABYTE B760M DS3H D4 GEN5 제이씨현,,144990,141몰,
106045001,GIGABYTE H810M H GEN5 피씨디렉트,,119390,112몰,
106045718,GIGABYTE H810M K GEN5 피씨디렉트,,110960,110몰,
106047329,GIGABYTE B760M DS3H WIFI6E D4 GEN5 제이씨현,,162980,111몰,
106220351,ASRock H810M-P Gen5 에즈윈,,105900,92몰,
106454201,GIGABYTE H810M D2HX SI GEN5 제이씨현,,126890,114몰,
106465508,GIGABYTE A620M H 피씨디렉트,,101060,89몰,
106688174,GIGABYTE H810M S2H GEN5 피씨디렉트,,130990,107몰,
106689341,ASRock H810M-P Gen5 디앤디컴,,111290,109몰,
106689347,ASRock H810M-P Gen5 디앤디컴 (벌크),,108340,89몰,
106689353,ASRock H810M-X Gen5 디앤디컴,,133900,110몰,
106689356,ASRock H810M-X Gen5 디앤디컴 (벌크),,132000,82몰,
106695713,GIGABYTE B850M AORUS PRO WIFI7 피씨디렉트,,267990,114몰,
106703318,ASUS PRIME A620AM-K 대원씨티에스,,98000,109몰,
106703432,ASUS PRIME A620AM-A 대원씨티에스,,101800,86몰,
106704263,GIGABYTE B850M FORCE V2 피씨디렉트,,164970,63몰,
106708949,ASUS PRIME B760M-A D4 코잇,,146820,85몰,
106709246,ASRock H810M-P Gen5 + WiFi6E 랜카드 패키지 디앤디컴,,136950,98몰,
106710032,ASRock H810M-X Gen5 + WiFi6E 랜카드 패키지 디앤디컴,,157500,95몰,
106717493,ASRock B850 Rock WiFi 7 에즈윈,,227050,106몰,
106717577,ASRock B850M Rock WiFi 에즈윈,,189050,102몰,
106717613,ASRock B760M Pro-A 에즈윈 (벌크),,134460,82몰,
106717637,ASRock H810M-HDVP 에즈윈 (벌크),,132050,88몰,
106727312,GIGABYTE B850M AORUS PRO WIFI7 제이씨현,,266500,132몰,
106728086,ASRock B860 Rock WiFi 7 에즈윈,,222090,106몰,
106728191,ASRock B860M Rock WiFi 에즈윈,,190620,103몰,
106728485,ASRock B850M Challenger WiFi 7 White 에즈윈,,242250,100몰,
106729391,ASRock H810M-X Gen5 + WiFi7 랜카드 패키지 디앤디컴,,178000,92몰,
106729403,ASRock H810M-P Gen5 + WiFi7 랜카드 패키지 디앤디컴,,158500,90몰,
106735550,GIGABYTE H810M D2HX SI GEN5 피씨디렉트,,126890,109몰,
106746197,ASRock H810M-P Gen5 인텍앤컴퍼니,,100000,74몰,
106746452,ASUS TUF Gaming X870-PRO WIFI7 W NEO 대원씨티에스,,407840,4몰,
106748744,ASRock B860 Rock WiFi 7 디앤디컴,,219890,110몰,
106749107,ASRock B760M Pro-A/D4 디앤디컴,,133910,109몰,
106764977,GIGABYTE X870E AORUS ELITE X3D 피씨디렉트,,436940,109몰,
106765016,GIGABYTE X870E AORUS ELITE X3D ICE 피씨디렉트,,445490,108몰,
106767464,GIGABYTE X870E AORUS ELITE X3D ICE 제이씨현,,448950,129몰,
106784549,COLORFUL BATTLE-AX B850M-T WIFI V14 도우정보,,165000,100몰,
106784699,COLORFUL BATTLE-AX B650M-E PRO V14 도우정보,,116000,115몰,
106785044,COLORFUL BATTLE-AX A520M-K M.2 V14 도우정보,,68000,114몰,
