75724184,ASRock B850M Pro-A 디앤디컴,,180870,166몰,
75856148,GIGABYTE W790 AI TOP 피씨디렉트,,1499000,2몰,
75856643,ASRock B860M Pro-A 인텍앤컴퍼니,,180980,31몰,
75857021,MSI MAG X870E 토마호크 WIFI,,488930,171몰,
75935612,ASRock B860M Pro RS WiFi 디앤디컴,,214930,91몰,
75935651,ASRock B860 Pro RS WiFi 디앤디컴,,251370,142몰,
75935675,ASRock B860M 스틸레전드 WiFi 디앤디컴,,261800,137몰,
75935729,ASRock B860I WiFi 디앤디컴,,281330,132몰,
75939005,ASRock B850 Pro RS WiFi 대원씨티에스,,250250,116몰,
75988922,GIGABYTE W790 AI TOP 제이씨현,,1623550,3몰,
76463696,ASUS H810M AYW GAMING WIFI STCOM,,151410,124몰,
76463777,ASUS H810M AYW GAMING WIFI-CSM STCOM,,160130,124몰,
76509641,ASRock B650M Pro X3D 에즈윈,,150940,198몰,
76554605,MAXSUN 터미네이터 B550M 디앤디컴,,98970,102몰,
76941716,GIGABYTE H810M S2H 제이씨현,,132790,176몰,
76941815,GIGABYTE H810M H 제이씨현,,120250,160몰,
76941983,GIGABYTE H810M K 제이씨현,,113920,188몰,
76942061,GIGABYTE H810M H 피씨디렉트,,115280,129몰,
76942073,GIGABYTE H810M K 피씨디렉트,,114650,126몰,
76942094,GIGABYTE H810M S2H 피씨디렉트,,131150,94몰,
76944080,ASUS ROG STRIX B850-F GAMING WIFI 인텍앤컴퍼니,,438990,10몰,
76946525,ASUS ROG STRIX B850-I GAMING WIFI 인텍앤컴퍼니,,425970,11몰,
76948274,MAXSUN 챌린저 A620A 2.5G 디앤디컴,,100710,85몰,
76948292,MAXSUN e스포츠 B650ITX WIFI ICE 디앤디컴,,181720,92몰,
77083181,ASUS PRIME H810M-A 코잇,,128390,132몰,
77083238,ASUS PRIME H810M-A WIFI 코잇,,148400,109몰,
77083265,ASUS H810M AYW GAMING WIFI 코잇,,157360,123몰,
77278676,ASRock B850I Lightning WiFi 대원씨티에스,,333050,105몰,
77278823,COLORFUL CH310M-F M.2 V20 STCOM,,90500,79몰,
77278937,ASRock B850 스틸레전드 WiFi 에즈윈,,307100,61몰,
77283125,MAXSUN 아이크레프트 Z890 아크틱 디앤디컴,,467990,86몰,
77313929,MAXSUN 챌린저 B760ITX D5 디앤디컴,,193050,85몰,
77319245,MAXSUN 터미네이터 Z890-A WIFI 디앤디컴,,252830,99몰,
77382695,ASUS PRO WS Z890-ACE SE STCOM,,859980,107몰,
77459585,NZXT N7 Z890 Black,,999000,1몰,
77459705,NZXT N7 Z890 White,,999000,1몰,
77460638,NZXT N9 Z890 Black,,696150,40몰,
77460707,NZXT N9 Z890 White,,696150,40몰,
77460818,GIGABYTE B850M DS3H ICE 제이씨현,,179940,203몰,
77460890,ASUS ROG STRIX B850-E GAMING WIFI 인텍앤컴퍼니,,476860,99몰,
77460911,ASUS TUF Gaming B850-PLUS WIFI 인텍앤컴퍼니,,325080,103몰,
77460956,ASUS ROG CROSSHAIR X870E HERO 인텍앤컴퍼니,,961000,5몰,
77460980,ASUS ROG STRIX X870-A GAMING WIFI 인텍앤컴퍼니,,496140,118몰,
77618858,ASUS ROG STRIX B850-E GAMING WIFI STCOM,,533920,129몰,
77620880,GIGABYTE B850M DS3H ICE 피씨디렉트,,177100,172몰,
77704688,ASRock B850M 스틸레전드 WiFi 대원씨티에스,,240910,121몰,
77705072,ASRock B850M Riptide WiFi 대원씨티에스,,250070,126몰,
77706647,ASRock B650M Pro X3D 대원씨티에스,,146020,160몰,
77706989,ASRock A520M-HVS 대원씨티에스,,61290,117몰,
77784170,ASRock W790 WS R2.0 에즈윈,,1196000,7몰,
77786621,ASRock B650M Pro X3D WiFi 디앤디컴,,169090,169몰,
77786816,ASRock B650M Pro X3D 디앤디컴,,150180,153몰,
77791190,GIGABYTE X870I AORUS PRO ICE 피씨디렉트,,501040,123몰,
77856971,GIGABYTE B850I AORUS PRO 피씨디렉트,,338430,134몰,
78099548,ASUS ROG STRIX B850-A GAMING WIFI 인텍앤컴퍼니,,396640,14몰,
78102320,BIOSTAR B850MT-E PRO 제이씨현,,147500,144몰,
78102458,ASRock Z890 Pro-A WiFi 디앤디컴,,318860,109몰,
78102476,ASRock B850M 스틸레전드 WiFi 디앤디컴,,238190,151몰,
78307601,ASRock B860M-X 디앤디컴,,176450,10몰,
78307670,ASRock H810M-X WIFI 디앤디컴,,144390,132몰,
78307739,ASRock H810M-X 디앤디컴,,140630,129몰,
78312209,ASRock H810M-X 디앤디컴 (벌크),,136040,89몰,
78534680,ASRock B850M Pro RS + WiFi6E 모듈 패키지 디앤디컴,,258730,89몰,
78843671,GIGABYTE B850M AORUS ELITE WIFI6E 제이씨현,,236850,211몰,
78977822,ASRock H810M-X 인텍앤컴퍼니,,135900,21몰,
78990293,ASRock B850 Pro-A WiFi 에즈윈,,228990,157몰,
79000790,GIGABYTE B850M AORUS ELITE WIFI6E 피씨디렉트,,235070,172몰,
79397648,MSI MAG B850M 박격포 WIFI,,262900,219몰,
79402439,GIGABYTE X870I AORUS PRO ICE 제이씨현,,507550,149몰,
79410686,ASRock X870 Pro RS WiFi 디앤디컴,,304620,141몰,
79410761,ASRock B850 Pro-A WiFi 디앤디컴,,229910,140몰,
79553249,ASRock B850M Pro-A WiFi 디앤디컴,,188930,153몰,
79553456,ASRock B850M-X R2.0 디앤디컴,,158700,126몰,
79556738,ASRock B850M-X R2.0 대원씨티에스,,164130,99몰,
79556987,NZXT N7 Z790 White,,278490,19몰,
79559189,ASRock H610M-H2/M.2 D4 인텍앤컴퍼니,,94300,3몰,
82093181,ASRock B850M-X R2.0 에즈윈,,164100,164몰,
82470941,ASRock B860 Pro-A WiFi 에즈윈,,250270,153몰,
89861528,COLORFUL CVN X870 ARK FROZEN V14 STCOM,,344940,90몰,
90271250,GIGABYTE B760M AORUS ELITE GEN5 제이씨현,,180990,164몰,
90502931,GIGABYTE B760M AORUS ELITE GEN5 피씨디렉트,,180970,133몰,
90506507,ASRock A620AM-X 디앤디컴,,119420,132몰,
90643316,ASRock H610M-HDVP/D5 R2.0 인텍앤컴퍼니 (벌크),,102730,84몰,
90643517,ASRock Z790 PG Lightning D5 인텍앤컴퍼니,,333000,2몰,
90957212,NZXT N9 X870E Black,,814200,2몰,
90957218,NZXT N9 X870E White,,814200,2몰,
91493696,MSI MAG B850M 박격포,,243400,195몰,
91870847,GIGABYTE MX34-BS0,,593000,3몰,
91871951,GIGABYTE B760M DS3H GEN5 제이씨현,,137700,185몰,
91872095,GIGABYTE B760M DS3H GEN5 피씨디렉트,,138280,165몰,
92043230,MAXSUN e스포츠 B850ITX WIFI ICE 디앤디컴,,195720,83몰,
92108180,ASRock A620AM-HVS 대원씨티에스,,97580,132몰,
92149667,ASRock A620AM-HVS 디앤디컴,,98970,130몰,
92357948,ASUS WS C422 PRO/SE,,1499000,3몰,
92360492,ASRock B860 Pro-A 에즈윈,,231020,122몰,
92360591,ASRock A620AM-HVS 에즈윈,,98060,145몰,
92678384,타무즈 H610M-ID4,,77730,47몰,
92678408,타무즈 H610M-ID5,,77880,78몰,
92678840,ASUS TUF Gaming B850-BTF WIFI W 인텍앤컴퍼니,,409550,81몰,
92687522,ASUS PRO WS W880-ACE SE STCOM,,763980,91몰,
92971409,ASRock H810M-H 인텍앤컴퍼니,,130210,11몰,
92971469,ASUS ROG CROSSHAIR X870E APEX STCOM,,1016100,109몰,
93018986,ASUS ROG CROSSHAIR X870E EXTREME STCOM,,1441560,117몰,
93019088,ASUS ROG CROSSHAIR X870E APEX 대원씨티에스,,960510,118몰,
93022388,ASUS TUF Gaming B850-BTF WIFI W 대원씨티에스,,393950,10몰,
93022430,ASUS ROG CROSSHAIR X870E EXTREME 대원씨티에스,,1460890,25몰,
93022751,ASUS PRIME B850M-A-CSM 대원씨티에스,,209000,118몰,
93071258,ASUS B850M MAX GAMING WIFI 대원씨티에스,,187410,115몰,
93073223,GIGABYTE X870 AORUS STEALTH ICE 제이씨현,,447970,15몰,
93073367,GIGABYTE X870 AORUS STEALTH ICE 피씨디렉트,,442030,103몰,
93317309,ASRock B650M Pro X3D WiFi 에즈윈,,169840,162몰,
93442604,GIGABYTE B850 AORUS STEALTH ICE 피씨디렉트,,374620,97몰,
93500939,GIGABYTE B850 AORUS STEALTH ICE 제이씨현,,378990,145몰,
93502442,MSI PRO B850M-A WIFI,,194470,155몰,
93702833,ASRock B650M Pro X3D WiFi 대원씨티에스,,171560,110몰,
93703418,ASUS TUF Gaming B650EM-E WIFI 대원씨티에스,,188980,138몰,
93803822,ASRock B850M Pro RS WiFi WHITE 디앤디컴,,224500,127몰,
93804581,ASRock B850M Pro Plus WiFi 디앤디컴,,231940,118몰,
94028396,ASRock B850M Pro RS WiFi WHITE 대원씨티에스,,214550,96몰,
94080773,GIGABYTE B650M K 제이씨현 (벌크),,125000,78몰,
94080806,GIGABYTE H610M K V2 제이씨현 (벌크),,83940,16몰,
94081583,ASRock A620AM-X + WiFi6E 랜카드 패키지 디앤디컴,,168300,17몰,
94081679,ASRock A620AM-HVS + WiFi6E 랜카드 패키지 디앤디컴,,137180,74몰,
94129904,COLORFUL BATTLE-AX B850M-PLUS PRO WIFI V14 STCOM,,187920,90몰,
94815752,ASUS ROG STRIX B850-G GAMING WIFI 대원씨티에스,,340360,112몰,
94888226,GIGABYTE B760M D2HX LITE SI GEN5 피씨디렉트 (벌크),,137040,61몰,
95200499,GIGABYTE B850M FORCE 피씨디렉트,,165140,147몰,
95280263,GIGABYTE B850M FORCE 제이씨현,,173040,181몰,
95420366,ASUS B850M MAX GAMING WIFI STCOM,,198960,111몰,
95420465,ASUS ROG STRIX B850-G GAMING WIFI STCOM,,344090,84몰,
95420537,ASUS PRIME B850M-A-CSM STCOM,,215990,10몰,
95421218,ASUS TUF Gaming B650EM-E WIFI STCOM,,186350,87몰,
95930900,BIOSTAR B850MT2-E DJ 제이씨현,,132050,128몰,
95988443,ASUS TUF Gaming B850M-E WIFI STCOM,,237590,93몰,
95988578,ASUS TUF Gaming B850M-PLUS II STCOM,,245630,137몰,
95988710,ASUS TUF Gaming B850M-PLUS WIFI7 STCOM,,267930,158몰,
95988944,ASUS TUF Gaming B850M-PLUS WIFI7 W STCOM,,282880,160몰,
96059018,ASUS P13R-E,,799000,1몰,
96259139,ASUS PRO WS TRX50-SAGE WiFi A 아이보라,,1426940,52몰,
96366245,ADVANTECH ASMB-925-00A1,,1122530,57몰,
96426692,ASUS Pro H610T-CSM D5 코잇 (벌크),120W 어댑터 포함,201590,4몰,
96426704,ASUS Pro H610T-CSM D5 코잇 (벌크),어댑터 미포함,172990,3몰,
96656717,ASUS TUF Gaming B850-BTF WIFI W STCOM,,408760,106몰,
96711170,ASUS PRIME Z890-P WIFI-CSM STCOM (중고),,333200,3몰,
96712895,ASUS PRIME B650EM-A STCOM,,158870,99몰,
96776582,ASRock H610M-H2/M.2 D5 에즈윈,,89670,128몰,
96981164,NZXT N7 B850 Black,,434980,23몰,
96981215,NZXT N7 B850 White,,434980,23몰,
97118543,ASUS TUF Gaming B850M-PLUS WIFI7 대원씨티에스,,271390,45몰,
97119116,ASUS TUF Gaming B850M-PLUS II 대원씨티에스,,245680,124몰,
97119959,ASUS PRIME B650EM-A 대원씨티에스,,151240,32몰,
97120361,ASUS TUF Gaming B850M-PLUS WIFI7 W 대원씨티에스,,275280,149몰,
97121303,ASUS TUF Gaming B850M-E WIFI 대원씨티에스,,226290,111몰,
97121510,MSI MPG B850I 엣지 TI WIFI,,374880,132몰,
97121798,MSI PRO H810M-B,,133240,156몰,
97224935,ASRock X870 Pro-A WiFi 디앤디컴,,308170,96몰,
97475957,ASUS TUF Gaming X870E-PLUS WIFI7 STCOM,,415440,93몰,
97476215,ASUS ROG STRIX X870E-H GAMING WIFI7 STCOM,,478970,104몰,
97476398,ASUS ROG CROSSHAIR X870E HERO BTF STCOM,,1079690,116몰,
97565858,ASRock A620AI WiFi 대원씨티에스,,226990,103몰,
97702355,ASRock B850 Challenger WiFi 7 White 대원씨티에스,,255490,75몰,
97702418,ASRock B850 Challenger WiFi 7 대원씨티에스,,250800,15몰,
97705844,ASUS ROG CROSSHAIR X870E HERO BTF 대원씨티에스,,1048900,6몰,
97837412,MSI PRO H610M-E DDR5,,91390,134몰,
97848539,MSI MAG B850M 박격포 WIFI (중고),,244350,1몰,
97903310,BIOSTAR A620MS-E 제이씨현,,93080,116몰,
97903817,MSI MPG B850I 엣지 TI WIFI (중고),,334350,2몰,
97903919,MSI MPG X670E 카본 WiFi (중고),,519200,1몰,
97904378,ASUS ROG STRIX B650E-I GAMING WIFI STCOM (중고),,382500,1몰,
97904522,MSI PRO B760M-A WIFI (중고),,129200,3몰,
98184140,ADVANTECH ASMB-807-00A1,,1080170,63몰,
98227940,GIGABYTE X870E AORUS MASTER X3D ICE 제이씨현,,833430,108몰,
98229074,GIGABYTE X870E AORUS PRO X3D ICE 제이씨현,,618970,127몰,
98415254,ASRock X870 Taichi Creator 에즈윈,,575180,17몰,
98543660,GIGABYTE X870E AORUS PRO X3D ICE 피씨디렉트,,596320,122몰,
98544125,ASUS ROG STRIX X870E-H GAMING WIFI7 대원씨티에스,,465190,92몰,
98544692,MSI PRO B850M-P,,179550,104몰,
98613731,GIGABYTE X870E AORUS MASTER X3D ICE 피씨디렉트,,772900,1몰,
98925365,ASRock X870 Pro-A WiFi 대원씨티에스,,286780,69몰,
99054896,ASRock B850 Challenger WiFi 7 White 디앤디컴,,258770,96몰,
99125546,ECS H610H7-TI5 D5 V2.2 코잇,어댑터 미포함,172980,68몰,
99125693,ECS H610H7-TI5 D5 V2.2 코잇,120W 어댑터 포함,195880,66몰,
99125729,ECS H610H7-TI5 D5 V2.2 코잇,150W 어댑터 포함,205980,69몰,
99288923,ASUS TUF Gaming X870E-PLUS WIFI7 대원씨티에스,,405670,96몰,
99640991,타무즈 B760M-ID5 (벌크),,107790,70몰,
99714806,ASRock B760M-X Gen5 에즈윈 (벌크),,142680,71몰,
99714830,ASRock H610M-X D5 Gen5 에즈윈 (벌크),,110740,71몰,
99714851,ASRock H610M-HDV/M.2 D5 Gen5 에즈윈,,97110,114몰,
99733238,ASUS PRIME B760M-A II 코잇,,153130,103몰,
99746582,GIGABYTE B850 EAGLE ICE 제이씨현,,231010,131몰,
99746822,GIGABYTE B850M AORUS ELITE WIFI7 ICE-P 제이씨현,,253520,133몰,
99893756,ASUS TUF Gaming B650EM-E WIFI 인텍앤컴퍼니,,192130,70몰,
99894263,ASUS TUF Gaming B850M-PLUS WIFI7 인텍앤컴퍼니,,269460,88몰,
99913676,ASUS PRO WS B850M-ACE SE STCOM,,632210,69몰,
99945386,GIGABYTE B850M AORUS ELITE WIFI7 ICE-P 피씨디렉트,,255730,110몰,
99948020,ADVANTECH ASMB-927T2-0A1,,2075630,53몰,
100192175,MSI PRO A620AM-B EVO,,100830,109몰,
100192475,GIGABYTE B850 EAGLE ICE 피씨디렉트,,227670,106몰,
100383200,ASRock B850 Challenger WiFi 7 White 에즈윈,,268470,90몰,
100691990,ASUS PRIME H810M-E 코잇,,119750,92몰,
100698416,ASUS PRIME B860M-A WIFI-CSM 코잇,,223440,92몰,
101069660,ASRock H610M-X D5 Gen5 디앤디컴,,114380,104몰,
101069831,ASRock H610M-HDV/M.2 D5 Gen5 디앤디컴,,95770,104몰,
101073890,ADVANTECH ASMB-816-00A1,,1041000,42몰,
101074490,ASRock H610M-X D5 Gen5 디앤디컴 (벌크),,113590,52몰,
101074493,ASRock H610M-HDV/M.2 D5 Gen5 디앤디컴 (벌크),,99030,57몰,
101184890,ASUS PRIME B850M-A-CSM 인텍앤컴퍼니,,176050,73몰,
101184935,ASUS TUF Gaming B850M-PLUS WIFI7 W 인텍앤컴퍼니,,275860,73몰,
101956625,액슬 MBAIH310 R2 에즈윈,,88640,52몰,
102004853,ASUS PRIME B650EM-A 인텍앤컴퍼니,,151950,84몰,
102004859,MAXSUN 챌린저 H810M 2.5G 디앤디컴,,132280,77몰,
102004862,MAXSUN 챌린저 H810ITX WIFI 디앤디컴,,211660,73몰,
102412694,ASRock B860M-X Gen5 디앤디컴,,172240,86몰,
102412697,ASRock B860M Pro-A 디앤디컴,,176910,92몰,
102553601,GIGABYTE B650EM DS3H WIFI6E 피씨디렉트,,148190,76몰,
102621374,ASUS TUF Gaming B860M-PLUS 코잇,,245680,54몰,
103130498,MAXSUN 챌린저 H810M-F 디앤디컴,,115190,56몰,
103182476,ASUS ROG STRIX B850-G GAMING WIFI 인텍앤컴퍼니,,342900,64몰,
103183034,ASUS TUF Gaming X870E-PLUS WIFI7 인텍앤컴퍼니,,409280,54몰,
103187819,ASRock H610TM-ITX 에즈윈 (벌크),,170990,49몰,
103187837,ASRock H610TM-ITX 에즈윈,120W 어댑터 포함,가격비교예정,0몰,
103187846,ASRock H610TM-ITX 에즈윈,180W 어댑터 포함,가격비교예정,0몰,
103188215,ASUS TUF Gaming B850M-PLUS II 인텍앤컴퍼니,,246100,71몰,
103188218,ASUS B850M MAX GAMING WIFI 인텍앤컴퍼니,,191940,73몰,
103414754,ASUS Pro H810T-CSM,어댑터 미포함,182370,4몰,
103414778,ASUS Pro H810T-CSM,120W 어댑터 포함,213090,4몰,
103414784,ASUS Pro H810T-CSM,180W 어댑터 포함,222590,4몰,
103415738,ASRock H610M-X D5 Gen5 에즈윈,,가격비교예정,0몰,
103415765,ASRock B860M-X Gen5 에즈윈 (벌크),,176990,53몰,
103415894,ADVANTECH ASMB-818I-00A1,,1228430,39몰,
103452395,MAXSUN e스포츠 B850M WIFI ICE 디앤디컴,,166160,59몰,
103483241,GIGABYTE B650EM DS3H WIFI6E 제이씨현,,155230,74몰,
103694657,BIOSTAR H610MT-E D5 제이씨현,,87870,41몰,
103750595,ASRock X870 Taichi Creator 대원씨티에스,,584570,28몰,
103877579,ASRock H810TM-ITX 에즈윈 (벌크),,181080,56몰,
104325440,MSI MAG X870E 토마호크 맥스 WIFI PZ,,가격비교예정,0몰,
104374862,MSI PRO B860M-C EX,,가격비교예정,0몰,
104554913,ASUS ROG CROSSHAIR X870E DARK HERO STCOM,,1077670,53몰,
104555231,ASUS ROG CROSSHAIR X870E GLACIAL STCOM,,일시품절,0몰,
104595728,ASRock H610M-X D5 Gen5 대원씨티에스,,가격비교예정,0몰,
104616128,ASUS PRIME H810M-K 인텍앤컴퍼니,,126030,16몰,
104628878,ASRock B860M-X Gen5 인텍앤컴퍼니,,가격비교예정,0몰,
