67852766,ASUS ROG STRIX X870E-E GAMING WIFI 대원씨티에스,,837670,17몰,
67852793,ASUS ROG STRIX X870-F GAMING WIFI 대원씨티에스,,720800,107몰,
67852838,ASUS TUF Gaming X870-PLUS WIFI 대원씨티에스,,488980,119몰,
67852946,ASUS ROG STRIX X870-I GAMING WIFI 대원씨티에스,,748710,80몰,
67852967,ASRock X870E Nova WiFi 에즈윈,,666730,104몰,
67976948,ASUS ROG STRIX X870-I GAMING WIFI STCOM,,738750,82몰,
68242061,ASRock X870 스틸레전드 WiFi 대원씨티에스,,472600,92몰,
68242124,ASRock X870 Pro RS WiFi 대원씨티에스,,450260,1몰,
68242145,ASRock X870 Pro RS 대원씨티에스,,362790,109몰,
68246816,ASRock X870E Taichi 대원씨티에스,,814990,82몰,
68440085,ASRock X870E Taichi 디앤디컴,,835940,100몰,
68440103,ASRock X870 스틸레전드 WiFi 디앤디컴,,474100,88몰,
68687615,ASRock Z890 Pro RS 에즈윈,,374990,121몰,
68687816,ASRock Z890 Pro RS WiFi White 에즈윈,,414990,116몰,
68776211,ASRock Z890 Taichi 에즈윈,,838990,104몰,
68919209,ASRock Z890 Pro-A 에즈윈,,356990,112몰,
69053765,ASRock Z890 Pro-A WiFi 에즈윈,,368990,102몰,
69468680,ASRock H610M-X D5 인텍앤컴퍼니 (벌크),,121990,80몰,
69468782,ASRock H610M-HVS M.2 R2.0 D4 인텍앤컴퍼니,,87290,128몰,
69468977,ASRock B760M Pro-A 인텍앤컴퍼니,,143870,122몰,
69469049,ASRock B760M Pro RS D5 인텍앤컴퍼니,,184000,75몰,
69471116,ASRock Z890I Nova WiFi 에즈윈,,531990,72몰,
69471320,ASRock Z890 Nova WiFi 에즈윈,,618990,105몰,
69566399,ASUS ROG MAXIMUS Z890 APEX 인텍앤컴퍼니,,825000,112몰,
69566516,ASUS ROG MAXIMUS Z890 EXTREME 인텍앤컴퍼니,,1415300,106몰,
69566996,ASUS ROG MAXIMUS Z890 HERO 인텍앤컴퍼니,,925000,114몰,
69656168,ASUS ROG STRIX Z890-A GAMING WIFI 인텍앤컴퍼니,,538190,112몰,
69656276,ASUS ROG STRIX Z890-E GAMING WIFI 인텍앤컴퍼니,,762620,99몰,
69656426,ASUS ROG STRIX Z890-F GAMING WIFI 인텍앤컴퍼니,,693530,100몰,
69656816,ASUS PRIME Z890-P WIFI-CSM 인텍앤컴퍼니,,367080,115몰,
69656858,ASUS PRIME Z890-P-CSM 인텍앤컴퍼니,,348680,107몰,
69661004,ASUS Z890 AYW GAMING WIFI W 인텍앤컴퍼니,,429000,103몰,
69661214,ASUS ProArt Z890-CREATOR WIFI 인텍앤컴퍼니,,759890,84몰,
69661250,ASUS PRIME Z890-P WIFI-CSM STCOM,,413990,101몰,
69661526,ASUS PRIME Z890-P-CSM STCOM,,378990,106몰,
69661643,ASUS ROG MAXIMUS Z890 APEX STCOM,,999000,93몰,
69661691,ASUS ROG MAXIMUS Z890 EXTREME STCOM,,1497900,124몰,
69661799,ASUS ROG MAXIMUS Z890 HERO STCOM,,998790,117몰,
69662105,ASUS ROG STRIX Z890-E GAMING WIFI STCOM,,798650,105몰,
69662114,ASUS ROG STRIX Z890-F GAMING WIFI STCOM,,728990,106몰,
69662153,ASUS ROG STRIX Z890-I GAMING WIFI STCOM,,799000,76몰,
69662171,ASUS TUF Gaming Z890-PRO WIFI STCOM,,493050,116몰,
69662327,ASUS Z890 AYW GAMING WIFI W STCOM,,437400,100몰,
69696089,ASUS PRIME Z890-P WIFI-CSM 코잇,,398790,76몰,
69696269,ASUS PRIME Z890-P-CSM 코잇,,373360,95몰,
69696464,ASUS PRIME Z890M-PLUS WIFI-CSM 코잇,,369590,88몰,
69696563,ASUS ProArt Z890-CREATOR WIFI 코잇,,785990,87몰,
69696602,ASUS ROG MAXIMUS Z890 APEX 코잇,,973690,92몰,
69696641,ASUS ROG MAXIMUS Z890 EXTREME 코잇,,1478990,96몰,
69696719,ASUS ROG MAXIMUS Z890 HERO 코잇,,979000,95몰,
69696863,ASUS ROG STRIX Z890-E GAMING WIFI 코잇,,764000,93몰,
69696959,ASUS ROG STRIX Z890-F GAMING WIFI 코잇,,702420,93몰,
69697016,ASUS ROG STRIX Z890-I GAMING WIFI 코잇,,736990,78몰,
69697058,ASUS TUF Gaming Z890-PLUS WIFI 코잇,,424790,107몰,
69697280,ASUS Z890 AYW GAMING WIFI W 코잇,,410590,95몰,
69697592,MSI MEG Z890 에이스,,948990,128몰,
69697766,MSI MAG Z890 토마호크 WIFI,,458980,128몰,
69697916,MSI PRO Z890-A WIFI,,388990,130몰,
69698066,MSI MPG Z890 카본 WIFI,,648990,130몰,
69698492,MSI MPG Z890 엣지 TI WIFI,,548990,123몰,
69698594,MSI MEG Z890 유니파이-X,,790680,119몰,
69698756,GIGABYTE Z890 AORUS MASTER 제이씨현,,658990,111몰,
69698870,GIGABYTE Z890 AORUS PRO ICE 제이씨현,,448990,137몰,
69699071,GIGABYTE Z890 AORUS ELITE WIFI7 ICE 제이씨현,,398990,145몰,
69699182,GIGABYTE Z890 AORUS ELITE WIFI7 제이씨현,,388990,143몰,
69699317,GIGABYTE Z890 UD 제이씨현,,328990,136몰,
69699389,GIGABYTE Z890I AORUS ULTRA 제이씨현,,498990,119몰,
69699425,GIGABYTE Z890 UD 피씨디렉트,,324820,114몰,
69699467,GIGABYTE Z890 AORUS MASTER 피씨디렉트,,649620,104몰,
69699584,GIGABYTE Z890 AORUS PRO ICE 피씨디렉트,,426540,113몰,
69699599,GIGABYTE Z890 AORUS ELITE WIFI7 ICE 피씨디렉트,,389120,116몰,
69699671,GIGABYTE Z890 AORUS ELITE WIFI7 피씨디렉트,,385940,113몰,
69699695,GIGABYTE Z890I AORUS ULTRA 피씨디렉트,,498980,70몰,
69699770,ASUS PRIME Z890M-PLUS WIFI-CSM 인텍앤컴퍼니,,378990,7몰,
69867761,ASRock Z890 스틸레전드 WIFI 인텍앤컴퍼니,,415260,109몰,
69867902,ASRock Z890 Taichi 인텍앤컴퍼니,,707450,91몰,
69868301,ASRock Z890 Nova WiFi 인텍앤컴퍼니,,548080,97몰,
69868430,ASRock Z890 LiveMixer WiFi 인텍앤컴퍼니,,385160,116몰,
69868478,ASRock Z890 Pro RS WiFi 인텍앤컴퍼니,,353280,99몰,
69868499,ASRock Z890 Pro-A WiFi 인텍앤컴퍼니,,326720,116몰,
70000382,ASRock Z890 Taichi 디앤디컴,,818980,112몰,
70001147,ASUS ProArt Z890-CREATOR WIFI STCOM,,797890,83몰,
70002455,ASUS PRIME Z890M-PLUS WIFI-CSM STCOM,,378990,86몰,
70006577,ASRock Z890 스틸레전드 WIFI 디앤디컴,,468970,107몰,
70006589,ASRock Z890 Pro RS 디앤디컴,,374980,106몰,
70006610,ASRock Z890 Pro-A 디앤디컴,,324600,113몰,
70101260,ASRock X870 Pro RS WiFi 에즈윈,,398970,94몰,
70769987,ASRock X870E Nova WiFi 대원씨티에스,,649170,57몰,
71007920,ASRock Z890 Lightning WiFi 에즈윈,,478990,99몰,
71010251,ASRock Z890 Pro RS WiFi White 디앤디컴,,410320,103몰,
71216543,MSI PRO Z890-P WIFI,,348990,87몰,
71219006,BIOSTAR X870E VALKYRIE 제이씨현,,602980,5몰,
71426399,ASRock Rack EC262D4U 명인일렉트로닉스,,598340,44몰,
71502050,Supermicro H13SSL-NT R2.0 STCOM,,1357900,55몰,
72227675,GIGABYTE Z890 AORUS XTREME AI TOP 피씨디렉트,,1466830,83몰,
72304610,ASRock B650 스틸레전드 WiFi 대원씨티에스,,323580,72몰,
72757274,ASRock X870E Nova WiFi 디앤디컴,,668970,102몰,
72911912,GIGABYTE Z890 AORUS XTREME AI TOP 제이씨현,,1498990,99몰,
72974786,COLORFUL iGame Z890 ULTRA V20 STCOM,,550500,60몰,
73071959,ASRock Rack SP2C741D16X-2T 명인일렉트로닉스,,1991000,50몰,
73072019,ASRock Rack SP2C741D16-2T 명인일렉트로닉스,,1932700,44몰,
73072130,ASRock Rack SPC741D8-2L2T/BCM 명인일렉트로닉스,,1334400,44몰,
73560548,GIGABYTE X870E AORUS PRO 피씨디렉트,,455980,125몰,
73763492,ASUS TUF Gaming B850-PLUS WIFI 대원씨티에스,,331800,67몰,
73763909,ASUS TUF Gaming B850M-PLUS WIFI 대원씨티에스,,280310,86몰,
73764137,ASUS ROG STRIX B850-A GAMING WIFI 대원씨티에스,,393730,70몰,
73767836,ASUS ROG STRIX B850-E GAMING WIFI 대원씨티에스,,555970,72몰,
73768364,ASUS ROG STRIX B850-I GAMING WIFI 대원씨티에스,,439000,29몰,
73769318,ASUS PRIME B840M-A WIFI-CSM 대원씨티에스,,245980,37몰,
73769342,ASUS PRIME B840M-A-CSM 대원씨티에스,,232090,88몰,
73769357,ASUS PRIME B840-PLUS WIFI-CSM 대원씨티에스,,274600,83몰,
73770173,GIGABYTE X870E AORUS XTREME AI TOP 제이씨현,,1159000,1몰,
73883426,ASUS TUF Gaming B850M-PLUS 대원씨티에스,,274480,85몰,
73883867,ASUS ROG STRIX B850-A GAMING WIFI STCOM,,408980,93몰,
73883918,ASUS ROG STRIX B850-F GAMING WIFI STCOM,,429960,45몰,
73883963,ASUS ROG STRIX B850-I GAMING WIFI STCOM,,438970,98몰,
73884029,ASUS TUF Gaming B850M-PLUS STCOM,,275000,111몰,
73884041,ASUS TUF Gaming B850M-PLUS WIFI STCOM,,283900,120몰,
73884083,ASUS TUF Gaming B850-PLUS WIFI STCOM,,332020,58몰,
73884143,ASUS PRIME B840M-A WIFI-CSM STCOM,,239400,100몰,
73884173,ASUS PRIME B840M-A-CSM STCOM,,221350,102몰,
73884218,ASUS PRIME B840-PLUS WIFI-CSM STCOM,,266950,102몰,
73891739,GIGABYTE B850 AORUS ELITE WIFI7 피씨디렉트,,352640,114몰,
73891778,GIGABYTE B850 AORUS ELITE WIFI7 ICE 피씨디렉트,,361530,117몰,
73892000,GIGABYTE B850M AORUS ELITE WIFI6E ICE 피씨디렉트,,270820,144몰,
73892084,GIGABYTE B850M DS3H 피씨디렉트,,231510,144몰,
73892279,GIGABYTE B850 AORUS ELITE WIFI7 ICE 제이씨현,,368990,134몰,
73892309,GIGABYTE B850 AORUS ELITE WIFI7 제이씨현,,358980,127몰,
73892354,GIGABYTE B850M DS3H 제이씨현,,231280,165몰,
73892423,GIGABYTE B850M AORUS ELITE WIFI6E ICE 제이씨현,,278980,157몰,
73948922,MSI PRO B840-P WIFI,,234250,81몰,
73949189,ASRock X870E Taichi Lite (해외구매),,647190,17몰,
73949327,GIGABYTE X870E AORUS ELITE WIFI7 (해외구매),,481270,38몰,
73952525,ASRock B850 Pro RS 에즈윈,,321020,34몰,
73952591,ASRock B850I Lightning WiFi 에즈윈,,일시품절,0몰,
73952600,ASRock B850 Pro RS WiFi 에즈윈,,339000,1몰,
73952729,ASRock B850M Pro RS 에즈윈,,265350,94몰,
73952732,ASRock B850M Pro RS WiFi 에즈윈,,285592,86몰,
74013710,ASRock B860M Pro RS 에즈윈,,245920,123몰,
74116181,ASRock B860 LiveMixer WiFi 인텍앤컴퍼니,,326720,100몰,
74116334,ASRock B860M LiveMixer WiFi 인텍앤컴퍼니,,264740,110몰,
74116589,ASRock B860 스틸레전드 WiFi 인텍앤컴퍼니,,353280,99몰,
74116682,ASRock B860M 스틸레전드 WiFi 인텍앤컴퍼니,,282450,91몰,
74121977,ASRock B860M Pro RS WiFi 인텍앤컴퍼니,,238170,67몰,
74122352,ASRock B860M-X 인텍앤컴퍼니,,167340,23몰,
74250455,ASRock B850 Pro-A 대원씨티에스,,309000,23몰,
74250557,ASRock B850 Riptide WiFi 대원씨티에스,,409000,60몰,
74250659,ASRock B850M-X 대원씨티에스,,199000,17몰,
74250827,GIGABYTE B860 AORUS ELITE WIFI7 ICE 제이씨현,,318130,135몰,
74250974,GIGABYTE B860M AORUS ELITE WIFI6E ICE 제이씨현,,288610,162몰,
74251187,GIGABYTE B860M AORUS ELITE WIFI6E 제이씨현,,288610,154몰,
74251253,GIGABYTE B860M AORUS ELITE 제이씨현,,248990,131몰,
74251349,GIGABYTE B860M DS3H 제이씨현,,185310,133몰,
74253203,ASUS ROG STRIX B860-I GAMING WIFI STCOM,,420890,100몰,
74253692,ASUS ROG STRIX B860-F GAMING WIFI STCOM,,440990,103몰,
74254586,ASUS ROG STRIX B860-A GAMING WIFI STCOM,,391190,104몰,
74254724,ASUS TUF Gaming B860-PLUS WIFI STCOM,,362590,100몰,
74254814,ASUS TUF Gaming B860M-PLUS WIFI STCOM,,307350,111몰,
74254832,ASUS TUF Gaming B860M-PLUS STCOM,,276690,109몰,
74255033,ASUS PRIME B860M-A WIFI-CSM STCOM,,263990,93몰,
74255060,ASUS PRIME B860M-A-CSM STCOM,,243680,102몰,
74255084,ASUS PRIME B860M-K-CSM STCOM,,188990,100몰,
74255114,ASUS PRIME B860-PLUS-CSM STCOM,,287250,100몰,
74255120,ASUS PRIME B860-PLUS WIFI-CSM STCOM,,304770,96몰,
74255204,ASUS PRIME B860M-A WIFI-CSM 인텍앤컴퍼니,,249744,96몰,
74255321,ASUS PRIME B860M-A-CSM 인텍앤컴퍼니,,212050,93몰,
74255327,ASUS PRIME B860-PLUS WIFI-CSM 인텍앤컴퍼니,,298350,60몰,
74255330,ASUS PRIME B860-PLUS-CSM 인텍앤컴퍼니,,276341,83몰,
74255333,ASUS ROG STRIX B860-A GAMING WIFI 인텍앤컴퍼니,,372361,91몰,
74255336,ASUS ROG STRIX B860-F GAMING WIFI 인텍앤컴퍼니,,419695,103몰,
74255369,ASUS ROG STRIX B860-I GAMING WIFI 인텍앤컴퍼니,,396254,86몰,
74255378,ASUS TUF Gaming B860-PLUS WIFI 인텍앤컴퍼니,,345100,79몰,
74255381,GIGABYTE B860 AORUS ELITE WIFI7 ICE 피씨디렉트,,304860,126몰,
74255384,GIGABYTE B860M AORUS ELITE 피씨디렉트,,234060,117몰,
74255387,GIGABYTE B860M AORUS ELITE WIFI6E ICE 피씨디렉트,,276200,149몰,
74255390,GIGABYTE B860M AORUS ELITE WIFI6E 피씨디렉트,,276200,143몰,
74255393,GIGABYTE B860M DS3H 피씨디렉트,,181090,110몰,
74336033,ASUS PRIME H810M-A STCOM,,138801,68몰,
74336102,ASUS PRIME H810M-A-CSM STCOM,,138801,66몰,
74336888,ASUS PRIME H810M-A WIFI STCOM,,153712,69몰,
74336894,ASUS PRIME H810M-A WIFI-CSM STCOM,,153712,67몰,
74337014,ASUS PRIME B860-PLUS-CSM 코잇,,293450,101몰,
74337680,ASUS PRIME B860M-A-CSM 코잇,,206690,101몰,
74337722,ASUS ROG STRIX B860-A GAMING WIFI 코잇,,393290,99몰,
74338013,ASUS ROG STRIX B860-F GAMING WIFI 코잇,,443090,99몰,
74338115,ASUS ROG STRIX B860-G GAMING WIFI 코잇,,308930,112몰,
74338499,ASUS ROG STRIX B860-I GAMING WIFI 코잇,,423990,92몰,
74338622,ASUS TUF Gaming B860-PLUS WIFI 코잇,,354000,101몰,
74339975,MSI PRO B860M-A WIFI,,258990,141몰,
74340266,MSI MAG B860M 박격포 WIFI,,298980,146몰,
74340455,MSI MAG B860 토마호크 WIFI,,318980,122몰,
74340596,ASRock B850 Pro RS WiFi 디앤디컴,,338970,38몰,
74340710,ASRock B850 스틸레전드 WiFi 디앤디컴,,378980,88몰,
74341163,ASRock B850M Pro-A 에즈윈,,231110,98몰,
74341325,ASRock B850M Pro-A WiFi 에즈윈,,254720,51몰,
74341418,ASRock B850M 스틸레전드 WiFi 에즈윈,,324710,75몰,
74341787,ASRock B850M-X 디앤디컴,,193000,119몰,
74415038,ASRock B860M Pro RS WiFi 에즈윈,,270740,88몰,
74415482,ASRock B860 Pro RS 에즈윈,,270740,89몰,
74415509,ASRock B860 Pro RS WiFi 에즈윈,,295100,91몰,
74422025,ASRock B860M Pro RS 디앤디컴,,243990,117몰,
74491244,ASUS PRIME B840M-A-CSM 인텍앤컴퍼니,,223030,94몰,
74491247,ASUS TUF Gaming B850M-PLUS 인텍앤컴퍼니,,260560,96몰,
74491250,ASUS TUF Gaming B850M-PLUS WIFI 인텍앤컴퍼니,,269570,87몰,
74491253,ASRock B860M-X 에즈윈,,174850,75몰,
74491295,ASRock B860I WiFi 에즈윈,,295110,82몰,
74808266,ASUS ROG STRIX Z890-I GAMING WIFI 인텍앤컴퍼니,,758700,76몰,
74814188,ASUS TUF Gaming X870-PLUS WIFI 인텍앤컴퍼니,,467630,88몰,
74814341,MSI MAG B850 토마호크 맥스 WIFI,,388760,93몰,
74814380,MSI MPG B850 엣지 TI WIFI,,418360,85몰,
74885192,ASRock H810M-X 에즈윈,,154910,75몰,
74885201,ASRock H810M-X 에즈윈 (벌크),,153740,64몰,
75372923,ASUS Z13PE-D16 아이보라,,2169000,1몰,
75372986,ASUS PRO WS X299 SAGE II 아이보라,,1187200,48몰,
75373118,ASUS PRO WS W790E-SAGE SE 아이보라,,2003400,46몰,
75465857,ASUS PRO WS TRX50-SAGE WiFi 아이보라,,1384640,27몰,
75536555,ASUS B860M AYW GAMING WIFI 인텍앤컴퍼니,,180900,93몰,
75538394,ASRock B850M Pro RS 대원씨티에스,,257580,124몰,
75538472,MSI MPG X870E 엣지 TI WIFI,,519000,74몰,
75538754,ASRock B850M Pro-A 대원씨티에스,,233080,108몰,
75540665,ASRock B850M Pro-A WiFi 대원씨티에스,,259000,52몰,
75600170,GIGABYTE X870E AORUS PRO 제이씨현,,468990,119몰,
75600842,ASRock B850M Pro RS 디앤디컴,,263830,108몰,
75600851,ASRock B850M Pro RS WiFi 디앤디컴,,288980,100몰,
75720068,ASUS PRIME H810M-A 인텍앤컴퍼니,,146190,56몰,
75724184,ASRock B850M Pro-A 디앤디컴,,231000,80몰,
75856148,GIGABYTE W790 AI TOP 피씨디렉트,,1489980,61몰,
75856643,ASRock B860M Pro-A 인텍앤컴퍼니,,193910,66몰,
75857021,MSI MAG X870E 토마호크 WIFI,,488990,62몰,
75935612,ASRock B860M Pro RS WiFi 디앤디컴,,259950,91몰,
75935651,ASRock B860 Pro RS WiFi 디앤디컴,,291940,85몰,
75935675,ASRock B860M 스틸레전드 WiFi 디앤디컴,,312660,85몰,
75935729,ASRock B860I WiFi 디앤디컴,,293940,80몰,
75939005,ASRock B850 Pro RS WiFi 대원씨티에스,,333890,53몰,
75988922,GIGABYTE W790 AI TOP 제이씨현,,1499000,69몰,
75989195,ASRock B760M-HDV/M.2 D5 대원씨티에스 (벌크),,139840,51몰,
76330571,Supermicro X14SBM-TP4F STCOM,,1586990,49몰,
76330748,Supermicro X14SBM-TF STCOM,,1348000,47몰,
76386635,ASUS TUF Gaming B650M-E 인텍앤컴퍼니,,157380,82몰,
76463696,ASUS H810M AYW GAMING WIFI STCOM,,167450,69몰,
76463777,ASUS H810M AYW GAMING WIFI-CSM STCOM,,167344,71몰,
76509641,ASRock B650M Pro X3D 에즈윈,,198380,85몰,
76554605,MAXSUN 터미네이터 B550M,,99000,54몰,
76875365,ASUS ProArt Z890-CREATOR WIFI 대원씨티에스,,793170,31몰,
76941716,GIGABYTE H810M S2H 제이씨현,,134100,99몰,
76941815,GIGABYTE H810M H 제이씨현,,121850,120몰,
76941983,GIGABYTE H810M K 제이씨현,,113120,123몰,
76942061,GIGABYTE H810M H 피씨디렉트,,120260,116몰,
76942073,GIGABYTE H810M K 피씨디렉트,,110957,114몰,
76942094,GIGABYTE H810M S2H 피씨디렉트,,138980,88몰,
76944080,ASUS ROG STRIX B850-F GAMING WIFI 인텍앤컴퍼니,,409778,49몰,
76946525,ASUS ROG STRIX B850-I GAMING WIFI 인텍앤컴퍼니,,409778,63몰,
76948274,MAXSUN 챌린저 A620A 2.5G,,118980,50몰,
76948292,MAXSUN e스포츠 B650ITX WIFI ICE,,198990,50몰,
77083181,ASUS PRIME H810M-A 코잇,,144000,57몰,
77083238,ASUS PRIME H810M-A WIFI 코잇,,156630,54몰,
77083265,ASUS H810M AYW GAMING WIFI 코잇,,170280,49몰,
77278676,ASRock B850I Lightning WiFi 대원씨티에스,,384390,51몰,
77278823,COLORFUL CH310M-F M.2 V20 STCOM,,91090,35몰,
77278937,ASRock B850 스틸레전드 WiFi 에즈윈,,379990,40몰,
77283125,MAXSUN 아이크레프트 Z890 아크틱,,489000,58몰,
77313929,MAXSUN 챌린저 B760ITX D5,,199000,56몰,
77314058,ASUS PRO WS WRX80E-SAGE SE WIFI II 아이보라,,1835050,1몰,
77319245,MAXSUN 터미네이터 Z890-A WIFI,,338990,59몰,
77382695,ASUS PRO WS Z890-ACE SE STCOM,,886000,60몰,
77460818,GIGABYTE B850M DS3H ICE 제이씨현,,227990,115몰,
77460890,ASUS ROG STRIX B850-E GAMING WIFI 인텍앤컴퍼니,,544570,56몰,
77460956,ASUS ROG CROSSHAIR X870E HERO 인텍앤컴퍼니,,954690,52몰,
77460980,ASUS ROG STRIX X870-A GAMING WIFI 인텍앤컴퍼니,,516630,66몰,
77618858,ASUS ROG STRIX B850-E GAMING WIFI STCOM,,567600,87몰,
77620880,GIGABYTE B850M DS3H ICE 피씨디렉트,,231420,106몰,
77704688,ASRock B850M 스틸레전드 WiFi 대원씨티에스,,320190,72몰,
77705072,ASRock B850M Riptide WiFi 대원씨티에스,,333790,68몰,
77706647,ASRock B650M Pro X3D 대원씨티에스,,198300,70몰,
77706989,ASRock A520M-HVS 대원씨티에스,,72000,2몰,
77784170,ASRock W790 WS R2.0 에즈윈,,1176590,39몰,
77786621,ASRock B650M Pro X3D WiFi 디앤디컴,,225790,38몰,
77786816,ASRock B650M Pro X3D 디앤디컴,,200000,73몰,
77791190,GIGABYTE X870I AORUS PRO ICE 피씨디렉트,,546990,77몰,
77856971,GIGABYTE B850I AORUS PRO 피씨디렉트,,346090,75몰,
78096599,Supermicro X14SBI-TF STCOM,,1444990,24몰,
78099548,ASUS ROG STRIX B850-A GAMING WIFI 인텍앤컴퍼니,,391190,46몰,
78102320,BIOSTAR B850MT-E PRO 제이씨현,,182240,82몰,
78102458,ASRock Z890 Pro-A WiFi 디앤디컴,,362590,85몰,
78102476,ASRock B850M 스틸레전드 WiFi 디앤디컴,,326960,90몰,
78180194,GIGABYTE B760M D3HP D4 제이씨현,,127980,64몰,
78307601,ASRock B860M-X 디앤디컴,,175440,70몰,
78307670,ASRock H810M-X WIFI 디앤디컴,,167290,80몰,
78307739,ASRock H810M-X 디앤디컴,,154040,81몰,
78312209,ASRock H810M-X 디앤디컴 (벌크),,154790,55몰,
78534680,ASRock B850M Pro RS + WiFi6E 모듈 패키지 디앤디컴,,284090,34몰,
78843671,GIGABYTE B850M AORUS ELITE WIFI6E 제이씨현,,272490,42몰,
78977822,ASRock H810M-X 인텍앤컴퍼니,,가격비교예정,0몰,
78990293,ASRock B850 Pro-A WiFi 에즈윈,,322800,59몰,
79000790,GIGABYTE B850M AORUS ELITE WIFI6E 피씨디렉트,,275380,56몰,
79397648,MSI MAG B850M 박격포 WIFI,,336920,8몰,
79402439,GIGABYTE X870I AORUS PRO ICE 제이씨현,,가격비교예정,0몰,
