Id,Name,Type,Price,Mall,2024-10-13 00:17:59
1357994,ASRock A780GM-LE (중고),,46000,1몰,
1675641,FOXCONN H77MXV-D,,65000,1몰,
2191233,PEGATRON IPMSB/H61 (B3) (중고) 인텍앤컴퍼니,,17260,13몰,
2951159,FOXCONN G31MX-K (중고),,29700,1몰,
2951174,ASRock B75M (중고),,27300,6몰,
2976067,ASUS H81M-E (중고),,26560,10몰,
2976087,ASUS H87-PLUS (중고),,96000,1몰,
2976233,ASUS H81M-A (중고),,44500,1몰,
2976245,ASUS Z87-PRO V (중고),,180000,1몰,
3025492,GIGABYTE GA-B75M-D3H (중고),,24490,16몰,
3032975,ASUS P8H61-MX (B3) (중고),,15510,14몰,
3226637,ASUS P9D-MH/10G-DUAL STCOM,,524980,49몰,
3266921,ASUS H81M-K (벌크),,119980,1몰,
3502709,Arduino 아두이노 우노 R3 부속품,호환보드,3600,6몰,
3502710,Arduino 아두이노 우노 R3 부속품,케이스,500,13몰,
3548546,ASUS H110M-K STCOM,,118740,83몰,
3603620,ASUS H110M-K 아이보라,,120360,72몰,
4465664,BIOSTAR G31-M7 TE (중고),,34500,1몰,
4465818,ASRock G31M-S (중고),,40000,1몰,
4467580,ASRock G41M-S3 (중고),,54500,1몰,
4467648,ASRock H55M-LE (중고),,30000,1몰,
4468027,ECS G41T-M6 (중고),,17290,6몰,
4468421,MSI G31TM-P21 (중고),,50000,1몰,
4470578,FOXCONN H61MXL-K (중고),,9860,14몰,
4470743,ECS G41T-M (중고),,32000,1몰,
4470793,ASUS P5G41T-M LX (중고),,50000,1몰,
4470858,GIGABYTE GA-H61M-D2 (B3) (중고),,27000,3몰,
4471348,FOXCONN H55MXV (중고),,30000,1몰,
4471379,FOXCONN H55MXV-LE (중고),,20000,2몰,
4471394,ECS H67H2-M3 (중고),,50000,1몰,
4471514,ASRock H61M-DGS (B3) (중고),,20840,10몰,
4471621,GIGABYTE GA-H61M-DS2V (B3) (중고),,20000,4몰,
4471645,GIGABYTE GA-H81M-S2PV (중고),,21170,22몰,
4471893,ASUS P5KPL-AM (중고),,40950,1몰,
4478863,ASRock B85M-DGS (중고),,30780,13몰,
4482977,ASUS B85M-G (중고),,26030,30몰,
4483142,ASUS H81M-K (중고),,20000,28몰,
4488764,ASRock B85M-HDS (중고),,28080,21몰,
4489009,GIGABYTE GA-B85M-HD3 (중고),,29780,12몰,
4489363,ECS DELUXE H81H3-M3 (중고),,17530,11몰,
4489472,MSI P55-CD53 (중고),,40000,1몰,
4489542,ASRock H81M-DGS (중고),,20760,24몰,
4489619,ASUS P7H55-M LX (중고),,10890,25몰,
4489674,ASUS P8B75-M LX (중고),,25990,18몰,
4490529,GIGABYTE GA-B85M-D3H (중고),,37490,26몰,
4490623,GIGABYTE GA-H61M-S2V (B3) (중고),,18420,10몰,
4490813,GIGABYTE GA-B75M-D3V (중고),,22490,13몰,
4490850,GIGABYTE GA-G31M-ES2L (중고),,31500,1몰,
4494385,FOXCONN G41MX-K (중고),,35000,1몰,
4494526,ASRock H61M-HVGS (B3) (중고),,39500,1몰,
4495710,GIGABYTE GA-H81M-DS2V (중고),,20500,25몰,
4496138,GIGABYTE GA-B85M-DS3H (중고),,32200,10몰,
4496749,ECS H55H-M (중고),,31000,1몰,
4497542,GIGABYTE GA-H77M-D3H (중고),,75000,1몰,
4497687,GIGABYTE GA-H81M-D2V (중고),,20980,16몰,
4497752,ASRock B75M-GL (중고),,27890,4몰,
4829871,ASUS H110M-K STCOM (벌크),,126500,1몰,
5064931,BIOSTAR A320MH PRO 이엠텍,,70000,1몰,
5232347,BIOSTAR TB250-BTC (해외구매),,142560,34몰,
5516497,ASRock Q87M vPRO (중고),,170000,1몰,
5679942,ASUS B85M-F (중고),,40000,1몰,
5682408,Arduino 아두이노 우노 R3 스타터 키트,프로,131500,1몰,
5682458,Arduino 아두이노 우노 R3 스타터 키트,기본,45090,2몰,
5686862,Arduino 아두이노 메가 부속품,케이스,1100,7몰,
5713431,ASUS H81M-D PLUS (중고),,23990,8몰,
5727101,GIGABYTE GA-P55A-UD3R (중고),,14230,10몰,
5791747,ASUS B250 MINING EXPERT (해외구매),,89500,14몰,
5857695,ASUS WS X299 PRO STCOM,,559400,92몰,
5857728,ASUS WS X299 PRO/SE STCOM,,625980,95몰,
5857774,ASUS WS X299 SAGE STCOM,,1290000,4몰,
5881295,BIOSTAR Hi-Fi B85S3+ (중고) 이엠텍,,46000,1몰,
5896041,ASUS WS X299 SAGE 아이보라,,1029000,1몰,
5973277,ASUS WS C621E SAGE 아이보라,,993360,74몰,
5991341,코코아팹 오렌지보드 BLE,기본,24200,1몰,
5991461,코코아팹 오렌지보드 Nano,기본,14810,45몰,
5993711,MSI H81M-P33 (중고),,22030,20몰,
5994057,ASRock B85M PRO4 (중고),,32500,33몰,
5994200,GIGABYTE GA-B85-HD3 (중고),,80000,1몰,
5994380,GIGABYTE GA-B85M-D2V (중고),,31290,5몰,
5994603,MSI B85M-E33 (중고),,39500,1몰,
5994682,ASRock H81M-DG4 (중고),,19820,15몰,
5994821,ASRock H81M-HDS (중고),,26850,4몰,
5994884,ECS ESSENTIALS H81H3-M4 (중고),,19780,12몰,
5997948,GIGABYTE GA-A320M-S2H 듀러블에디션 피씨디렉트,,85000,1몰,
6016659,GIGABYTE H370 HD3 듀러블에디션 피씨디렉트,,170000,1몰,
6017713,ASRock B360M PRO4 디앤디컴,,130000,1몰,
6032630,ASRock B360 PRO4 디앤디컴,,130000,1몰,
6132986,ASRock Rack EPC621D8A 명인일렉트로닉스,,694610,69몰,
6145321,ASUS H97-PLUS (중고),,54600,2몰,
6145411,GIGABYTE GA-B85M-Gaming 3 게이밍에디션 (중고),,60000,1몰,
6145461,ASRock B85M (중고),,30420,1몰,
6153517,GIGABYTE GA-H110M-DS2V 듀러블에디션 (중고),,61000,1몰,
6153564,GIGABYTE GA-H110-D3A BTC 듀러블에디션 (중고),,50000,1몰,
6153694,ASRock H110M-HDV (중고),,55000,1몰,
6153801,BIOSTAR H81MDV3 (중고),,13650,2몰,
6153807,BIOSTAR H81MDV5 (중고),,23670,6몰,
6179481,GIGABYTE GA-H81M-HD2 (중고),,49500,1몰,
6179521,GIGABYTE GA-H81M-D3V (중고),,25920,7몰,
6179549,GIGABYTE GA-H87M-HD3 (중고),,41300,6몰,
6192932,BIOSTAR H77MU3 소백 (중고) 이엠텍,,75000,1몰,
6343237,ASRock H77 Pro4/MVP (중고),,91000,1몰,
6354378,MSI B75MA-E33 GEN3 (중고),,46000,1몰,
6371155,GIGABYTE GA-B85M-DS3H-A (중고),,37210,12몰,
6449392,ASUS P8H67 B3 (중고),,28550,7몰,
6494014,ASRock B450 PRO4 디앤디컴,,155000,1몰,
6494926,ASUS PRIME H310M-K R2.0 인텍앤컴퍼니,,156000,1몰,
6500307,GIGABYTE A320M-H 듀러블에디션 피씨디렉트,,110000,1몰,
6508375,GIGABYTE Z390 AORUS ULTRA 제이씨현,,300000,1몰,
6540358,ASUS WS X299 SAGE/10G 아이보라,,1250000,1몰,
6558463,ASRock H97 Performance (중고),,96000,1몰,
6643243,ASUS P11C-X 아이보라,,410000,1몰,
6897841,B150 M-ATX (중고),,31850,19몰,
6898267,H110 M-ATX (중고),,24990,41몰,
6898489,H110 ATX (중고),,20480,2몰,
6898747,B250 M-ATX (중고),,75000,1몰,
6898861,B250 ATX (중고),,75000,2몰,
6899308,Z170 ATX (중고),,59990,8몰,
6899626,H170 ATX (중고),,45500,4몰,
6900646,Z270 ATX (중고),,91000,2몰,
6900835,H270 ATX (중고),,43230,5몰,
6901537,H170 M-ATX (중고),,150000,1몰,
6978166,ASRock B450M-HDV R4.0 디앤디컴,,67310,5몰,
7015291,ASRock B450 스틸레전드 디앤디컴,,153000,1몰,
7097008,ASRock B450M 스틸레전드 디앤디컴,,155000,1몰,
7452148,ASUS EX A320M-GAMING 대원씨티에스,,106000,1몰,
7452181,ASUS PRIME A320M-K 대원씨티에스,,98590,2몰,
8345859,ASUS WS X299 SAGE/10G STCOM,,1254180,71몰,
8515179,ASUS ROG CROSSHAIR VIII HERO (Wi-Fi) 아이보라,,890000,1몰,
8520741,MSI MPG X570 게이밍 엣지 WiFi,,1099900,1몰,
8654246,ASUS WS C621E SAGE STCOM,,996980,64몰,
8747690,ASRock X570 Phantom Gaming 4 에즈윈,,141040,114몰,
9302775,MSI A320M-A PRO,,100000,1몰,
9480156,MSI B450M-A PRO 맥스,,91000,5몰,
9500100,MSI MPG X470 게이밍 플러스 맥스,,165000,2몰,
9511734,ASUS PRIME X299-A II 코잇,,606390,79몰,
9597318,ASRock X570 AQUA 에즈윈,,1302690,1몰,
10114683,GIGABYTE TRX40 DESIGNARE 피씨디렉트,,2450000,1몰,
10132605,GIGABYTE TRX40 AORUS XTREME 피씨디렉트,,2198000,1몰,
10525329,ECS DURATHON2 GLKD-I-J4005 코잇 (벌크),기본,107990,3몰,
10525335,ECS DURATHON2 GLKD-I-J4005 코잇 (벌크),65W 어댑터,119050,2몰,
10641108,ASUS Tinker Fanless Aluminum Case,,34070,23몰,
10864752,ASRock A320M-HDVP 디앤디컴,,110000,1몰,
11032305,ASUS Tinker Edge T,기본,127000,1몰,
11210097,ASUS ROG STRIX Z490-E GAMING STCOM,,400000,1몰,
11222715,ASUS ROG MAXIMUS XII FORMULA 코잇,,965000,1몰,
11223537,MSI MEG Z490 갓라이크,,1871520,3몰,
11223846,ASUS ROG STRIX Z490-F GAMING 아이보라,,400000,1몰,
11231553,GIGABYTE Z490 AORUS XTREME 제이씨현,,1382100,1몰,
11231616,GIGABYTE Z490 AORUS PRO AX 제이씨현,,362590,1몰,
11231685,GIGABYTE Z490 AORUS ELITE 제이씨현,,440950,1몰,
11297130,GIGABYTE Z490 AORUS ULTRA 피씨디렉트,,561300,1몰,
11338638,GIGABYTE Z490 AORUS XTREME WATERFORCE 제이씨현,,1531270,2몰,
11571272,ASUS TUF Gaming B550-PLUS STCOM,,240980,115몰,
11571368,ASUS TUF Gaming B550M-PLUS STCOM,,155750,162몰,
11571746,ASRock B550 Phantom Gaming 4 에즈윈,,159900,1몰,
11572991,ASRock B550M PRO4 에즈윈,,539130,1몰,
11574341,ASUS TUF Gaming B550-PLUS 대원씨티에스,,350000,1몰,
11574458,ASUS PRIME B550M-A 대원씨티에스,,113970,138몰,
11574545,ASUS PRIME B550M-K 대원씨티에스,,114430,138몰,
11575373,GIGABYTE B550M DS3H 듀러블에디션 피씨디렉트,,111740,11몰,
11578097,MSI MAG B550M 박격포,,491010,1몰,
11578325,MSI MAG B550M 박격포 WiFi,,200000,1몰,
11580941,ASRock B550 PRO4 에즈윈,,230000,2몰,
11583095,ASUS PRIME B550M-K 아이보라,,114950,45몰,
11583224,ASUS TUF Gaming B550-PLUS 아이보라,,204960,4몰,
11606894,GIGABYTE B550 AORUS ELITE 제이씨현,,240000,1몰,
11684576,GIGABYTE B550M AORUS ELITE 제이씨현,,126780,202몰,
11751599,GIGABYTE B550M AORUS ELITE 피씨디렉트,,119700,117몰,
11934316,ASUS ROG STRIX B550-A GAMING 대원씨티에스,,191160,97몰,
11934553,GIGABYTE B460M H 듀러블에디션 피씨디렉트,,112000,1몰,
11973272,Z370 (중고),,67440,13몰,
11973338,H310 (중고),,43790,49몰,
11973377,B360 (중고),,83000,4몰,
11973419,B365 (중고),,150000,1몰,
11973452,H370 (중고),,160000,1몰,
11973482,Z390 (중고),,220000,3몰,
12022880,ASRock B550M-ITX/ac 디앤디컴,,218430,136몰,
12060293,ASUS PRIME A520M-K STCOM,,80780,137몰,
12060863,ASUS PRIME A520M-K/CSM STCOM,,112980,95몰,
12067598,MSI A520M-A PRO,,67610,178몰,
12067610,ASUS PRIME A520M-K 아이보라,,66990,84몰,
12069566,ASUS PRIME A520M-K 대원씨티에스,,66900,168몰,
12077093,GIGABYTE A520M S2H 듀러블에디션 제이씨현,,84380,151몰,
12077126,GIGABYTE A520M H 듀러블에디션 제이씨현,,72380,111몰,
12083765,GIGABYTE A520M S2H 듀러블에디션 피씨디렉트,,85000,1몰,
12086510,ASRock A520M-HVS 디앤디컴,,67990,124몰,
12092663,ASRock A520M-HDV 디앤디컴,,71790,161몰,
12121013,ASRock A520M-ITX/ac 디앤디컴,,178970,132몰,
12130286,ASRock A520M-HDV 에즈윈,,69570,140몰,
12130319,ASRock A520M-HVS 에즈윈,,72380,125몰,
12464213,ASRock B550M Phantom Gaming 4 에즈윈,,108090,122몰,
12487823,ASRock B550M Phantom Gaming 4 디앤디컴,,105900,131몰,
12660353,ASRock A520M-HDV 디앤디컴 (벌크),,68330,124몰,
12660362,ASRock A520M-HVS 디앤디컴 (벌크),,71170,96몰,
12702185,ASUS ROG STRIX B550-XE GAMING WIFI STCOM,,416910,1몰,
12761789,ASUS ROG ZENITH EXTREME ALPHA 대원씨티에스,,748800,61몰,
12797720,ASRock B550M-HDV 디앤디컴,,130510,3몰,
12840617,ECS DURATHON2 GLKD-I-J4025 코잇 (벌크),기본,105990,3몰,
12840632,ECS DURATHON2 GLKD-I-J4025 코잇 (벌크),65W 어댑터,119000,1몰,
12952262,MSI MPG Z490 게이밍 엣지 WiFi (해외구매),,378860,9몰,
12968927,라즈베리파이 실습용 프리미엄 키트 41종 (SZH-EK041),,106300,1몰,
12971276,아두이노 CH341A USB EEOROM 롬라이터,,3790,43몰,
13016483,BBC 마이크로비트,기본키트,52200,3몰,
13057562,아두이노 터치 센서 TTP223B,,220,33몰,
13057682,아두이노 압력 센서 FSR402,,4180,16몰,
13057787,Arduino 아두이노 우노 R3 DIP타입 호환보드 DM70,,13270,4몰,
13058087,아두이노 적외선 광센서 TCRT5000,,80,64몰,
13058783,아두이노 RGB 모듈 5mm DM52,,570,2몰,
13147263,ASUS ROG CROSSHAIR X670E HERO STCOM,,1247000,2몰,
13154523,ASRock X670E PG Lightning 디앤디컴,,489000,1몰,
13158384,ASUS ROG STRIX X670E-E GAMING WIFI STCOM,,1094600,1몰,
13158504,ASUS ROG STRIX X670E-F GAMING WIFI STCOM,,994880,1몰,
13164092,MSI 프레스티지 X570 크리에이션 (해외구매),,600000,1몰,
13165257,A520 (중고),,58890,9몰,
13165613,아두이노 센서 적외선 포토 인터럽트 C73,,1100,4몰,
13165736,아두이노 헤더핀 40핀 DM659,,140,1몰,
13167473,MSI MAG X570 토마호크 WiFi (해외구매),,5616730,14몰,
13222421,아두이노 나노 V3.0 호환보드,,2990,64몰,
13278866,아두이노 HM-10 블루투스 4.0 모듈,,7320,7몰,
13289012,ASRock B560 PRO4 에즈윈,,201000,1몰,
13289171,ASRock B560M PRO4 에즈윈,,186000,1몰,
13355396,ASUS ROG STRIX Z590-E GAMING WIFI 인텍앤컴퍼니,,550000,1몰,
13355441,ASUS ROG STRIX Z590-F GAMING WIFI 인텍앤컴퍼니,,480000,1몰,
13369847,아두이노 DM2472 TTL to RS485 컨버터 모듈,,8700,1몰,
13396157,ASUS TUF B450M-PRO GAMING (해외구매),,150660,122몰,
13434407,Retroflag NESPi 케이스 for 라즈베리파이 (해외구매),,40500,1몰,
13435220,아두이노 적외선 PIR 인체감지센서 HC-SR501,,770,39몰,
13435439,아두이노 0.96인치 OLED 모듈 3종,,4500,4몰,
13435628,아두이노 우노 2.4인치 TFT 터치 LCD 쉴드,,7700,8몰,
13435784,아두이노 완전정복 + 스타터 키트 라이트,,86890,34몰,
13435838,아두이노 완전정복 + 스타터 키트 스탠다드,,221090,29몰,
13436012,3.2인치 TFT 터치 LCD For 라즈베리파이,,25300,1몰,
13523756,ASRock B560M-HDV 디앤디컴,,99000,6몰,
13561976,ASUS TUF Gaming B560M-PLUS WIFI 인텍앤컴퍼니,,300000,1몰,
13570775,Raspberry Pi 라즈베리 파이 400 키보드 일체형 PC 세트 (해외구매),,137900,1몰,
13571723,NE555P 타이머IC,,70,10몰,
13587644,ASUS TUF Gaming Z590-PLUS 인텍앤컴퍼니,,430000,1몰,
13607285,삼성전자 H61S1 (중고),,13010,27몰,
13628021,MSI H510M-A PRO,,111000,1몰,
13628870,MSI MAG B450M 박격포 맥스 (해외구매),,154740,17몰,
13631252,MSI MAG B550 토마호크 (해외구매),,185160,298몰,
13695704,ASUS Tinker board 2S,,209000,1몰,
13744889,ASRock B560M-ITX/ac 디앤디컴,,181430,3몰,
13761692,ASUS PRIME B560M-K/CSM 인텍앤컴퍼니,,166670,1몰,
13774883,ASUS ROG MAXIMUS XIII EXTREME 코잇,,1644240,5몰,
13817240,ASUS KRPA-U16 대원씨티에스,,680000,3몰,
13830011,GIGABYTE H510M H 듀러블에디션 제이씨현,,94990,7몰,
13889696,ASRock H81 PRO BTC R2.0 (중고),,59000,1몰,
13889813,아두이노 16채널 12V 릴레이 모듈,,8990,25몰,
13889939,아두이노 Pro Micro 보드,,6890,3몰,
13902929,B450 (중고),,66990,261몰,
13923911,ASUS PRO WS WRX80E-SAGE SE WIFI 아이보라,,1340830,104몰,
13947872,ASUS ROG MAXIMUS XIII EXTREME GLACIAL 인텍앤컴퍼니,,1750000,2몰,
13948124,ASRock B560M-HDV 디앤디컴 (벌크),,103610,2몰,
13949078,아두이노 MP1584EN DC-DC 스텝다운,,690,11몰,
13949195,아두이노 MAX485 TTL to RS485 컨버터 모듈,,340,67몰,
13949315,아두이노 텍스트 LCD 2004 (20X4),,6040,18몰,
13949627,LKino MEGA128 트레이닝 보드 LA18,,86900,2몰,
13980314,ASUS ROG MAXIMUS XIII EXTREME GLACIAL 코잇,,1038080,73몰,
14005334,ASUS PRIME H510M-K 인텍앤컴퍼니,,96170,15몰,
14146673,아이노비아 H81-BTC (중고),,49500,1몰,
14146880,아두이노 전압측정센서 모듈,,200,33몰,
14146994,아두이노 레오나르도 R3 호환보드,,5500,17몰,
14200919,NVIDIA Jetson Xavier NX Developer Kit (해외구매),,1239990,6몰,
14267837,ASUS P8H61-M PLUS2 (B3) (중고),,38000,1몰,
14348456,ASRock Z590 OC Formula 에즈윈,,750000,1몰,
14652515,ASRock B75M-DGS (중고),,31500,1몰,
14749595,아두이노 PS2 조이스틱 모듈,,420,25몰,
14769233,ASRock TPM2-S 2.0 Module (해외구매),,114920,1몰,
14872736,ASUS P11C-X 인텍앤컴퍼니,,459990,2몰,
14895107,COLORFUL H510M-K M.2 V20 STCOM,,88420,1몰,
14913623,ASUS PRIME H510M-K 아이보라,,112000,1몰,
14991143,ASUS PRIME Z590-V (해외구매),,430000,1몰,
15140333,아두이노 Micro USB TP4056 리튬배터리 충전모듈,,390,7몰,
15141536,아두이노 MG996R 180도 서보모터,,2700,73몰,
15250106,ASRock Rack ROMED8-2T,,1186490,63몰,
15298127,Supermicro X11SCZ-F STCOM,,611640,82몰,
15493718,MSI MAG B550M 박격포 WiFi (해외구매),,431000,3몰,
15497456,아두이노 S335 토양 습도 수분 감지 센서 Probe,,6600,2몰,
15497636,리니어레일 슬라이드 아두이노 구동 부품 세트,,47990,3몰,
15497753,라즈베리파이 호환 18650 5V 4A UPS 충전모듈,,49290,3몰,
15497837,W302 USB 호스트 쉴드 보드 아두이노,,57200,2몰,
15497894,HC-06 아두이노 블루투스 모듈,,2960,35몰,
15497969,Arduino 아두이노 우노 R3 호환보드 DM72,,2990,15몰,
15498581,Arduino 아두이노 MQ135 유해가스 감지 센서 모듈,,1680,4몰,
15498641,Arduino 아두이노 MQ9 일산화탄소 감지 센서 모듈,,1800,5몰,
15504092,MSI MAG Z590 토마호크 WIFI (해외구매),,390670,3몰,
15504146,MSI MPG Z590 게이밍 카본 WIFI (해외구매),,480000,1몰,
15601616,ASUS ROG STRIX Z690-I GAMING WIFI STCOM,,649000,1몰,
15604190,ASUS ROG STRIX Z690-A GAMING WIFI D4 코잇,,633390,3몰,
15609011,ASUS ROG STRIX Z690-E GAMING WIFI 코잇,,742890,1몰,
15610361,ASUS ROG STRIX Z690-E GAMING WIFI 아이보라,,640000,1몰,
15617057,ASUS ROG MAXIMUS Z690 APEX 인텍앤컴퍼니,,589990,2몰,
15639767,ASRock Z690 PG Riptide D4 에즈윈,,500000,1몰,
15673778,ASUS ROG MAXIMUS Z690 EXTREME GLACIAL 아이보라,,2962320,12몰,
15694070,GIGABYTE Z690 UD AX 피씨디렉트,,668800,1몰,
15914351,MSI MPG Z690 포스 WIFI (해외구매),,694730,9몰,
15914372,MSI MAG Z690 토마호크 WIFI DDR4 (해외구매),,418420,28몰,
15914450,MSI MPG Z690 카본 WIFI (해외구매),,481700,3몰,
15932150,GIGABYTE Z690 AORUS XTREME WATERFORCE 피씨디렉트,,1266000,4몰,
16058795,ASUS ROG MAXIMUS Z690 EXTREME GLACIAL 코잇,,2620000,6몰,
16083650,ASUS PRIME H610M-K D4 인텍앤컴퍼니,,92180,212몰,
16084070,ASUS PRIME B660M-K D4 인텍앤컴퍼니,,138410,50몰,
16084790,ASUS PRIME H610M-E D4 인텍앤컴퍼니,,125000,2몰,
16085327,ASUS TUF Gaming B660M-E D4 인텍앤컴퍼니,,204000,1몰,
16095542,ASUS EX B660M-V5 D4 코잇,,143000,1몰,
16095767,ASUS PRIME H610M-D D4 코잇,,104900,115몰,
16097975,ASUS TUF Gaming B550-PLUS WiFi II STCOM,,258900,121몰,
16099619,ASUS PRIME H610M-E D4 코잇,,140000,1몰,
16099739,ASUS ROG STRIX B660-A GAMING WIFI D4 코잇,,342780,97몰,
16099766,ASUS ROG STRIX B660-F GAMING WIFI 코잇,,379130,105몰,
16102367,GIGABYTE H610M H D4 듀러블에디션 제이씨현,,95990,11몰,
16102667,GIGABYTE H610M S2H D4 듀러블에디션 제이씨현,,118480,8몰,
16103087,ASUS TUF Gaming B660-PLUS WIFI D4 STCOM,,220000,1몰,
16103102,ASUS TUF Gaming B660M-PLUS D4 STCOM,,195000,7몰,
16103105,ASUS TUF Gaming B660M-E D4 STCOM,,201600,1몰,
16103126,ASUS ROG STRIX B660-F GAMING WIFI STCOM,,402000,8몰,
16103129,ASUS ROG STRIX B660-A GAMING WIFI D4 STCOM,,368980,89몰,
16103138,ASUS PRIME H610M-E D4 STCOM,,118480,127몰,
16103177,ASUS PRIME H610M-A D4 STCOM,,110060,117몰,
16103186,ASUS PRIME B660-PLUS D4 STCOM,,233900,5몰,
16103219,ASUS PRIME B660M-A D4 STCOM,,174870,131몰,
16103234,ASUS PRIME B660M-A WIFI D4 STCOM,,209980,109몰,
16103297,ASUS PRIME H610M-E D4 아이보라,,146400,3몰,
16103303,ASUS ROG STRIX B660-A GAMING WIFI D4 아이보라,,384920,1몰,
16103324,ASUS TUF Gaming B660-PLUS WIFI D4 인텍앤컴퍼니,,302000,1몰,
16103330,GIGABYTE H610M H D4 듀러블에디션 피씨디렉트,,103000,3몰,
16103333,GIGABYTE H610M S2H D4 듀러블에디션 피씨디렉트,,114920,4몰,
16103336,GIGABYTE B660 AORUS MASTER D4 피씨디렉트,,308000,1몰,
16123055,ASRock Rack EP2C621D12 WS 명인일렉트로닉스,,826740,61몰,
16145165,ATUM B250-P MINING (벌크),,70810,66몰,
16153055,GIGABYTE Z690 AORUS ELITE AX D4 피씨디렉트,,340000,1몰,
16180658,ASUS PRIME H510TS 아이보라 (벌크),기본,178000,1몰,
16252274,GIGABYTE B660M GAMING X D4 피씨디렉트,,548500,1몰,
16259744,NVIDIA Jetson AGX Xavier Developer Kit (해외구매),,3450000,2몰,
16260212,ASUS ROG STRIX B660-A GAMING WIFI STCOM,,365000,3몰,
16260506,ASUS EX H610M-V3 D4 STCOM,,95980,90몰,
16275491,Z490 (중고),,210000,2몰,
16275497,H470 (중고),,120000,1몰,
16275503,B460 (중고),,1000000,2몰,
16275521,H410 (중고),,67700,17몰,
16275539,Z590 (중고),,280000,1몰,
16275545,H570 (중고),,125000,2몰,
16275551,B560 (중고),,150000,1몰,
16275566,H510 (중고),,72620,4몰,
16275866,A320 (중고),,51990,42몰,
16276010,B350 (중고),,51240,3몰,
16276364,X570 (중고),,230000,1몰,
16277339,B550 (중고),,99890,14몰,
16284179,ASUS PRIME A520M-A II 대원씨티에스,,78700,156몰,
16285538,ASUS ROG MAXIMUS Z690 EXTREME GLACIAL STCOM,,2989990,10몰,
16301447,BIOSTAR H610MH D4 이엠텍,,82480,165몰,
16313690,ECS DURATHON2 GLKD-I-N4020 코잇 (벌크),기본,97990,11몰,
16314863,MSI PRO H610M-G DDR4,,98940,127몰,
16388984,ECS DURATHON2 GLKD-I-N4020 코잇 (벌크),65W 어댑터,100990,7몰,
16406390,ASRock B660M 스틸레전드 D4 에즈윈,,233200,1몰,
16425494,ASUS TUF Gaming Z690-PLUS WIFI 인텍앤컴퍼니,,459000,1몰,
16431992,MSI MAG Z690 토피도 (해외구매),,325590,6몰,
16444226,ASUS PRIME H510TS 아이보라 (벌크),120W 어댑터,192000,2몰,
16479872,ASRock B660M-HDVP/D5 에즈윈 (벌크),,129000,1몰,
16500779,ASRock B660M-ITX/ac D4 디앤디컴,,232260,2몰,
16507886,아두이노 1채널 12V 릴레이 모듈,,650,9몰,
16625258,ASRock H610M-HVS D4 에즈윈 (벌크),,101000,2몰,
16637543,MSI PRO H610M-C EX,,107880,150몰,
16734461,에너지옵티머스 B250 BTC-12P (벌크),,106660,5몰,
16946939,W238 UART 아두이노 초음파 거리센서,,39800,1몰,
16946948,W238 PWM 아두이노 초음파 거리센서,,37040,7몰,
16971290,ASUS PRIME H410M-A STCOM,,123050,87몰,
16991345,에너지옵티머스 B75USB BTC (벌크),,103000,1몰,
17021852,ASRock H310CM-HDVP 에즈윈,,156000,1몰,
17025563,BIOSTAR B660MX-E PRO D4 이엠텍,,136080,1몰,
17054963,아두이노 RGB 3색 LED 4핀 센서,,330,2몰,
17062373,GIGABYTE B660M AORUS ELITE D4 제이씨현,,235690,2몰,
17122259,GIGABYTE H610M H D4 듀러블에디션 (벌크),,95000,1몰,
17161250,Raspberry Pi 라즈베리 파이 제로 2W,,213580,1몰,
17192960,ASUS Pro H610T/CSM D4 코잇 (벌크),기본,160810,30몰,
17193002,ASUS Pro H610T/CSM D4 코잇 (벌크),120W 어댑터,191610,3몰,
17458589,NVIDIA Jetson NANO Developer Kit 2GB (해외구매),,1323300,1몰,
17458847,NVIDIA Jetson NANO Developer Kit 4GB,,1299300,1몰,
17529074,라즈베리파이 3B 아크릴 케이스,,3100,1몰,
17529134,아두이노 CDS 조도 센서 GL5537,,70,13몰,
17541941,ASRock B660M-HDVP/D5 R2.0 에즈윈 (벌크),,125160,104몰,
17541950,ASUS Pro H610T/CSM D4 아이보라 (벌크),기본,153920,55몰,
17543279,MSI MEG Z690 유니파이 (해외구매),,420180,26몰,
17543330,MSI MPG Z690 엣지 WIFI (해외구매),,489810,9몰,
17617955,ASUS PRIME H510M-K STCOM,,101680,78몰,
17662394,MSI MAG B660M 박격포 WIFI DDR4 (해외구매),,395220,9몰,
17667608,ASRock WRX80 Creator 대원씨티에스,,1104520,67몰,
17670656,에너지옵티머스 B75USB BTC-8P (벌크),,71080,48몰,
17700305,NVIDIA Jetson AGX Orin Developer Kit (해외구매),,3000000,29몰,
17743769,B660 DDR4 (중고),,115000,5몰,
17773823,MSI MAG B550M 박격포 맥스 WiFi,,350000,2몰,
17792948,ASRock H610M-HDV/M.2 R2.0 D4 디앤디컴,,91650,152몰,
17793371,ASRock H610M-HVS/M.2 R2.0 D4 디앤디컴,,86990,116몰,
17831603,ASRock H610M-HDV/M.2 R2.0 D4 디앤디컴 (벌크),,91270,104몰,
17831615,ASRock H610M-HVS/M.2 R2.0 D4 디앤디컴 벌크,,86880,92몰,
17847224,ASRock H610M-HDV/M.2 R2.0 D4 에즈윈,,90320,135몰,
17847233,ASRock H610M-HDV/M.2 R2.0 D4 에즈윈 (벌크),,88990,95몰,
17847248,ASRock H610M-HVS/M.2 R2.0 D4 에즈윈,,97840,106몰,
17847254,ASRock H610M-HVS/M.2 R2.0 D4 에즈윈 (벌크),,92440,97몰,
17856809,ASRock B660M-HDVP/D5 R2.0 에즈윈,,159680,1몰,
17910983,MSI PRO B550M-P GEN3,,139000,1몰,
17915426,GIGABYTE X670 AORUS ELITE AX 제이씨현,,379000,12몰,
17917991,MSI PRO X670-P WiFi,,469000,2몰,
17925728,MSI MPG X670E 카본 WiFi,,698900,78몰,
17926424,ASRock X670E Pro RS 에즈윈,,437500,1몰,
17926655,GIGABYTE X670 AORUS ELITE AX 피씨디렉트,,366850,127몰,
17926661,GIGABYTE X670E AORUS XTREME 피씨디렉트,,1319000,2몰,
17926670,ASRock X670E PG Lightning 에즈윈,,386920,126몰,
17926736,ASUS ProArt X670E-CREATOR WIFI STCOM,,880000,1몰,
17926742,ASUS TUF Gaming X670E-PLUS STCOM,,439980,128몰,
17926745,ASUS TUF Gaming X670E-PLUS WIFI STCOM,,639600,1몰,
17926751,ASUS ROG STRIX X670E-I GAMING WIFI STCOM,,683980,128몰,
17926757,ASUS ROG CROSSHAIR X670E Gene STCOM,,1257690,1몰,
17926763,ASRock X670E PG Lightning 대원씨티에스,,393350,5몰,
17926766,ASRock X670E 스틸레전드 대원씨티에스,,441700,113몰,
17926772,ASUS PRIME X670-P 대원씨티에스,,399000,1몰,
17926778,ASUS ProArt X670E-CREATOR WIFI 대원씨티에스,,850670,1몰,
17926781,ASUS TUF Gaming X670E-PLUS 대원씨티에스,,469560,1몰,
17926787,ASUS ROG STRIX X670E-A GAMING WIFI 대원씨티에스,,885300,1몰,
17926799,ASUS PRIME X670E-PRO WIFI 대원씨티에스,,646100,1몰,
17929595,ASRock X670E 스틸레전드 디앤디컴,,493960,25몰,
17929628,ASRock X670E Taichi 디앤디컴,,889000,2몰,
17968601,ASRock C621A WS 에즈윈,,946350,95몰,
17970146,GIGABYTE B650 AORUS ELITE AX 피씨디렉트,,299000,20몰,
17970338,GIGABYTE B650M AORUS ELITE 제이씨현,,238800,144몰,
17970548,GIGABYTE B650 AERO G 제이씨현,,459000,1몰,
17971178,MSI MPG B650 카본 WIFI,,915000,1몰,
17971181,MSI MAG B650 토마호크 WIFI,,295460,142몰,
17971184,MSI PRO B650M-A WIFI,,186450,179몰,
17971187,MSI MAG B650M 박격포 WIFI,,240550,180몰,
17971196,ASRock B650 PG Lightning 디앤디컴,,319000,3몰,
17971199,ASRock B650M PG Riptide 디앤디컴,,299000,1몰,
17971202,ASRock B650 Pro RS 디앤디컴,,379000,1몰,
17971205,ASRock B650E PG Riptide WiFi 디앤디컴,,426790,26몰,
17971247,ASRock B650 Pro RS 에즈윈,,329000,4몰,
17971253,ASRock B650M PG Riptide 에즈윈,,222150,78몰,
17971598,ASRock B650 PG Lightning 대원씨티에스,,259910,120몰,
17971604,ASRock B650M PG Riptide 대원씨티에스,,205110,160몰,
18000098,ASUS PRIME X670-P-CSM STCOM,,455060,10몰,
18000254,ASUS PRIME X670-P WIFI-CSM STCOM,,473000,6몰,
18007478,ASRock B650E PG Riptide WiFi 대원씨티에스,,361620,106몰,
