18718829,ASRock B650 Pro RS 대원씨티에스,,300990,86몰,
18718865,ASRock B650 LiveMixer 대원씨티에스,,405000,2몰,
18725312,ASUS PRIME B760M-K D4 인텍앤컴퍼니,,230000,4몰,
18780872,GIGABYTE B760 AORUS ELITE 피씨디렉트,,235630,34몰,
18781991,GIGABYTE B760M DS3H 피씨디렉트,,144870,83몰,
18813608,GIGABYTE B760M DS3H 제이씨현,,145230,225몰,
18815033,GIGABYTE B760 AORUS ELITE 제이씨현,,292000,2몰,
18815243,GIGABYTE B760 GAMING X 제이씨현,,289000,1몰,
18917408,X470 (중고),,75610,8몰,
18993305,GIGABYTE B760M AORUS ELITE AX 제이씨현,,221860,6몰,
19163258,ASUS PRIME B650M-A II STCOM,,205200,118몰,
19170107,GIGABYTE H610M S2H V2 D4 듀러블에디션 피씨디렉트,,115970,37몰,
19177262,BIOSTAR B760MZ-E PRO D5 이엠텍,,212000,1몰,
19240112,ECS H610H7-TI5 코잇,기본,165000,3몰,
19240121,ECS H610H7-TI5 코잇,120W 어댑터 포함,188000,1몰,
19241759,MSI PRO B760M-A WIFI,,163180,174몰,
19242146,GIGABYTE H610M S2H V2 D4 듀러블에디션 제이씨현,,111120,167몰,
19306598,ASUS TUF Gaming B760-PLUS WIFI 인텍앤컴퍼니,,315000,1몰,
19356875,GIGABYTE B760M GAMING D4 피씨디렉트,,224850,2몰,
19427744,ASUS TUF Gaming B760-PLUS WIFI STCOM,,287980,46몰,
19429325,ASUS PRIME B760-PLUS STCOM,,249000,2몰,
19431530,GIGABYTE A520M K V2 피씨디렉트,,61870,165몰,
19498640,ASRock B760M Pro RS D5 디앤디컴,,165250,137몰,
19523846,COLORFUL H610M-E M.2 V20 D4 STCOM,,82000,113몰,
19536062,ASRock B760M Pro RS D5 에즈윈,,164060,153몰,
19536692,ASRock B650M-HDV/M.2 에즈윈,,196500,2몰,
19554155,ASUS WS C422 SAGE/10G STCOM,,1356870,2몰,
19556732,ASUS PRO WS W680-ACE IPMI STCOM,,655980,114몰,
19556996,ASUS PRO WS W680-ACE STCOM,,525770,1몰,
19605602,ASUS PRIME B760M-A STCOM,,168980,127몰,
19606709,ASUS ROG STRIX B760-A GAMING WIFI STCOM,,365650,120몰,
19607402,ASUS TUF Gaming B760M-E D4 STCOM,,231000,4몰,
19610558,GIGABYTE H610M S2H 듀러블에디션 제이씨현,,128000,5몰,
19619507,GIGABYTE H610M H 듀러블에디션 제이씨현,,119000,6몰,
19627397,ASRock B550M Phantom Gaming 4 대원씨티에스,,110700,111몰,
19628207,ASUS TUF Gaming B760M-PLUS 코잇,,188750,75몰,
19648718,ASRock B650 Pro RS + WiFi6E 모듈 패키지 디앤디컴,,379320,1몰,
19649354,ASRock B650 PG Lightning + WiFi6E 모듈 패키지 디앤디컴,,349000,1몰,
19673210,ASUS PRIME B760M-A WIFI STCOM,,233000,4몰,
19673600,GIGABYTE A620M GAMING X 제이씨현,,159410,7몰,
19673975,ECS DURATHON2 B760H7-M8 코잇 (벌크),,142070,65몰,
19691519,ASUS PRIME B650M-A II 대원씨티에스,,134400,182몰,
19692893,GIGABYTE H610M H 듀러블에디션 피씨디렉트,,229320,1몰,
19704527,ASUS PRIME B760M-A 코잇,,152640,159몰,
19705316,MSI PRO A620M-E,,107520,145몰,
19719305,GIGABYTE H310M HD2 2.0 듀러블에디션 (중고),,156000,1몰,
19719872,MSI H110M PRO-VD PLUS (중고),,30610,7몰,
19725299,GIGABYTE A620M GAMING X 피씨디렉트,,167010,100몰,
19753526,ECS DURATHON2 B760H7-M8 코잇,,144990,69몰,
19755890,ASRock A620M-HDV/M.2+ 에즈윈,,126000,38몰,
19756130,ASUS PRIME B760-PLUS 코잇,,240510,93몰,
19756199,ASUS TUF Gaming B760-PLUS WIFI 코잇,,254100,77몰,
19772375,ASUS PRIME B760M-A 인텍앤컴퍼니,,157450,147몰,
19772732,ASUS TUF Gaming B760M-PLUS 인텍앤컴퍼니,,185000,7몰,
19827572,ASRock A620M-HDV/M.2+ 디앤디컴,,129000,4몰,
19827944,ASRock A620M-HDV/M.2 디앤디컴,,104510,88몰,
19834694,GIGABYTE H610M S2H 듀러블에디션 피씨디렉트,,128000,3몰,
19868960,GIGABYTE B760M H D4 제이씨현,,156240,1몰,
19903283,ASUS ROG STRIX B760-A GAMING WIFI 코잇,,378750,1몰,
19903481,ASUS ROG STRIX B760-G GAMING WIFI 코잇,,217070,180몰,
19924310,ASUS PRIME A620M-A STCOM,,113200,138몰,
19925807,ASUS TUF Gaming A620M-PLUS STCOM,,185980,62몰,
19926059,ASUS TUF Gaming A620M-PLUS WIFI STCOM,,204400,63몰,
19926611,ASUS PRIME A620M-A 대원씨티에스,,110900,121몰,
19926731,ASUS TUF Gaming A620M-PLUS 대원씨티에스,,139160,98몰,
19927037,ASUS TUF Gaming A620M-PLUS WIFI 대원씨티에스,,201000,2몰,
19927871,ASUS P12R-I STCOM,,392980,101몰,
19936247,ASRock A620M-HDV/M.2 대원씨티에스,,104620,131몰,
19938515,GIGABYTE H610M K 제이씨현,,109000,6몰,
19996577,ASUS PRIME B650M-A WIFI II STCOM,,219000,4몰,
19999916,GIGABYTE H610M K 피씨디렉트,,108580,4몰,
20012147,ASRock Z790 Pro RS D5 + WiFi6E 모듈 패키지 디앤디컴,,337490,98몰,
20027564,ASUS PRIME H510M-K R2.0 인텍앤컴퍼니,,102970,97몰,
20079008,ASUS PRIME Z790M-PLUS-CSM 코잇,,332420,109몰,
20103287,ASRock B760M Pro RS D5 + WiFi6E 모듈 패키지 디앤디컴,,196160,118몰,
20108249,MSI PRO B650M-P,,134640,163몰,
20119583,GIGABYTE H610M H V2 D4 피씨디렉트,,80740,170몰,
20120033,GIGABYTE B760M D2H 제이씨현,,130000,4몰,
20140688,ASRock A620M-HDV/M.2+ + WiFi6E 모듈 패키지 디앤디컴,,156600,4몰,
20140877,ASRock A620M-HDV/M.2 + WiFi6E 모듈 패키지 디앤디컴,,147960,73몰,
20171636,MSI PRO B760M-P,,144980,113몰,
20225543,Supermicro X13SAE-F STCOM,,756990,79몰,
20226533,Supermicro X13SAQ STCOM,,690930,103몰,
20226770,Supermicro X13SAZ-Q STCOM,,720530,101몰,
20231597,GIGABYTE A620M S2H 피씨디렉트,,110030,68몰,
20238110,GIGABYTE A620M S2H 제이씨현,,113990,16몰,
20317493,ASUS PRIME B760M-K STCOM,,143980,48몰,
20318291,ASUS TUF Gaming A620-PRO WIFI STCOM,,276730,118몰,
20324882,GIGABYTE B650M K 제이씨현,,139990,263몰,
20343650,ASUS PRIME B760M-K 코잇,,167990,98몰,
20344700,ASUS PRIME H610M-CS D4 코잇,,81690,167몰,
20391572,ASRock B650M Pro RS 디앤디컴,,181520,98몰,
20405063,ASRock B760M PG LIGHTNING/D4 디앤디컴,,163680,1몰,
20459081,GIGABYTE A520M K V2 제이씨현,,63000,209몰,
20462924,GIGABYTE H610M H V2 D4 제이씨현,,88820,184몰,
20506130,ASRock A620M-HDV/M.2+ 대원씨티에스,,126000,21몰,
20509004,Supermicro H12SSL-C STCOM,,1128900,82몰,
20524634,ASRock A520M-HVS 에즈윈 (벌크),,73340,25몰,
20530115,ASRock B760M PG LIGHTNING D5 에즈윈,,172000,1몰,
20536331,ASRock B760M-HDVP D5 에즈윈 (벌크),,133790,120몰,
20593100,BIOSTAR A520MT 이엠텍,,66500,136몰,
20600072,Supermicro X13SEM-F STCOM,,1242420,41몰,
20612690,ASUS PRIME B760M-KS 코잇 (벌크),,135590,60몰,
20645813,Supermicro X13SWA-TF STCOM,,1608000,70몰,
20710217,ASUS PRIME B760M-K 인텍앤컴퍼니,,141450,175몰,
20738630,COLORFUL BATTLE-AX B760M-K V20 D5 STCOM,,123300,95몰,
21421541,ASUS TUF Gaming B650M-E 대원씨티에스,,171010,127몰,
21427535,ASUS TUF Gaming B650M-E WIFI 대원씨티에스,,193610,152몰,
21428693,ASUS PRIME A620M-K 대원씨티에스,,108000,120몰,
21627827,ASRock B650M Pro RS 대원씨티에스,,180400,149몰,
21628184,ASRock B650M Pro RS WiFi 대원씨티에스,,245520,1몰,
21727307,GIGABYTE B650M K 피씨디렉트,,138790,234몰,
21731021,GIGABYTE B650M S2H 제이씨현,,171080,2몰,
21755828,ASRock B650M Pro RS + WiFi6E 모듈 패키지 디앤디컴,,267990,2몰,
24703229,ASRock Rack ROME2D16-2T,,1416620,10몰,
25129808,ASUS PRO WS W790E-SAGE SE STCOM,,2058980,74몰,
25208807,ASUS PRO WS W790-ACE STCOM,,1367740,123몰,
25866491,ASRock H610M-HDV/M.2+ D5 에즈윈,,105250,152몰,
25869083,ASRock H610M-HDV/M.2+ D5 에즈윈 (벌크),,107980,113몰,
27409910,ASRock H610M-HDV/M.2+ D5 디앤디컴,,108790,137몰,
27474755,MSI PRO B760M-A DDR4 II,,144980,147몰,
27475223,MSI MAG X670E 토마호크 WIFI,,560000,6몰,
27499739,ASRock B760M-HDV/M.2 D5 디앤디컴,,135210,134몰,
27508001,ASUS WS X299 PRO-SE 대원씨티에스,,602660,17몰,
27534158,GIGABYTE H610M H V2 D4 제이씨현 (벌크),,84230,121몰,
27546074,ASRock H610M-HDV/M.2+ D5 대원씨티에스,,109780,89몰,
27547688,ASUS PRO WS W680-ACE 대원씨티에스,,564290,2몰,
27572138,ASUS PRIME H610M-E 인텍앤컴퍼니,,130000,5몰,
27576677,MSI MAG X670E 토마호크 WIFI (해외구매),,397350,25몰,
27629561,ASRock B760M-HDV/M.2 D5 에즈윈,,134390,160몰,
27634559,ASRock B760M-HDV/M.2 D5 대원씨티에스,,139100,112몰,
27634862,ASRock H610M-HDV/M.2 R2.0 D4 대원씨티에스,,106450,3몰,
27635057,ASRock Z790 PG Lightning D5 대원씨티에스,,377400,1몰,
27635753,ASRock Z790 스틸레전드 WiFi D5 대원씨티에스,,457560,2몰,
27675110,ASUS PRIME H610M-E 코잇,,122530,116몰,
27679898,COLORFUL CH510M-K M.2 V20 STCOM,,90580,103몰,
27691589,NVIDIA Jetson Orin Nano Developer Kit 용량확인필요 (해외구매),,849980,8몰,
27698261,GIGABYTE H510M H V2 제이씨현,,98980,15몰,
27779696,ASRock N100M 디앤디컴,,185920,97몰,
28029617,ASRock H610M-H2/M.2 D5 에즈윈 (벌크),,102830,124몰,
28059134,ASRock H610M-HDV/M.2+ D5 디앤디컴 (벌크),,105980,123몰,
28063598,ASRock Rack SPC621D8 명인일렉트로닉스,,1085480,41몰,
28183691,ASRock H610M-H2/M.2 D5 디앤디컴,,103530,140몰,
28183721,ASRock H610M-H2/M.2 D5 디앤디컴 (벌크),,100640,103몰,
28247648,BIOSTAR A520MS 제이씨현,,58840,170몰,
28248419,BIOSTAR B650MT 제이씨현,,100550,149몰,
28248743,BIOSTAR H610MHD D5 제이씨현,,93590,136몰,
28248950,BIOSTAR H610MS 제이씨현,,78580,149몰,
28486034,GIGABYTE Z790 AORUS ELITE X 제이씨현,,448000,2몰,
28577999,ASUS Tinker Edge R,어댑터 포함,271950,58몰,
28581716,ASUS Tinker Edge T,어댑터 포함,141750,65몰,
28582691,ASUS EX B650M-V7 대원씨티에스,,138000,1몰,
28603964,ASRock B650M PG Lightning 에즈윈,,139000,168몰,
28651910,Z790 (중고),,239900,2몰,
28652501,H610 DDR5 (중고),,106000,1몰,
28779206,ASRock B760M-HDV/M.2 D5 + WiFi6E 모듈 패키지 디앤디컴,,178980,31몰,
28780247,ASUS PRO WS W790E-SAGE SE 대원씨티에스,,1980000,1몰,
28803482,ASUS ROG MAXIMUS Z790 APEX ENCORE STCOM,,889700,112몰,
28807472,BIOSTAR B650MP-E PRO 이엠텍,,137680,110몰,
28826786,GIGABYTE Z790 AORUS ELITE X 피씨디렉트,,461300,1몰,
28827020,GIGABYTE Z790 AORUS ELITE X WIFI7 피씨디렉트,,472000,3몰,
28827605,GIGABYTE Z790 AORUS PRO X 피씨디렉트,,574000,5몰,
28827962,GIGABYTE Z790 AORUS ELITE AX ICE 피씨디렉트,,356670,125몰,
28828121,GIGABYTE Z790 AORUS XTREME X 제이씨현,,1759000,1몰,
28828751,GIGABYTE Z790 AORUS MASTER X 제이씨현,,979000,1몰,
28828997,GIGABYTE Z790 AORUS PRO X 제이씨현,,546000,2몰,
28829297,GIGABYTE Z790 AORUS ELITE AX ICE 제이씨현,,373390,108몰,
28857518,ASUS PRIME H610M-K D5 인텍앤컴퍼니,,124000,7몰,
28857623,ASUS PRIME H610M-K ARGB 인텍앤컴퍼니,,125620,11몰,
28857914,ASUS TUF Gaming B760M-BTF WIFI 인텍앤컴퍼니,,252190,90몰,
28859531,ASUS ROG STRIX Z790-F GAMING WIFI II 인텍앤컴퍼니,,729120,1몰,
28860020,ASUS TUF Gaming Z790-PRO WIFI 인텍앤컴퍼니,,759810,1몰,
29309096,MSI MAG Z790 토마호크 맥스 WIFI,,364640,112몰,
29393921,ASUS PRIME H610I-PLUS 코잇,,188990,118몰,
29619623,AFOX IH110D4-MA5-V2 에즈윈,,85350,94몰,
29679326,GIGABYTE B760M AORUS ELITE X AX 피씨디렉트,,430000,4몰,
29681957,MSI PRO Z790-A 맥스 WIFI,,325650,106몰,
29687339,MSI MPG Z790 엣지 TI 맥스 WIFI,,800000,4몰,
29759561,BIOSTAR B650MT-E PRO 제이씨현,,132600,130몰,
29863127,GIGABYTE B650M AORUS ELITE AX ICE 제이씨현,,225320,220몰,
29879357,ASRock B450M-HDV R4.0 대원씨티에스,,61190,146몰,
29879744,ASRock B650M-H/M.2+ 대원씨티에스,,101900,1몰,
29880134,ASRock H610M-HVS M.2 R2.0 D4 대원씨티에스,,87430,126몰,
29880191,ASRock H610M-HVS M.2 R2.0 D4 대원씨티에스 (벌크),,86460,110몰,
29908775,ASRock B650M PG Lightning 디앤디컴,,138990,147몰,
29916821,GIGABYTE B650M AORUS ELITE AX ICE 피씨디렉트,,230370,176몰,
29916875,GIGABYTE B650 AORUS ELITE AX ICE 피씨디렉트,,267340,151몰,
29942195,ASUS PRIME H610M-D 코잇,,112720,103몰,
29942531,ASUS PRIME H610M-CS 코잇,,223860,1몰,
29960138,Supermicro H13SAE-MF STCOM,,877000,88몰,
29960348,Supermicro X12SPL-F STCOM,,1142000,1몰,
30003794,ASUS PRO WS WRX80E-SAGE SE WIFI II 대원씨티에스,,1596970,88몰,
30070400,GIGABYTE B650 AORUS ELITE AX ICE 제이씨현,,268970,164몰,
30127295,ASRock B760M-HDV/M.2 D5 에즈윈 (벌크),,131800,122몰,
30161945,ASRock B760M-HDVP D5 디앤디컴,,146000,4몰,
30162119,ASRock B760M-HDVP D5 디앤디컴 (벌크),,146910,86몰,
30167879,ASRock B650M PG Lightning + WiFi6E 모듈 패키지 디앤디컴,,176070,108몰,
30300260,ASRock B650M PG Lightning 대원씨티에스,,134490,158몰,
30311870,COLORFUL BATTLE-AX A520M-K M.2 V14 STCOM,,63060,88몰,
30621842,MSI MEG Z790 갓라이크 (해외구매),,2335980,5몰,
30622283,ASRock B650M PG Lightning + WiFi6E 모듈 패키지 에즈윈,,180000,39몰,
30638927,ASRock B760M Pro RS D5 + WiFi6E 모듈 패키지 에즈윈,,195750,47몰,
30641906,ASRock B760M PG Riptide D5 + WiFi6E 모듈 패키지 에즈윈,,198990,30몰,
31261997,GIGABYTE Z790 AORUS ELITE X THRONE AND LIBERTY EDITION 피씨디렉트,,554400,1몰,
31280975,GIGABYTE Z790 AORUS ELITE X THRONE AND LIBERTY EDITION 제이씨현,,475000,5몰,
31383614,GIGABYTE TRX50 AERO D 제이씨현,,1066890,25몰,
31426703,ASRock Z790 Nova WIFI 대원씨티에스,,574570,1몰,
31429022,Supermicro X12DPi-NT6 STCOM,,1596000,90몰,
31429109,Supermicro X12DPi-N6 STCOM,,1463680,85몰,
31463747,ECS ADLN-I N100 코잇 (무지박스),기본,167000,2몰,
31464083,ECS ADLN-I3 N100 코잇 (무지박스),기본,199000,2몰,
31472456,GIGABYTE TRX50 AERO D 피씨디렉트,,1069000,1몰,
31489457,ECS ADLN-I3 N100 코잇 (무지박스),60W 어댑터 포함,213000,1몰,
31959437,ASRock Z790 Pro RS D5 + WiFi7 모듈 패키지 디앤디컴,,367960,89몰,
31959920,ASRock B760M Pro RS D5 + WiFi7 모듈 패키지 디앤디컴,,221950,92몰,
31981667,GIGABYTE X670E AORUS PRO X 제이씨현,,770000,4몰,
31981778,GIGABYTE X670E AORUS PRO X (해외구매),,522290,18몰,
32002067,GIGABYTE H610M K D4 제이씨현 (벌크),,81500,113몰,
32036924,ASRock B760M PG LIGHTNING/D4 에즈윈,,137410,136몰,
32043872,ASUS PRO WS TRX50-SAGE WiFi (해외구매),,1751690,6몰,
32070719,GIGABYTE B650 AORUS ELITE AX V2 피씨디렉트,,268590,139몰,
32071067,GIGABYTE B650 AORUS ELITE V2 피씨디렉트,,262080,132몰,
32078006,GIGABYTE B650 AORUS ELITE V2 제이씨현,,182470,121몰,
32110508,ASRock A520M-HDVP R2.0 에즈윈 (벌크),,83280,115몰,
32126690,ASUS PRO WS TRX50-SAGE WiFi STCOM,,1409000,105몰,
32487287,ASUS PRO WS TRX50-SAGE WiFi 대원씨티에스,,1395570,100몰,
33363434,ASUS PRO WS W790E-SAGE SE 코잇,,2129000,2몰,
34372580,ASUS PRIME B760M-PLUS-CSM STCOM,,226700,132몰,
34372781,ASUS TUF Gaming B760M-PLUS II STCOM,,244000,3몰,
34373075,ASUS TUF Gaming B650-E WIFI STCOM,,311000,15몰,
34739282,ASUS PRIME H610M-CS 2.5G 코잇,,116990,8몰,
34741700,GIGABYTE B650E AORUS ELITE X AX ICE 피씨디렉트,,333510,139몰,
34741730,GIGABYTE B650E AORUS ELITE X AX ICE 제이씨현,,285000,152몰,
34810925,ASUS PRIME B760M-PLUS-CSM 인텍앤컴퍼니,,226630,108몰,
34815323,ASUS PRIME B760M-PLUS-CSM 코잇,,200990,1몰,
34815659,ASUS TUF Gaming B760M-PLUS II 코잇,,185920,166몰,
35810231,ASRock A620M-HDV/M.2 에즈윈,,135000,2몰,
36157511,ASRock A620M-HDVP 에즈윈,,108370,135몰,
36157520,ASRock A620M-HDVP 에즈윈 (벌크),,103190,117몰,
36308306,ASUS TUF Gaming B650-E WIFI 대원씨티에스,,316000,1몰,
36709451,ASRock B760M-HDV/M.2 D5 디앤디컴 (벌크),,136720,119몰,
37226114,MSI MAG B760M 박격포 II,,178110,190몰,
37286501,GIGABYTE H610M K D4 피씨디렉트 (벌크),,81650,28몰,
37286591,GIGABYTE H610M H V2 D4 피씨디렉트 (벌크),,86830,44몰,
37927508,ASUS P12R-E STCOM,,821130,1몰,
38347157,ASUS PRO WS WRX90E-SAGE SE STCOM,,2062980,101몰,
39249221,MSI PRO A620M-C EX,,116840,147몰,
40895255,ASRock B760M Pro-A 에즈윈,,171500,2몰,
42390188,MAXSUN 챌린저 H510M-H,,83400,87몰,
42860537,ASUS Z13PE-D16 STCOM,,1955980,66몰,
43546877,MAXSUN 터미네이터 B760M D5,,159000,25몰,
43557464,MAXSUN 챌린저 H610M,,128750,4몰,
45257993,ASUS PRO WS WRX90E-SAGE SE 대원씨티에스,,2055980,107몰,
46309496,GIGABYTE B650M D3HP 제이씨현,,145000,1몰,
46742996,ASRock B650M PG Lightning WiFi 디앤디컴,,189000,1몰,
48476933,ASUS TUF Gaming B650M-E STCOM,,218480,109몰,
48476972,ASUS TUF Gaming B650M-E WiFi STCOM,,235170,72몰,
48477197,GIGABYTE B650M D3HP 피씨디렉트,,133410,116몰,
49162646,ASRock B550M Pro RS 디앤디컴,,125040,150몰,
49538822,ASRock B550M Pro RS + WiFi6E 랜카드 패키지 디앤디컴,,168500,72몰,
49740182,ASRock B550M Pro RS 에즈윈,,123570,130몰,
49742366,ASRock B760M Pro-A 디앤디컴,,174840,2몰,
49995851,ASRock B550M Pro RS 대원씨티에스,,122390,136몰,
50128154,BIOSTAR A620MS 제이씨현,,124000,2몰,
50128394,BIOSTAR H610MHP 2.0 제이씨현,,88000,3몰,
53418977,MSI B650M 프로젝트 제로,,266680,126몰,
53419463,MSI B760M 프로젝트 제로,,248980,141몰,
54218069,Supermicro H13SRA-TF STCOM,,1257990,90몰,
54326459,Raspberry Pi 라즈베리 파이 4 모델 B (해외구매),8GB,121000,31몰,
54326471,Raspberry Pi 라즈베리 파이 4 모델 B (해외구매),2GB,89990,50몰,
54326486,Raspberry Pi 라즈베리 파이 4 모델 B (해외구매),4GB,101900,76몰,
54326606,GIGABYTE Z790 AORUS XTREME X ICE + AORUS 지포스 RTX 4080 SUPER XTREME ICE 패키지 피씨디렉트,,5569000,1몰,
54481319,액슬 MBAIH310 에즈윈,,79300,107몰,
54816743,ASUS Tinker Edge R (병행수입),,186610,9몰,
55468811,ASRock H510M-HDV/M.2 SE 에즈윈,,93130,142몰,
56139419,Supermicro X12SPO-F STCOM,,909000,81몰,
56139584,Supermicro X12SPO-NTF STCOM,,1189990,81몰,
56144006,ASRock A620M-HDVP 디앤디컴,,111800,88몰,
56156189,ASRock A620M-HDVP 디앤디컴 (벌크),,110770,95몰,
57295043,MSI PRO B650M-B,,124990,154몰,
58103081,KHADAS VIM3 Pro 4GB,,201300,1몰,
58103207,KHADAS VIM3 Pro 2GB (해외구매),,205000,1몰,
58115534,COLORFUL COLORFIRE B760M-MEOW WIFI D5 ORANGE STCOM,,229840,74몰,
58119920,GIGABYTE B650E AORUS PRO X USB4 제이씨현,,509000,1몰,
58623128,ASRock H610M-H2/M.2 D4 에즈윈 (벌크),,86410,89몰,
58837484,MAXSUN 챌린저 H610ITX 2LAN,,145290,91몰,
59826524,ASRock H610M-H2/M.2 D4 디앤디컴,,81020,132몰,
59827064,ASRock H610M-H2/M.2 D4 디앤디컴 (벌크),,81960,108몰,
60064028,마이크로틱 MikroTik L11UG-5HaxD,,120990,19몰,
60151763,COLORFUL BATTLE-AX B650M-PLUS V14 STCOM,,148830,120몰,
60247235,COLORFUL COLORFIRE B760M-MEOW WIFI D5 ORANGE 디앤디컴,,267860,3몰,
61423451,ASRock H610M-X D5 에즈윈,,121620,71몰,
61423463,ASRock H610M-X D5 에즈윈 (벌크),,118290,77몰,
62568890,MSI PRO B650M-A,,159070,139몰,
62636738,Supermicro H12SSL-i STCOM,,984000,30몰,
62791640,ASRock B650M PG Riptide WiFi White 에즈윈,,226990,125몰,
63035990,GIGABYTE B650E AORUS STEALTH ICE 제이씨현,,388990,13몰,
63087248,GIGABYTE B650E AORUS STEALTH ICE 피씨디렉트,,368850,108몰,
63087650,ASRock H610M-X D5 디앤디컴,,120140,131몰,
63140087,ASRock H610M-X D5 디앤디컴 (벌크),,120960,93몰,
63269363,ASRock B650M PG Riptide WiFi White 디앤디컴,,248490,89몰,
63478082,ASRock B650M PG Riptide WiFi White 대원씨티에스,,235660,9몰,
63478493,KHADAS VIM4 8GB,,284900,3몰,
63478505,KHADAS VIM4 8GB (해외구매),,273710,10몰,
63938699,GIGABYTE TRX50 AI TOP 제이씨현,,1398960,43몰,
64267934,GIGABYTE TRX50 AI TOP 피씨디렉트,,1300000,1몰,
64375265,GIGABYTE H610M H V2 피씨디렉트,,112310,117몰,
64394135,ASRock B650 스틸레전드 WiFi 디앤디컴,,320700,95몰,
65307479,GIGABYTE H610M S2H V2 피씨디렉트,,122600,108몰,
66046067,GIGABYTE H610M S2H V2 제이씨현,,124690,170몰,
66046259,GIGABYTE H610M H V2 제이씨현,,114950,146몰,
66046349,GIGABYTE H610M K V2 제이씨현,,101860,172몰,
67371704,ASRock Rack SP2C621D16-2T 명인일렉트로닉스,,2598240,2몰,
67372934,ASRock H510M-HDV/M.2 SE 디앤디컴,,95950,136몰,
67373036,ASRock H510M-HDV/M.2 SE 디앤디컴 (벌크),,94960,101몰,
67622027,ASRock H610M-X D5 대원씨티에스,,123000,1몰,
67678283,GIGABYTE H610M K V2 피씨디렉트,,98950,115몰,
67693886,ASUS PRIME X870-P WIFI-CSM STCOM,,376900,127몰,
67693952,ASUS PRIME X870-P-CSM STCOM,,356180,110몰,
67694132,ASUS ProArt X870E-CREATOR WIFI STCOM,,777980,115몰,
67694456,ASUS ROG CROSSHAIR X870E HERO STCOM,,914890,126몰,
67694840,ASUS ROG STRIX X870-A GAMING WIFI STCOM,,540950,108몰,
67694921,ASUS ROG STRIX X870E-E GAMING WIFI STCOM,,770400,129몰,
67695545,ASUS ROG STRIX X870-F GAMING WIFI STCOM,,711770,102몰,
67695563,ASUS TUF Gaming X870-PLUS WIFI STCOM,,452980,127몰,
67695641,ASRock X870 Pro RS 에즈윈,,308650,124몰,
67845767,GIGABYTE X870E AORUS MASTER 제이씨현,,698990,24몰,
67845785,GIGABYTE X870E AORUS PRO ICE 제이씨현,,429700,206몰,
67845815,GIGABYTE X870 AORUS ELITE WIFI7 제이씨현,,371990,193몰,
67845863,GIGABYTE X870 AORUS ELITE WIFI7 ICE 제이씨현,,372870,199몰,
67846052,GIGABYTE X870 EAGLE WIFI7 제이씨현,,313530,173몰,
67847060,ASRock X870 스틸레전드 WiFi 에즈윈,,475000,1몰,
67847474,GIGABYTE X870 AORUS ELITE WIFI7 피씨디렉트,,366840,151몰,
67847492,GIGABYTE X870 AORUS ELITE WIFI7 ICE 피씨디렉트,,377370,160몰,
67847543,GIGABYTE X870E AORUS MASTER 피씨디렉트,,682720,127몰,
67847609,GIGABYTE X870E AORUS PRO ICE 피씨디렉트,,423110,169몰,
67850639,ASRock X870E Taichi 에즈윈,,773769,129몰,
67851653,ASUS PRIME X870-P WIFI-CSM 대원씨티에스,,364500,115몰,
67851971,ASUS PRIME X870-P-CSM 대원씨티에스,,361700,85몰,
67852106,ASUS ProArt X870E-CREATOR WIFI 대원씨티에스,,738990,116몰,
67852211,ASUS ROG CROSSHAIR X870E HERO 대원씨티에스,,910190,128몰,
67852265,ASUS ROG STRIX X870-A GAMING WIFI 대원씨티에스,,530960,100몰,
67852370,MSI MAG X870 토마호크 WIFI,,454260,174몰,
67852469,MSI PRO X870-P WIFI,,375880,141몰,
67852652,MSI MPG X870E 카본 WIFI,,657740,160몰,
67852706,GIGABYTE X870 EAGLE WIFI7 피씨디렉트,,319930,142몰,
67852766,ASUS ROG STRIX X870E-E GAMING WIFI 대원씨티에스,,715000,101몰,
67852793,ASUS ROG STRIX X870-F GAMING WIFI 대원씨티에스,,724990,84몰,
67852838,ASUS TUF Gaming X870-PLUS WIFI 대원씨티에스,,466740,122몰,
67852946,ASUS ROG STRIX X870-I GAMING WIFI 대원씨티에스,,754990,93몰,
67852967,ASRock X870E Nova WiFi 에즈윈,,534410,126몰,
67976948,ASUS ROG STRIX X870-I GAMING WIFI STCOM,,734910,111몰,
68242061,ASRock X870 스틸레전드 WiFi 대원씨티에스,,371970,109몰,
68242124,ASRock X870 Pro RS WiFi 대원씨티에스,,336270,79몰,
68242145,ASRock X870 Pro RS 대원씨티에스,,303010,123몰,
68246816,ASRock X870E Taichi 대원씨티에스,,835000,1몰,
68440085,ASRock X870E Taichi 디앤디컴,,766990,114몰,
68440103,ASRock X870 스틸레전드 WiFi 디앤디컴,,373940,110몰,
68687615,ASRock Z890 Pro RS 에즈윈,,363160,153몰,
68687816,ASRock Z890 Pro RS WiFi White 에즈윈,,406290,145몰,
68776211,ASRock Z890 Taichi 에즈윈,,798980,122몰,
68919209,ASRock Z890 Pro-A 에즈윈,,326010,139몰,
69053765,ASRock Z890 Pro-A WiFi 에즈윈,,346320,133몰,
69468680,ASRock H610M-X D5 인텍앤컴퍼니 (벌크),,121990,94몰,
69468782,ASRock H610M-HVS M.2 R2.0 D4 인텍앤컴퍼니,,90050,142몰,
69468977,ASRock B760M Pro-A 인텍앤컴퍼니,,143870,138몰,
69469049,ASRock B760M Pro RS D5 인텍앤컴퍼니,,183750,112몰,
69471116,ASRock Z890I Nova WiFi 에즈윈,,508190,106몰,
69471320,ASRock Z890 Nova WiFi 에즈윈,,613010,117몰,
69566399,ASUS ROG MAXIMUS Z890 APEX 인텍앤컴퍼니,,944970,123몰,
69566516,ASUS ROG MAXIMUS Z890 EXTREME 인텍앤컴퍼니,,1389990,121몰,
69566996,ASUS ROG MAXIMUS Z890 HERO 인텍앤컴퍼니,,815000,132몰,
69656168,ASUS ROG STRIX Z890-A GAMING WIFI 인텍앤컴퍼니,,529440,134몰,
69656276,ASUS ROG STRIX Z890-E GAMING WIFI 인텍앤컴퍼니,,699000,126몰,
69656426,ASUS ROG STRIX Z890-F GAMING WIFI 인텍앤컴퍼니,,685960,126몰,
69656816,ASUS PRIME Z890-P WIFI-CSM 인텍앤컴퍼니,,397370,109몰,
69656858,ASUS PRIME Z890-P-CSM 인텍앤컴퍼니,,339190,132몰,
69661004,ASUS Z890 AYW GAMING WIFI W 인텍앤컴퍼니,,388980,118몰,
69661214,ASUS ProArt Z890-CREATOR WIFI 인텍앤컴퍼니,,770530,97몰,
69661250,ASUS PRIME Z890-P WIFI-CSM STCOM,,392500,125몰,
69661526,ASUS PRIME Z890-P-CSM STCOM,,335150,132몰,
69661643,ASUS ROG MAXIMUS Z890 APEX STCOM,,974990,120몰,
69661691,ASUS ROG MAXIMUS Z890 EXTREME STCOM,,1457890,139몰,
69661799,ASUS ROG MAXIMUS Z890 HERO STCOM,,961890,140몰,
69662105,ASUS ROG STRIX Z890-E GAMING WIFI STCOM,,782290,132몰,
69662114,ASUS ROG STRIX Z890-F GAMING WIFI STCOM,,707990,133몰,
69662153,ASUS ROG STRIX Z890-I GAMING WIFI STCOM,,768060,99몰,
69662171,ASUS TUF Gaming Z890-PRO WIFI STCOM,,437300,136몰,
69662327,ASUS Z890 AYW GAMING WIFI W STCOM,,428990,110몰,
69696089,ASUS PRIME Z890-P WIFI-CSM 코잇,,399000,12몰,
69696269,ASUS PRIME Z890-P-CSM 코잇,,335980,127몰,
69696464,ASUS PRIME Z890M-PLUS WIFI-CSM 코잇,,365490,115몰,
69696563,ASUS ProArt Z890-CREATOR WIFI 코잇,,775410,95몰,
69696602,ASUS ROG MAXIMUS Z890 APEX 코잇,,950110,110몰,
69696641,ASUS ROG MAXIMUS Z890 EXTREME 코잇,,1347240,106몰,
69696719,ASUS ROG MAXIMUS Z890 HERO 코잇,,919000,105몰,
69696863,ASUS ROG STRIX Z890-E GAMING WIFI 코잇,,701220,119몰,
69696959,ASUS ROG STRIX Z890-F GAMING WIFI 코잇,,650980,119몰,
69697016,ASUS ROG STRIX Z890-I GAMING WIFI 코잇,,718210,109몰,
69697058,ASUS TUF Gaming Z890-PLUS WIFI 코잇,,418990,85몰,
69697280,ASUS Z890 AYW GAMING WIFI W 코잇,,361210,111몰,
69697592,MSI MEG Z890 에이스,,944520,119몰,
69697766,MSI MAG Z890 토마호크 WIFI,,444060,154몰,
69697916,MSI PRO Z890-A WIFI,,388980,128몰,
69698066,MSI MPG Z890 카본 WIFI,,643520,142몰,
69698492,MSI MPG Z890 엣지 TI WIFI,,548980,140몰,
69698594,MSI MEG Z890 유니파이-X,,698980,143몰,
69698756,GIGABYTE Z890 AORUS MASTER 제이씨현,,658990,8몰,
69698870,GIGABYTE Z890 AORUS PRO ICE 제이씨현,,427800,176몰,
69699071,GIGABYTE Z890 AORUS ELITE WIFI7 ICE 제이씨현,,381060,181몰,
69699182,GIGABYTE Z890 AORUS ELITE WIFI7 제이씨현,,372770,152몰,
69699317,GIGABYTE Z890 UD 제이씨현,,324410,173몰,
