18007499,ASRock B650E 스틸레전드 WiFi 대원씨티에스,,374090,82몰,
18021440,ASUS TUF Gaming B650M-PLUS 대원씨티에스,,239630,117몰,
18021491,ASUS TUF Gaming B650M-PLUS WIFI 대원씨티에스,,265400,123몰,
18021581,ASUS TUF Gaming B650-PLUS 대원씨티에스,,273860,158몰,
18021662,ASUS TUF Gaming B650-PLUS WIFI 대원씨티에스,,292180,98몰,
18021842,ASUS ROG STRIX B650-A GAMING WIFI 대원씨티에스,,385180,6몰,
18021965,ASUS ROG STRIX B650E-E GAMING WIFI 대원씨티에스,,401900,78몰,
18036947,MSI B550M PRO-VDH WIFI,,138760,109몰,
18036965,MSI B550M PRO-VDH WIFI (해외구매),,132010,156몰,
18039902,ASRock B650 LiveMixer 디앤디컴,,388540,26몰,
18044417,ASUS TUF Gaming Z790-PLUS D4 인텍앤컴퍼니,,325000,43몰,
18044462,ASUS TUF Gaming Z790-PLUS WIFI D4 인텍앤컴퍼니,,418590,7몰,
18044519,ASUS TUF Gaming B650M-PLUS STCOM,,249910,139몰,
18044522,ASUS TUF Gaming B650M-PLUS WIFI STCOM,,274980,115몰,
18044549,ASUS TUF Gaming B650-PLUS STCOM,,306270,119몰,
18044558,ASUS TUF Gaming B650-PLUS WIFI STCOM,,333480,139몰,
18044567,ASUS ROG STRIX B650-A GAMING WIFI STCOM,,363980,134몰,
18044582,ASUS ROG STRIX B650E-E GAMING WIFI STCOM,,409600,139몰,
18052067,ASRock Z790 Pro RS D5 에즈윈,,338800,128몰,
18052187,ASRock Z790 Pro RS/D4 에즈윈,,405490,1몰,
18052283,ASRock Z790 PG Lightning/D4 에즈윈,,310800,2몰,
18052340,ASRock Z790 PG Lightning D5 에즈윈,,277390,129몰,
18052667,ASRock Z790 Taichi D5 에즈윈,,898990,4몰,
18053897,ASRock Z790 LiveMixer D5 에즈윈,,368450,95몰,
18054518,ASUS PRIME Z790M-PLUS D4-CSM 코잇,,390000,2몰,
18054638,ASUS PRIME Z790-P D4-CSM 코잇,,1431660,1몰,
18054803,ASUS PRIME Z790-P-CSM 코잇,,332850,144몰,
18054881,ASUS PRIME Z790-P WIFI-CSM 코잇,,357320,119몰,
18054935,ASUS PRIME Z790M-PLUS D4-CSM 인텍앤컴퍼니,,428000,1몰,
18057965,ASUS PRIME Z790M-PLUS D4-CSM STCOM,,324980,99몰,
18058475,ASUS PRIME Z790-A WIFI-CSM STCOM,,472990,130몰,
18059252,ASUS ROG STRIX Z790-A GAMING WIFI D4 STCOM,,530740,118몰,
18059426,ASUS ROG STRIX Z790-E GAMING WIFI STCOM,,701990,3몰,
18059516,ASUS ROG STRIX Z790-F GAMING WIFI STCOM,,560980,86몰,
18059699,ASUS ROG STRIX Z790-I GAMING WIFI STCOM,,610770,122몰,
18059849,ASUS ROG MAXIMUS Z790 HERO STCOM,,987990,8몰,
18060347,GIGABYTE Z790 AORUS MASTER 피씨디렉트,,843500,1몰,
18060350,GIGABYTE Z790 AORUS ELITE 피씨디렉트,,348890,26몰,
18060353,ASRock Z790 Pro RS D5 디앤디컴,,323200,129몰,
18060359,ASRock Z790 PG Lightning/D4 디앤디컴,,292800,1몰,
18060362,ASRock Z790 PG Lightning D5 디앤디컴,,277390,46몰,
18060365,ASRock Z790M PG Lightning/D4 디앤디컴,,269000,2몰,
18060371,ASRock Z790M-ITX WiFi D5 디앤디컴,,388560,94몰,
18060374,ASRock Z790 스틸레전드 WiFi D5 디앤디컴,,407000,18몰,
18060377,ASRock Z790 LiveMixer D5 디앤디컴,,379890,58몰,
18060380,MSI PRO Z790-A WIFI DDR4,,439190,4몰,
18060383,MSI PRO Z790-A WIFI,,473800,2몰,
18060389,MSI MPG Z790 엣지 WIFI DDR4,,368460,109몰,
18060395,MSI MPG Z790 카본 WIFI,,505880,126몰,
18060779,ASUS ROG STRIX X670E-F GAMING WIFI 대원씨티에스,,955500,1몰,
18060878,ASUS ROG CROSSHAIR X670E HERO 대원씨티에스,,1223820,2몰,
18109313,MSI PRO H610M-E DDR4,,87760,160몰,
18112316,GIGABYTE Z790 AORUS ELITE 제이씨현,,343280,40몰,
18112607,GIGABYTE B650 AERO G 피씨디렉트,,377060,116몰,
18113015,GIGABYTE B650M AORUS ELITE AX 피씨디렉트,,245380,131몰,
18113240,GIGABYTE B650M DS3H 듀러블에디션 피씨디렉트,,266000,1몰,
18128375,ASUS PRIME B650-PLUS STCOM,,306980,133몰,
18140852,ASUS ProArt B650-CREATOR STCOM,,440000,16몰,
18154367,ASUS PRIME B650M-A WIFI 대원씨티에스,,281620,2몰,
18154397,ASUS PRIME B650-PLUS 대원씨티에스,,315240,2몰,
18154490,ASUS ProArt B650-CREATOR 대원씨티에스,,420000,8몰,
18157412,GIGABYTE B650M DS3H 듀러블에디션 제이씨현,,304700,3몰,
18165161,GIGABYTE B650M AORUS ELITE 피씨디렉트,,231280,140몰,
18167522,MSI MPG Z790 엣지 WIFI,,476000,37몰,
18167699,MSI MAG Z790 토마호크 WIFI,,517440,1몰,
18169370,ASUS ROG MAXIMUS Z790 HERO 인텍앤컴퍼니,,997990,23몰,
18169559,ASUS ROG STRIX Z790-E GAMING WIFI 인텍앤컴퍼니,,769000,1몰,
18169658,ASUS ROG STRIX Z790-F GAMING WIFI 인텍앤컴퍼니,,804000,1몰,
18172115,MSI MPG B650 엣지 WIFI,,345260,97몰,
18173051,ASUS ROG STRIX B650E-F GAMING WIFI STCOM,,375770,81몰,
18189497,GIGABYTE B650 AORUS ELITE 피씨디렉트,,328000,3몰,
18204860,MSI MPG Z790 엣지 WIFI DDR4 (해외구매),,1021100,1몰,
18221786,MSI MPG Z790I 엣지 WIFI (해외구매),,359440,91몰,
18222359,MSI MPG X670E 카본 WiFi (해외구매),,451960,41몰,
18222548,MSI PRO X670-P WiFi (해외구매),,387950,31몰,
18223226,MSI MAG B650 토마호크 WIFI (해외구매),,212620,177몰,
18254819,ASUS ROG MAXIMUS Z790 HERO 코잇,,1045000,1몰,
18254966,ASUS ROG STRIX Z790-E GAMING WIFI 코잇,,688010,27몰,
18255077,ASUS ROG STRIX Z790-F GAMING WIFI 코잇,,527500,18몰,
18255188,ASUS ROG STRIX Z790-I GAMING WIFI 코잇,,595340,92몰,
18261176,GIGABYTE Z790 AORUS ELITE AX 피씨디렉트,,376870,137몰,
18261245,GIGABYTE Z790 UD 피씨디렉트,,301490,117몰,
18264857,GIGABYTE Z790 AORUS ELITE AX 제이씨현,,388900,88몰,
18265187,GIGABYTE Z790 UD 제이씨현,,307780,145몰,
18265439,BIOSTAR B550MX/E PRO 이엠텍,,107340,118몰,
18265715,ASUS ROG STRIX B650E-F GAMING WIFI 대원씨티에스,,354990,74몰,
18274538,ASRock Z790 스틸레전드 WiFi D5 에즈윈,,404800,124몰,
18295433,GIGABYTE Z790 GAMING X 피씨디렉트,,430000,2몰,
18301766,MSI PRO H610M-G DDR4 (해외구매),,107560,128몰,
18312236,GIGABYTE Z790 AERO G 피씨디렉트,,445050,35몰,
18319445,MSI MPG Z790 카본 WIFI (해외구매),,330950,52몰,
18342989,MSI MEG Z790 에이스 (해외구매),,662050,36몰,
18344078,GIGABYTE Z790 AORUS ELITE AX (해외구매),,346540,33몰,
18348485,ASRock Z790 Pro RS WiFi D5 에즈윈,,388980,90몰,
18375494,ASUS ROG STRIX B650E-I GAMING WIFI 대원씨티에스,,389000,4몰,
18376385,ASUS ROG STRIX B650E-I GAMING WIFI STCOM,,418980,132몰,
18397403,GIGABYTE B560M AORUS PRO AX (해외구매),,257990,5몰,
18397637,ASUS TUF Gaming H670-PRO WIFI D4 (해외구매),,391390,3몰,
18400013,MSI MAG Z790 토마호크 WIFI (해외구매),,288770,234몰,
18403331,ASRock A520M-HDV 대원씨티에스,,70620,115몰,
18403334,ASRock B550M-HDV 대원씨티에스,,92320,122몰,
18420125,GIGABYTE B450M K 피씨디렉트,,69440,98몰,
18448628,MSI MPG B650I 엣지 WIFI,,347630,77몰,
18449468,MSI MPG B650I 엣지 WIFI (해외구매),,303770,80몰,
18460412,GIGABYTE Z790 AORUS XTREME 제이씨현,,1550000,1몰,
18474035,ASUS ROG STRIX Z790-I GAMING WIFI 인텍앤컴퍼니,,696990,54몰,
18485645,ASRock Z790 Pro RS WiFi D5 디앤디컴,,348100,118몰,
18523409,ASUS PRIME H610M-K D4 아이보라,,90290,88몰,
18557519,GIGABYTE A520M K 제이씨현,,82790,4몰,
18584546,GIGABYTE Z790 AORUS TACHYON 피씨디렉트,,876430,106몰,
18599705,ASUS TUF Gaming Z790-PLUS WIFI 인텍앤컴퍼니,,385200,73몰,
18645737,ASRock B760M Pro RS/D4 WiFi 에즈윈,,215330,1몰,
18645974,ASRock B760 Pro RS D5 에즈윈,,225270,132몰,
18646154,ASRock B760M PG SONIC WiFi D5 에즈윈,,211260,125몰,
18646550,ASRock B760M 스틸레전드 WiFi D5 에즈윈,,190000,121몰,
18646934,ASRock B760M PG Riptide D5 에즈윈,,171740,137몰,
18649769,GIGABYTE B760M GAMING X D4 제이씨현,,195000,1몰,
18649997,GIGABYTE B760M AORUS ELITE 제이씨현,,185050,208몰,
18650078,GIGABYTE B760M AORUS ELITE D4 제이씨현,,181960,135몰,
18650483,GIGABYTE B760M DS3H D4 제이씨현,,136950,164몰,
18650654,GIGABYTE B760 AORUS ELITE D4 제이씨현,,285000,1몰,
18651329,GIGABYTE B760M GAMING X D4 피씨디렉트,,194990,4몰,
18651404,GIGABYTE B760 AORUS ELITE D4 피씨디렉트,,238310,44몰,
18651431,GIGABYTE B760M AORUS ELITE 피씨디렉트,,185030,183몰,
18651506,GIGABYTE B760M AORUS ELITE AX 피씨디렉트,,218870,148몰,
18651545,GIGABYTE B760M AORUS ELITE D4 피씨디렉트,,166680,63몰,
18651560,GIGABYTE B760M DS3H D4 피씨디렉트,,136890,167몰,
18651962,GIGABYTE B760 AORUS MASTER D4 피씨디렉트,,298990,13몰,
18652151,ASRock B760 Pro RS D5 디앤디컴,,229900,127몰,
18652196,ASRock B760M PG SONIC WiFi D5 디앤디컴,,216070,103몰,
18652220,ASRock B760M Pro RS/D4 디앤디컴,,199000,2몰,
18652442,ASUS PRIME B760M-K D4 코잇,,155470,81몰,
18652511,ASUS EX B760M-V5 D4 코잇,,155710,84몰,
18652586,ASRock B760M PG Riptide D5 디앤디컴,,178960,46몰,
18652601,ASRock B760M 스틸레전드 WiFi D5 디앤디컴,,229000,51몰,
18652865,MSI MAG B760 토마호크 WIFI,,227780,153몰,
18652868,MSI MAG B760 토마호크 WIFI DDR4,,287000,2몰,
18652871,MSI MAG B760M 박격포,,195000,13몰,
18652877,MSI MAG B760M 박격포 맥스 WIFI,,211710,186몰,
18652883,MSI PRO B760M-A WIFI DDR4,,243930,4몰,
18652886,MSI PRO B760M-G DDR4,,131070,99몰,
18652889,MSI PRO B760M-P DDR4,,128880,156몰,
18652895,ASUS PRIME B760M-K D4 STCOM,,178660,124몰,
18652898,ASUS PRIME B760M-A D4 STCOM,,210880,123몰,
18652901,ASUS PRIME B760M-A WIFI D4 STCOM,,233680,129몰,
18652904,ASUS ProArt B760-CREATOR D4 STCOM,,387000,5몰,
18662405,ASUS ROG STRIX B760-A GAMING WIFI D4 STCOM,,388990,106몰,
18662558,ASUS ROG STRIX B760-F GAMING WIFI STCOM,,436880,107몰,
18662669,ASUS ROG STRIX B760-G GAMING WIFI D4 STCOM,,281980,107몰,
18662789,ASUS ROG STRIX B760-I GAMING WIFI STCOM,,362880,120몰,
18663323,COLORFUL BATTLE-AX B760M-PLUS V20 D5 STCOM,,160010,104몰,
18663455,GIGABYTE H610M K D4 피씨디렉트,,81480,147몰,
18670778,GIGABYTE H610M K D4 제이씨현,,82500,168몰,
18716924,ASUS ROG STRIX B760-I GAMING WIFI 코잇,,337220,110몰,
18718829,ASRock B650 Pro RS 대원씨티에스,,249090,136몰,
18718865,ASRock B650 LiveMixer 대원씨티에스,,235810,100몰,
18719444,ASUS ROG STRIX B760-A GAMING WIFI D4 코잇,,317960,86몰,
18725312,ASUS PRIME B760M-K D4 인텍앤컴퍼니,,136790,110몰,
18725330,ASUS ROG STRIX B760-A GAMING WIFI D4 인텍앤컴퍼니,,325980,82몰,
18725342,ASUS ROG STRIX B760-G GAMING WIFI D4 인텍앤컴퍼니,,289000,1몰,
18725357,ASUS ROG STRIX B760-I GAMING WIFI 인텍앤컴퍼니,,376000,1몰,
18725831,ASUS TUF Gaming B760M-PLUS D4 인텍앤컴퍼니,,392400,1몰,
18742877,ASRock B660M-HDVP/D5 R2.0 디앤디컴,,134890,27몰,
18780872,GIGABYTE B760 AORUS ELITE 피씨디렉트,,238910,145몰,
18781067,GIGABYTE B760 AORUS ELITE AX 피씨디렉트,,241590,105몰,
18781991,GIGABYTE B760M DS3H 피씨디렉트,,147390,169몰,
18813608,GIGABYTE B760M DS3H 제이씨현,,147220,190몰,
18815033,GIGABYTE B760 AORUS ELITE 제이씨현,,236730,95몰,
18815243,GIGABYTE B760 GAMING X 제이씨현,,250000,6몰,
18841790,ASUS ProArt Z790-CREATOR WIFI 인텍앤컴퍼니,,786990,6몰,
18863900,GIGABYTE A520M K 피씨디렉트,,83600,1몰,
18917408,X470 (중고),,157000,2몰,
18967931,NZXT N7 Z790 Matte White,,456080,86몰,
18975980,NZXT N7 B650E Matte Black,,498000,4몰,
18976055,NZXT N7 B650E Matte White,,477030,91몰,
18981086,GIGABYTE B760 GAMING X 피씨디렉트,,251500,5몰,
18993305,GIGABYTE B760M AORUS ELITE AX 제이씨현,,216990,38몰,
19068557,ASUS PRIME H610M-D D4 아이보라,,118060,2몰,
19090373,GIGABYTE B760M GAMING X 피씨디렉트,,209110,5몰,
19098683,GIGABYTE B760M GAMING X 제이씨현,,221250,1몰,
19163258,ASUS PRIME B650M-A II STCOM,,181780,128몰,
19170107,GIGABYTE H610M S2H V2 D4 듀러블에디션 피씨디렉트,,114030,112몰,
19177262,BIOSTAR B760MZ-E PRO D5 이엠텍,,142490,135몰,
19240112,ECS H610H7-TI5 코잇,기본,147000,3몰,
19240121,ECS H610H7-TI5 코잇,120W 어댑터 포함,174990,2몰,
19241759,MSI PRO B760M-A WIFI,,167760,159몰,
19242146,GIGABYTE H610M S2H V2 D4 듀러블에디션 제이씨현,,114960,156몰,
19306598,ASUS TUF Gaming B760-PLUS WIFI 인텍앤컴퍼니,,288000,2몰,
19356875,GIGABYTE B760M GAMING D4 피씨디렉트,,132520,116몰,
19427744,ASUS TUF Gaming B760-PLUS WIFI STCOM,,286880,136몰,
19429325,ASUS PRIME B760-PLUS STCOM,,264980,124몰,
19431530,GIGABYTE A520M K V2 피씨디렉트,,59990,114몰,
19480850,ASUS Z590 WIFI GUNDAM EDITION (해외구매),,385280,3몰,
19498640,ASRock B760M Pro RS D5 디앤디컴,,169700,122몰,
19523846,COLORFUL H610M-E M.2 V20 D4 STCOM,,84790,77몰,
19536062,ASRock B760M Pro RS D5 에즈윈,,174990,143몰,
19536692,ASRock B650M-HDV/M.2 에즈윈,,163990,132몰,
19554155,ASUS WS C422 SAGE/10G STCOM,,1269990,10몰,
19556108,ASUS PRO WS WRX80E-SAGE SE WIFI STCOM,,1470990,17몰,
19556732,ASUS PRO WS W680-ACE IPMI STCOM,,629980,95몰,
19556996,ASUS PRO WS W680-ACE STCOM,,512780,101몰,
19566989,ASRock Z790 PG Lightning SE D5 에즈윈 (벌크),,268920,95몰,
19605602,ASUS PRIME B760M-A STCOM,,167480,131몰,
19606709,ASUS ROG STRIX B760-A GAMING WIFI STCOM,,339980,112몰,
19606931,ASUS ROG STRIX B760-G GAMING WIFI STCOM,,275780,118몰,
19607402,ASUS TUF Gaming B760M-E D4 STCOM,,208780,87몰,
19608158,ASUS TUF Gaming B760M-PLUS STCOM,,215000,8몰,
19608629,ASUS TUF Gaming B760M-PLUS WIFI STCOM,,257000,6몰,
19610558,GIGABYTE H610M S2H 듀러블에디션 제이씨현,,120990,58몰,
19619507,GIGABYTE H610M H 듀러블에디션 제이씨현,,114480,132몰,
19627259,ASRock B650M-HDV/M.2 대원씨티에스,,158920,130몰,
19627397,ASRock B550M Phantom Gaming 4 대원씨티에스,,103140,99몰,
19628207,ASUS TUF Gaming B760M-PLUS 코잇,,183060,97몰,
19648718,ASRock B650 Pro RS + WiFi6E 모듈 패키지 디앤디컴,,379320,1몰,
19649354,ASRock B650 PG Lightning + WiFi6E 모듈 패키지 디앤디컴,,349000,3몰,
19673210,ASUS PRIME B760M-A WIFI STCOM,,213400,113몰,
19673600,GIGABYTE A620M GAMING X 제이씨현,,165230,32몰,
19673975,ECS DURATHON2 B760H7-M8 코잇 (벌크),,142300,65몰,
19691519,ASUS PRIME B650M-A II 대원씨티에스,,156160,137몰,
19692893,GIGABYTE H610M H 듀러블에디션 피씨디렉트,,114570,95몰,
19704527,ASUS PRIME B760M-A 코잇,,154840,106몰,
19705316,MSI PRO A620M-E,,107760,157몰,
19719305,GIGABYTE H310M HD2 2.0 듀러블에디션 (중고),,156000,1몰,
19719872,MSI H110M PRO-VD PLUS (중고),,60000,1몰,
19725047,ASRock H610M-HDVP/D5 R2.0 디앤디컴 (벌크),,116590,15몰,
19725299,GIGABYTE A620M GAMING X 피씨디렉트,,167560,128몰,
19753526,ECS DURATHON2 B760H7-M8 코잇,,143370,70몰,
19755890,ASRock A620M-HDV/M.2+ 에즈윈,,118990,131몰,
19756130,ASUS PRIME B760-PLUS 코잇,,253220,116몰,
19756199,ASUS TUF Gaming B760-PLUS WIFI 코잇,,247740,112몰,
19772375,ASUS PRIME B760M-A 인텍앤컴퍼니,,158340,109몰,
19772489,ASUS PRIME B760M-A WIFI 인텍앤컴퍼니,,198520,6몰,
19772519,ASUS PRIME B760-PLUS 인텍앤컴퍼니,,246000,1몰,
19772603,ASUS ROG STRIX B760-A GAMING WIFI 인텍앤컴퍼니,,319940,2몰,
19772675,ASUS ROG STRIX B760-G GAMING WIFI 인텍앤컴퍼니,,215800,3몰,
19772732,ASUS TUF Gaming B760M-PLUS 인텍앤컴퍼니,,178990,135몰,
19772786,ASUS TUF Gaming B760M-PLUS WIFI 인텍앤컴퍼니,,230000,10몰,
19827572,ASRock A620M-HDV/M.2+ 디앤디컴,,115990,135몰,
19827944,ASRock A620M-HDV/M.2 디앤디컴,,110470,169몰,
19834694,GIGABYTE H610M S2H 듀러블에디션 피씨디렉트,,122000,12몰,
19868960,GIGABYTE B760M H D4 제이씨현,,136590,6몰,
19903283,ASUS ROG STRIX B760-A GAMING WIFI 코잇,,378750,1몰,
19903481,ASUS ROG STRIX B760-G GAMING WIFI 코잇,,215220,158몰,
19903640,ASUS TUF Gaming B760M-PLUS WIFI 코잇,,258000,1몰,
19919207,GIGABYTE Z790 AORUS ELITE AX-W 피씨디렉트,,394650,130몰,
19924310,ASUS PRIME A620M-A STCOM,,128940,146몰,
19925807,ASUS TUF Gaming A620M-PLUS STCOM,,178480,128몰,
19926059,ASUS TUF Gaming A620M-PLUS WIFI STCOM,,198980,123몰,
19926275,GIGABYTE Z790 AORUS ELITE AX-W 제이씨현,,409000,2몰,
19926611,ASUS PRIME A620M-A 대원씨티에스,,123430,89몰,
19926731,ASUS TUF Gaming A620M-PLUS 대원씨티에스,,140040,140몰,
19927037,ASUS TUF Gaming A620M-PLUS WIFI 대원씨티에스,,172830,128몰,
19927871,ASUS P12R-I STCOM,,392980,97몰,
19936247,ASRock A620M-HDV/M.2 대원씨티에스,,105490,126몰,
19938515,GIGABYTE H610M K 제이씨현,,102000,161몰,
19996577,ASUS PRIME B650M-A WIFI II STCOM,,216280,127몰,
19999916,GIGABYTE H610M K 피씨디렉트,,101060,57몰,
20012147,ASRock Z790 Pro RS D5 + WiFi6E 모듈 패키지 디앤디컴,,358750,102몰,
20013098,ASUS ROG STRIX Z790-A GAMING WIFI STCOM,,527990,47몰,
20013806,ASUS ROG STRIX Z790-H GAMING WIFI STCOM,,545990,44몰,
20014406,ASUS PRIME Z790M-PLUS-CSM STCOM,,343370,101몰,
20027564,ASUS PRIME H510M-K R2.0 인텍앤컴퍼니,,95390,100몰,
20079008,ASUS PRIME Z790M-PLUS-CSM 코잇,,320310,92몰,
20079428,ASUS ROG STRIX Z790-A GAMING WIFI 코잇,,504430,58몰,
20101856,ASRock B760M PG Riptide D5 + WiFi6E 모듈 패키지 디앤디컴,,208960,83몰,
20103287,ASRock B760M Pro RS D5 + WiFi6E 모듈 패키지 디앤디컴,,195500,106몰,
20108249,MSI PRO B650M-P,,152060,149몰,
20119583,GIGABYTE H610M H V2 D4 피씨디렉트,,87290,147몰,
20120033,GIGABYTE B760M D2H 제이씨현,,150990,14몰,
20126900,ASRock B760M-HDVP D5 에즈윈,,139090,94몰,
20140688,ASRock A620M-HDV/M.2+ + WiFi6E 모듈 패키지 디앤디컴,,144220,109몰,
20140877,ASRock A620M-HDV/M.2 + WiFi6E 모듈 패키지 디앤디컴,,139400,150몰,
20171636,MSI PRO B760M-P,,148200,146몰,
20178734,BIOSTAR H610MH D5 이엠텍,,92140,138몰,
20225543,Supermicro X13SAE-F STCOM,,783980,77몰,
20226533,Supermicro X13SAQ STCOM,,690980,97몰,
20226770,Supermicro X13SAZ-Q STCOM,,705670,103몰,
20231597,GIGABYTE A620M S2H 피씨디렉트,,114690,110몰,
20238110,GIGABYTE A620M S2H 제이씨현,,114850,146몰,
20287199,BIOSTAR B760MXC PRO 2.0 D4 이엠텍,,134880,26몰,
20317493,ASUS PRIME B760M-K STCOM,,139980,116몰,
20317796,ASUS ProArt B760-CREATOR STCOM,,464700,88몰,
20318291,ASUS TUF Gaming A620-PRO WIFI STCOM,,276410,127몰,
20324882,GIGABYTE B650M K 제이씨현,,155400,233몰,
20343650,ASUS PRIME B760M-K 코잇,,166480,106몰,
20344700,ASUS PRIME H610M-CS D4 코잇,,83970,151몰,
20391572,ASRock B650M Pro RS 디앤디컴,,178820,161몰,
20405063,ASRock B760M PG LIGHTNING/D4 디앤디컴,,144000,3몰,
20444672,ASRock B650M Pro RS WIFI 디앤디컴,,213930,71몰,
20459081,GIGABYTE A520M K V2 제이씨현,,61000,189몰,
20462924,GIGABYTE H610M H V2 D4 제이씨현,,88780,170몰,
20506130,ASRock A620M-HDV/M.2+ 대원씨티에스,,111490,112몰,
20508416,Supermicro H12DSi-NT6 STCOM,,1404190,97몰,
20509004,Supermicro H12SSL-C STCOM,,1083410,96몰,
20524469,ASRock B760M PG LIGHTNING D5 디앤디컴,,166000,6몰,
20524634,ASRock A520M-HVS 에즈윈 (벌크),,74110,92몰,
20530115,ASRock B760M PG LIGHTNING D5 에즈윈,,172000,1몰,
20536331,ASRock B760M-HDVP D5 에즈윈 (벌크),,134890,98몰,
20578094,GIGAIPC mITX-1900A 산업용,,330000,1몰,
20593100,BIOSTAR A520MT 이엠텍,,64380,171몰,
20600042,Supermicro X13SEI-TF STCOM,,1296780,96몰,
20600072,Supermicro X13SEM-F STCOM,,1244100,99몰,
20606708,Supermicro X13SRA-TF STCOM,,1169880,104몰,
20612690,ASUS PRIME B760M-KS 코잇 (벌크),,140590,15몰,
20615138,Supermicro X13DAI-T STCOM,,1954370,96몰,
20645075,Supermicro X13DEI-T STCOM,,1783180,93몰,
20645813,Supermicro X13SWA-TF STCOM,,1498860,105몰,
20646362,Supermicro H13SSL-NT STCOM,,1323760,101몰,
20710217,ASUS PRIME B760M-K 인텍앤컴퍼니,,136670,158몰,
20738630,COLORFUL BATTLE-AX B760M-K V20 D5 STCOM,,119890,117몰,
20760632,GIGABYTE B650 GAMING X 제이씨현,,279000,1몰,
21400361,ASUS PRIME A620M-E 대원씨티에스,,119000,1몰,
21421541,ASUS TUF Gaming B650M-E 대원씨티에스,,184570,127몰,
21427535,ASUS TUF Gaming B650M-E WIFI 대원씨티에스,,194760,137몰,
21428693,ASUS PRIME A620M-K 대원씨티에스,,110970,151몰,
21497582,BIOSTAR B760MX2-E D5 이엠텍,,123490,137몰,
21518960,ASRock W790 WS 디앤디컴,,1349960,108몰,
21574646,GIGABYTE B760M D2H D4 제이씨현,,140940,97몰,
21627827,ASRock B650M Pro RS 대원씨티에스,,172900,166몰,
21628184,ASRock B650M Pro RS WiFi 대원씨티에스,,228660,109몰,
21628397,ASRock W790 WS 대원씨티에스,,1615130,1몰,
21690839,ASUS P12R-M STCOM,,456980,44몰,
21695969,ASRock A520M-HDV 대원씨티에스 (벌크),,69030,131몰,
21727307,GIGABYTE B650M K 피씨디렉트,,155410,235몰,
21731021,GIGABYTE B650M S2H 제이씨현,,157430,4몰,
21755828,ASRock B650M Pro RS + WiFi6E 모듈 패키지 디앤디컴,,211420,136몰,
21759887,GIGABYTE B650M S2H 피씨디렉트,,237100,1몰,
23548343,ASRock Z790 PG Lightning D5 + WiFi6E 모듈 패키지 디앤디컴,,313970,35몰,
25129808,ASUS PRO WS W790E-SAGE SE STCOM,,1982000,6몰,
25208807,ASUS PRO WS W790-ACE STCOM,,1496040,1몰,
25213067,ASRock A520M-HDV 에즈윈 (벌크),,71090,28몰,
25638305,ASRock W790 WS 에즈윈,,1318440,108몰,
25866491,ASRock H610M-HDV/M.2+ D5 에즈윈,,103540,157몰,
25869083,ASRock H610M-HDV/M.2+ D5 에즈윈 (벌크),,102750,117몰,
27157916,ASUS PRIME H770-PLUS 인텍앤컴퍼니,,242990,95몰,
27409910,ASRock H610M-HDV/M.2+ D5 디앤디컴,,107930,165몰,
27474755,MSI PRO B760M-A DDR4 II,,147760,172몰,
27475169,MSI PRO Z790-P WIFI,,346910,2몰,
27475223,MSI MAG X670E 토마호크 WIFI,,395360,148몰,
27499739,ASRock B760M-HDV/M.2 D5 디앤디컴,,140700,138몰,
27507986,ASUS WS X299 PRO 대원씨티에스,,671620,1몰,
27508001,ASUS WS X299 PRO-SE 대원씨티에스,,604190,94몰,
27534158,GIGABYTE H610M H V2 D4 제이씨현 (벌크),,85180,114몰,
27546074,ASRock H610M-HDV/M.2+ D5 대원씨티에스,,102400,128몰,
27547688,ASUS PRO WS W680-ACE 대원씨티에스,,568800,1몰,
27572138,ASUS PRIME H610M-E 인텍앤컴퍼니,,130000,12몰,
27576677,MSI MAG X670E 토마호크 WIFI (해외구매),,375730,109몰,
27629561,ASRock B760M-HDV/M.2 D5 에즈윈,,141990,119몰,
27633896,ASRock B760 Pro RS D5 대원씨티에스,,233690,2몰,
27634160,ASRock B760M PG Riptide D5 대원씨티에스,,172750,8몰,
27634559,ASRock B760M-HDV/M.2 D5 대원씨티에스,,134600,21몰,
27634862,ASRock H610M-HDV/M.2 R2.0 D4 대원씨티에스,,91860,129몰,
27635057,ASRock Z790 PG Lightning D5 대원씨티에스,,291590,114몰,
27635753,ASRock Z790 스틸레전드 WiFi D5 대원씨티에스,,404670,108몰,
27665717,ASUS PRIME X670-P-CSM 대원씨티에스,,404320,4몰,
27675110,ASUS PRIME H610M-E 코잇,,126010,116몰,
27679898,COLORFUL CH510M-K M.2 V20 STCOM,,86490,101몰,
27691589,NVIDIA Jetson Orin Nano Developer Kit 용량확인필요 (해외구매),,809990,14몰,
27698261,GIGABYTE H510M H V2 제이씨현,,93040,141몰,
27779696,ASRock N100M 디앤디컴,,182200,117몰,
28010348,GIGABYTE B760M E 피씨디렉트,,207600,2몰,
28029617,ASRock H610M-H2/M.2 D5 에즈윈 (벌크),,99170,61몰,
28059134,ASRock H610M-HDV/M.2+ D5 디앤디컴 (벌크),,105200,106몰,
28063598,ASRock Rack SPC621D8 명인일렉트로닉스,,1081500,51몰,
28183691,ASRock H610M-H2/M.2 D5 디앤디컴,,102470,119몰,
28183721,ASRock H610M-H2/M.2 D5 디앤디컴 (벌크),,102820,80몰,
28247648,BIOSTAR A520MS 제이씨현,,58990,140몰,
28248419,BIOSTAR B650MT 제이씨현,,96990,109몰,
28248743,BIOSTAR H610MHD D5 제이씨현,,83000,95몰,
28248950,BIOSTAR H610MS 제이씨현,,78000,125몰,
28486034,GIGABYTE Z790 AORUS ELITE X 제이씨현,,360240,152몰,
28486283,GIGABYTE Z790 AORUS ELITE X WIFI7 제이씨현,,389000,137몰,
28511822,ASUS PRIME H510M-K R2.0 STCOM,,102030,78몰,
28577999,ASUS Tinker Edge R,어댑터 포함,277200,60몰,
28581716,ASUS Tinker Edge T,어댑터 포함,141740,65몰,
28581923,ASUS Tinker board 2S/2G,어댑터 포함,164000,4몰,
28582691,ASUS EX B650M-V7 대원씨티에스,,142990,6몰,
28603964,ASRock B650M PG Lightning 에즈윈,,153990,172몰,
28779206,ASRock B760M-HDV/M.2 D5 + WiFi6E 모듈 패키지 디앤디컴,,168580,124몰,
28779371,ASRock B760 Pro RS D5 + WiFi6E 모듈 패키지 디앤디컴,,257960,125몰,
28779527,ASRock B760M PG LIGHTNING D5 + WiFi6E 모듈 패키지 디앤디컴,,196000,8몰,
28780247,ASUS PRO WS W790E-SAGE SE 대원씨티에스,,1780000,1몰,
28802609,COLORFUL CVN Z790M FROZEN D5 V20 STCOM,,291750,101몰,
28803482,ASUS ROG MAXIMUS Z790 APEX ENCORE STCOM,,1087980,134몰,
28804280,ASUS ROG MAXIMUS Z790 DARK HERO STCOM,,1085080,6몰,
28805039,ASUS ROG STRIX Z790-A GAMING WIFI II STCOM,,518990,8몰,
28805222,ASUS ROG STRIX Z790-E GAMING WIFI II STCOM,,716000,11몰,
28805396,ASUS ROG STRIX Z790-F GAMING WIFI II STCOM,,535500,116몰,
28807472,BIOSTAR B650MP-E PRO 이엠텍,,144510,132몰,
28809197,ASUS ROG STRIX Z790-A GAMING WIFI II 코잇,,642500,1몰,
28810082,ASUS ROG STRIX Z790-F GAMING WIFI II 코잇,,539000,5몰,
28826600,GIGABYTE Z790 AORUS MASTER X 피씨디렉트,,811440,110몰,
28826786,GIGABYTE Z790 AORUS ELITE X 피씨디렉트,,357420,137몰,
28827020,GIGABYTE Z790 AORUS ELITE X WIFI7 피씨디렉트,,378960,144몰,
28827605,GIGABYTE Z790 AORUS PRO X 피씨디렉트,,436930,145몰,
28827962,GIGABYTE Z790 AORUS ELITE AX ICE 피씨디렉트,,366580,155몰,
28828751,GIGABYTE Z790 AORUS MASTER X 제이씨현,,838260,148몰,
28828997,GIGABYTE Z790 AORUS PRO X 제이씨현,,444780,161몰,
28829297,GIGABYTE Z790 AORUS ELITE AX ICE 제이씨현,,389700,165몰,
28857518,ASUS PRIME H610M-K D5 인텍앤컴퍼니,,121880,85몰,
28857623,ASUS PRIME H610M-K ARGB 인텍앤컴퍼니,,120360,87몰,
28857914,ASUS TUF Gaming B760M-BTF WIFI 인텍앤컴퍼니,,293250,148몰,
28859252,ASUS ROG MAXIMUS Z790 DARK HERO 인텍앤컴퍼니,,1198990,8몰,
28859378,ASUS ROG STRIX Z790-A GAMING WIFI II 인텍앤컴퍼니,,606380,122몰,
28859429,ASUS ROG STRIX Z790-E GAMING WIFI II 인텍앤컴퍼니,,751990,11몰,
28859531,ASUS ROG STRIX Z790-F GAMING WIFI II 인텍앤컴퍼니,,539990,51몰,
28860020,ASUS TUF Gaming Z790-PRO WIFI 인텍앤컴퍼니,,506990,109몰,
29309096,MSI MAG Z790 토마호크 맥스 WIFI,,365860,158몰,
29393921,ASUS PRIME H610I-PLUS 코잇,,183860,96몰,
29619623,AFOX IH110D4-MA5-V2 에즈윈,,85700,90몰,
29621219,ASRock 라이젠 스레드리퍼 PRO 5975WX (샤갈 프로) + WRX80 Creator 대원씨티에스 패키지,,4665610,12몰,
