101073890,ADVANTECH ASMB-816-00A1,,1061000,53몰,
101074490,ASRock H610M-X D5 Gen5 디앤디컴 (벌크),,114280,80몰,
101074493,ASRock H610M-HDV/M.2 D5 Gen5 디앤디컴 (벌크),,98180,87몰,
101184890,ASUS PRIME B850M-A-CSM 인텍앤컴퍼니,,194060,84몰,
101184935,ASUS TUF Gaming B850M-PLUS WIFI7 W 인텍앤컴퍼니,,271000,104몰,
101956625,액슬 MBAIH310 R2 에즈윈,,88610,83몰,
102004853,ASUS PRIME B650EM-A 인텍앤컴퍼니,,135900,39몰,
102004859,MAXSUN 챌린저 H810M 2.5G 디앤디컴,,123440,105몰,
102004862,MAXSUN 챌린저 H810ITX WIFI 디앤디컴,,204000,91몰,
102412694,ASRock B860M-X Gen5 디앤디컴,,162480,127몰,
102412697,ASRock B860M Pro-A 디앤디컴,,176800,124몰,
102621374,ASUS TUF Gaming B860M-PLUS 코잇,,245680,65몰,
103130498,MAXSUN 챌린저 H810M-F 디앤디컴,,95060,83몰,
103182476,ASUS ROG STRIX B850-G GAMING WIFI 인텍앤컴퍼니,,402240,6몰,
103183034,ASUS TUF Gaming X870E-PLUS WIFI7 인텍앤컴퍼니,,408770,69몰,
103187819,ASRock H610TM-ITX 에즈윈 (벌크),,167350,85몰,
103187837,ASRock H610TM-ITX 에즈윈,120W 어댑터 포함,208990,3몰,
103187846,ASRock H610TM-ITX 에즈윈,180W 어댑터 포함,213130,4몰,
103188215,ASUS TUF Gaming B850M-PLUS II 인텍앤컴퍼니,,236730,99몰,
103188218,ASUS B850M MAX GAMING WIFI 인텍앤컴퍼니,,193020,95몰,
103414754,ASUS Pro H810T-CSM,어댑터 미포함,176530,4몰,
103414778,ASUS Pro H810T-CSM,120W 어댑터 포함,213130,4몰,
103414784,ASUS Pro H810T-CSM,180W 어댑터 포함,222630,4몰,
103415738,ASRock H610M-X D5 Gen5 에즈윈,,112210,80몰,
103415765,ASRock B860M-X Gen5 에즈윈 (벌크),,144780,95몰,
103415894,ADVANTECH ASMB-818I-00A1,,1224880,60몰,
103452395,MAXSUN e스포츠 B850M WIFI ICE 디앤디컴,,161580,102몰,
103694657,BIOSTAR H610MT-E D5 제이씨현,,83900,110몰,
103750595,ASRock X870 Taichi Creator 대원씨티에스,,579810,42몰,
103877579,ASRock H810TM-ITX 에즈윈 (벌크),어댑터 미포함,173840,89몰,
104325440,MSI MAG X870E 토마호크 맥스 WIFI PZ,,525000,114몰,
104554913,ASUS ROG CROSSHAIR X870E DARK HERO STCOM,,1110100,3몰,
104595728,ASRock H610M-X D5 Gen5 대원씨티에스,,98580,94몰,
104616128,ASUS PRIME H810M-K 인텍앤컴퍼니,,112990,99몰,
104628878,ASRock B860M-X Gen5 인텍앤컴퍼니,,166110,91몰,
104966219,ASRock H810M-X Gen5 에즈윈,,129350,107몰,
104966246,ASRock B860M-X Gen5 에즈윈,,163990,104몰,
104966306,GIGABYTE X870 AORUS STEALTH 피씨디렉트,,454980,103몰,
104966336,GIGABYTE B850 AORUS STEALTH 피씨디렉트,,382180,98몰,
104989463,ASUS ROG CROSSHAIR X870E DARK HERO 대원씨티에스,,1087580,92몰,
104989499,ASUS PRIME H810M-K STCOM,,121800,104몰,
104989559,ASUS PRIME A620AM-A STCOM,,121000,89몰,
105184787,ASRock H810M-X Gen5 인텍앤컴퍼니,,134000,90몰,
105813494,GIGABYTE B760M AORUS ELITE D4 GEN5 피씨디렉트,,181610,97몰,
105817802,GIGABYTE B760M AORUS ELITE D4 GEN5 제이씨현,,181480,118몰,
105968849,ASUS PRIME B550M-K ARGB 대원씨티에스,,109890,92몰,
105968858,ASUS PRIME B550M-K ARGB STCOM,,116400,96몰,
105968915,GIGABYTE B760M DS3H WIFI6E D4 GEN5 피씨디렉트,,166980,122몰,
105969083,ASRock H810M-HDVP 디앤디컴,,138540,113몰,
105969161,MSI PRO H810M-C EX,,132490,131몰,
105969170,ASRock Rack SPC741D8UD-2T/X550 명인일렉트로닉스,,1319890,40몰,
106044725,GIGABYTE B760M DS3H D4 GEN5 제이씨현,,136560,142몰,
106045001,GIGABYTE H810M H GEN5 피씨디렉트,,119380,113몰,
106045718,GIGABYTE H810M K GEN5 피씨디렉트,,110940,114몰,
106047329,GIGABYTE B760M DS3H WIFI6E D4 GEN5 제이씨현,,162890,114몰,
106220351,ASRock H810M-P Gen5 에즈윈,,105900,90몰,
106454201,GIGABYTE H810M D2HX SI GEN5 제이씨현,,125600,117몰,
106465508,GIGABYTE A620M H 피씨디렉트,,101050,89몰,
106688174,GIGABYTE H810M S2H GEN5 피씨디렉트,,130980,108몰,
106689341,ASRock H810M-P Gen5 디앤디컴,,110850,104몰,
106689347,ASRock H810M-P Gen5 디앤디컴 (벌크),,108330,89몰,
106689353,ASRock H810M-X Gen5 디앤디컴,,133960,108몰,
106689356,ASRock H810M-X Gen5 디앤디컴 (벌크),,128490,80몰,
106695713,GIGABYTE B850M AORUS PRO WIFI7 피씨디렉트,,267980,111몰,
106703318,ASUS PRIME A620AM-K 대원씨티에스,,106290,106몰,
106703432,ASUS PRIME A620AM-A 대원씨티에스,,103410,85몰,
106704263,GIGABYTE B850M FORCE V2 피씨디렉트,,164960,64몰,
106708949,ASUS PRIME B760M-A D4 코잇,,146810,84몰,
106709246,ASRock H810M-P Gen5 + WiFi6E 랜카드 패키지 디앤디컴,,136940,95몰,
106710032,ASRock H810M-X Gen5 + WiFi6E 랜카드 패키지 디앤디컴,,156800,95몰,
106717493,ASRock B850 Rock WiFi 7 에즈윈,,227050,104몰,
106717577,ASRock B850M Rock WiFi 에즈윈,,189050,101몰,
106717613,ASRock B760M Pro-A 에즈윈 (벌크),,134460,81몰,
106717637,ASRock H810M-HDVP 에즈윈 (벌크),,132050,87몰,
106727312,GIGABYTE B850M AORUS PRO WIFI7 제이씨현,,259380,129몰,
106728086,ASRock B860 Rock WiFi 7 에즈윈,,222100,104몰,
106728191,ASRock B860M Rock WiFi 에즈윈,,190620,102몰,
106728485,ASRock B850M Challenger WiFi 7 White 에즈윈,,242250,97몰,
106729391,ASRock H810M-X Gen5 + WiFi7 랜카드 패키지 디앤디컴,,177900,92몰,
106729403,ASRock H810M-P Gen5 + WiFi7 랜카드 패키지 디앤디컴,,158460,90몰,
106735550,GIGABYTE H810M D2HX SI GEN5 피씨디렉트,,126880,110몰,
106746197,ASRock H810M-P Gen5 인텍앤컴퍼니,,100000,75몰,
106746452,ASUS TUF Gaming X870-PRO WIFI7 W NEO 대원씨티에스,,407840,4몰,
106748744,ASRock B860 Rock WiFi 7 디앤디컴,,219890,107몰,
106749107,ASRock B760M Pro-A/D4 디앤디컴,,130950,114몰,
106764977,GIGABYTE X870E AORUS ELITE X3D 피씨디렉트,,436970,108몰,
106765016,GIGABYTE X870E AORUS ELITE X3D ICE 피씨디렉트,,445480,105몰,
106767464,GIGABYTE X870E AORUS ELITE X3D ICE 제이씨현,,431990,128몰,
106784549,COLORFUL BATTLE-AX B850M-T WIFI V14 도우정보,,165000,98몰,
106784699,COLORFUL BATTLE-AX B650M-E PRO V14 도우정보,,116000,114몰,
106785044,COLORFUL BATTLE-AX A520M-K M.2 V14 도우정보,,68000,112몰,
106785122,COLORFUL BATTLE-AX B760M-D PRO D4 V20 도우정보,,125000,102몰,
106785227,COLORFUL H610M-D V20A 도우정보,,75000,111몰,
107768525,ASRock B850M Challenger WiFi 7 White 디앤디컴,,228970,109몰,
107956478,ASRock B850M Challenger WiFi 7 White 대원씨티에스,,238340,103몰,
107958404,ASRock B850 Rock WiFi 7 대원씨티에스,,232210,101몰,
107960645,ASRock B850M Rock WiFi 대원씨티에스,,178230,109몰,
107989658,GIGABYTE X870E AORUS ELITE X3D 제이씨현,,432940,121몰,
108167225,ASUS PRIME H810M-X 2.5G Gen5 코잇,,120720,44몰,
108227489,GIGABYTE B850 AORUS STEALTH 제이씨현,,379000,11몰,
108227564,GIGABYTE X870 AORUS STEALTH 제이씨현,,457990,93몰,
108352127,ASRock H810TM-ITX 에즈윈 (벌크),120W 어댑터 포함,218990,3몰,
108352133,ASRock H810TM-ITX 에즈윈 (벌크),180W 어댑터 포함,228990,3몰,
108401501,ADVANTECH ASMB-817I-00A1 아이보라,,1540000,3몰,
108401528,GIGABYTE H810M K GEN5 제이씨현,,106020,127몰,
108411866,BIOSTAR A520MSP 제이씨현,,61990,80몰,
108456887,ASRock B860M Rock WiFi 인텍앤컴퍼니,,191980,71몰,
109483313,ASRock B760M Pro-A/D4 에즈윈,,136750,102몰,
109597367,GIGABYTE B760M DS3H D4 GEN5 피씨디렉트,,144980,98몰,
109680482,GIGABYTE Z890 AORUS ELITE DUO X 피씨디렉트,,465980,99몰,
122616566,MAXSUN 아이크레프트 Z890 퍼시픽 디앤디컴,,444720,80몰,
122617802,GIGABYTE Z890 AORUS ELITE WIFI7 PLUS 피씨디렉트,,396480,107몰,
122617854,GIGABYTE Z890M AORUS ELITE WIFI7 ICE 피씨디렉트,,346600,92몰,
122617914,GIGABYTE Z890M AORUS ELITE WIFI7 피씨디렉트,,328980,73몰,
122618006,GIGABYTE Z890 AORUS ELITE DUO X 제이씨현,,452880,119몰,
122618520,ASRock B550M Phantom Gaming 4 + WiFi7 랜카드 패키지 디앤디컴,,161980,78몰,
122618538,ASRock B550M Pro RS + WiFi7 랜카드 패키지 디앤디컴,,173000,73몰,
122618900,GIGABYTE Z890 AORUS ELITE WIFI7 PLUS 제이씨현,,383880,101몰,
122620820,ASRock B860M-HDVP 에즈윈 (벌크),,146670,79몰,
122621357,ASUS TUF Gaming X870-PRO WIFI7 W NEO STCOM,,409830,101몰,
122621970,ASUS PRO WS W890E-SAGE SE STCOM,,2687550,4몰,
122636609,MSI MAG B860M 박격포,,245580,34몰,
122637313,MSI PRO B760M-E DDR4,,117490,118몰,
122637941,ASUS ROG STRIX B850-F GAMING WIFI7 NEO STCOM,,434960,95몰,
122639563,MSI B850M 게이밍 플러스 WIFI6E,,206480,145몰,
122641599,ASUS ProArt B850-CREATOR WIFI NEO 대원씨티에스,,374880,27몰,
122642210,ASUS ROG STRIX X870E-E GAMING WIFI7 NEO 대원씨티에스,,910730,24몰,
122642236,ASUS ROG STRIX B850-F GAMING WIFI7 NEO 대원씨티에스,,429920,79몰,
122642245,ASUS ROG STRIX B850-A GAMING WIFI7 NEO 대원씨티에스,,381230,28몰,
122642328,ASUS TUF Gaming B850-PRO WIFI7 W NEO 대원씨티에스,,333490,48몰,
122642347,ASRock B860 Rock WiFi7 인텍앤컴퍼니,,193000,75몰,
122643555,ASUS PRIME A520M-K 인텍앤컴퍼니,,62100,77몰,
122645205,ASUS ROG STRIX X870E-A GAMING WIFI7 NEO 대원씨티에스,,683050,24몰,
122645671,BIOSTAR H810MT-E 2.0 제이씨현,,109000,86몰,
122662050,GIGABYTE X870E AERO X3D DARK WOOD 제이씨현,,562090,88몰,
122663533,ASUS ProArt B850-CREATOR WIFI NEO 인텍앤컴퍼니,,370650,4몰,
122663559,ASUS ROG STRIX B850-F GAMING WIFI7 NEO 인텍앤컴퍼니,,437360,53몰,
122663567,ASUS ROG STRIX B850-A GAMING WIFI7 NEO 인텍앤컴퍼니,,397990,49몰,
122663659,ASUS ROG STRIX X870E-A GAMING WIFI7 NEO 인텍앤컴퍼니,,681890,51몰,
122663671,ASUS TUF Gaming B850-PRO WIFI7 W NEO 인텍앤컴퍼니,,333590,52몰,
122663744,ASRock H810M-X Gen5 에즈윈 (벌크),,128140,51몰,
122669173,GIGABYTE B860M GAMING X 피씨디렉트,,188930,94몰,
122670765,ASUS ROG STRIX B850-A GAMING WIFI7 NEO STCOM,,379000,76몰,
122670803,ASUS ProArt B850-CREATOR WIFI NEO STCOM,,374890,3몰,
122670820,ASUS TUF Gaming B850-PRO WIFI7 W NEO STCOM,,333450,84몰,
122675438,MSI PRO H810M-E,,117490,104몰,
122676874,GIGABYTE B860M GAMING X 제이씨현,,183400,98몰,
122676913,ASUS ROG STRIX X870E-A GAMING WIFI7 NEO STCOM,,670310,75몰,
122678230,ECS H810H8-TI 코잇,,178880,46몰,
122678247,ECS H810H8-TI 코잇,125W 어댑터 포함,205990,46몰,
122678251,ECS H810H8-TI 코잇,152W 어댑터 포함,217990,46몰,
122678326,ASRock B650M Pro X3D + WiFi6E 모듈 패키지 디앤디컴,,160950,14몰,
122678434,ASRock B760M Pro-A/D4 + WiFi7 모듈 패키지 디앤디컴,,188480,52몰,
122678463,ASRock B760M Pro-A/D4 + WiFi6E 모듈 패키지 디앤디컴,,166240,52몰,
122681102,GIGABYTE X870E AERO X3D DARK WOOD 피씨디렉트,,578980,93몰,
122684807,ASUS ROG STRIX X870E-E GAMING WIFI7 NEO STCOM,,910730,87몰,
122687782,GIGABYTE H810M S2H GEN5 제이씨현,,129140,91몰,
122690875,ASUS ROG CROSSHAIR 2006 STCOM,,1244960,80몰,
122694411,MSI B550M-A PRO,,96000,76몰,
122694479,MSI PRO B550M-P,,113290,87몰,
122694530,GIGABYTE B850M GAMING X WIFI6E 피씨디렉트,,195810,58몰,
122694851,ASRock Z890 Pro RS WiFi 디앤디컴,,331120,62몰,
122694855,ASRock B860M Rock WiFi 디앤디컴,,190840,66몰,
122694865,ASRock B850M Rock WiFi 디앤디컴,,192660,72몰,
122694871,ASRock B850 Rock WiFi 7 디앤디컴,,232620,72몰,
122697197,GIGABYTE B850M GAMING X WIFI6E 제이씨현,,193980,96몰,
122697250,ASRock B650M PRO-A Gen5 디앤디컴,,138970,63몰,
122699502,ASRock B650M PRO-A Gen5 대원씨티에스,,136680,48몰,
122699665,GIGABYTE B850M FORCE V2 제이씨현,,165980,95몰,
122701088,ASUS PRO WS W880-ACE SE 아이보라,,813310,26몰,
122705643,ASUS ROG CROSSHAIR 2006 인텍앤컴퍼니,,1205990,33몰,
122710775,GIGABYTE B850M AORUS STEALTH ICE 피씨디렉트,,가격비교예정,0몰,
122710792,GIGABYTE B850M AORUS STEALTH 피씨디렉트,,가격비교예정,0몰,
122711070,GIGABYTE B850M AORUS STEALTH ICE 제이씨현,,가격비교예정,0몰,
122711072,GIGABYTE B850M AORUS STEALTH 제이씨현,,가격비교예정,0몰,
122712415,ASUS P13R-M STCOM,,754990,15몰,
