Id,Name,Type,Price,Mall,2026-06-30 23:28:08
11743040,ASUS Tinker Edge R,기본,109060,1몰,
13158504,ASUS ROG STRIX X670E-F GAMING WIFI STCOM,,749000,1몰,
13165257,A520 (중고),,48990,29몰,
13170663,Z690 DDR4 (중고),,328900,2몰,
13170711,Z690 DDR5 (중고),,159000,2몰,
13949195,아두이노 MAX485 TTL to RS485 컨버터 모듈,,420,74몰,
13949315,아두이노 텍스트 LCD 2004 (20X4),,5850,25몰,
13949627,LKino MEGA128 트레이닝 보드 LA18,,97900,1몰,
14005334,ASUS PRIME H510M-K 인텍앤컴퍼니,,137750,1몰,
14146880,아두이노 전압측정센서 모듈,,190,56몰,
14146994,아두이노 레오나르도 R3 호환보드,,6270,18몰,
14200919,NVIDIA Jetson Xavier NX Developer Kit (해외구매),,1348500,3몰,
14749595,아두이노 PS2 조이스틱 모듈,,440,38몰,
14872736,ASUS P11C-X 인텍앤컴퍼니,,455050,2몰,
14901068,LattePanda 라떼판다 알파 864s DFR0547,,814000,1몰,
15140333,아두이노 Micro USB TP4056 리튬배터리 충전모듈,,300,15몰,
15141536,아두이노 MG996R 180도 서보모터,,3160,24몰,
15497456,아두이노 S335 토양 습도 수분 감지 센서 Probe,,5200,3몰,
15497636,리니어레일 슬라이드 아두이노 구동 부품 세트,,45090,5몰,
15497753,라즈베리파이 호환 18650 5V 4A UPS 충전모듈,,49300,2몰,
15497837,W302 USB 호스트 쉴드 보드 아두이노,,57200,3몰,
15497894,HC-06 아두이노 블루투스 모듈,,2400,38몰,
15497969,Arduino 아두이노 우노 R3 호환보드 DM72,,3480,13몰,
15498581,Arduino 아두이노 MQ135 유해가스 감지 센서 모듈,,1800,5몰,
15498641,Arduino 아두이노 MQ9 일산화탄소 감지 센서 모듈,,1800,5몰,
15601613,GIGABYTE Z690 UD D4 제이씨현,,600000,1몰,
15604190,ASUS ROG STRIX Z690-A GAMING WIFI D4 코잇,,763010,2몰,
15609182,ASUS PRIME Z690-P WIFI D4 코잇,,560000,1몰,
15638735,ASUS PRIME Z690-P WIFI D4 인텍앤컴퍼니,,336700,1몰,
15653582,GIGABYTE Z690 AORUS ELITE 피씨디렉트,,450000,1몰,
15673778,ASUS ROG MAXIMUS Z690 EXTREME GLACIAL 아이보라,,3230000,2몰,
15932150,GIGABYTE Z690 AORUS XTREME WATERFORCE 피씨디렉트,,3200000,3몰,
16083650,ASUS PRIME H610M-K D4 인텍앤컴퍼니,,84480,181몰,
16085327,ASUS TUF Gaming B660M-E D4 인텍앤컴퍼니,,226900,1몰,
16089002,MSI MAG B660M 박격포 DDR4,,186000,1몰,
16089554,ASRock B660M Pro RS D4 에즈윈,,171000,1몰,
16094537,ASRock B660M-HDV D4 디앤디컴,,156000,1몰,
16102367,GIGABYTE H610M H D4 듀러블에디션 제이씨현,,100800,1몰,
16103102,ASUS TUF Gaming B660M-PLUS D4 STCOM,,186000,1몰,
16103126,ASUS ROG STRIX B660-F GAMING WIFI STCOM,,402000,1몰,
16103177,ASUS PRIME H610M-A D4 STCOM,,89000,150몰,
16103297,ASUS PRIME H610M-E D4 아이보라,,161180,2몰,
16145165,아툼 B250-P MINING (벌크),,155000,1몰,
16259744,NVIDIA Jetson AGX Xavier Developer Kit (해외구매),,3450000,1몰,
16260506,ASUS EX H610M-V3 D4 STCOM,,95210,113몰,
16275491,Z490 (중고),,90000,8몰,
16275497,H470 (중고),,48550,42몰,
16275503,B460 (중고),,65000,34몰,
16275521,H410 (중고),,49990,79몰,
16275539,Z590 (중고),,179000,7몰,
16275545,H570 (중고),,99370,15몰,
16275551,B560 (중고),,95000,3몰,
16275566,H510 (중고),,58000,41몰,
16275866,A320 (중고),,42000,71몰,
16276010,B350 (중고),,47200,23몰,
16276364,X570 (중고),,149000,2몰,
16277339,B550 (중고),,85000,27몰,
16284179,ASUS PRIME A520M-A II 대원씨티에스,,82090,178몰,
16285538,ASUS ROG MAXIMUS Z690 EXTREME GLACIAL STCOM,,2994000,2몰,
16313690,ECS DURATHON2 GLKD-I-N4020 코잇 (벌크),기본,375990,3몰,
16314863,MSI PRO H610M-G DDR4,,99500,6몰,
16388984,ECS DURATHON2 GLKD-I-N4020 코잇 (벌크),65W 어댑터,395990,2몰,
16507886,아두이노 1채널 12V 릴레이 모듈,,440,14몰,
16637543,MSI PRO H610M-C EX,,111540,154몰,
16734461,에너지옵티머스 B250 BTC-12P (벌크),,141000,1몰,
16946939,W238 UART 아두이노 초음파 거리센서,,36990,4몰,
16946948,W238 PWM 아두이노 초음파 거리센서,,34770,8몰,
16991345,에너지옵티머스 B75USB BTC (벌크),,103000,1몰,
17054963,아두이노 RGB 3색 LED 4핀 센서,,330,2몰,
17192960,ASUS Pro H610T/CSM D4 코잇 (벌크),기본,173990,5몰,
17193002,ASUS Pro H610T/CSM D4 코잇 (벌크),120W 어댑터,205520,4몰,
17395088,ECS DURATHON2 H610H7-M2 코잇,,103220,4몰,
17529074,라즈베리파이 3B 아크릴 케이스,,3100,1몰,
17529134,아두이노 CDS 조도 센서 GL5537,,50,15몰,
17541950,ASUS Pro H610T/CSM D4 아이보라 (벌크),기본,179550,13몰,
17662394,MSI MAG B660M 박격포 WIFI DDR4 (해외구매),,450500,1몰,
17697992,GIGABYTE H610I D4 듀러블에디션 피씨디렉트,,160980,86몰,
17700305,NVIDIA Jetson AGX Orin Developer Kit (해외구매),,2793880,21몰,
17743769,B660 DDR4 (중고),,156000,1몰,
17792948,ASRock H610M-HDV/M.2 R2.0 D4 디앤디컴,,88200,99몰,
17793371,ASRock H610M-HVS/M.2 R2.0 D4 디앤디컴,,85130,98몰,
17831603,ASRock H610M-HDV/M.2 R2.0 D4 디앤디컴 (벌크),,89160,23몰,
17847224,ASRock H610M-HDV/M.2 R2.0 D4 에즈윈,,104330,3몰,
17847233,ASRock H610M-HDV/M.2 R2.0 D4 에즈윈 (벌크),,87900,101몰,
17847254,ASRock H610M-HVS/M.2 R2.0 D4 에즈윈 (벌크),,83140,8몰,
17915426,GIGABYTE X670 AORUS ELITE AX 제이씨현,,279000,1몰,
17925728,MSI MPG X670E 카본 WiFi,,1477300,1몰,
17926748,ASUS ROG STRIX X670E-A GAMING WIFI STCOM,,435000,70몰,
17926787,ASUS ROG STRIX X670E-A GAMING WIFI 대원씨티에스,,421940,22몰,
17968601,ASRock C621A WS 에즈윈,,1871000,1몰,
17970146,GIGABYTE B650 AORUS ELITE AX 피씨디렉트,,216140,9몰,
17970338,GIGABYTE B650M AORUS ELITE 제이씨현,,178460,14몰,
17971178,MSI MPG B650 카본 WIFI,,912000,1몰,
17971181,MSI MAG B650 토마호크 WIFI,,253810,194몰,
17971184,MSI PRO B650M-A WIFI,,163800,238몰,
17971187,MSI MAG B650M 박격포 WIFI,,202530,265몰,
17971196,ASRock B650 PG Lightning 디앤디컴,,323750,2몰,
17971202,ASRock B650 Pro RS 디앤디컴,,379000,1몰,
17971247,ASRock B650 Pro RS 에즈윈,,329000,2몰,
17971253,ASRock B650M PG Riptide 에즈윈,,299000,1몰,
17971604,ASRock B650M PG Riptide 대원씨티에스,,164290,143몰,
18007478,ASRock B650E PG Riptide WiFi 대원씨티에스,,355100,3몰,
18007499,ASRock B650E 스틸레전드 WiFi 대원씨티에스,,438970,1몰,
18021491,ASUS TUF Gaming B650M-PLUS WIFI 대원씨티에스,,242300,1몰,
18021662,ASUS TUF Gaming B650-PLUS WIFI 대원씨티에스,,377200,1몰,
18021842,ASUS ROG STRIX B650-A GAMING WIFI 대원씨티에스,,292490,101몰,
18036965,MSI B550M PRO-VDH WIFI (해외구매),,165110,20몰,
18044519,ASUS TUF Gaming B650M-PLUS STCOM,,218900,139몰,
18044522,ASUS TUF Gaming B650M-PLUS WIFI STCOM,,259000,125몰,
18044558,ASUS TUF Gaming B650-PLUS WIFI STCOM,,259360,14몰,
18044567,ASUS ROG STRIX B650-A GAMING WIFI STCOM,,364000,4몰,
18044582,ASUS ROG STRIX B650E-E GAMING WIFI STCOM,,476500,3몰,
18052340,ASRock Z790 PG Lightning D5 에즈윈,,346800,6몰,
18054803,ASUS PRIME Z790-P-CSM 코잇,,347990,143몰,
18054881,ASUS PRIME Z790-P WIFI-CSM 코잇,,388990,110몰,
18059849,ASUS ROG MAXIMUS Z790 HERO STCOM,,1186000,2몰,
18060353,ASRock Z790 Pro RS D5 디앤디컴,,351000,4몰,
18060380,MSI PRO Z790-A WIFI DDR4,,390890,1몰,
18109313,MSI PRO H610M-E DDR4,,87980,169몰,
18112316,GIGABYTE Z790 AORUS ELITE 제이씨현,,217690,4몰,
18113015,GIGABYTE B650M AORUS ELITE AX 피씨디렉트,,314900,3몰,
18128375,ASUS PRIME B650-PLUS STCOM,,340000,3몰,
18165161,GIGABYTE B650M AORUS ELITE 피씨디렉트,,166000,2몰,
18169316,ASUS ROG MAXIMUS Z790 HERO (해외구매),,1541000,1몰,
18172115,MSI MPG B650 엣지 WIFI,,329000,4몰,
18173051,ASUS ROG STRIX B650E-F GAMING WIFI STCOM,,459000,2몰,
18189497,GIGABYTE B650 AORUS ELITE 피씨디렉트,,220350,50몰,
18204728,MSI MPG B650 엣지 WIFI (해외구매),,310800,11몰,
18221786,MSI MPG Z790I 엣지 WIFI (해외구매),,604500,1몰,
18222194,MSI PRO B660M-A WIFI DDR4 (해외구매),,325660,2몰,
18222278,MSI PRO B660M-A WIFI (해외구매),,458900,1몰,
18222359,MSI MPG X670E 카본 WiFi (해외구매),,579790,8몰,
18222548,MSI PRO X670-P WiFi (해외구매),,1009300,1몰,
18223226,MSI MAG B650 토마호크 WIFI (해외구매),,253200,5몰,
18254819,ASUS ROG MAXIMUS Z790 HERO 코잇,,1038490,87몰,
18261176,GIGABYTE Z790 AORUS ELITE AX 피씨디렉트,,450000,1몰,
18261245,GIGABYTE Z790 UD 피씨디렉트,,301500,150몰,
18264857,GIGABYTE Z790 AORUS ELITE AX 제이씨현,,450000,1몰,
18265187,GIGABYTE Z790 UD 제이씨현,,298000,3몰,
18265715,ASUS ROG STRIX B650E-F GAMING WIFI 대원씨티에스,,593000,1몰,
18301766,MSI PRO H610M-G DDR4 (해외구매),,117600,25몰,
18342989,MSI MEG Z790 에이스 (해외구매),,1435780,1몰,
18343058,GIGABYTE Z790 AERO G (해외구매),,451340,2몰,
18344078,GIGABYTE Z790 AORUS ELITE AX (해외구매),,433470,2몰,
18344240,GIGABYTE B650M AORUS ELITE AX (해외구매),,342000,3몰,
18348485,ASRock Z790 Pro RS WiFi D5 에즈윈,,389000,1몰,
18397130,GIGABYTE Z790 GAMING X (해외구매),,681030,1몰,
18448628,MSI MPG B650I 엣지 WIFI,,362380,3몰,
18449468,MSI MPG B650I 엣지 WIFI (해외구매),,392060,4몰,
18460412,GIGABYTE Z790 AORUS XTREME 제이씨현,,1550000,1몰,
18485645,ASRock Z790 Pro RS WiFi D5 디앤디컴,,354000,1몰,
18523409,ASUS PRIME H610M-K D4 아이보라,,86960,7몰,
18649997,GIGABYTE B760M AORUS ELITE 제이씨현,,183000,8몰,
18650483,GIGABYTE B760M DS3H D4 제이씨현,,128280,249몰,
18651431,GIGABYTE B760M AORUS ELITE 피씨디렉트,,183000,13몰,
18651506,GIGABYTE B760M AORUS ELITE AX 피씨디렉트,,238280,2몰,
18651545,GIGABYTE B760M AORUS ELITE D4 피씨디렉트,,188870,2몰,
18651560,GIGABYTE B760M DS3H D4 피씨디렉트,,132960,204몰,
18652442,ASUS PRIME B760M-K D4 코잇,,132050,118몰,
18652511,ASUS EX B760M-V5 D4 코잇,,129000,92몰,
18652865,MSI MAG B760 토마호크 WIFI,,227990,196몰,
18652889,MSI PRO B760M-P DDR4,,126490,106몰,
18652895,ASUS PRIME B760M-K D4 STCOM,,134980,117몰,
18652898,ASUS PRIME B760M-A D4 STCOM,,145440,126몰,
18662789,ASUS ROG STRIX B760-I GAMING WIFI STCOM,,390740,103몰,
18663323,COLORFUL BATTLE-AX B760M-PLUS V20 D5 STCOM,,154710,112몰,
18663455,GIGABYTE H610M K D4 피씨디렉트,,74280,204몰,
18670778,GIGABYTE H610M K D4 제이씨현,,71080,239몰,
18716924,ASUS ROG STRIX B760-I GAMING WIFI 코잇,,376980,92몰,
18718829,ASRock B650 Pro RS 대원씨티에스,,307390,4몰,
18725312,ASUS PRIME B760M-K D4 인텍앤컴퍼니,,134000,2몰,
18781991,GIGABYTE B760M DS3H 피씨디렉트,,151720,24몰,
18813608,GIGABYTE B760M DS3H 제이씨현,,139000,12몰,
18917408,X470 (중고),,84000,12몰,
19163258,ASUS PRIME B650M-A II STCOM,,225990,91몰,
19170107,GIGABYTE H610M S2H V2 D4 듀러블에디션 피씨디렉트,,113990,119몰,
19240112,ECS H610H7-TI5 코잇,기본,165000,1몰,
19241759,MSI PRO B760M-A WIFI,,157000,221몰,
19242146,GIGABYTE H610M S2H V2 D4 듀러블에디션 제이씨현,,107800,204몰,
19306598,ASUS TUF Gaming B760-PLUS WIFI 인텍앤컴퍼니,,442140,1몰,
19429325,ASUS PRIME B760-PLUS STCOM,,288000,1몰,
19431530,GIGABYTE A520M K V2 피씨디렉트,,60740,224몰,
19498640,ASRock B760M Pro RS D5 디앤디컴,,156490,165몰,
19523846,COLORFUL H610M-E M.2 V20 D4 STCOM,,77750,95몰,
19536062,ASRock B760M Pro RS D5 에즈윈,,148590,190몰,
19536692,ASRock B650M-HDV/M.2 에즈윈,,186680,1몰,
19556732,ASUS PRO WS W680-ACE IPMI STCOM,,713870,128몰,
19556996,ASUS PRO WS W680-ACE STCOM,,599000,118몰,
19605602,ASUS PRIME B760M-A STCOM,,156000,121몰,
19610558,GIGABYTE H610M S2H 듀러블에디션 제이씨현,,135000,1몰,
19619507,GIGABYTE H610M H 듀러블에디션 제이씨현,,118000,2몰,
19627397,ASRock B550M Phantom Gaming 4 대원씨티에스,,111100,158몰,
19628207,ASUS TUF Gaming B760M-PLUS 코잇,,190890,87몰,
19648718,ASRock B650 Pro RS + WiFi6E 모듈 패키지 디앤디컴,,379320,1몰,
19649354,ASRock B650 PG Lightning + WiFi6E 모듈 패키지 디앤디컴,,354790,1몰,
19673600,GIGABYTE A620M GAMING X 제이씨현,,153240,11몰,
19673975,ECS DURATHON2 B760H7-M8 코잇 (벌크),,142150,81몰,
19691519,ASUS PRIME B650M-A II 대원씨티에스,,93000,18몰,
19704527,ASUS PRIME B760M-A 코잇,,148990,128몰,
19705316,MSI PRO A620M-E,,154500,1몰,
19725299,GIGABYTE A620M GAMING X 피씨디렉트,,160230,88몰,
19753526,ECS DURATHON2 B760H7-M8 코잇,,142470,23몰,
19754957,ASRock B560M-HDV/M.2 디앤디컴,,136000,1몰,
19756130,ASUS PRIME B760-PLUS 코잇,,260660,123몰,
19756199,ASUS TUF Gaming B760-PLUS WIFI 코잇,,293490,129몰,
19772375,ASUS PRIME B760M-A 인텍앤컴퍼니,,150570,155몰,
19772519,ASUS PRIME B760-PLUS 인텍앤컴퍼니,,279000,1몰,
19772675,ASUS ROG STRIX B760-G GAMING WIFI 인텍앤컴퍼니,,241500,1몰,
19827944,ASRock A620M-HDV/M.2 디앤디컴,,109240,2몰,
19834694,GIGABYTE H610M S2H 듀러블에디션 피씨디렉트,,121000,1몰,
19903481,ASUS ROG STRIX B760-G GAMING WIFI 코잇,,230350,141몰,
19924310,ASUS PRIME A620M-A STCOM,,128000,3몰,
19925807,ASUS TUF Gaming A620M-PLUS STCOM,,186000,5몰,
19926059,ASUS TUF Gaming A620M-PLUS WIFI STCOM,,200030,59몰,
19926611,ASUS PRIME A620M-A 대원씨티에스,,124990,9몰,
19926731,ASUS TUF Gaming A620M-PLUS 대원씨티에스,,133690,14몰,
19927037,ASUS TUF Gaming A620M-PLUS WIFI 대원씨티에스,,181000,1몰,
19927871,ASUS P12R-I STCOM,,358990,131몰,
19938515,GIGABYTE H610M K 제이씨현,,85700,5몰,
19999916,GIGABYTE H610M K 피씨디렉트,,82000,1몰,
20012147,ASRock Z790 Pro RS D5 + WiFi6E 모듈 패키지 디앤디컴,,386000,3몰,
20027564,ASUS PRIME H510M-K R2.0 인텍앤컴퍼니,,300000,1몰,
20079008,ASUS PRIME Z790M-PLUS-CSM 코잇,,354980,94몰,
20103287,ASRock B760M Pro RS D5 + WiFi6E 모듈 패키지 디앤디컴,,185490,141몰,
20108249,MSI PRO B650M-P,,119100,182몰,
20119583,GIGABYTE H610M H V2 D4 피씨디렉트,,88960,174몰,
20140877,ASRock A620M-HDV/M.2 + WiFi6E 모듈 패키지 디앤디컴,,150500,1몰,
20171636,MSI PRO B760M-P,,134980,170몰,
20178734,BIOSTAR H610MH D5 이엠텍,,98050,1몰,
20226533,Supermicro X13SAQ STCOM,,680000,6몰,
20226770,Supermicro X13SAZ-Q STCOM,,684100,98몰,
20231597,GIGABYTE A620M S2H 피씨디렉트,,114000,1몰,
20238110,GIGABYTE A620M S2H 제이씨현,,111000,1몰,
20318291,ASUS TUF Gaming A620-PRO WIFI STCOM,,270760,140몰,
20324882,GIGABYTE B650M K 제이씨현,,112670,268몰,
20343650,ASUS PRIME B760M-K 코잇,,159000,90몰,
20344700,ASUS PRIME H610M-CS D4 코잇,,80990,134몰,
20459081,GIGABYTE A520M K V2 제이씨현,,56990,278몰,
20462924,GIGABYTE H610M H V2 D4 제이씨현,,97990,5몰,
20536331,ASRock B760M-HDVP D5 에즈윈 (벌크),,121320,139몰,
20606708,Supermicro X13SRA-TF STCOM,,1338000,12몰,
20612690,ASUS PRIME B760M-KS 코잇 (벌크),,139690,11몰,
20710217,ASUS PRIME B760M-K 인텍앤컴퍼니,,131280,159몰,
20738630,COLORFUL BATTLE-AX B760M-K V20 D5 STCOM,,119650,98몰,
21427535,ASUS TUF Gaming B650M-E WIFI 대원씨티에스,,229120,3몰,
21428693,ASUS PRIME A620M-K 대원씨티에스,,117300,6몰,
21627827,ASRock B650M Pro RS 대원씨티에스,,165000,1몰,
21727307,GIGABYTE B650M K 피씨디렉트,,112550,265몰,
21731021,GIGABYTE B650M S2H 제이씨현,,178360,2몰,
24703229,ASRock Rack ROME2D16-2T,,1336000,1몰,
25129808,ASUS PRO WS W790E-SAGE SE STCOM,,2214560,128몰,
25208807,ASUS PRO WS W790-ACE STCOM,,1542000,136몰,
25213067,ASRock A520M-HDV 에즈윈 (벌크),,65120,21몰,
25866491,ASRock H610M-HDV/M.2+ D5 에즈윈,,92390,150몰,
25869083,ASRock H610M-HDV/M.2+ D5 에즈윈 (벌크),,93940,112몰,
27409910,ASRock H610M-HDV/M.2+ D5 디앤디컴,,94320,122몰,
27474755,MSI PRO B760M-A DDR4 II,,144980,171몰,
27475223,MSI MAG X670E 토마호크 WIFI,,468950,2몰,
27534158,GIGABYTE H610M H V2 D4 제이씨현 (벌크),,101850,3몰,
27546074,ASRock H610M-HDV/M.2+ D5 대원씨티에스,,90090,131몰,
27572138,ASUS PRIME H610M-E 인텍앤컴퍼니,,169990,2몰,
27576677,MSI MAG X670E 토마호크 WIFI (해외구매),,442710,2몰,
27675110,ASUS PRIME H610M-E 코잇,,111920,127몰,
27691589,NVIDIA Jetson Orin Nano Developer Kit 용량확인필요 (해외구매),,1195000,2몰,
28010348,GIGABYTE B760M E 피씨디렉트,,96380,38몰,
28029617,ASRock H610M-H2/M.2 D5 에즈윈 (벌크),,80940,141몰,
28059134,ASRock H610M-HDV/M.2+ D5 디앤디컴 (벌크),,97990,37몰,
28183691,ASRock H610M-H2/M.2 D5 디앤디컴,,79570,169몰,
28183721,ASRock H610M-H2/M.2 D5 디앤디컴 (벌크),,79650,133몰,
28248743,BIOSTAR H610MHD D5 제이씨현,,59000,156몰,
28248950,BIOSTAR H610MS 제이씨현,,75000,155몰,
28511822,ASUS PRIME H510M-K R2.0 STCOM,,116990,81몰,
28577999,ASUS Tinker Edge R,어댑터 포함,244000,93몰,
28581716,ASUS Tinker Edge T,어댑터 포함,135000,1몰,
28603964,ASRock B650M PG Lightning 에즈윈,,112280,195몰,
28651910,Z790 (중고),,132000,11몰,
28652501,H610 DDR5 (중고),,39000,17몰,
28780247,ASUS PRO WS W790E-SAGE SE 대원씨티에스,,1980000,1몰,
28803482,ASUS ROG MAXIMUS Z790 APEX ENCORE STCOM,,898000,121몰,
28857518,ASUS PRIME H610M-K D5 인텍앤컴퍼니,,79900,3몰,
28857623,ASUS PRIME H610M-K ARGB 인텍앤컴퍼니,,166080,2몰,
29393921,ASUS PRIME H610I-PLUS 코잇,,202340,114몰,
29759561,BIOSTAR B650MT-E PRO 제이씨현,,124000,158몰,
29863127,GIGABYTE B650M AORUS ELITE AX ICE 제이씨현,,238990,11몰,
29879357,ASRock B450M-HDV R4.0 대원씨티에스,,950000,1몰,
29880134,ASRock H610M-HVS M.2 R2.0 D4 대원씨티에스,,95000,1몰,
29908775,ASRock B650M PG Lightning 디앤디컴,,111480,185몰,
29942195,ASUS PRIME H610M-D 코잇,,76000,106몰,
30070400,GIGABYTE B650 AORUS ELITE AX ICE 제이씨현,,262000,1몰,
30161945,ASRock B760M-HDVP D5 디앤디컴,,176000,1몰,
30167879,ASRock B650M PG Lightning + WiFi6E 모듈 패키지 디앤디컴,,138480,151몰,
30300260,ASRock B650M PG Lightning 대원씨티에스,,111160,200몰,
30311870,COLORFUL BATTLE-AX A520M-K M.2 V14 STCOM,,165210,3몰,
30621842,MSI MEG Z790 갓라이크 (해외구매),,2956390,1몰,
30622283,ASRock B650M PG Lightning + WiFi6E 모듈 패키지 에즈윈,,142090,8몰,
30638927,ASRock B760M Pro RS D5 + WiFi6E 모듈 패키지 에즈윈,,188370,12몰,
31472456,GIGABYTE TRX50 AERO D 피씨디렉트,,1069000,4몰,
31959437,ASRock Z790 Pro RS D5 + WiFi7 모듈 패키지 디앤디컴,,405000,5몰,
31959920,ASRock B760M Pro RS D5 + WiFi7 모듈 패키지 디앤디컴,,202650,133몰,
32002067,GIGABYTE H610M K D4 제이씨현 (벌크),,71680,132몰,
32043872,ASUS PRO WS TRX50-SAGE WiFi (해외구매),,1629080,5몰,
32070719,GIGABYTE B650 AORUS ELITE AX V2 피씨디렉트,,217990,152몰,
32071067,GIGABYTE B650 AORUS ELITE V2 피씨디렉트,,203990,145몰,
32078006,GIGABYTE B650 AORUS ELITE V2 제이씨현,,209000,5몰,
32110508,ASRock A520M-HDVP R2.0 에즈윈 (벌크),,84000,1몰,
32126690,ASUS PRO WS TRX50-SAGE WiFi STCOM,,1443990,119몰,
32487287,ASUS PRO WS TRX50-SAGE WiFi 대원씨티에스,,1396980,134몰,
33363434,ASUS PRO WS W790E-SAGE SE 코잇,,1929000,1몰,
34372580,ASUS PRIME B760M-PLUS-CSM STCOM,,227990,7몰,
34373075,ASUS TUF Gaming B650-E WIFI STCOM,,326000,5몰,
34739282,ASUS PRIME H610M-CS 2.5G 코잇,,115460,130몰,
34741700,GIGABYTE B650E AORUS ELITE X AX ICE 피씨디렉트,,263990,113몰,
34741730,GIGABYTE B650E AORUS ELITE X AX ICE 제이씨현,,251690,3몰,
34810925,ASUS PRIME B760M-PLUS-CSM 인텍앤컴퍼니,,211800,62몰,
34815323,ASUS PRIME B760M-PLUS-CSM 코잇,,200990,1몰,
34815659,ASUS TUF Gaming B760M-PLUS II 코잇,,163960,148몰,
35810231,ASRock A620M-HDV/M.2 에즈윈,,131990,1몰,
36157520,ASRock A620M-HDVP 에즈윈 (벌크),,101990,56몰,
37226114,MSI MAG B760M 박격포 II,,173440,252몰,
37286501,GIGABYTE H610M K D4 피씨디렉트 (벌크),,74190,76몰,
37286591,GIGABYTE H610M H V2 D4 피씨디렉트 (벌크),,83150,22몰,
37286687,GIGABYTE H610M K 피씨디렉트 (벌크),,92000,75몰,
38347157,ASUS PRO WS WRX90E-SAGE SE STCOM,,2133470,133몰,
39249221,MSI PRO A620M-C EX,,118980,96몰,
40895255,ASRock B760M Pro-A 에즈윈,,171500,2몰,
42860537,ASUS Z13PE-D16 STCOM,,1994920,94몰,
43546877,MAXSUN 터미네이터 B760M D5,,109900,9몰,
43557464,MAXSUN 챌린저 H610M,,128750,4몰,
45257993,ASUS PRO WS WRX90E-SAGE SE 대원씨티에스,,2101820,128몰,
46742996,ASRock B650M PG Lightning WiFi 디앤디컴,,170000,29몰,
48476933,ASUS TUF Gaming B650M-E STCOM,,219310,7몰,
48647831,ASRock WRX90 WS EVO 대원씨티에스,,1861730,15몰,
49162646,ASRock B550M Pro RS 디앤디컴,,119130,175몰,
49538822,ASRock B550M Pro RS + WiFi6E 랜카드 패키지 디앤디컴,,160480,98몰,
49740182,ASRock B550M Pro RS 에즈윈,,124500,148몰,
49995851,ASRock B550M Pro RS 대원씨티에스,,121160,160몰,
50129651,ASRock B760M Pro-A + WiFi6E 모듈 패키지 디앤디컴,,182990,15몰,
53418977,MSI B650M 프로젝트 제로,,208350,195몰,
53419463,MSI B760M 프로젝트 제로,,236300,95몰,
54326606,GIGABYTE Z790 AORUS XTREME X ICE + AORUS 지포스 RTX 4080 SUPER XTREME ICE 패키지 피씨디렉트,,3115260,57몰,
54481319,액슬 MBAIH310 에즈윈,,88640,11몰,
54816743,ASUS Tinker Edge R (병행수입),,195000,8몰,
55468811,ASRock H510M-HDV/M.2 SE 에즈윈,,93550,136몰,
57295043,MSI PRO B650M-B,,111130,154몰,
58103081,KHADAS VIM3 Pro 4GB,,363000,1몰,
58115534,COLORFUL COLORFIRE B760M-MEOW WIFI D5 ORANGE STCOM,,232040,91몰,
58432343,ASRock H610M-H2/M.2 D4 에즈윈,,80000,82몰,
58623128,ASRock H610M-H2/M.2 D4 에즈윈 (벌크),,80730,31몰,
58837484,MAXSUN 챌린저 H610ITX 2LAN 디앤디컴,,142470,98몰,
59826524,ASRock H610M-H2/M.2 D4 디앤디컴,,78870,184몰,
59827064,ASRock H610M-H2/M.2 D4 디앤디컴 (벌크),,75990,128몰,
60064028,마이크로틱 MikroTik L11UG-5HaxD,,117990,30몰,
60151763,COLORFUL BATTLE-AX B650M-PLUS V14 STCOM,,106380,4몰,
61423463,ASRock H610M-X D5 에즈윈 (벌크),,103190,114몰,
62568890,MSI PRO B650M-A,,149150,193몰,
62791640,ASRock B650M PG Riptide WiFi White 에즈윈,,220500,160몰,
63087650,ASRock H610M-X D5 디앤디컴,,95680,113몰,
63140087,ASRock H610M-X D5 디앤디컴 (벌크),,95310,133몰,
63269363,ASRock B650M PG Riptide WiFi White 디앤디컴,,248500,118몰,
63478082,ASRock B650M PG Riptide WiFi White 대원씨티에스,,259000,2몰,
63478493,KHADAS VIM4 8GB,,495000,1몰,
63478505,KHADAS VIM4 8GB (해외구매),,480620,2몰,
63938699,GIGABYTE TRX50 AI TOP 제이씨현,,1407900,152몰,
64267934,GIGABYTE TRX50 AI TOP 피씨디렉트,,1396590,124몰,
64375265,GIGABYTE H610M H V2 피씨디렉트,,105990,137몰,
64394135,ASRock B650 스틸레전드 WiFi 디앤디컴,,242580,121몰,
65307479,GIGABYTE H610M S2H V2 피씨디렉트,,114390,145몰,
66046067,GIGABYTE H610M S2H V2 제이씨현,,99000,181몰,
66046259,GIGABYTE H610M H V2 제이씨현,,102700,174몰,
66046349,GIGABYTE H610M K V2 제이씨현,,79470,202몰,
67372934,ASRock H510M-HDV/M.2 SE 디앤디컴,,99340,128몰,
67373036,ASRock H510M-HDV/M.2 SE 디앤디컴 (벌크),,95990,101몰,
67678283,GIGABYTE H610M K V2 피씨디렉트,,80860,153몰,
67693886,ASUS PRIME X870-P WIFI-CSM STCOM,,347840,152몰,
67693952,ASUS PRIME X870-P-CSM STCOM,,323500,155몰,
67694132,ASUS ProArt X870E-CREATOR WIFI STCOM,,769000,134몰,
67694456,ASUS ROG CROSSHAIR X870E HERO STCOM,,1032500,131몰,
67694840,ASUS ROG STRIX X870-A GAMING WIFI STCOM,,541500,39몰,
67694921,ASUS ROG STRIX X870E-E GAMING WIFI STCOM,,854270,10몰,
67695545,ASUS ROG STRIX X870-F GAMING WIFI STCOM,,712000,19몰,
67695563,ASUS TUF Gaming X870-PLUS WIFI STCOM,,409000,10몰,
67695641,ASRock X870 Pro RS 에즈윈,,284100,150몰,
67845785,GIGABYTE X870E AORUS PRO ICE 제이씨현,,451490,26몰,
67845815,GIGABYTE X870 AORUS ELITE WIFI7 제이씨현,,352190,228몰,
67845863,GIGABYTE X870 AORUS ELITE WIFI7 ICE 제이씨현,,358700,237몰,
67846052,GIGABYTE X870 EAGLE WIFI7 제이씨현,,301000,193몰,
67847474,GIGABYTE X870 AORUS ELITE WIFI7 피씨디렉트,,359980,188몰,
67847492,GIGABYTE X870 AORUS ELITE WIFI7 ICE 피씨디렉트,,360990,185몰,
67847609,GIGABYTE X870E AORUS PRO ICE 피씨디렉트,,442000,5몰,
67850639,ASRock X870E Taichi 에즈윈,,753000,1몰,
67851653,ASUS PRIME X870-P WIFI-CSM 대원씨티에스,,331880,104몰,
67851971,ASUS PRIME X870-P-CSM 대원씨티에스,,304980,110몰,
67852106,ASUS ProArt X870E-CREATOR WIFI 대원씨티에스,,762470,109몰,
67852211,ASUS ROG CROSSHAIR X870E HERO 대원씨티에스,,1015430,13몰,
67852265,ASUS ROG STRIX X870-A GAMING WIFI 대원씨티에스,,524880,92몰,
67852370,MSI MAG X870 토마호크 WIFI,,415000,147몰,
67852469,MSI PRO X870-P WIFI,,394380,2몰,
67852652,MSI MPG X870E 카본 WIFI,,665000,125몰,
67852706,GIGABYTE X870 EAGLE WIFI7 피씨디렉트,,312990,143몰,
67852766,ASUS ROG STRIX X870E-E GAMING WIFI 대원씨티에스,,789530,3몰,
67852793,ASUS ROG STRIX X870-F GAMING WIFI 대원씨티에스,,675500,109몰,
67852838,ASUS TUF Gaming X870-PLUS WIFI 대원씨티에스,,381960,20몰,
67852946,ASUS ROG STRIX X870-I GAMING WIFI 대원씨티에스,,760600,93몰,
67852967,ASRock X870E Nova WiFi 에즈윈,,474900,154몰,
67976948,ASUS ROG STRIX X870-I GAMING WIFI STCOM,,758990,134몰,
68242061,ASRock X870 스틸레전드 WiFi 대원씨티에스,,279000,125몰,
68242124,ASRock X870 Pro RS WiFi 대원씨티에스,,317910,20몰,
68242145,ASRock X870 Pro RS 대원씨티에스,,300140,5몰,
68246816,ASRock X870E Taichi 대원씨티에스,,768000,1몰,
68440085,ASRock X870E Taichi 디앤디컴,,778980,128몰,
68440103,ASRock X870 스틸레전드 WiFi 디앤디컴,,364980,161몰,
68687615,ASRock Z890 Pro RS 에즈윈,,324550,129몰,
68687816,ASRock Z890 Pro RS WiFi White 에즈윈,,335190,147몰,
68776211,ASRock Z890 Taichi 에즈윈,,671560,150몰,
68919209,ASRock Z890 Pro-A 에즈윈,,302240,127몰,
69053765,ASRock Z890 Pro-A WiFi 에즈윈,,318560,148몰,
69468680,ASRock H610M-X D5 인텍앤컴퍼니 (벌크),,79000,98몰,
69468782,ASRock H610M-HVS M.2 R2.0 D4 인텍앤컴퍼니,,97200,6몰,
69468977,ASRock B760M Pro-A 인텍앤컴퍼니,,133900,150몰,
69469049,ASRock B760M Pro RS D5 인텍앤컴퍼니,,169000,113몰,
