Id,Name,Type,Price,Mall,2025-07-01 21:41:06
1357994,ASRock A780GM-LE (중고),,46000,1몰,
2191233,PEGATRON IPMSB/H61 (B3) (중고) 인텍앤컴퍼니,,16900,11몰,
2951159,FOXCONN G31MX-K (중고),,18000,2몰,
2951174,ASRock B75M (중고),,25370,15몰,
2976067,ASUS H81M-E (중고),,24990,13몰,
2976087,ASUS H87-PLUS (중고),,28030,10몰,
2976233,ASUS H81M-A (중고),,20990,8몰,
2976245,ASUS Z87-PRO V (중고),,180000,1몰,
3025492,GIGABYTE GA-B75M-D3H (중고),,28790,18몰,
3032975,ASUS P8H61-MX (B3) (중고),,18600,6몰,
3226637,ASUS P9D-MH/10G-DUAL STCOM,,524980,42몰,
3266921,ASUS H81M-K (벌크),,119980,1몰,
3502709,Arduino 아두이노 우노 R3 부속품,호환보드,3300,16몰,
3502710,Arduino 아두이노 우노 R3 부속품,케이스,500,10몰,
3548546,ASUS H110M-K STCOM,,116920,101몰,
3603620,ASUS H110M-K 아이보라,,121460,8몰,
4465664,BIOSTAR G31-M7 TE (중고),,18600,1몰,
4465818,ASRock G31M-S (중고),,27440,3몰,
4467580,ASRock G41M-S3 (중고),,26040,2몰,
4467648,ASRock H55M-LE (중고),,18600,2몰,
4468027,ECS G41T-M6 (중고),,17670,3몰,
4468421,MSI G31TM-P21 (중고),,21390,1몰,
4470578,FOXCONN H61MXL-K (중고),,17000,3몰,
4470743,ECS G41T-M (중고),,17670,3몰,
4470793,ASUS P5G41T-M LX (중고),,30690,2몰,
4470858,GIGABYTE GA-H61M-D2 (B3) (중고),,14790,9몰,
4471348,FOXCONN H55MXV (중고),,12010,8몰,
4471379,FOXCONN H55MXV-LE (중고),,13950,2몰,
4471394,ECS H67H2-M3 (중고),,50000,1몰,
4471514,ASRock H61M-DGS (B3) (중고),,20460,10몰,
4471621,GIGABYTE GA-H61M-DS2V (B3) (중고),,16390,12몰,
4471645,GIGABYTE GA-H81M-S2PV (중고),,19790,18몰,
4471893,ASUS P5KPL-AM (중고),,75000,1몰,
4478863,ASRock B85M-DGS (중고),,17900,26몰,
4482977,ASUS B85M-G (중고),,27990,24몰,
4483142,ASUS H81M-K (중고),,19990,24몰,
4488764,ASRock B85M-HDS (중고),,27400,15몰,
4489009,GIGABYTE GA-B85M-HD3 (중고),,28330,17몰,
4489363,ECS DELUXE H81H3-M3 (중고),,16990,13몰,
4489472,MSI P55-CD53 (중고),,40000,1몰,
4489542,ASRock H81M-DGS (중고),,17990,25몰,
4489619,ASUS P7H55-M LX (중고),,40000,1몰,
4489674,ASUS P8B75-M LX (중고),,22490,23몰,
4490529,GIGABYTE GA-B85M-D3H (중고),,39150,15몰,
4490623,GIGABYTE GA-H61M-S2V (B3) (중고),,15000,9몰,
4490813,GIGABYTE GA-B75M-D3V (중고),,26920,7몰,
4490850,GIGABYTE GA-G31M-ES2L (중고),,37200,3몰,
4494385,FOXCONN G41MX-K (중고),,23250,2몰,
4494526,ASRock H61M-HVGS (B3) (중고),,39500,1몰,
4495710,GIGABYTE GA-H81M-DS2V (중고),,20790,22몰,
4496138,GIGABYTE GA-B85M-DS3H (중고),,29990,23몰,
4496749,ECS H55H-M (중고),,31000,1몰,
4497542,GIGABYTE GA-H77M-D3H (중고),,75000,1몰,
4497687,GIGABYTE GA-H81M-D2V (중고),,20460,14몰,
4497752,ASRock B75M-GL (중고),,26250,10몰,
5232347,BIOSTAR TB250-BTC (해외구매),,149190,11몰,
5516497,ASRock Q87M vPRO (중고),,170000,1몰,
5679942,ASUS B85M-F (중고),,32990,4몰,
5682458,Arduino 아두이노 우노 R3 스타터 키트,기본,45090,2몰,
5686862,Arduino 아두이노 메가 부속품,케이스,1650,2몰,
5713431,ASUS H81M-D PLUS (중고),,21770,13몰,
5727101,GIGABYTE GA-P55A-UD3R (중고),,46500,3몰,
5791747,ASUS B250 MINING EXPERT (해외구매),,144060,5몰,
5857695,ASUS WS X299 PRO STCOM,,646350,3몰,
5857728,ASUS WS X299 PRO/SE STCOM,,654270,5몰,
5857774,ASUS WS X299 SAGE STCOM,,1538010,3몰,
5881295,BIOSTAR Hi-Fi B85S3+ (중고) 이엠텍,,46000,1몰,
5896041,ASUS WS X299 SAGE 아이보라,,1164900,66몰,
5991341,코코아팹 오렌지보드 BLE,기본,24200,1몰,
5991461,코코아팹 오렌지보드 Nano,기본,15990,12몰,
5993711,MSI H81M-P33 (중고),,21390,19몰,
5994057,ASRock B85M PRO4 (중고),,32550,28몰,
5994200,GIGABYTE GA-B85-HD3 (중고),,31360,8몰,
5994380,GIGABYTE GA-B85M-D2V (중고),,24990,14몰,
5994603,MSI B85M-E33 (중고),,32030,4몰,
5994682,ASRock H81M-DG4 (중고),,19570,23몰,
5994821,ASRock H81M-HDS (중고),,19000,22몰,
5994884,ECS ESSENTIALS H81H3-M4 (중고),,15000,16몰,
5997948,GIGABYTE GA-A320M-S2H 듀러블에디션 피씨디렉트,,110000,1몰,
6016659,GIGABYTE H370 HD3 듀러블에디션 피씨디렉트,,200000,1몰,
6017713,ASRock B360M PRO4 디앤디컴,,146000,1몰,
6024335,ASUS PRIME H310M-K STCOM,,156000,1몰,
6132986,ASRock Rack EPC621D8A 명인일렉트로닉스,,688350,60몰,
6145321,ASUS H97-PLUS (중고),,96000,1몰,
6145411,GIGABYTE GA-B85M-Gaming 3 게이밍에디션 (중고),,60000,1몰,
6145461,ASRock B85M (중고),,25750,4몰,
6153517,GIGABYTE GA-H110M-DS2V 듀러블에디션 (중고),,32990,9몰,
6153564,GIGABYTE GA-H110-D3A BTC 듀러블에디션 (중고),,75000,1몰,
6153694,ASRock H110M-HDV (중고),,30250,21몰,
6153801,BIOSTAR H81MDV3 (중고),,18000,4몰,
6153807,BIOSTAR H81MDV5 (중고),,20930,1몰,
6179481,GIGABYTE GA-H81M-HD2 (중고),,39190,2몰,
6179521,GIGABYTE GA-H81M-D3V (중고),,24470,7몰,
6179549,GIGABYTE GA-H87M-HD3 (중고),,90000,1몰,
6192932,BIOSTAR H77MU3 소백 (중고) 이엠텍,,75000,1몰,
6343237,ASRock H77 Pro4/MVP (중고),,71000,1몰,
6354378,MSI B75MA-E33 GEN3 (중고),,27550,7몰,
6371155,GIGABYTE GA-B85M-DS3H-A (중고),,34530,15몰,
6449392,ASUS P8H67 B3 (중고),,41000,1몰,
6494014,ASRock B450 PRO4 디앤디컴,,155000,1몰,
6500307,GIGABYTE A320M-H 듀러블에디션 피씨디렉트,,110000,1몰,
6508375,GIGABYTE Z390 AORUS ULTRA 제이씨현,,350000,1몰,
6558463,ASRock H97 Performance (중고),,46500,3몰,
6643243,ASUS P11C-X 아이보라,,410000,1몰,
6897841,B150 M-ATX (중고),,31290,137몰,
6898267,H110 M-ATX (중고),,20890,367몰,
6898747,B250 M-ATX (중고),,59000,2몰,
6898861,B250 ATX (중고),,65000,2몰,
6899308,Z170 ATX (중고),,46500,3몰,
6899626,H170 ATX (중고),,43790,16몰,
6900646,Z270 ATX (중고),,150000,1몰,
6900835,H270 ATX (중고),,44180,5몰,
6901537,H170 M-ATX (중고),,150000,1몰,
7015291,ASRock B450 스틸레전드 디앤디컴,,155000,1몰,
7097008,ASRock B450M 스틸레전드 디앤디컴,,155000,1몰,
7452148,ASUS EX A320M-GAMING 대원씨티에스,,116000,1몰,
8345859,ASUS WS X299 SAGE/10G STCOM,,1800000,4몰,
8520741,MSI MPG X570 게이밍 엣지 WiFi,,1099900,1몰,
9500100,MSI MPG X470 게이밍 플러스 맥스,,157000,6몰,
9597318,ASRock X570 AQUA 에즈윈,,1302700,1몰,
9680205,Raspberry Pi 라즈베리 파이 4 모델 B,2GB,72100,1몰,
9739197,ASUS ROG CROSSHAIR VIII IMPACT 아이보라,,632510,1몰,
10114683,GIGABYTE TRX40 DESIGNARE 피씨디렉트,,1467000,2몰,
10525329,ECS DURATHON2 GLKD-I-J4005 코잇 (벌크),기본,107990,3몰,
10525335,ECS DURATHON2 GLKD-I-J4005 코잇 (벌크),65W 어댑터,116620,2몰,
10641108,ASUS Tinker Fanless Aluminum Case,,36800,33몰,
10864752,ASRock A320M-HDVP 디앤디컴,,110000,1몰,
11032305,ASUS Tinker Edge T,기본,139000,1몰,
11210097,ASUS ROG STRIX Z490-E GAMING STCOM,,400000,1몰,
11222715,ASUS ROG MAXIMUS XII FORMULA 코잇,,965000,1몰,
11223537,MSI MEG Z490 갓라이크,,1390000,1몰,
11231685,GIGABYTE Z490 AORUS ELITE 제이씨현,,400000,1몰,
11571368,ASUS TUF Gaming B550M-PLUS STCOM,,148470,175몰,
11572991,ASRock B550M PRO4 에즈윈,,539130,1몰,
11574458,ASUS PRIME B550M-A 대원씨티에스,,120560,111몰,
11574545,ASUS PRIME B550M-K 대원씨티에스,,112400,87몰,
11684576,GIGABYTE B550M AORUS ELITE 제이씨현,,123950,62몰,
11743040,ASUS Tinker Edge R,기본,219000,1몰,
11751599,GIGABYTE B550M AORUS ELITE 피씨디렉트,,121950,127몰,
11934316,ASUS ROG STRIX B550-A GAMING 대원씨티에스,,1939000,1몰,
11934553,GIGABYTE B460M H 듀러블에디션 피씨디렉트,,115000,1몰,
11973272,Z370 (중고),,68360,36몰,
11973338,H310 (중고),,38990,77몰,
11973377,B360 (중고),,47990,101몰,
11973419,B365 (중고),,51330,74몰,
11973452,H370 (중고),,58990,21몰,
11973482,Z390 (중고),,79580,27몰,
12022880,ASRock B550M-ITX/ac 디앤디컴,,228000,114몰,
12060293,ASUS PRIME A520M-K STCOM,,64190,141몰,
12060863,ASUS PRIME A520M-K/CSM STCOM,,118370,111몰,
12067598,MSI A520M-A PRO,,65320,127몰,
12067610,ASUS PRIME A520M-K 아이보라,,68500,4몰,
12069566,ASUS PRIME A520M-K 대원씨티에스,,62600,147몰,
12077093,GIGABYTE A520M S2H 듀러블에디션 제이씨현,,88980,56몰,
12077126,GIGABYTE A520M H 듀러블에디션 제이씨현,,90000,3몰,
12083765,GIGABYTE A520M S2H 듀러블에디션 피씨디렉트,,89000,1몰,
12086510,ASRock A520M-HVS 디앤디컴,,61730,138몰,
12092663,ASRock A520M-HDV 디앤디컴,,73990,40몰,
12121013,ASRock A520M-ITX/ac 디앤디컴,,178960,114몰,
12130286,ASRock A520M-HDV 에즈윈,,69700,135몰,
12130319,ASRock A520M-HVS 에즈윈,,73460,65몰,
12464213,ASRock B550M Phantom Gaming 4 에즈윈,,113200,115몰,
12487823,ASRock B550M Phantom Gaming 4 디앤디컴,,111760,141몰,
12660353,ASRock A520M-HDV 디앤디컴 (벌크),,72990,29몰,
12660362,ASRock A520M-HVS 디앤디컴 (벌크),,71870,94몰,
12698210,ASUS ROG CROSSHAIR VIII DARK HERO 대원씨티에스,,330000,1몰,
12701975,ASUS ROG CROSSHAIR VIII DARK HERO STCOM,,330000,1몰,
12761789,ASUS ROG ZENITH EXTREME ALPHA 대원씨티에스,,762470,69몰,
12968927,라즈베리파이 실습용 프리미엄 키트 41종 (SZH-EK041),,101200,1몰,
12971276,아두이노 CH341A USB EEOROM 롬라이터,,3530,74몰,
13057562,아두이노 터치 센서 TTP223B,,210,57몰,
13057682,아두이노 압력 센서 FSR402,,3840,20몰,
13057787,Arduino 아두이노 우노 R3 DIP타입 호환보드 DM70,,15770,3몰,
13058087,아두이노 적외선 광센서 TCRT5000,,80,53몰,
13058783,아두이노 RGB 모듈 5mm DM52,,570,2몰,
13154523,ASRock X670E PG Lightning 디앤디컴,,489000,1몰,
13158384,ASUS ROG STRIX X670E-E GAMING WIFI STCOM,,773990,83몰,
13158504,ASUS ROG STRIX X670E-F GAMING WIFI STCOM,,701000,6몰,
13164092,MSI 프레스티지 X570 크리에이션 (해외구매),,600000,1몰,
13165257,A520 (중고),,58900,2몰,
13165613,아두이노 센서 적외선 포토 인터럽트 C73,,1100,4몰,
13222421,아두이노 나노 V3.0 호환보드,,2890,79몰,
13278866,아두이노 HM-10 블루투스 4.0 모듈,,6600,11몰,
13289012,ASRock B560 PRO4 에즈윈,,220000,1몰,
13289171,ASRock B560M PRO4 에즈윈,,201000,1몰,
13355441,ASUS ROG STRIX Z590-F GAMING WIFI 인텍앤컴퍼니,,550000,1몰,
13396157,ASUS TUF B450M-PRO GAMING (해외구매),,171740,32몰,
13411379,MSI A520M-A PRO (해외구매),,70570,69몰,
13411424,MSI A520M PRO (해외구매),,72270,20몰,
13435220,아두이노 적외선 PIR 인체감지센서 HC-SR501,,700,40몰,
13435439,아두이노 0.96인치 OLED 모듈 3종,,4500,4몰,
13435628,아두이노 우노 2.4인치 TFT 터치 LCD 쉴드,,6050,8몰,
13435784,아두이노 완전정복 + 스타터 키트 라이트,,86900,27몰,
13435838,아두이노 완전정복 + 스타터 키트 스탠다드,,221090,24몰,
13436012,3.2인치 TFT 터치 LCD For 라즈베리파이,,25300,1몰,
13561976,ASUS TUF Gaming B560M-PLUS WIFI 인텍앤컴퍼니,,300000,1몰,
13571723,NE555P 타이머IC,,70,16몰,
13587644,ASUS TUF Gaming Z590-PLUS 인텍앤컴퍼니,,450000,1몰,
13607285,삼성전자 H61S1 (중고),,13000,16몰,
13612370,MSI MEG Z490I 유니파이 (해외구매),,281840,6몰,
13628021,MSI H510M-A PRO,,111000,1몰,
13628870,MSI MAG B450M 박격포 맥스 (해외구매),,185430,7몰,
13631252,MSI MAG B550 토마호크 (해외구매),,212980,78몰,
13774883,ASUS ROG MAXIMUS XIII EXTREME 코잇,,1727250,5몰,
13830011,GIGABYTE H510M H 듀러블에디션 제이씨현,,108990,6몰,
13875599,ASUS ROG MAXIMUS XIII APEX 인텍앤컴퍼니,,650000,1몰,
13889696,ASRock H81 PRO BTC R2.0 (중고),,53900,2몰,
13889813,아두이노 16채널 12V 릴레이 모듈,,8800,28몰,
13889939,아두이노 Pro Micro 보드,,5000,11몰,
13902929,B450 (중고),,55900,68몰,
13923911,ASUS PRO WS WRX80E-SAGE SE WIFI 아이보라,,1557100,65몰,
13928168,ASUS ROG MAXIMUS XIII EXTREME GLACIAL 아이보라,,2750000,1몰,
13947872,ASUS ROG MAXIMUS XIII EXTREME GLACIAL 인텍앤컴퍼니,,1079990,2몰,
13949078,아두이노 MP1584EN DC-DC 스텝다운,,600,6몰,
13949195,아두이노 MAX485 TTL to RS485 컨버터 모듈,,420,53몰,
13949315,아두이노 텍스트 LCD 2004 (20X4),,6440,18몰,
13949627,LKino MEGA128 트레이닝 보드 LA18,,97900,1몰,
13980314,ASUS ROG MAXIMUS XIII EXTREME GLACIAL 코잇,,1164900,43몰,
14005334,ASUS PRIME H510M-K 인텍앤컴퍼니,,109990,2몰,
14146673,아이노비아 H81-BTC (중고),,75000,1몰,
14146880,아두이노 전압측정센서 모듈,,140,26몰,
14146994,아두이노 레오나르도 R3 호환보드,,5160,21몰,
14200919,NVIDIA Jetson Xavier NX Developer Kit (해외구매),,1240000,3몰,
14267837,ASUS P8H61-M PLUS2 (B3) (중고),,38000,1몰,
14652515,ASRock B75M-DGS (중고),,24990,11몰,
14749595,아두이노 PS2 조이스틱 모듈,,420,43몰,
14872736,ASUS P11C-X 인텍앤컴퍼니,,409990,2몰,
14901068,LattePanda 라떼판다 알파 864s DFR0547,,735900,1몰,
14913623,ASUS PRIME H510M-K 아이보라,,112000,1몰,
15140333,아두이노 Micro USB TP4056 리튬배터리 충전모듈,,300,9몰,
15141536,아두이노 MG996R 180도 서보모터,,2700,27몰,
15250106,ASRock Rack ROMED8-2T,,1265000,8몰,
15298127,Supermicro X11SCZ-F STCOM,,543870,83몰,
15493718,MSI MAG B550M 박격포 WiFi (해외구매),,664120,2몰,
15497456,아두이노 S335 토양 습도 수분 감지 센서 Probe,,6600,2몰,
15497636,리니어레일 슬라이드 아두이노 구동 부품 세트,,47990,3몰,
15497753,라즈베리파이 호환 18650 5V 4A UPS 충전모듈,,49300,2몰,
15497837,W302 USB 호스트 쉴드 보드 아두이노,,57200,3몰,
15497894,HC-06 아두이노 블루투스 모듈,,2090,51몰,
15497969,Arduino 아두이노 우노 R3 호환보드 DM72,,2790,14몰,
15498581,Arduino 아두이노 MQ135 유해가스 감지 센서 모듈,,1680,19몰,
15498641,Arduino 아두이노 MQ9 일산화탄소 감지 센서 모듈,,1800,4몰,
15504146,MSI MPG Z590 게이밍 카본 WIFI (해외구매),,500000,1몰,
15613028,ASUS PRIME H570-PLUS 인텍앤컴퍼니,,110670,2몰,
15653582,GIGABYTE Z690 AORUS ELITE 피씨디렉트,,380000,1몰,
15673778,ASUS ROG MAXIMUS Z690 EXTREME GLACIAL 아이보라,,3162000,1몰,
15914351,MSI MPG Z690 포스 WIFI (해외구매),,789990,5몰,
15932150,GIGABYTE Z690 AORUS XTREME WATERFORCE 피씨디렉트,,1090000,17몰,
16058795,ASUS ROG MAXIMUS Z690 EXTREME GLACIAL 코잇,,2620280,2몰,
16083650,ASUS PRIME H610M-K D4 인텍앤컴퍼니,,85840,241몰,
16084070,ASUS PRIME B660M-K D4 인텍앤컴퍼니,,218350,2몰,
16084790,ASUS PRIME H610M-E D4 인텍앤컴퍼니,,125000,2몰,
16095767,ASUS PRIME H610M-D D4 코잇,,132440,1몰,
16099739,ASUS ROG STRIX B660-A GAMING WIFI D4 코잇,,358990,6몰,
16102367,GIGABYTE H610M H D4 듀러블에디션 제이씨현,,97890,7몰,
16102667,GIGABYTE H610M S2H D4 듀러블에디션 제이씨현,,120000,4몰,
16103087,ASUS TUF Gaming B660-PLUS WIFI D4 STCOM,,250000,1몰,
16103114,ASUS ROG STRIX B660-G GAMING WIFI STCOM,,400830,1몰,
16103126,ASUS ROG STRIX B660-F GAMING WIFI STCOM,,402000,1몰,
16103129,ASUS ROG STRIX B660-A GAMING WIFI D4 STCOM,,369000,3몰,
16103138,ASUS PRIME H610M-E D4 STCOM,,119660,23몰,
16103177,ASUS PRIME H610M-A D4 STCOM,,112060,138몰,
16103297,ASUS PRIME H610M-E D4 아이보라,,146400,6몰,
16103330,GIGABYTE H610M H D4 듀러블에디션 피씨디렉트,,115000,1몰,
16123055,ASRock Rack EP2C621D12 WS 명인일렉트로닉스,,2000000,1몰,
16145165,ATUM B250-P MINING (벌크),,104640,2몰,
16180658,ASUS PRIME H510TS 아이보라 (벌크),기본,178000,1몰,
16259744,NVIDIA Jetson AGX Xavier Developer Kit (해외구매),,3450000,2몰,
16260506,ASUS EX H610M-V3 D4 STCOM,,96000,86몰,
16275491,Z490 (중고),,110060,15몰,
16275497,H470 (중고),,56290,15몰,
16275503,B460 (중고),,62490,45몰,
16275521,H410 (중고),,56290,52몰,
16275539,Z590 (중고),,186000,3몰,
16275545,H570 (중고),,115000,2몰,
16275551,B560 (중고),,71490,17몰,
16275566,H510 (중고),,60130,51몰,
16275866,A320 (중고),,51150,24몰,
16276010,B350 (중고),,60030,13몰,
16276364,X570 (중고),,135000,12몰,
16277339,B550 (중고),,89890,21몰,
16284179,ASUS PRIME A520M-A II 대원씨티에스,,81300,166몰,
16285538,ASUS ROG MAXIMUS Z690 EXTREME GLACIAL STCOM,,2994000,2몰,
16313690,ECS DURATHON2 GLKD-I-N4020 코잇 (벌크),기본,97990,8몰,
16314863,MSI PRO H610M-G DDR4,,104980,143몰,
16388984,ECS DURATHON2 GLKD-I-N4020 코잇 (벌크),65W 어댑터,101000,6몰,
16425494,ASUS TUF Gaming Z690-PLUS WIFI 인텍앤컴퍼니,,459000,1몰,
16426892,ASUS ROG STRIX B660-A GAMING WIFI 인텍앤컴퍼니,,230000,1몰,
16444226,ASUS PRIME H510TS 아이보라 (벌크),120W 어댑터,260400,1몰,
16507886,아두이노 1채널 12V 릴레이 모듈,,550,14몰,
16625258,ASRock H610M-HVS D4 에즈윈 (벌크),,105000,1몰,
16637543,MSI PRO H610M-C EX,,114140,144몰,
16660088,ASRock H610M-HDV/M.2 D4 디앤디컴 (벌크),,96360,10몰,
16734461,에너지옵티머스 B250 BTC-12P (벌크),,111000,1몰,
16946939,W238 UART 아두이노 초음파 거리센서,,38290,3몰,
16946948,W238 PWM 아두이노 초음파 거리센서,,34080,7몰,
16971290,ASUS PRIME H410M-A STCOM,,122310,98몰,
16991345,에너지옵티머스 B75USB BTC (벌크),,103000,1몰,
17021852,ASRock H310CM-HDVP 에즈윈,,156000,1몰,
17054963,아두이노 RGB 3색 LED 4핀 센서,,330,2몰,
17161250,Raspberry Pi 라즈베리 파이 제로 2W,,213580,1몰,
17192960,ASUS Pro H610T/CSM D4 코잇 (벌크),기본,172990,4몰,
17193002,ASUS Pro H610T/CSM D4 코잇 (벌크),120W 어댑터,203180,3몰,
17400644,GIGABYTE B660M GAMING X 피씨디렉트,,202000,1몰,
17458589,NVIDIA Jetson NANO Developer Kit 2GB (해외구매),,1323300,1몰,
17529074,라즈베리파이 3B 아크릴 케이스,,3100,1몰,
17529134,아두이노 CDS 조도 센서 GL5537,,70,14몰,
17541941,ASRock B660M-HDVP/D5 R2.0 에즈윈 (벌크),,200000,4몰,
17541950,ASUS Pro H610T/CSM D4 아이보라 (벌크),기본,171550,58몰,
17543330,MSI MPG Z690 엣지 WIFI (해외구매),,621965,3몰,
17670656,에너지옵티머스 B75USB BTC-8P (벌크),,82730,4몰,
17700305,NVIDIA Jetson AGX Orin Developer Kit (해외구매),,2730060,31몰,
17743769,B660 DDR4 (중고),,121000,1몰,
17792948,ASRock H610M-HDV/M.2 R2.0 D4 디앤디컴,,97960,138몰,
17793371,ASRock H610M-HVS/M.2 R2.0 D4 디앤디컴,,88960,17몰,
17831603,ASRock H610M-HDV/M.2 R2.0 D4 디앤디컴 (벌크),,89270,107몰,
17847224,ASRock H610M-HDV/M.2 R2.0 D4 에즈윈,,92120,150몰,
17847233,ASRock H610M-HDV/M.2 R2.0 D4 에즈윈 (벌크),,91990,103몰,
17847248,ASRock H610M-HVS/M.2 R2.0 D4 에즈윈,,89000,140몰,
17847254,ASRock H610M-HVS/M.2 R2.0 D4 에즈윈 (벌크),,92440,117몰,
17910983,MSI PRO B550M-P GEN3,,139000,1몰,
17915426,GIGABYTE X670 AORUS ELITE AX 제이씨현,,835380,1몰,
17925728,MSI MPG X670E 카본 WiFi,,644900,77몰,
17926655,GIGABYTE X670 AORUS ELITE AX 피씨디렉트,,589000,5몰,
17926745,ASUS TUF Gaming X670E-PLUS WIFI STCOM,,500340,1몰,
17926748,ASUS ROG STRIX X670E-A GAMING WIFI STCOM,,671980,100몰,
17926751,ASUS ROG STRIX X670E-I GAMING WIFI STCOM,,987580,1몰,
17926763,ASRock X670E PG Lightning 대원씨티에스,,687960,1몰,
17926766,ASRock X670E 스틸레전드 대원씨티에스,,457210,2몰,
17926769,ASRock X670E Taichi 대원씨티에스,,850860,1몰,
17926787,ASUS ROG STRIX X670E-A GAMING WIFI 대원씨티에스,,431980,82몰,
17926799,ASUS PRIME X670E-PRO WIFI 대원씨티에스,,904540,1몰,
17929628,ASRock X670E Taichi 디앤디컴,,1085000,1몰,
17968601,ASRock C621A WS 에즈윈,,941290,104몰,
17970338,GIGABYTE B650M AORUS ELITE 제이씨현,,233480,117몰,
17970548,GIGABYTE B650 AERO G 제이씨현,,459000,1몰,
17971178,MSI MPG B650 카본 WIFI,,915000,1몰,
17971181,MSI MAG B650 토마호크 WIFI,,265890,166몰,
17971184,MSI PRO B650M-A WIFI,,182040,188몰,
17971187,MSI MAG B650M 박격포 WIFI,,232070,194몰,
17971196,ASRock B650 PG Lightning 디앤디컴,,319000,2몰,
17971202,ASRock B650 Pro RS 디앤디컴,,379000,1몰,
17971205,ASRock B650E PG Riptide WiFi 디앤디컴,,429000,1몰,
17971247,ASRock B650 Pro RS 에즈윈,,329000,3몰,
17971253,ASRock B650M PG Riptide 에즈윈,,245820,2몰,
17971598,ASRock B650 PG Lightning 대원씨티에스,,230000,18몰,
17971604,ASRock B650M PG Riptide 대원씨티에스,,192950,131몰,
18000098,ASUS PRIME X670-P-CSM STCOM,,882700,1몰,
18000254,ASUS PRIME X670-P WIFI-CSM STCOM,,473000,2몰,
18007478,ASRock B650E PG Riptide WiFi 대원씨티에스,,315780,88몰,
18007499,ASRock B650E 스틸레전드 WiFi 대원씨티에스,,377000,17몰,
18021440,ASUS TUF Gaming B650M-PLUS 대원씨티에스,,213960,83몰,
18021491,ASUS TUF Gaming B650M-PLUS WIFI 대원씨티에스,,261490,3몰,
18021581,ASUS TUF Gaming B650-PLUS 대원씨티에스,,217120,125몰,
18021662,ASUS TUF Gaming B650-PLUS WIFI 대원씨티에스,,282000,20몰,
18021842,ASUS ROG STRIX B650-A GAMING WIFI 대원씨티에스,,292690,78몰,
18021965,ASUS ROG STRIX B650E-E GAMING WIFI 대원씨티에스,,980980,1몰,
18036965,MSI B550M PRO-VDH WIFI (해외구매),,96300,46몰,
18044519,ASUS TUF Gaming B650M-PLUS STCOM,,215880,150몰,
18044522,ASUS TUF Gaming B650M-PLUS WIFI STCOM,,257390,106몰,
18044549,ASUS TUF Gaming B650-PLUS STCOM,,312000,6몰,
18044558,ASUS TUF Gaming B650-PLUS WIFI STCOM,,388980,111몰,
18044567,ASUS ROG STRIX B650-A GAMING WIFI STCOM,,356290,119몰,
18044582,ASUS ROG STRIX B650E-E GAMING WIFI STCOM,,355000,66몰,
18052067,ASRock Z790 Pro RS D5 에즈윈,,282590,141몰,
18052340,ASRock Z790 PG Lightning D5 에즈윈,,276990,133몰,
18054803,ASUS PRIME Z790-P-CSM 코잇,,328990,148몰,
18054881,ASUS PRIME Z790-P WIFI-CSM 코잇,,378990,83몰,
18054935,ASUS PRIME Z790M-PLUS D4-CSM 인텍앤컴퍼니,,288000,1몰,
18059849,ASUS ROG MAXIMUS Z790 HERO STCOM,,1309900,1몰,
18060350,GIGABYTE Z790 AORUS ELITE 피씨디렉트,,448310,10몰,
18060353,ASRock Z790 Pro RS D5 디앤디컴,,304530,110몰,
18060362,ASRock Z790 PG Lightning D5 디앤디컴,,268990,28몰,
18060380,MSI PRO Z790-A WIFI DDR4,,430420,2몰,
18060383,MSI PRO Z790-A WIFI,,473800,2몰,
18060779,ASUS ROG STRIX X670E-F GAMING WIFI 대원씨티에스,,1337700,1몰,
18109313,MSI PRO H610M-E DDR4,,87420,181몰,
18112316,GIGABYTE Z790 AORUS ELITE 제이씨현,,432250,5몰,
18112607,GIGABYTE B650 AERO G 피씨디렉트,,386210,91몰,
18113015,GIGABYTE B650M AORUS ELITE AX 피씨디렉트,,229090,147몰,
18128375,ASUS PRIME B650-PLUS STCOM,,333460,112몰,
18154367,ASUS PRIME B650M-A WIFI 대원씨티에스,,227000,1몰,
18157412,GIGABYTE B650M DS3H 듀러블에디션 제이씨현,,236000,3몰,
18165161,GIGABYTE B650M AORUS ELITE 피씨디렉트,,222330,158몰,
18172115,MSI MPG B650 엣지 WIFI,,324640,89몰,
18173051,ASUS ROG STRIX B650E-F GAMING WIFI STCOM,,375680,59몰,
18221786,MSI MPG Z790I 엣지 WIFI (해외구매),,420890,25몰,
18222359,MSI MPG X670E 카본 WiFi (해외구매),,601190,18몰,
18222548,MSI PRO X670-P WiFi (해외구매),,454290,8몰,
18223226,MSI MAG B650 토마호크 WIFI (해외구매),,260500,30몰,
18254819,ASUS ROG MAXIMUS Z790 HERO 코잇,,1058990,62몰,
18261176,GIGABYTE Z790 AORUS ELITE AX 피씨디렉트,,462000,2몰,
18261245,GIGABYTE Z790 UD 피씨디렉트,,299840,131몰,
18264857,GIGABYTE Z790 AORUS ELITE AX 제이씨현,,452000,3몰,
18265187,GIGABYTE Z790 UD 제이씨현,,285550,204몰,
18265715,ASUS ROG STRIX B650E-F GAMING WIFI 대원씨티에스,,362300,14몰,
18301766,MSI PRO H610M-G DDR4 (해외구매),,123640,43몰,
18319445,MSI MPG Z790 카본 WIFI (해외구매),,524200,10몰,
18342989,MSI MEG Z790 에이스 (해외구매),,1184290,2몰,
18344078,GIGABYTE Z790 AORUS ELITE AX (해외구매),,358500,5몰,
18344240,GIGABYTE B650M AORUS ELITE AX (해외구매),,311320,23몰,
18348485,ASRock Z790 Pro RS WiFi D5 에즈윈,,389000,1몰,
18376385,ASUS ROG STRIX B650E-I GAMING WIFI STCOM,,413480,112몰,
18397403,GIGABYTE B560M AORUS PRO AX (해외구매),,257990,2몰,
18397637,ASUS TUF Gaming H670-PRO WIFI D4 (해외구매),,391400,1몰,
18400013,MSI MAG Z790 토마호크 WIFI (해외구매),,360880,21몰,
18403331,ASRock A520M-HDV 대원씨티에스,,74190,30몰,
18420125,GIGABYTE B450M K 피씨디렉트,,154000,1몰,
18440045,GIGABYTE B650I AORUS ULTRA 피씨디렉트,,574990,2몰,
18448628,MSI MPG B650I 엣지 WIFI,,344350,90몰,
18449468,MSI MPG B650I 엣지 WIFI (해외구매),,338380,33몰,
18460412,GIGABYTE Z790 AORUS XTREME 제이씨현,,1550000,1몰,
18485645,ASRock Z790 Pro RS WiFi D5 디앤디컴,,354000,3몰,
18523409,ASUS PRIME H610M-K D4 아이보라,,81600,92몰,
18557519,GIGABYTE A520M K 제이씨현,,74510,3몰,
18584546,GIGABYTE Z790 AORUS TACHYON 피씨디렉트,,1266000,1몰,
18610844,MSI PRO H610M-B DDR4 (해외구매),,138660,5몰,
18646550,ASRock B760M 스틸레전드 WiFi D5 에즈윈,,350000,3몰,
18646934,ASRock B760M PG Riptide D5 에즈윈,,179000,3몰,
18649997,GIGABYTE B760M AORUS ELITE 제이씨현,,186170,69몰,
18650483,GIGABYTE B760M DS3H D4 제이씨현,,134590,208몰,
18651431,GIGABYTE B760M AORUS ELITE 피씨디렉트,,179240,190몰,
18651506,GIGABYTE B760M AORUS ELITE AX 피씨디렉트,,214370,168몰,
18651545,GIGABYTE B760M AORUS ELITE D4 피씨디렉트,,266250,1몰,
18651560,GIGABYTE B760M DS3H D4 피씨디렉트,,135980,139몰,
18652442,ASUS PRIME B760M-K D4 코잇,,160000,85몰,
18652511,ASUS EX B760M-V5 D4 코잇,,158350,74몰,
18652586,ASRock B760M PG Riptide D5 디앤디컴,,190150,6몰,
18652865,MSI MAG B760 토마호크 WIFI,,234980,142몰,
18652871,MSI MAG B760M 박격포,,278340,1몰,
18652886,MSI PRO B760M-G DDR4,,124390,139몰,
18652889,MSI PRO B760M-P DDR4,,125310,162몰,
18652895,ASUS PRIME B760M-K D4 STCOM,,163980,78몰,
18652898,ASUS PRIME B760M-A D4 STCOM,,184000,10몰,
18662558,ASUS ROG STRIX B760-F GAMING WIFI STCOM,,441000,14몰,
18662669,ASUS ROG STRIX B760-G GAMING WIFI D4 STCOM,,423000,23몰,
18662789,ASUS ROG STRIX B760-I GAMING WIFI STCOM,,399980,130몰,
18663323,COLORFUL BATTLE-AX B760M-PLUS V20 D5 STCOM,,159840,124몰,
18663455,GIGABYTE H610M K D4 피씨디렉트,,78830,182몰,
18670778,GIGABYTE H610M K D4 제이씨현,,83920,210몰,
18716924,ASUS ROG STRIX B760-I GAMING WIFI 코잇,,375390,119몰,
