75935675,ASRock B860M 스틸레전드 WiFi 디앤디컴,,271730,108몰,
75935729,ASRock B860I WiFi 디앤디컴,,278380,137몰,
75939005,ASRock B850 Pro RS WiFi 대원씨티에스,,242170,117몰,
75988922,GIGABYTE W790 AI TOP 제이씨현,,1499000,1몰,
76463696,ASUS H810M AYW GAMING WIFI STCOM,,158840,122몰,
76463777,ASUS H810M AYW GAMING WIFI-CSM STCOM,,160740,114몰,
76509641,ASRock B650M Pro X3D 에즈윈,,143410,194몰,
76554605,MAXSUN 터미네이터 B550M 디앤디컴,,97570,36몰,
76875365,ASUS ProArt Z890-CREATOR WIFI 대원씨티에스,,842670,5몰,
76941716,GIGABYTE H810M S2H 제이씨현,,129730,175몰,
76941815,GIGABYTE H810M H 제이씨현,,108000,183몰,
76941983,GIGABYTE H810M K 제이씨현,,106880,168몰,
76942061,GIGABYTE H810M H 피씨디렉트,,113900,153몰,
76942073,GIGABYTE H810M K 피씨디렉트,,108750,178몰,
76942094,GIGABYTE H810M S2H 피씨디렉트,,128730,160몰,
76944080,ASUS ROG STRIX B850-F GAMING WIFI 인텍앤컴퍼니,,439000,6몰,
76946525,ASUS ROG STRIX B850-I GAMING WIFI 인텍앤컴퍼니,,419320,9몰,
76948274,MAXSUN 챌린저 A620A 2.5G 디앤디컴,,100680,85몰,
76948292,MAXSUN e스포츠 B650ITX WIFI ICE 디앤디컴,,181040,90몰,
77083181,ASUS PRIME H810M-A 코잇,,120990,141몰,
77083238,ASUS PRIME H810M-A WIFI 코잇,,142000,121몰,
77083265,ASUS H810M AYW GAMING WIFI 코잇,,152000,119몰,
77278676,ASRock B850I Lightning WiFi 대원씨티에스,,336720,108몰,
77278823,COLORFUL CH310M-F M.2 V20 STCOM,,88820,79몰,
77278937,ASRock B850 스틸레전드 WiFi 에즈윈,,302380,66몰,
77283125,MAXSUN 아이크레프트 Z890 아크틱 디앤디컴,,456230,94몰,
77313929,MAXSUN 챌린저 B760ITX D5 디앤디컴,,189390,78몰,
77318666,ASUS PRO WS Z890-ACE SE 아이보라,,859170,5몰,
77319245,MAXSUN 터미네이터 Z890-A WIFI 디앤디컴,,252160,94몰,
77382695,ASUS PRO WS Z890-ACE SE STCOM,,858880,109몰,
77460638,NZXT N9 Z890 Black,,673200,25몰,
77460707,NZXT N9 Z890 White,,673200,35몰,
77460818,GIGABYTE B850M DS3H ICE 제이씨현,,178880,195몰,
77460890,ASUS ROG STRIX B850-E GAMING WIFI 인텍앤컴퍼니,,494950,87몰,
77460911,ASUS TUF Gaming B850-PLUS WIFI 인텍앤컴퍼니,,308920,133몰,
77460956,ASUS ROG CROSSHAIR X870E HERO 인텍앤컴퍼니,,923990,73몰,
77460980,ASUS ROG STRIX X870-A GAMING WIFI 인텍앤컴퍼니,,549000,11몰,
77618858,ASUS ROG STRIX B850-E GAMING WIFI STCOM,,513690,129몰,
77620880,GIGABYTE B850M DS3H ICE 피씨디렉트,,171500,202몰,
77704688,ASRock B850M 스틸레전드 WiFi 대원씨티에스,,223000,114몰,
77705072,ASRock B850M Riptide WiFi 대원씨티에스,,241180,127몰,
77706647,ASRock B650M Pro X3D 대원씨티에스,,147730,161몰,
77706989,ASRock A520M-HVS 대원씨티에스,,62780,138몰,
77784170,ASRock W790 WS R2.0 에즈윈,,1276500,1몰,
77786621,ASRock B650M Pro X3D WiFi 디앤디컴,,174970,166몰,
77786816,ASRock B650M Pro X3D 디앤디컴,,146600,154몰,
77791190,GIGABYTE X870I AORUS PRO ICE 피씨디렉트,,499940,149몰,
77856971,GIGABYTE B850I AORUS PRO 피씨디렉트,,336840,141몰,
78099548,ASUS ROG STRIX B850-A GAMING WIFI 인텍앤컴퍼니,,398870,13몰,
78102320,BIOSTAR B850MT-E PRO 제이씨현,,132170,144몰,
78102458,ASRock Z890 Pro-A WiFi 디앤디컴,,305500,133몰,
78102476,ASRock B850M 스틸레전드 WiFi 디앤디컴,,238170,143몰,
78307601,ASRock B860M-X 디앤디컴,,169000,9몰,
78307670,ASRock H810M-X WIFI 디앤디컴,,149860,99몰,
78307739,ASRock H810M-X 디앤디컴,,133880,133몰,
78312209,ASRock H810M-X 디앤디컴 (벌크),,132980,82몰,
78534680,ASRock B850M Pro RS + WiFi6E 모듈 패키지 디앤디컴,,258970,90몰,
78843671,GIGABYTE B850M AORUS ELITE WIFI6E 제이씨현,,232220,223몰,
78977822,ASRock H810M-X 인텍앤컴퍼니,,124520,8몰,
78990293,ASRock B850 Pro-A WiFi 에즈윈,,230220,142몰,
79000790,GIGABYTE B850M AORUS ELITE WIFI6E 피씨디렉트,,232730,185몰,
79397648,MSI MAG B850M 박격포 WIFI,,266140,223몰,
79402439,GIGABYTE X870I AORUS PRO ICE 제이씨현,,492640,147몰,
79410686,ASRock X870 Pro RS WiFi 디앤디컴,,303290,148몰,
79410761,ASRock B850 Pro-A WiFi 디앤디컴,,231560,137몰,
79553249,ASRock B850M Pro-A WiFi 디앤디컴,,170650,172몰,
79553456,ASRock B850M-X R2.0 디앤디컴,,154660,151몰,
79556738,ASRock B850M-X R2.0 대원씨티에스,,159750,114몰,
79556987,NZXT N7 Z790 White,,399000,5몰,
79559189,ASRock H610M-H2/M.2 D4 인텍앤컴퍼니,,76500,9몰,
82093181,ASRock B850M-X R2.0 에즈윈,,154190,164몰,
82470941,ASRock B860 Pro-A WiFi 에즈윈,,251160,143몰,
89861528,COLORFUL CVN X870 ARK FROZEN V14 STCOM,,336200,91몰,
90271250,GIGABYTE B760M AORUS ELITE GEN5 제이씨현,,162020,168몰,
90502931,GIGABYTE B760M AORUS ELITE GEN5 피씨디렉트,,165000,152몰,
90506507,ASRock A620AM-X 디앤디컴,,114590,135몰,
90643316,ASRock H610M-HDVP/D5 R2.0 인텍앤컴퍼니 (벌크),,102730,82몰,
90643517,ASRock Z790 PG Lightning D5 인텍앤컴퍼니,,284000,2몰,
90643637,ASRock B760M-HDVP D5 인텍앤컴퍼니 (벌크),,129790,65몰,
90702200,ASUS PRO WS W790-ACE 아이보라,,1452090,59몰,
90957212,NZXT N9 X870E Black,,659000,14몰,
90957218,NZXT N9 X870E White,,659000,17몰,
91493696,MSI MAG B850M 박격포,,245360,215몰,
91870847,GIGABYTE MX34-BS0,,593000,3몰,
91871951,GIGABYTE B760M DS3H GEN5 제이씨현,,122890,184몰,
91872095,GIGABYTE B760M DS3H GEN5 피씨디렉트,,130999,180몰,
92043230,MAXSUN e스포츠 B850ITX WIFI ICE 디앤디컴,,190990,85몰,
92108180,ASRock A620AM-HVS 대원씨티에스,,100500,117몰,
92149667,ASRock A620AM-HVS 디앤디컴,,99970,130몰,
92357948,ASUS WS C422 PRO/SE,,1499000,3몰,
92360492,ASRock B860 Pro-A 에즈윈,,227690,114몰,
92360591,ASRock A620AM-HVS 에즈윈,,90230,133몰,
92523728,싸이피아 아두이노 INA219 직류 전류 센서 모듈 DM2250,,13490,2몰,
92678384,타무즈 H610M-ID4,,77290,72몰,
92678408,타무즈 H610M-ID5,,77870,83몰,
92678840,ASUS TUF Gaming B850-BTF WIFI W 인텍앤컴퍼니,,386050,85몰,
92687522,ASUS PRO WS W880-ACE SE STCOM,,760080,88몰,
92971409,ASRock H810M-H 인텍앤컴퍼니,,112550,87몰,
92971469,ASUS ROG CROSSHAIR X870E APEX STCOM,,1018600,105몰,
93018986,ASUS ROG CROSSHAIR X870E EXTREME STCOM,,1441490,8몰,
93019088,ASUS ROG CROSSHAIR X870E APEX 대원씨티에스,,959290,119몰,
93022430,ASUS ROG CROSSHAIR X870E EXTREME 대원씨티에스,,1460700,5몰,
93022751,ASUS PRIME B850M-A-CSM 대원씨티에스,,209000,95몰,
93071258,ASUS B850M MAX GAMING WIFI 대원씨티에스,,189070,122몰,
93073223,GIGABYTE X870 AORUS STEALTH ICE 제이씨현,,455620,12몰,
93073367,GIGABYTE X870 AORUS STEALTH ICE 피씨디렉트,,442610,131몰,
93317309,ASRock B650M Pro X3D WiFi 에즈윈,,166200,162몰,
93382583,ASRock B550M Phantom Gaming 4 + WiFi6E 랜카드 패키지 디앤디컴,,154970,83몰,
93442604,GIGABYTE B850 AORUS STEALTH ICE 피씨디렉트,,367680,125몰,
93500939,GIGABYTE B850 AORUS STEALTH ICE 제이씨현,,364900,143몰,
93502442,MSI PRO B850M-A WIFI,,188950,187몰,
93702833,ASRock B650M Pro X3D WiFi 대원씨티에스,,165510,117몰,
93703418,ASUS TUF Gaming B650EM-E WIFI 대원씨티에스,,177730,163몰,
93803822,ASRock B850M Pro RS WiFi WHITE 디앤디컴,,224860,132몰,
93804581,ASRock B850M Pro Plus WiFi 디앤디컴,,230800,137몰,
94028396,ASRock B850M Pro RS WiFi WHITE 대원씨티에스,,204890,97몰,
94080773,GIGABYTE B650M K 제이씨현 (벌크),,111880,86몰,
94080806,GIGABYTE H610M K V2 제이씨현 (벌크),,79390,26몰,
94081583,ASRock A620AM-X + WiFi6E 랜카드 패키지 디앤디컴,,169860,15몰,
94081679,ASRock A620AM-HVS + WiFi6E 랜카드 패키지 디앤디컴,,131350,72몰,
94129904,COLORFUL BATTLE-AX B850M-PLUS PRO WIFI V14 STCOM,,179350,87몰,
94815752,ASUS ROG STRIX B850-G GAMING WIFI 대원씨티에스,,326500,97몰,
94888226,GIGABYTE B760M D2HX LITE SI GEN5 피씨디렉트 (벌크),,139160,75몰,
94998482,ASRock B650M PG Riptide WiFi White 디앤디컴 (중고),,211680,1몰,
95200499,GIGABYTE B850M FORCE 피씨디렉트,,161920,162몰,
95280263,GIGABYTE B850M FORCE 제이씨현,,159100,204몰,
95420366,ASUS B850M MAX GAMING WIFI STCOM,,193280,119몰,
95420465,ASUS ROG STRIX B850-G GAMING WIFI STCOM,,324240,116몰,
95420537,ASUS PRIME B850M-A-CSM STCOM,,215990,11몰,
95421218,ASUS TUF Gaming B650EM-E WIFI STCOM,,184810,100몰,
95930900,BIOSTAR B850MT2-E DJ 제이씨현,,104890,138몰,
95988443,ASUS TUF Gaming B850M-E WIFI STCOM,,238970,91몰,
95988578,ASUS TUF Gaming B850M-PLUS II STCOM,,256560,148몰,
95988710,ASUS TUF Gaming B850M-PLUS WIFI7 STCOM,,278770,168몰,
95988944,ASUS TUF Gaming B850M-PLUS WIFI7 W STCOM,,267610,172몰,
96059018,ASUS P13R-E,,798900,1몰,
96259139,ASUS PRO WS TRX50-SAGE WiFi A 아이보라,,1513500,1몰,
96314975,BIOSTAR H610MHD D5 제이씨현 (중고),,82800,1몰,
96366245,ADVANTECH ASMB-925-00A1,,1500000,1몰,
96426092,MSI PRO H610M-E DDR4 (중고),,72400,1몰,
96426692,ASUS Pro H610T-CSM D5 코잇 (벌크),120W 어댑터 포함,194100,4몰,
96426704,ASUS Pro H610T-CSM D5 코잇 (벌크),어댑터 미포함,171450,4몰,
96656717,ASUS TUF Gaming B850-BTF WIFI W STCOM,,401410,109몰,
96711170,ASUS PRIME Z890-P WIFI-CSM STCOM (중고),,333200,3몰,
96712895,ASUS PRIME B650EM-A STCOM,,146720,112몰,
96776582,ASRock H610M-H2/M.2 D5 에즈윈,,82560,127몰,
96981164,NZXT N7 B850 Black,,477890,20몰,
96981215,NZXT N7 B850 White,,449940,25몰,
97118543,ASUS TUF Gaming B850M-PLUS WIFI7 대원씨티에스,,269740,146몰,
97119116,ASUS TUF Gaming B850M-PLUS II 대원씨티에스,,243580,138몰,
97119959,ASUS PRIME B650EM-A 대원씨티에스,,139820,110몰,
97120361,ASUS TUF Gaming B850M-PLUS WIFI7 W 대원씨티에스,,268760,147몰,
97121303,ASUS TUF Gaming B850M-E WIFI 대원씨티에스,,227890,121몰,
97121510,MSI MPG B850I 엣지 TI WIFI,,374710,133몰,
97121798,MSI PRO H810M-B,,128950,168몰,
97224935,ASRock X870 Pro-A WiFi 디앤디컴,,301890,110몰,
97475957,ASUS TUF Gaming X870E-PLUS WIFI7 STCOM,,410780,111몰,
97476215,ASUS ROG STRIX X870E-H GAMING WIFI7 STCOM,,474350,102몰,
97476398,ASUS ROG CROSSHAIR X870E HERO BTF STCOM,,1059640,110몰,
97565858,ASRock A620AI WiFi 대원씨티에스,,227250,109몰,
97702355,ASRock B850 Challenger WiFi 7 White 대원씨티에스,,250950,87몰,
97702418,ASRock B850 Challenger WiFi 7 대원씨티에스,,250550,74몰,
97705844,ASUS ROG CROSSHAIR X870E HERO BTF 대원씨티에스,,1044790,3몰,
97837412,MSI PRO H610M-E DDR5,,92580,137몰,
97855343,MSI MPG X870E 엣지 TI WIFI (중고),,401200,5몰,
97903310,BIOSTAR A620MS-E 제이씨현,,88020,126몰,
97903688,MSI PRO H610M-C EX (중고),,94000,4몰,
97903817,MSI MPG B850I 엣지 TI WIFI (중고),,334350,2몰,
97903919,MSI MPG X670E 카본 WiFi (중고),,519200,2몰,
97904327,GIGABYTE B850M AORUS ELITE WIFI6E ICE 제이씨현 (중고),,227290,3몰,
97904522,MSI PRO B760M-A WIFI (중고),,137280,3몰,
97904633,MSI MEG Z890 유니파이-X (중고),,559200,2몰,
98184140,ADVANTECH ASMB-807-00A1,,1071100,57몰,
98227940,GIGABYTE X870E AORUS MASTER X3D ICE 제이씨현,,832160,51몰,
98229074,GIGABYTE X870E AORUS PRO X3D ICE 제이씨현,,628850,90몰,
98415419,ASRock B860M Pro-A 에즈윈,,173140,88몰,
98543660,GIGABYTE X870E AORUS PRO X3D ICE 피씨디렉트,,600410,155몰,
98544125,ASUS ROG STRIX X870E-H GAMING WIFI7 대원씨티에스,,469220,6몰,
98544692,MSI PRO B850M-P,,178950,125몰,
98613731,GIGABYTE X870E AORUS MASTER X3D ICE 피씨디렉트,,766880,8몰,
98925365,ASRock X870 Pro-A WiFi 대원씨티에스,,281010,88몰,
99054896,ASRock B850 Challenger WiFi 7 White 디앤디컴,,249000,108몰,
99125546,ECS H610H7-TI5 D5 V2.2 코잇,어댑터 미포함,170670,70몰,
99125693,ECS H610H7-TI5 D5 V2.2 코잇,120W 어댑터 포함,195970,66몰,
99125729,ECS H610H7-TI5 D5 V2.2 코잇,150W 어댑터 포함,205380,69몰,
99288923,ASUS TUF Gaming X870E-PLUS WIFI7 대원씨티에스,,411390,97몰,
99640991,타무즈 B760M-ID5 (벌크),,111180,80몰,
99714806,ASRock B760M-X Gen5 에즈윈 (벌크),,124570,85몰,
99714830,ASRock H610M-X D5 Gen5 에즈윈 (벌크),,109610,73몰,
99714851,ASRock H610M-HDV/M.2 D5 Gen5 에즈윈,,98100,108몰,
99733238,ASUS PRIME B760M-A II 코잇,,149500,110몰,
99746582,GIGABYTE B850 EAGLE ICE 제이씨현,,228460,142몰,
99746822,GIGABYTE B850M AORUS ELITE WIFI7 ICE-P 제이씨현,,248940,154몰,
99893756,ASUS TUF Gaming B650EM-E WIFI 인텍앤컴퍼니,,179000,84몰,
99894263,ASUS TUF Gaming B850M-PLUS WIFI7 인텍앤컴퍼니,,237780,107몰,
99913676,ASUS PRO WS B850M-ACE SE STCOM,,621690,87몰,
99945386,GIGABYTE B850M AORUS ELITE WIFI7 ICE-P 피씨디렉트,,253690,125몰,
99948020,ADVANTECH ASMB-927T2-00A1 아이보라,,2058780,58몰,
100192175,MSI PRO A620AM-B EVO,,98620,141몰,
100192475,GIGABYTE B850 EAGLE ICE 피씨디렉트,,229200,113몰,
100383200,ASRock B850 Challenger WiFi 7 White 에즈윈,,268980,118몰,
100691990,ASUS PRIME H810M-E 코잇,,113270,102몰,
100698416,ASUS PRIME B860M-A WIFI-CSM 코잇,,208000,101몰,
101069660,ASRock H610M-X D5 Gen5 디앤디컴,,116430,105몰,
101069831,ASRock H610M-HDV/M.2 D5 Gen5 디앤디컴,,101870,106몰,
101073890,ADVANTECH ASMB-816-00A1,,1158820,7몰,
101074490,ASRock H610M-X D5 Gen5 디앤디컴 (벌크),,114330,65몰,
101074493,ASRock H610M-HDV/M.2 D5 Gen5 디앤디컴 (벌크),,99490,70몰,
101184890,ASUS PRIME B850M-A-CSM 인텍앤컴퍼니,,197000,79몰,
101184935,ASUS TUF Gaming B850M-PLUS WIFI7 W 인텍앤컴퍼니,,272570,107몰,
101956625,액슬 MBAIH310 R2 에즈윈,,88610,74몰,
102004853,ASUS PRIME B650EM-A 인텍앤컴퍼니,,141470,108몰,
102004859,MAXSUN 챌린저 H810M 2.5G 디앤디컴,,123840,92몰,
102004862,MAXSUN 챌린저 H810ITX WIFI 디앤디컴,,206540,83몰,
102412694,ASRock B860M-X Gen5 디앤디컴,,168140,103몰,
102412697,ASRock B860M Pro-A 디앤디컴,,176190,97몰,
102553601,GIGABYTE B650EM DS3H WIFI6E 피씨디렉트,,156190,30몰,
102621374,ASUS TUF Gaming B860M-PLUS 코잇,,238000,73몰,
103130498,MAXSUN 챌린저 H810M-F 디앤디컴,,106500,70몰,
103182476,ASUS ROG STRIX B850-G GAMING WIFI 인텍앤컴퍼니,,394480,8몰,
103183034,ASUS TUF Gaming X870E-PLUS WIFI7 인텍앤컴퍼니,,397810,53몰,
103187819,ASRock H610TM-ITX 에즈윈 (벌크),,167370,65몰,
103187837,ASRock H610TM-ITX 에즈윈,120W 어댑터 포함,208890,3몰,
103187846,ASRock H610TM-ITX 에즈윈,180W 어댑터 포함,203150,4몰,
103188215,ASUS TUF Gaming B850M-PLUS II 인텍앤컴퍼니,,244330,86몰,
103188218,ASUS B850M MAX GAMING WIFI 인텍앤컴퍼니,,190940,88몰,
103414754,ASUS Pro H810T-CSM,어댑터 미포함,178570,4몰,
103414778,ASUS Pro H810T-CSM,120W 어댑터 포함,203470,4몰,
103414784,ASUS Pro H810T-CSM,180W 어댑터 포함,215140,4몰,
103415738,ASRock H610M-X D5 Gen5 에즈윈,,112250,65몰,
103415765,ASRock B860M-X Gen5 에즈윈 (벌크),,144810,86몰,
103415894,ADVANTECH ASMB-818I-00A1,,1218460,51몰,
103452395,MAXSUN e스포츠 B850M WIFI ICE 디앤디컴,,161630,76몰,
103694657,BIOSTAR H610MT-E D5 제이씨현,,85690,84몰,
103877579,ASRock H810TM-ITX 에즈윈 (벌크),어댑터 미포함,175990,68몰,
104325440,MSI MAG X870E 토마호크 맥스 WIFI PZ,,522930,78몰,
104554913,ASUS ROG CROSSHAIR X870E DARK HERO STCOM,,1085000,35몰,
104595728,ASRock H610M-X D5 Gen5 대원씨티에스,,105650,81몰,
104616128,ASUS PRIME H810M-K 인텍앤컴퍼니,,114130,88몰,
104628878,ASRock B860M-X Gen5 인텍앤컴퍼니,,166110,81몰,
104966219,ASRock H810M-X Gen5 에즈윈,,127710,83몰,
104966246,ASRock B860M-X Gen5 에즈윈,,162550,96몰,
104966306,GIGABYTE X870 AORUS STEALTH 피씨디렉트,,449050,77몰,
104966336,GIGABYTE B850 AORUS STEALTH 피씨디렉트,,374830,80몰,
104989463,ASUS ROG CROSSHAIR X870E DARK HERO 대원씨티에스,,1087530,67몰,
104989499,ASUS PRIME H810M-K STCOM,,124000,80몰,
104989559,ASUS PRIME A620AM-A STCOM,,124850,70몰,
104989574,ADVANTECH ASMB-831T2-00A1 아이보라,,1683780,14몰,
105184787,ASRock H810M-X Gen5 인텍앤컴퍼니,,133590,68몰,
105813494,GIGABYTE B760M AORUS ELITE D4 GEN5 피씨디렉트,,179220,92몰,
105817802,GIGABYTE B760M AORUS ELITE D4 GEN5 제이씨현,,181120,89몰,
105968849,ASUS PRIME B550M-K ARGB 대원씨티에스,,114880,75몰,
105968858,ASUS PRIME B550M-K ARGB STCOM,,118990,69몰,
105968915,GIGABYTE B760M DS3H WIFI6E D4 GEN5 피씨디렉트,,161950,109몰,
105969083,ASRock H810M-HDVP 디앤디컴,,135890,88몰,
105969161,MSI PRO H810M-C EX,,128250,118몰,
105969170,ASRock Rack SPC741D8UD-2T/X550 명인일렉트로닉스,,1386210,4몰,
106044725,GIGABYTE B760M DS3H D4 GEN5 제이씨현,,139880,117몰,
106045001,GIGABYTE H810M H GEN5 피씨디렉트,,116420,100몰,
106045718,GIGABYTE H810M K GEN5 피씨디렉트,,110590,110몰,
106047329,GIGABYTE B760M DS3H WIFI6E D4 GEN5 제이씨현,,164790,103몰,
106220351,ASRock H810M-P Gen5 에즈윈,,109070,75몰,
106454201,GIGABYTE H810M D2HX SI GEN5 제이씨현,,131440,100몰,
106465508,GIGABYTE A620M H 피씨디렉트,,100520,61몰,
106688174,GIGABYTE H810M S2H GEN5 피씨디렉트,,127970,96몰,
106689341,ASRock H810M-P Gen5 디앤디컴,,108590,97몰,
106689347,ASRock H810M-P Gen5 디앤디컴 (벌크),,109990,77몰,
106689353,ASRock H810M-X Gen5 디앤디컴,,133240,87몰,
106689356,ASRock H810M-X Gen5 디앤디컴 (벌크),,132900,63몰,
106695713,GIGABYTE B850M AORUS PRO WIFI7 피씨디렉트,,262310,89몰,
106703318,ASUS PRIME A620AM-K 대원씨티에스,,105720,80몰,
106703432,ASUS PRIME A620AM-A 대원씨티에스,,108000,23몰,
106708949,ASUS PRIME B760M-A D4 코잇,,142000,70몰,
106709246,ASRock H810M-P Gen5 + WiFi6E 랜카드 패키지 디앤디컴,,142980,81몰,
106710032,ASRock H810M-X Gen5 + WiFi6E 랜카드 패키지 디앤디컴,,162980,70몰,
106717493,ASRock B850 Rock WiFi 7 에즈윈,,229800,81몰,
106717577,ASRock B850M Rock WiFi 에즈윈,,192200,79몰,
106717613,ASRock B760M Pro-A 에즈윈 (벌크),,134490,64몰,
106717637,ASRock H810M-HDVP 에즈윈 (벌크),,134980,74몰,
106727312,GIGABYTE B850M AORUS PRO WIFI7 제이씨현,,259000,94몰,
106728086,ASRock B860 Rock WiFi 7 에즈윈,,222930,87몰,
106728191,ASRock B860M Rock WiFi 에즈윈,,192520,82몰,
106728485,ASRock B850M Challenger WiFi 7 White 에즈윈,,244620,77몰,
106729391,ASRock H810M-X Gen5 + WiFi7 랜카드 패키지 디앤디컴,,178330,67몰,
106729403,ASRock H810M-P Gen5 + WiFi7 랜카드 패키지 디앤디컴,,159630,70몰,
106735550,GIGABYTE H810M D2HX SI GEN5 피씨디렉트,,132970,90몰,
106746197,ASRock H810M-P Gen5 인텍앤컴퍼니,,109000,62몰,
106746452,ASUS TUF Gaming X870-PRO WIFI7 W NEO 대원씨티에스,,389470,56몰,
106748744,ASRock B860 Rock WiFi 7 디앤디컴,,224430,82몰,
106749107,ASRock B760M Pro-A/D4 디앤디컴,,137770,89몰,
106764977,GIGABYTE X870E AORUS ELITE X3D 피씨디렉트,,437990,97몰,
106765016,GIGABYTE X870E AORUS ELITE X3D ICE 피씨디렉트,,434190,84몰,
106767464,GIGABYTE X870E AORUS ELITE X3D ICE 제이씨현,,432840,100몰,
106784549,COLORFUL BATTLE-AX B850M-T WIFI V14 도우정보,,165000,74몰,
106784699,COLORFUL BATTLE-AX B650M-E PRO V14 도우정보,,116000,97몰,
106785044,COLORFUL BATTLE-AX A520M-K M.2 V14 도우정보,,68000,100몰,
106785122,COLORFUL BATTLE-AX B760M-D PRO D4 V20 도우정보,,125000,86몰,
106785227,COLORFUL H610M-D V20A 도우정보,,75000,102몰,
107768525,ASRock B850M Challenger WiFi 7 White 디앤디컴,,242560,85몰,
107956478,ASRock B850M Challenger WiFi 7 White 대원씨티에스,,242190,83몰,
107958404,ASRock B850 Rock WiFi 7 대원씨티에스,,232450,78몰,
107960645,ASRock B850M Rock WiFi 대원씨티에스,,188950,87몰,
107989658,GIGABYTE X870E AORUS ELITE X3D 제이씨현,,436120,84몰,
108167225,ASUS PRIME H810M-X 2.5G Gen5 코잇,,121000,48몰,
108227489,GIGABYTE B850 AORUS STEALTH 제이씨현,,375460,36몰,
108227564,GIGABYTE X870 AORUS STEALTH 제이씨현,,444460,79몰,
108352127,ASRock H810TM-ITX 에즈윈 (벌크),120W 어댑터 포함,218890,3몰,
108352133,ASRock H810TM-ITX 에즈윈 (벌크),180W 어댑터 포함,228890,3몰,
108401501,ADVANTECH ASMB-817I-00A1 아이보라,,1138990,30몰,
108401528,GIGABYTE H810M K GEN5 제이씨현,,108010,81몰,
108411866,BIOSTAR A520MSP 제이씨현,,64590,36몰,
108456887,ASRock B860M Rock WiFi 인텍앤컴퍼니,,185000,11몰,
109483313,ASRock B760M Pro-A/D4 에즈윈,,135450,82몰,
109597367,GIGABYTE B760M DS3H D4 GEN5 피씨디렉트,,144840,74몰,
109680482,GIGABYTE Z890 AORUS ELITE DUO X 피씨디렉트,,465140,75몰,
122616566,MAXSUN 아이크레프트 Z890 퍼시픽 디앤디컴,,453320,62몰,
122617802,GIGABYTE Z890 AORUS ELITE WIFI7 PLUS 피씨디렉트,,394390,78몰,
122617854,GIGABYTE Z890M AORUS ELITE WIFI7 ICE 피씨디렉트,,347980,43몰,
122617914,GIGABYTE Z890M AORUS ELITE WIFI7 피씨디렉트,,320290,68몰,
122618006,GIGABYTE Z890 AORUS ELITE DUO X 제이씨현,,453950,87몰,
122618520,ASRock B550M Phantom Gaming 4 + WiFi7 랜카드 패키지 디앤디컴,,175260,29몰,
122618538,ASRock B550M Pro RS + WiFi7 랜카드 패키지 디앤디컴,,188000,13몰,
122618900,GIGABYTE Z890 AORUS ELITE WIFI7 PLUS 제이씨현,,386700,78몰,
122620820,ASRock B860M-HDVP 에즈윈 (벌크),,150380,43몰,
122621357,ASUS TUF Gaming X870-PRO WIFI7 W NEO STCOM,,411000,73몰,
122621970,ASUS PRO WS W890E-SAGE SE STCOM,,2385300,57몰,
